username;date;retweets;favorites;text;geo;mentions;hashtags;id;permalink
Btl_aj;2017-01-31 14:57;0;0;"She's a nothing who wanted attention. She deserves to be fired";;;;"826444204830236672";https://twitter.com/Btl_aj/status/826444204830236672
Btl_aj;2017-01-31 14:56;0;0;"They both have my vote Idiot";;;;"826443990077681665";https://twitter.com/Btl_aj/status/826443990077681665
Btl_aj;2017-01-31 14:55;0;0;"Tomorrow you will be starting! Thank Goodness";;;;"826443903670820865";https://twitter.com/Btl_aj/status/826443903670820865
Btl_aj;2017-01-31 12:57;0;0;"What history book will bother putting this in? She's a joke";;;;"826414193016438785";https://twitter.com/Btl_aj/status/826414193016438785
Btl_aj;2017-01-31 12:57;0;0;"Soros STFU";;;;"826414093305262082";https://twitter.com/Btl_aj/status/826414093305262082
Btl_aj;2017-01-31 12:57;0;0;"Who is the black guy? I forgot";;;;"826414022941630464";https://twitter.com/Btl_aj/status/826414022941630464
Btl_aj;2017-01-31 12:56;0;0;"Yes let in all foreigners and they will be allowed to also bring in their bombs! Just what you want";;;;"826413919241637888";https://twitter.com/Btl_aj/status/826413919241637888
Btl_aj;2017-01-31 12:55;0;0;"Go back to walking the streets stupid";;;;"826413592304037888";https://twitter.com/Btl_aj/status/826413592304037888
Btl_aj;2017-01-31 12:55;0;0;"She is";;;;"826413507646255109";https://twitter.com/Btl_aj/status/826413507646255109
Btl_aj;2017-01-31 12:54;0;0;"Chucky is a crybaby";;;;"826413406957744128";https://twitter.com/Btl_aj/status/826413406957744128
Btl_aj;2017-01-31 12:54;0;0;"She was fired stupid! Haha";;;;"826413336711536640";https://twitter.com/Btl_aj/status/826413336711536640
Btl_aj;2017-01-31 12:54;0;0;"Grow a pair? So uneducated on many levels";;;;"826413237822439424";https://twitter.com/Btl_aj/status/826413237822439424
Btl_aj;2017-01-31 12:53;0;0;"She was paid off by Syrians";;;;"826413080959676416";https://twitter.com/Btl_aj/status/826413080959676416
Btl_aj;2017-01-31 12:53;0;0;"Experts? Who CNN";;;;"826412994863230977";https://twitter.com/Btl_aj/status/826412994863230977
Btl_aj;2017-01-31 12:52;0;0;"She could give a rats ass! She was paid off";;;;"826412917075611649";https://twitter.com/Btl_aj/status/826412917075611649
Btl_aj;2017-01-31 12:52;0;0;"Oh please! How much was she paid off?";;;;"826412837341913088";https://twitter.com/Btl_aj/status/826412837341913088
Btl_aj;2017-01-31 12:51;0;0;"They didn't vote because they are too stupid how too, can't drive, special needs, ex-cons, not registered, illegals, trash";;;;"826412632647299074";https://twitter.com/Btl_aj/status/826412632647299074
Btl_aj;2017-01-31 12:49;0;0;"Dear Jesus! Stop Embarrassing yourself you dumb fuck";;;;"826412127212679172";https://twitter.com/Btl_aj/status/826412127212679172
Btl_aj;2017-01-31 12:49;0;0;"I bet you would love too or is he too old for your liking? Creep";;;;"826411999206768641";https://twitter.com/Btl_aj/status/826411999206768641
Btl_aj;2017-01-31 12:48;0;0;"Anither Idiot post";;;;"826411831153537024";https://twitter.com/Btl_aj/status/826411831153537024
Btl_aj;2017-01-31 12:47;0;0;"Go back to BOCES";;;;"826411657584852992";https://twitter.com/Btl_aj/status/826411657584852992
Btl_aj;2017-01-31 12:47;0;0;"Creepy";;;;"826411600278073344";https://twitter.com/Btl_aj/status/826411600278073344
Btl_aj;2017-01-31 12:47;0;0;"Fight? In a wheelchair. So uneducated";;;;"826411494745182209";https://twitter.com/Btl_aj/status/826411494745182209
Btl_aj;2017-01-31 12:46;0;0;"Idiot! Attend school and stop praying to the rainbow flag";;;;"826411384208502785";https://twitter.com/Btl_aj/status/826411384208502785
Btl_aj;2017-01-31 12:46;0;0;"I'm sorry your daddy abused you as a child. It's not our President's fault";;;;"826411223143026689";https://twitter.com/Btl_aj/status/826411223143026689
Btl_aj;2017-01-31 12:45;0;0;"Uneducated trash right there";;;;"826411090351357952";https://twitter.com/Btl_aj/status/826411090351357952
Btl_aj;2017-01-31 12:45;0;0;"How embarrassing. Misfits";;;;"826411019803193344";https://twitter.com/Btl_aj/status/826411019803193344
Btl_aj;2017-01-31 12:44;0;0;"Why don't you go back to playing with yourself!";;;;"826410949485666306";https://twitter.com/Btl_aj/status/826410949485666306
Btl_aj;2017-01-31 12:44;0;0;"WTF are you saying?";;;;"826410823274942464";https://twitter.com/Btl_aj/status/826410823274942464
Btl_aj;2017-01-31 12:44;0;0;"Go back to praising your rainbow flag";;;;"826410710053830656";https://twitter.com/Btl_aj/status/826410710053830656
Btl_aj;2017-01-31 12:43;0;0;"Go back to Yemen";;;;"826410606576140292";https://twitter.com/Btl_aj/status/826410606576140292
Btl_aj;2017-01-31 12:43;0;0;"Jealous you didn't?";;;;"826410552494809088";https://twitter.com/Btl_aj/status/826410552494809088
Btl_aj;2017-01-31 12:42;0;0;"If anyone disrespects you anymore on twitter I am going after them!";;;;"826410292431224832";https://twitter.com/Btl_aj/status/826410292431224832
Btl_aj;2017-01-31 12:41;0;0;"Maybe Anderson Cooper? i bet that would turn you on from the looks of your picture";;;;"826410093403062272";https://twitter.com/Btl_aj/status/826410093403062272
Btl_aj;2017-01-31 12:40;0;0;"And when is the punch line? Try again stupid";;;;"826409834039894018";https://twitter.com/Btl_aj/status/826409834039894018
Btl_aj;2017-01-31 12:40;0;0;"you're not funny. Go back to cutting hair or riding your unicorn";;;;"826409733439574018";https://twitter.com/Btl_aj/status/826409733439574018
Btl_aj;2017-01-31 12:39;0;0;"Great choice. But he's not a judge genius";;;;"826409463489916928";https://twitter.com/Btl_aj/status/826409463489916928
Btl_aj;2017-01-31 12:38;0;0;"Crooked Hillary is too busy Counting her pennies at the Clinton Foundation. She must be broke";;;;"826409388395073537";https://twitter.com/Btl_aj/status/826409388395073537
Btl_aj;2017-01-31 12:37;0;0;"How would you know? Are you working with them? Investigate this man!";;;;"826409145918222336";https://twitter.com/Btl_aj/status/826409145918222336
Btl_aj;2017-01-31 12:37;0;0;"She is better then the trash in their now";;;;"826409000048668673";https://twitter.com/Btl_aj/status/826409000048668673
Btl_aj;2017-01-31 12:36;0;0;"Great choice. He's better then sell outs in their now";;;;"826408938358845442";https://twitter.com/Btl_aj/status/826408938358845442
Btl_aj;2017-01-31 12:36;0;0;"George Soros- wait he ruined Europe and President Trump won't let this happen. Who runs your twitter???";;;;"826408766899888129";https://twitter.com/Btl_aj/status/826408766899888129
Btl_aj;2017-01-31 12:35;0;0;"Go back to school and get an education! Poor thing";;;;"826408531083587584";https://twitter.com/Btl_aj/status/826408531083587584
Btl_aj;2017-01-31 12:34;0;0;"Not funny and I find it abusive. I will now report this to twitter. Are you a pedophile with this picture?";;;;"826408409385820161";https://twitter.com/Btl_aj/status/826408409385820161
Btl_aj;2017-01-31 12:33;0;0;"Just keep John Lewis away. No more racists now that we dumped Obama";;;;"826408155500445696";https://twitter.com/Btl_aj/status/826408155500445696
Btl_aj;2017-01-31 12:33;0;0;"He would be better then sell outs in their now";;;;"826408022637416448";https://twitter.com/Btl_aj/status/826408022637416448
Btl_aj;2017-01-31 12:32;0;0;"What a stupid comment. President Trump is a leader. Go back to riding your rainbow unicorn";;;;"826407920195817473";https://twitter.com/Btl_aj/status/826407920195817473
Btl_aj;2017-01-31 12:32;0;0;"Better him then Arnold. He talks like he has shit in his mouth";;;;"826407702461083648";https://twitter.com/Btl_aj/status/826407702461083648
Btl_aj;2017-01-31 12:31;0;0;"I wish! She is brilliant";;;;"826407573293252608";https://twitter.com/Btl_aj/status/826407573293252608
Btl_aj;2017-01-31 12:31;0;0;"It you don't care then get off his post and if you're in this country take that hat off your head";;;;"826407464090353664";https://twitter.com/Btl_aj/status/826407464090353664
Btl_aj;2017-01-31 12:30;0;0;"You must be a beauty school dropout";;;;"826407232233410560";https://twitter.com/Btl_aj/status/826407232233410560
Btl_aj;2017-01-31 12:29;0;0;"You have done everything right for this country. Keep up the great job.";;;;"826407024732827650";https://twitter.com/Btl_aj/status/826407024732827650
Btl_aj;2017-01-31 12:28;0;0;"Syria paid off the Democrats to be their puppets. Now you pull the strings!! Love it";;;;"826406825713135618";https://twitter.com/Btl_aj/status/826406825713135618
Btl_aj;2017-01-31 12:27;0;0;"They have a stick up their ass because they lost. Just bitter and they now have no one to pay them off.";;;;"826406620850688000";https://twitter.com/Btl_aj/status/826406620850688000
Btl_aj;2017-01-31 12:26;0;0;"Did Chuck cry over the mic not working? Did Nancy wipe his tears away or was she busy spying on NSA";;;;"826406322606309376";https://twitter.com/Btl_aj/status/826406322606309376
Btl_aj;2017-01-31 12:24;0;0;"They have deep pockets and want you to bribe them off! It's what they are use too.";;;;"826405807646449664";https://twitter.com/Btl_aj/status/826405807646449664
Btl_aj;2017-01-31 12:22;0;0;"The whole thing is starting to bore me. They aren't worth my time";;;;"826405218292232192";https://twitter.com/Btl_aj/status/826405218292232192
Btl_aj;2017-01-31 12:21;0;0;"Duh";;;;"826405032744591361";https://twitter.com/Btl_aj/status/826405032744591361
Btl_aj;2017-01-31 12:21;0;0;"They know what he likes at least!";;;;"826404942441226242";https://twitter.com/Btl_aj/status/826404942441226242
Btl_aj;2017-01-31 12:19;0;0;"Fear of doing their job! Thanks to President Hollywood Obama";;;;"826404604095111172";https://twitter.com/Btl_aj/status/826404604095111172
Btl_aj;2017-01-31 12:18;0;0;"I hope who did this dies from cancer";;;;"826404330840453120";https://twitter.com/Btl_aj/status/826404330840453120
Btl_aj;2017-01-31 12:17;0;0;"YES!!!";;;;"826404157779300352";https://twitter.com/Btl_aj/status/826404157779300352
Btl_aj;2017-01-31 12:17;0;0;"Two geniuses";;;;"826404100661190656";https://twitter.com/Btl_aj/status/826404100661190656
Btl_aj;2017-01-31 12:17;0;0;"With bombs strapped";;;;"826403994541182976";https://twitter.com/Btl_aj/status/826403994541182976
Btl_aj;2017-01-31 12:16;0;0;"He has always hated Americans. Even his brother says he is Muslim";;;;"826403879386497024";https://twitter.com/Btl_aj/status/826403879386497024
Btl_aj;2017-01-31 12:16;0;0;"Thank you Mexico";;;;"826403718228762628";https://twitter.com/Btl_aj/status/826403718228762628
Btl_aj;2017-01-31 12:15;0;0;"Blame Obama";;;;"826403644841029637";https://twitter.com/Btl_aj/status/826403644841029637
Btl_aj;2017-01-31 12:15;0;0;"Go back to playing golf";;;;"826403600129728513";https://twitter.com/Btl_aj/status/826403600129728513
Btl_aj;2017-01-31 12:15;0;0;"He doesn't need those idiots. He is brilliant";;;;"826403502855487488";https://twitter.com/Btl_aj/status/826403502855487488
Btl_aj;2017-01-31 12:14;0;0;"Thank George Soros for paying off animals";;;;"826403400996773889";https://twitter.com/Btl_aj/status/826403400996773889
Btl_aj;2017-01-31 12:14;0;0;"Amazon is useless. Screws up my order every time";;;;"826403316112490496";https://twitter.com/Btl_aj/status/826403316112490496
Btl_aj;2017-01-31 12:14;0;0;"King of the world! Haha";;;;"826403156741468160";https://twitter.com/Btl_aj/status/826403156741468160
Btl_aj;2017-01-31 12:13;0;0;"Goldman Sachs lost the election";;;;"826402922179264512";https://twitter.com/Btl_aj/status/826402922179264512
Btl_aj;2017-01-31 12:12;0;0;"Get over it he is our President. Remember 9/11";;;;"826402825123016704";https://twitter.com/Btl_aj/status/826402825123016704
Btl_aj;2017-01-31 12:11;0;0;"They both look high";;;;"826402646261129216";https://twitter.com/Btl_aj/status/826402646261129216
Btl_aj;2017-01-31 06:11;0;0;"Koch, Soros, Rockefeller, Buffet all evil";;;;"826312047247945728";https://twitter.com/Btl_aj/status/826312047247945728
Btl_aj;2017-01-31 06:11;0;0;"Drugs";;;;"826311918923165696";https://twitter.com/Btl_aj/status/826311918923165696
Btl_aj;2017-01-31 06:10;0;0;"He is a Muslim";;;;"826311743437697024";https://twitter.com/Btl_aj/status/826311743437697024
Btl_aj;2017-01-31 06:10;0;0;"Pussy! Oops I'm going to get protested by a bunch of psych patients";;;;"826311601225613318";https://twitter.com/Btl_aj/status/826311601225613318
Btl_aj;2017-01-31 06:09;0;0;"Obama needs to play golf and why start now getting involved in politics";;;;"826311314003861504";https://twitter.com/Btl_aj/status/826311314003861504
Btl_aj;2017-01-31 06:08;0;0;"Didn't this ass once say he's king of the world? He's nothing";;;;"826311138447093760";https://twitter.com/Btl_aj/status/826311138447093760
Btl_aj;2017-01-31 06:07;0;0;"Nietro runs the Cartels!";;;;"826310934297706496";https://twitter.com/Btl_aj/status/826310934297706496
Btl_aj;2017-01-31 06:06;0;0;"Magic better worry about HIV not Trump.";;;;"826310695427899392";https://twitter.com/Btl_aj/status/826310695427899392
Btl_aj;2017-01-31 06:05;0;0;"Now she can flip burgers";;;;"826310484609662976";https://twitter.com/Btl_aj/status/826310484609662976
Btl_aj;2017-01-31 06:05;0;0;"Keaton is a has been. Put down the bottle";;;;"826310411444158465";https://twitter.com/Btl_aj/status/826310411444158465
Btl_aj;2017-01-31 06:05;0;0;"DeBlasio ruins NYC. His wife is some loud mouth black women and together they rob the city blind";;;;"826310318095728640";https://twitter.com/Btl_aj/status/826310318095728640
Btl_aj;2017-01-31 06:04;0;0;"Throw them out of this country. No more 9/11";;;;"826310046581669889";https://twitter.com/Btl_aj/status/826310046581669889
Btl_aj;2017-01-31 06:03;0;0;"Hollywood tears. Him and Cuomo need to get jobs in Hollywood";;;;"826309797763022848";https://twitter.com/Btl_aj/status/826309797763022848
Btl_aj;2017-01-31 06:02;0;0;"I'm sure he was bullied his whole life. Still looks like a nerd who pisses his pants";;;;"826309670470086656";https://twitter.com/Btl_aj/status/826309670470086656
Btl_aj;2017-01-31 06:01;0;0;"Soros must really be desperate";;;;"826309461920841729";https://twitter.com/Btl_aj/status/826309461920841729
Btl_aj;2017-01-31 06:01;0;0;"They are desperate to plummeting ratings. Money talks and they are losing it";;;;"826309318022746114";https://twitter.com/Btl_aj/status/826309318022746114
Btl_aj;2017-01-31 06:00;0;0;"Grow up and be a man";;;;"826309123960614912";https://twitter.com/Btl_aj/status/826309123960614912
Btl_aj;2017-01-31 05:59;0;0;"Chuck is a crybaby!";;;;"826309024853454848";https://twitter.com/Btl_aj/status/826309024853454848
Btl_aj;2017-01-31 05:58;0;0;"Only President not full of Bullshit";;;;"826308706518310912";https://twitter.com/Btl_aj/status/826308706518310912
Btl_aj;2017-01-31 05:57;0;0;"They don't like him because he called them out!";;;;"826308523990585344";https://twitter.com/Btl_aj/status/826308523990585344
Btl_aj;2017-01-31 05:57;0;0;"They need to get the chip off their shoulders. Put down the weed, get a job and grow up!";;;;"826308367652155392";https://twitter.com/Btl_aj/status/826308367652155392
Btl_aj;2017-01-31 05:55;0;0;"Respect the President or go to Canada with that loser Trudeau";;;;"826307996120674304";https://twitter.com/Btl_aj/status/826307996120674304
Btl_aj;2017-01-31 05:55;0;0;"Trump is taking the brunt for these women being raped or abandoned by there fathers as children";;;;"826307793699344385";https://twitter.com/Btl_aj/status/826307793699344385
Btl_aj;2017-01-31 05:53;0;0;"Soros, Clinton, Rockefeller, Buffet and every other millionaire pedophile";;;;"826307508318896128";https://twitter.com/Btl_aj/status/826307508318896128
Btl_aj;2017-01-31 05:52;0;0;"Give Soros to Russia! We all need to protest in front of his house";;;;"826307163261919232";https://twitter.com/Btl_aj/status/826307163261919232
Btl_aj;2017-01-31 05:51;0;0;"No one really cares what some Muslim has to say.";;;;"826306982659371008";https://twitter.com/Btl_aj/status/826306982659371008
Btl_aj;2017-01-31 05:50;0;0;"Yes";;;;"826306738164994048";https://twitter.com/Btl_aj/status/826306738164994048
Btl_aj;2017-01-31 05:48;0;0;"They better start packing";;;;"826306200392306688";https://twitter.com/Btl_aj/status/826306200392306688
Btl_aj;2017-01-31 05:47;0;0;"Obama who?";;;;"826306001716527104";https://twitter.com/Btl_aj/status/826306001716527104
Btl_aj;2017-01-31 05:47;0;0;"The blacks and gays all need to take the chip off their shoulder. Time to grow up or see a Shrink";;;;"826305946049724416";https://twitter.com/Btl_aj/status/826305946049724416
Btl_aj;2017-01-31 05:44;0;0;"She learned a lesson the hard way. What an Idiot";;;;"826305060888072192";https://twitter.com/Btl_aj/status/826305060888072192
Btl_aj;2017-01-31 05:43;0;0;"Completely get rid of the EPA. Waste of money";;;;"826304754942955521";https://twitter.com/Btl_aj/status/826304754942955521
Btl_aj;2017-01-31 05:40;0;0;"President Trump is a HERO";;;;"826304226146009088";https://twitter.com/Btl_aj/status/826304226146009088
Btl_aj;2017-01-31 05:38;0;0;"Get Jeff Sessions in ASAP";;;;"826303723471241216";https://twitter.com/Btl_aj/status/826303723471241216
Btl_aj;2017-01-31 05:38;0;0;"Today you better find a job! How embarrassing for you.";;;;"826303562175111168";https://twitter.com/Btl_aj/status/826303562175111168
Btl_aj;2017-01-31 05:37;0;0;"Traitor";;;;"826303447829970944";https://twitter.com/Btl_aj/status/826303447829970944
Btl_aj;2017-01-31 05:37;0;0;"He wanted the vote.";;;;"826303393752838144";https://twitter.com/Btl_aj/status/826303393752838144
Btl_aj;2017-01-31 05:37;0;0;"I don't respect unemployed people";;;;"826303318930632704";https://twitter.com/Btl_aj/status/826303318930632704
Btl_aj;2017-01-31 05:36;0;0;"Can't get unemployment even! Hahahah";;;;"826303218305077248";https://twitter.com/Btl_aj/status/826303218305077248
Btl_aj;2017-01-31 05:36;0;0;"McDonalds is hiring. Haha";;;;"826303147782045697";https://twitter.com/Btl_aj/status/826303147782045697
Btl_aj;2017-01-31 05:36;0;0;"These marches are NOT about you. Its about hating men because their fathers abandoned or raped these women or beat them.";;;;"826303035102076928";https://twitter.com/Btl_aj/status/826303035102076928
Btl_aj;2017-01-31 05:32;0;0;"Keep an eye on Paul Ryan. I feel he's a mole for the Democrats and why is McCain so bitter/jealous of you? He's no hero!";;;;"826302084685389825";https://twitter.com/Btl_aj/status/826302084685389825
Btl_aj;2017-01-31 05:29;0;0;"Also add to the agenda-acknowledge student loan debt, give Soros to Russia, keep allowing fracking and drilling!";;;;"826301439068741632";https://twitter.com/Btl_aj/status/826301439068741632
Btl_aj;2017-01-31 05:22;0;0;"You're the best! Dump Sally Yates. She's a traitor. She can't even collect unemployment! She was a sell out";;;;"826299502453805056";https://twitter.com/Btl_aj/status/826299502453805056
Btl_aj;2017-01-31 05:20;0;0;"She is a traitor just like The Washington Post.";;;;"826299142062354432";https://twitter.com/Btl_aj/status/826299142062354432
Btl_aj;2017-01-31 05:20;0;0;"Now She can't even collect unemployment! Ha";;;;"826299022235332608";https://twitter.com/Btl_aj/status/826299022235332608
Btl_aj;2017-01-31 02:57;0;0;"Look at the paid protestors, Crooked Hillary, Sell Out Sanders and that evil Soros. Give him to Russia And become Messiah";;;;"826263029356584962";https://twitter.com/Btl_aj/status/826263029356584962
Btl_aj;2017-01-31 02:55;0;0;"The democrats just want welfare, unicorns and rainbows";;;;"826262526857863169";https://twitter.com/Btl_aj/status/826262526857863169
Btl_aj;2017-01-31 02:54;0;0;"Fire that bitch";;;;"826262285572268032";https://twitter.com/Btl_aj/status/826262285572268032
Btl_aj;2017-01-31 01:28;0;0;"Fire her";;;;"826240804612141058";https://twitter.com/Btl_aj/status/826240804612141058
Btl_aj;2017-01-31 01:28;0;0;"She is not right in the head";;;;"826240713486630912";https://twitter.com/Btl_aj/status/826240713486630912
Btl_aj;2017-01-31 01:28;0;0;"Please run so Trump will win again.";;;;"826240626945617922";https://twitter.com/Btl_aj/status/826240626945617922
Btl_aj;2017-01-31 01:27;0;0;"She probably was a sell out to Soros";;;;"826240529042112512";https://twitter.com/Btl_aj/status/826240529042112512
Btl_aj;2017-01-31 01:27;0;0;"It proves women are stupid";;;;"826240432388636673";https://twitter.com/Btl_aj/status/826240432388636673
Btl_aj;2017-01-31 01:27;0;0;"Who paid her off and how much?";;;;"826240368710709248";https://twitter.com/Btl_aj/status/826240368710709248
Btl_aj;2017-01-31 01:26;0;0;"OMG That's letter is awful. She sounds uneducated";;;;"826240300674928640";https://twitter.com/Btl_aj/status/826240300674928640
Btl_aj;2017-01-31 01:26;0;0;"Fire that idiot";;;;"826240175005134848";https://twitter.com/Btl_aj/status/826240175005134848
Btl_aj;2017-01-31 01:25;0;0;"Maybe cops are paid off by Soros or Fake news??";;;;"826240043849248768";https://twitter.com/Btl_aj/status/826240043849248768
Btl_aj;2017-01-31 01:24;0;0;"That's when you want some Muslim to blow up all those animals";;;;"826239775522844672";https://twitter.com/Btl_aj/status/826239775522844672
Btl_aj;2017-01-31 01:23;0;0;"Who cares what that Cult does";;;;"826239562817142784";https://twitter.com/Btl_aj/status/826239562817142784
Btl_aj;2017-01-31 01:23;0;0;"I bet he pockets the money since Kumar or WTF his movie was called sucked";;;;"826239475672047616";https://twitter.com/Btl_aj/status/826239475672047616
Btl_aj;2017-01-31 01:22;0;0;"And these women marched because their fathers sexually abused them and it's Trumps fault?";;;;"826239104161574912";https://twitter.com/Btl_aj/status/826239104161574912
Btl_aj;2017-01-31 01:21;0;0;"Hillary who?";;;;"826238912960032768";https://twitter.com/Btl_aj/status/826238912960032768
Btl_aj;2017-01-31 01:21;0;0;"Here's where Starbucks goes out of business! Good coffee sucks";;;;"826238840184651777";https://twitter.com/Btl_aj/status/826238840184651777
Btl_aj;2017-01-31 01:20;0;0;"I wouldn't count on it";;;;"826238689906925568";https://twitter.com/Btl_aj/status/826238689906925568
Btl_aj;2017-01-31 01:20;0;0;"Animals";;;;"826238596956958721";https://twitter.com/Btl_aj/status/826238596956958721
Btl_aj;2017-01-31 01:18;0;0;"she looks like a pussy";;;;"826238199148208128";https://twitter.com/Btl_aj/status/826238199148208128
Btl_aj;2017-01-31 01:17;0;0;"What an ass";;;;"826237967287144448";https://twitter.com/Btl_aj/status/826237967287144448
Btl_aj;2017-01-31 01:17;0;0;"I'm going to protest her and riot for calling you the N word and wear a big Vagina costume. Then invite Madonna";;;;"826237892192243712";https://twitter.com/Btl_aj/status/826237892192243712
Btl_aj;2017-01-31 01:15;0;0;"What a shame. Savages";;;;"826237511810826242";https://twitter.com/Btl_aj/status/826237511810826242
Btl_aj;2017-01-31 01:14;0;0;"How much did CNN pay him off??";;;;"826237158235181056";https://twitter.com/Btl_aj/status/826237158235181056
Btl_aj;2017-01-31 01:14;0;0;"Animals";;;;"826237064186363904";https://twitter.com/Btl_aj/status/826237064186363904
Btl_aj;2017-01-31 01:12;0;0;"No one cares about Obama. Go play golf";;;;"826236750410416128";https://twitter.com/Btl_aj/status/826236750410416128
Btl_aj;2017-01-31 01:11;0;0;"What a bunch of babies. When will it stop??";;;;"826236480674754560";https://twitter.com/Btl_aj/status/826236480674754560
Btl_aj;2017-01-31 01:10;0;0;"I'm Catholic and that Pope is evil.";;;;"826236112238698498";https://twitter.com/Btl_aj/status/826236112238698498
Btl_aj;2017-01-30 13:14;0;0;"What an ASS";;;;"826056100038447105";https://twitter.com/Btl_aj/status/826056100038447105
Btl_aj;2017-01-30 13:14;0;0;"Khan is evil";;;;"826056055343943681";https://twitter.com/Btl_aj/status/826056055343943681
Btl_aj;2017-01-30 13:14;0;0;"They don't even know why they marched. The night before they are too many carbs";;;;"826055930907394049";https://twitter.com/Btl_aj/status/826055930907394049
Btl_aj;2017-01-30 13:13;0;0;"3 don't forget all the protesters. Their parents did it with a goat";;;;"826055689487413248";https://twitter.com/Btl_aj/status/826055689487413248
Btl_aj;2017-01-30 13:12;0;0;"Arrest then! What are they waiting for";;;;"826055533870346242";https://twitter.com/Btl_aj/status/826055533870346242
Btl_aj;2017-01-30 13:12;0;0;"Arrest her and Madonna.";;;;"826055404450934785";https://twitter.com/Btl_aj/status/826055404450934785
Btl_aj;2017-01-30 13:11;0;0;"This was all staged by Soros";;;;"826055294790860800";https://twitter.com/Btl_aj/status/826055294790860800
Btl_aj;2017-01-30 13:11;0;0;"Haha and all the riots aimed at Starbucks. Soros must own the place";;;;"826055115392040960";https://twitter.com/Btl_aj/status/826055115392040960
Btl_aj;2017-01-30 13:10;0;0;"Because he gave interviews and never said anything bad. All about the $$$";;;;"826054965160529920";https://twitter.com/Btl_aj/status/826054965160529920
Btl_aj;2017-01-30 13:09;0;0;"I think it's time to Show these freaks who is boss.";;;;"826054833039933440";https://twitter.com/Btl_aj/status/826054833039933440
Btl_aj;2017-01-30 13:09;0;0;"Who is he? Must want attention";;;;"826054635395891200";https://twitter.com/Btl_aj/status/826054635395891200
Btl_aj;2017-01-30 13:08;0;0;"Only 109 were Detained and for a reason";;;;"826054542630518784";https://twitter.com/Btl_aj/status/826054542630518784
Btl_aj;2017-01-30 13:08;0;0;"who cares it was in Canada";;;;"826054449508515841";https://twitter.com/Btl_aj/status/826054449508515841
Btl_aj;2017-01-30 13:07;0;0;"Fake news. They are all bitter because Trump called them on their lies";;;;"826054306403074049";https://twitter.com/Btl_aj/status/826054306403074049
Btl_aj;2017-01-30 13:06;0;0;"Yes";;;;"826053951808237568";https://twitter.com/Btl_aj/status/826053951808237568
Btl_aj;2017-01-30 13:06;0;0;"What's the name of the guy with long hair and live streams the news. I think Sticks? He is brilliant. Is he on twitter?";;;;"826053856853385217";https://twitter.com/Btl_aj/status/826053856853385217
Btl_aj;2017-01-30 13:04;0;0;"Did she die from alcohol poisoning?";;;;"826053563184971780";https://twitter.com/Btl_aj/status/826053563184971780
