username;date;retweets;favorites;text;geo;mentions;hashtags;id;permalink
Btl_aj;2017-06-14 03:10;0;0;"Just have Hillary arrested. You promised us. She will love all those women in prison.";;;;"874826448170881024";https://twitter.com/Btl_aj/status/874826448170881024
Btl_aj;2017-06-14 03:09;0;0;"No one listens to fake news unless you're Muslim, gay or a misfit.";;;;"874826109724102656";https://twitter.com/Btl_aj/status/874826109724102656
Btl_aj;2017-06-14 03:08;0;0;"Don't hold your breathe. They won't stop!";;;;"874825738263900160";https://twitter.com/Btl_aj/status/874825738263900160
Btl_aj;2017-06-14 03:06;0;0;"I'm so glad he's home but going forward Americans that go to these fucked up countries deserve what they get!";;;;"874825461788020736";https://twitter.com/Btl_aj/status/874825461788020736
Btl_aj;2017-06-13 01:23;0;1;"Wonder what he did with Madeline?";;;;"874436942234103808";https://twitter.com/Btl_aj/status/874436942234103808
Btl_aj;2017-06-13 01:22;0;0;"What about Bill Clinton?";;;;"874436765217587201";https://twitter.com/Btl_aj/status/874436765217587201
Btl_aj;2017-06-13 01:21;1;2;"Was Obama, Clinton and Podestas arrested?";;;;"874436529954979840";https://twitter.com/Btl_aj/status/874436529954979840
Btl_aj;2017-06-13 01:20;0;0;"Who is she? Better yet who cares what she thinks";;;;"874436232041857025";https://twitter.com/Btl_aj/status/874436232041857025
Btl_aj;2017-06-13 01:18;0;0;"No surprise! Ramadan is best time to make Allah happy! Fuck we are screwed!";;;;"874435747050401793";https://twitter.com/Btl_aj/status/874435747050401793
Btl_aj;2017-06-13 01:16;0;0;"Maybe Tucker is a Russian spy!";;;;"874435380338151424";https://twitter.com/Btl_aj/status/874435380338151424
Btl_aj;2017-06-13 01:15;0;0;"Both gay";;;;"874435001391120384";https://twitter.com/Btl_aj/status/874435001391120384
Btl_aj;2017-06-13 01:15;0;0;"She ain't nothing but a gold digger";;;;"874434898840498177";https://twitter.com/Btl_aj/status/874434898840498177
Btl_aj;2017-06-13 01:14;0;0;"Oh it's in Washington- they're all weird!";;;;"874434727540817920";https://twitter.com/Btl_aj/status/874434727540817920
Btl_aj;2017-06-13 01:13;0;0;"Boycott This school!! No Federal funding due to racism";;;;"874434577015746569";https://twitter.com/Btl_aj/status/874434577015746569
Btl_aj;2017-06-13 01:12;0;0;"Imagine if it was the reverse situation! We would have rioting and looting!";;;;"874434214753685509";https://twitter.com/Btl_aj/status/874434214753685509
Btl_aj;2017-06-11 09:11;0;0;"Or bring an HIV person and have them bite back, or some from Hospice who has a gun, or get some nut who is into blowing up things.";;;;"873830015565279233";https://twitter.com/Btl_aj/status/873830015565279233
Btl_aj;2017-06-11 09:06;0;0;"You knew Antifa was there, you knew cops don't care- so why not bring a hungry mean pitbull and a bottle of chlorox to throw in their eyes?";;;;"873828795618394112";https://twitter.com/Btl_aj/status/873828795618394112
Btl_aj;2017-06-11 09:02;0;0;"Fake news";;;;"873827741925298176";https://twitter.com/Btl_aj/status/873827741925298176
Btl_aj;2017-06-11 09:00;0;0;"The real big mess- student loans. These kids can't pay them back. Stop giving foreigners and welfare free rides or give everyone it free!";;;;"873827199295655936";https://twitter.com/Btl_aj/status/873827199295655936
Btl_aj;2017-06-11 08:53;0;0;"He's going to lose. He always loses";;;;"873825544030351360";https://twitter.com/Btl_aj/status/873825544030351360
Btl_aj;2017-06-11 03:31;0;0;"Leave Jeb alone- is he autistic?";;;;"873744369790144512";https://twitter.com/Btl_aj/status/873744369790144512
Btl_aj;2017-06-11 03:27;0;0;"Ivanka is a Jewish Shill. She married that Jew whose father went to prison and he hires a hooker to set up his brother in law? Fuck ups";;;;"873743530153390082";https://twitter.com/Btl_aj/status/873743530153390082
Btl_aj;2017-06-11 03:25;0;0;"I'm sure your blamed. Bill probably has checked you out too";;;;"873743014635741186";https://twitter.com/Btl_aj/status/873743014635741186
Btl_aj;2017-06-11 03:24;0;1;"Hahaha! Why do politicians lie, steal and into porn?";;;;"873742773261922304";https://twitter.com/Btl_aj/status/873742773261922304
Btl_aj;2017-06-11 03:24;0;1;"He did this for that $10 mil book deal. Am I the only one who sees this?";;;;"873742617489571840";https://twitter.com/Btl_aj/status/873742617489571840
Btl_aj;2017-06-11 03:22;0;0;"Cruises are trailer parks of the water";;;;"873742205504061440";https://twitter.com/Btl_aj/status/873742205504061440
Btl_aj;2017-06-11 03:21;0;0;"Brad should have stayed in rehab longer. And his kids are beyond frugally!";;;;"873741969381625856";https://twitter.com/Btl_aj/status/873741969381625856
Btl_aj;2017-06-11 03:17;0;0;"What's their problem? Are they Jews? Trump loves Jews. Ivanka is one now";;;;"873740871417700353";https://twitter.com/Btl_aj/status/873740871417700353
Btl_aj;2017-06-11 03:15;0;0;"I don't know why people watch her? She's not funny, old and ugly as fuck";;;;"873740479430569984";https://twitter.com/Btl_aj/status/873740479430569984
Btl_aj;2017-06-11 03:14;0;0;"PA has more rednecks. No wonder hairdressers are hard to come by.";;;;"873740147187220480";https://twitter.com/Btl_aj/status/873740147187220480
Btl_aj;2017-06-11 03:13;0;0;"That's so racist just because Bill has a black son. That Danny kid";;;;"873739930408714241";https://twitter.com/Btl_aj/status/873739930408714241
Btl_aj;2017-06-11 03:10;0;0;"At least he didn't blow up a school first. One less nut in the world.";;;;"873739266500833280";https://twitter.com/Btl_aj/status/873739266500833280
Btl_aj;2017-06-11 03:08;0;0;"Who else wants to light the match after she's doused in gasoline?";;;;"873738721216139265";https://twitter.com/Btl_aj/status/873738721216139265
Btl_aj;2017-06-11 03:06;0;0;"Brits need to get rid of the Mayor before he blows up that country in the name of Allah";;;;"873738206134644736";https://twitter.com/Btl_aj/status/873738206134644736
Btl_aj;2017-06-11 03:04;0;0;"Agree!";;;;"873737712163008512";https://twitter.com/Btl_aj/status/873737712163008512
Btl_aj;2017-06-11 03:04;0;0;"Worse thing it the world if PR gets statehood. It's beyond poor";;;;"873737627161198592";https://twitter.com/Btl_aj/status/873737627161198592
Btl_aj;2017-06-11 03:03;0;0;"And those kids look filthy";;;;"873737453626159104";https://twitter.com/Btl_aj/status/873737453626159104
Btl_aj;2017-06-11 03:03;0;0;"Muslims have no interest in going to Mexico. Guess they aren't into drug cartels and tacos";;;;"873737330368053252";https://twitter.com/Btl_aj/status/873737330368053252
Btl_aj;2017-06-11 02:56;0;0;"If the Muslims blow up these people then they get a free pass!";;;;"873735655557402624";https://twitter.com/Btl_aj/status/873735655557402624
Btl_aj;2017-06-11 02:54;0;2;"Pray for Indiana- pissed off Muslims!";;;;"873735145060225026";https://twitter.com/Btl_aj/status/873735145060225026
Btl_aj;2017-06-11 02:53;0;0;"It's called trying to avoid the pokie";;;;"873734941221285888";https://twitter.com/Btl_aj/status/873734941221285888
Btl_aj;2017-06-11 02:52;0;0;"Wow! They are turning on each other and Hillary looks like the Pillsbury Dough Boy";;;;"873734616062066690";https://twitter.com/Btl_aj/status/873734616062066690
Btl_aj;2017-06-10 21:17;0;0;"I hope he goes to jail before the $ rolls in or Clinton's kill in";;;;"873650335755186177";https://twitter.com/Btl_aj/status/873650335755186177
Btl_aj;2017-06-10 10:21;0;0;"My advice to her: be a better mother to you son who committed security fraud";;;;"873485201405603840";https://twitter.com/Btl_aj/status/873485201405603840
Btl_aj;2017-06-10 10:19;0;0;"Isn't he Muslim with that name? Who cares about this old guy";;;;"873484713599651844";https://twitter.com/Btl_aj/status/873484713599651844
Btl_aj;2017-06-10 10:18;0;0;"I saw MSNBC and stopped reading. Haha";;;;"873484406849249281";https://twitter.com/Btl_aj/status/873484406849249281
Btl_aj;2017-06-10 10:17;0;0;"I agree with Jeb too. Now he can go back to playing with his turtle";;;;"873484153060282368";https://twitter.com/Btl_aj/status/873484153060282368
Btl_aj;2017-06-10 10:15;0;0;"This lawyer looks like Bernie Maddox. Another Jewish crook";;;;"873483674242748416";https://twitter.com/Btl_aj/status/873483674242748416
Btl_aj;2017-06-10 10:14;0;0;"He's gone. Get with the news";;;;"873483446194188292";https://twitter.com/Btl_aj/status/873483446194188292
Btl_aj;2017-06-10 10:13;0;0;"Has been and she got fat";;;;"873483214484111361";https://twitter.com/Btl_aj/status/873483214484111361
Btl_aj;2017-06-10 10:12;0;0;"What they talk about? Trudeau coming out of the closet";;;;"873482993222004736";https://twitter.com/Btl_aj/status/873482993222004736
Btl_aj;2017-06-10 10:11;0;0;"I just lost my appetite.";;;;"873482685661970432";https://twitter.com/Btl_aj/status/873482685661970432
Btl_aj;2017-06-10 10:10;0;0;"That guy looks special needs.";;;;"873482547543584769";https://twitter.com/Btl_aj/status/873482547543584769
Btl_aj;2017-06-10 10:09;0;0;"Bad decision- now they will feel sorry for the Muslim kids who have the bomb strapped to their diapers";;;;"873482234220728320";https://twitter.com/Btl_aj/status/873482234220728320
Btl_aj;2017-06-10 10:05;0;0;"He's old and weak. Plus the wife is under investigation and he was such a fast sell out and he likes to steal from college kids";;;;"873481310421090304";https://twitter.com/Btl_aj/status/873481310421090304
Btl_aj;2017-06-10 08:35;0;0;"What if we have a war? Romney would bolt the country again";;;;"873458650995716096";https://twitter.com/Btl_aj/status/873458650995716096
Btl_aj;2017-06-10 08:35;0;0;"Creepy Joe likes Romney just because he wants to entertain those million morman kids. Gross";;;;"873458461820018688";https://twitter.com/Btl_aj/status/873458461820018688
Btl_aj;2017-06-10 08:32;0;0;"Worry about your son with his securities fraud. You're a crook like Hillary and probably a lesbian like her too";;;;"873457904589910018";https://twitter.com/Btl_aj/status/873457904589910018
Btl_aj;2017-06-10 08:29;1;0;"Her husband is so feminine. I'm sure he loves Anderson Cooper";;;;"873457130824749056";https://twitter.com/Btl_aj/status/873457130824749056
Btl_aj;2017-06-10 08:28;0;0;"Wrong instead she is a want to be Jew and her husband only cares about Israel and starting a war with Syria";;;;"873456930920034304";https://twitter.com/Btl_aj/status/873456930920034304
Btl_aj;2017-06-10 08:26;0;0;"If he goes to jail I bet she stops being a Jew";;;;"873456417616932864";https://twitter.com/Btl_aj/status/873456417616932864
Btl_aj;2017-06-10 08:26;0;1;"Ivanka is a Jewish shill. Her husband is a crook and looks gay";;;;"873456227040276481";https://twitter.com/Btl_aj/status/873456227040276481
Btl_aj;2017-06-10 08:25;0;1;"Her husband is a crook. Stop giving all our money to Israel";;;;"873456042021187584";https://twitter.com/Btl_aj/status/873456042021187584
Btl_aj;2017-06-10 08:22;0;0;"You're a Jewish Shill. I can't stand your crook husband. We don't want a war with Syria. Stop funding Israel. But I voted for your father";;;;"873455374371835905";https://twitter.com/Btl_aj/status/873455374371835905
Btl_aj;2017-06-10 08:17;0;0;"Who cares about Europe or U.K. I say let all the Muslims go there as long as they stay the fuck away from US";;;;"873454031871586304";https://twitter.com/Btl_aj/status/873454031871586304
Btl_aj;2017-06-10 08:15;0;0;"That's what happens when you have one too many.";;;;"873453499174047745";https://twitter.com/Btl_aj/status/873453499174047745
Btl_aj;2017-06-10 08:14;0;0;"I never liked her because of her big horse mouth and gums showing.";;;;"873453280944369666";https://twitter.com/Btl_aj/status/873453280944369666
Btl_aj;2017-06-10 08:13;0;0;"I'm so sick of these people and Bosnians flowing in US. Plus they stink and get free healthcare.";;;;"873452990430154752";https://twitter.com/Btl_aj/status/873452990430154752
Btl_aj;2017-06-10 08:11;0;0;"Duh! They have every good player on their team and I don't even watch this shit";;;;"873452465051627520";https://twitter.com/Btl_aj/status/873452465051627520
Btl_aj;2017-06-10 08:07;0;0;"She need to put down the weed!";;;;"873451592397320192";https://twitter.com/Btl_aj/status/873451592397320192
Btl_aj;2017-06-10 08:04;0;0;"I'm glad none had a towel wrapped on their head.";;;;"873450754740236289";https://twitter.com/Btl_aj/status/873450754740236289
Btl_aj;2017-06-10 08:02;0;0;"Can you get rid of these Muslim doctors? Stop allowing them to go to US medical schools.";;;;"873450273481654272";https://twitter.com/Btl_aj/status/873450273481654272
Btl_aj;2017-06-10 08:00;0;1;"And the Mayors number on speed dial.";;;;"873449655274795008";https://twitter.com/Btl_aj/status/873449655274795008
Btl_aj;2017-06-10 07:51;0;0;"Side effects from shooting but I can't stand Ivanka and her husband- Why give all that money to Israel? They should not be involved!";;;;"873447441810374656";https://twitter.com/Btl_aj/status/873447441810374656
Btl_aj;2017-06-10 07:47;0;0;"Yes- didn't you watch Sean?";;;;"873446614446288896";https://twitter.com/Btl_aj/status/873446614446288896
Btl_aj;2017-06-10 07:46;0;0;"What about Hillary going to prison? Trump promised that in his campaign. That's why I voted for him";;;;"873446362754543616";https://twitter.com/Btl_aj/status/873446362754543616
Btl_aj;2017-06-10 07:44;0;0;"No but he's Hillary's puppet since she paid him off.";;;;"873445688293634048";https://twitter.com/Btl_aj/status/873445688293634048
Btl_aj;2017-06-10 07:42;0;0;"Jew=Christ Killer";;;;"873445324920107009";https://twitter.com/Btl_aj/status/873445324920107009
Btl_aj;2017-06-10 07:41;0;0;"Mitt Romney is a Moron and a Morman. No wonder why he keeps losing!";;;;"873444933969076227";https://twitter.com/Btl_aj/status/873444933969076227
Btl_aj;2017-06-10 07:40;0;0;"Joe just worry about your grandchildren since your son can't keep his hands off his sister in law. Those kids must be fucked up.";;;;"873444669216235522";https://twitter.com/Btl_aj/status/873444669216235522
Btl_aj;2017-06-10 07:37;0;0;"He's the black version of creepy Joe Biden";;;;"873443966137622528";https://twitter.com/Btl_aj/status/873443966137622528
Btl_aj;2017-06-10 07:36;0;0;"Agree but stop giving all this money to Israel. Your son in law is a crook";;;;"873443637450985472";https://twitter.com/Btl_aj/status/873443637450985472
Btl_aj;2017-06-10 07:34;0;0;"Another ISIS worshipper who is making 6 figures in the US. Go back to Iran";;;;"873443320172871680";https://twitter.com/Btl_aj/status/873443320172871680
Btl_aj;2017-06-10 07:31;0;0;"He's a Jew so shut up about Christians";;;;"873442451679309824";https://twitter.com/Btl_aj/status/873442451679309824
Btl_aj;2017-06-10 07:29;0;0;"Isn't it time for Sanders and McCain to be in Assisted Living?";;;;"873441869082001408";https://twitter.com/Btl_aj/status/873441869082001408
Btl_aj;2017-06-10 01:44;0;0;"My only issue with you right now is Ivanka and her husband. He wanted a war with Syria. Stop giving Israel all that money! Don't trust Jared";;;;"873355151616208896";https://twitter.com/Btl_aj/status/873355151616208896
Btl_aj;2017-06-09 10:22;0;0;"What about the $600000 bribe Comey's wife took from Clinton Foundation?";;;;"873123245599236096";https://twitter.com/Btl_aj/status/873123245599236096
Btl_aj;2017-06-09 10:22;0;0;""That gave me a queasy feeling" Comey said about Loretta Lynch. Hahaha";;;;"873123083954958337";https://twitter.com/Btl_aj/status/873123083954958337
Btl_aj;2017-06-09 10:20;0;0;"I bet he has Alzheimer's";;;;"873122658350530560";https://twitter.com/Btl_aj/status/873122658350530560
Btl_aj;2017-06-09 10:20;0;0;"And the Russian this is old";;;;"873122509469605890";https://twitter.com/Btl_aj/status/873122509469605890
Btl_aj;2017-06-09 10:19;0;0;"We all knew she was corrupt. No surprise.";;;;"873122383082561536";https://twitter.com/Btl_aj/status/873122383082561536
Btl_aj;2017-06-09 10:18;0;0;"Khan is behind all these crimes.";;;;"873122220666634240";https://twitter.com/Btl_aj/status/873122220666634240
Btl_aj;2017-06-09 10:18;0;0;"Comey is done next Loretta! I need popcorn";;;;"873122015258886146";https://twitter.com/Btl_aj/status/873122015258886146
Btl_aj;2017-06-09 10:16;0;0;"I love this! It's going down and can't wait!!";;;;"873121576836775937";https://twitter.com/Btl_aj/status/873121576836775937
Btl_aj;2017-06-09 10:14;0;0;"Hey man? Freak";;;;"873121226503315458";https://twitter.com/Btl_aj/status/873121226503315458
Btl_aj;2017-06-09 10:13;0;0;"The only liar is Comey and Loretta Lynch and Clinton's and Obama";;;;"873120878661259266";https://twitter.com/Btl_aj/status/873120878661259266
Btl_aj;2017-06-09 10:12;0;0;"Can you block this freak? Or better yet just say it's you Crooked Hillary";;;;"873120690639060992";https://twitter.com/Btl_aj/status/873120690639060992
Btl_aj;2017-06-09 10:11;0;0;"You're be safe but Loretta Lynch is screwed. I'm sure the Clinton's are planning his death right about now!";;;;"873120411092885504";https://twitter.com/Btl_aj/status/873120411092885504
Btl_aj;2017-06-09 05:24;0;0;"Very good!";;;;"873048141389484034";https://twitter.com/Btl_aj/status/873048141389484034
Btl_aj;2017-06-09 02:53;0;0;"Democrats have all failed the American people and Trump is exposing them one at a time. Brilliant!";;;;"873010048032800769";https://twitter.com/Btl_aj/status/873010048032800769
Btl_aj;2017-06-09 02:52;0;1;"Israel loves Trump but why do the Jews in US hate him?";;;;"873009833741615104";https://twitter.com/Btl_aj/status/873009833741615104
Btl_aj;2017-06-09 02:24;0;0;"Comey cleared Trump but those Democrats- wow!!!!";;;;"873002852658163712";https://twitter.com/Btl_aj/status/873002852658163712
Btl_aj;2017-06-09 02:23;0;0;"The London Mayor was probably behind it all";;;;"873002636345307138";https://twitter.com/Btl_aj/status/873002636345307138
Btl_aj;2017-06-09 02:22;0;0;"Conshita is probably Crooked Hillary writing this shit while hitting the bottle hard";;;;"873002236368105473";https://twitter.com/Btl_aj/status/873002236368105473
Btl_aj;2017-06-09 02:21;0;0;"STFU. You must be some Antifa troll or some freak Muslim. Just go blow yourself up and leave us alone! Pull all financial aid to Berkeley";;;;"873001983870996480";https://twitter.com/Btl_aj/status/873001983870996480
Btl_aj;2017-06-09 02:19;0;0;"President Trump was exonerated today. Crooked Hillary, Loretta Lynch and NYTimes must all be scared shitless!";;;;"873001594920591361";https://twitter.com/Btl_aj/status/873001594920591361
Btl_aj;2017-06-09 02:17;0;0;"He's laughing at all you stupids because Comey exonerated him today and ripped Loretta Lynch apart. Hillary must be shitting!";;;;"873001029973016578";https://twitter.com/Btl_aj/status/873001029973016578
Btl_aj;2017-06-09 02:15;0;0;"? You exonerated him today. Trump came out smelling like a rose but you nailed Loretta Lynch's coffin. Hahah";;;;"873000466283728896";https://twitter.com/Btl_aj/status/873000466283728896
Btl_aj;2017-06-09 02:13;0;0;"Trump will win the next election. He's brilliant. Too bad you jumped ship Ann.";;;;"873000047390195712";https://twitter.com/Btl_aj/status/873000047390195712
Btl_aj;2017-06-09 02:11;0;0;"You don't even like Trump. You must be pissed Comey cleared him today.";;;;"872999587224727553";https://twitter.com/Btl_aj/status/872999587224727553
Btl_aj;2017-06-09 02:09;0;0;"Comey was either in cahoots with Trump or Trump is sheer genius and can give every Democrat the finger!";;;;"872998976525611008";https://twitter.com/Btl_aj/status/872998976525611008
Btl_aj;2017-06-09 02:06;0;1;"President Trump is sheer genius. He always comes out smelling like a rose and I semi like him!";;;;"872998247027142657";https://twitter.com/Btl_aj/status/872998247027142657
Btl_aj;2017-06-08 16:42;0;0;"President Comey? He's drunk";;;;"872856428792381440";https://twitter.com/Btl_aj/status/872856428792381440
Btl_aj;2017-06-08 16:42;1;0;"Why did Comey's wife take a bribe from Clinton Foundation?";;;;"872856283619217408";https://twitter.com/Btl_aj/status/872856283619217408
Btl_aj;2017-06-07 02:26;0;0;"This guy not only seems special needs but also is socially inept";;;;"872278547632721921";https://twitter.com/Btl_aj/status/872278547632721921
Btl_aj;2017-06-07 02:25;0;0;"This guy was on Live with Kelly and Ryan and I thought he was Autistic.";;;;"872278197634822144";https://twitter.com/Btl_aj/status/872278197634822144
Btl_aj;2017-06-07 02:23;0;0;"Cont?";;;;"872277837780328450";https://twitter.com/Btl_aj/status/872277837780328450
Btl_aj;2017-06-07 02:23;0;0;"It's called Operation blow you all up in the name of Allah. Stupids";;;;"872277733933555712";https://twitter.com/Btl_aj/status/872277733933555712
Btl_aj;2017-06-07 02:22;0;0;"Two stupid fools";;;;"872277449572331520";https://twitter.com/Btl_aj/status/872277449572331520
Btl_aj;2017-06-07 02:20;0;1;"Good and stay out! Hope you make it to your next birthday in Allah ridden Europe";;;;"872276973632065536";https://twitter.com/Btl_aj/status/872276973632065536
Btl_aj;2017-06-07 02:19;0;0;"Go now because Europe is probably just going to keep getting worse";;;;"872276693112819712";https://twitter.com/Btl_aj/status/872276693112819712
Btl_aj;2017-06-07 02:18;0;0;"Allah too! This guy is bad news!!";;;;"872276528477999105";https://twitter.com/Btl_aj/status/872276528477999105
Btl_aj;2017-06-07 02:16;0;0;"I doubt it.";;;;"872275942156234752";https://twitter.com/Btl_aj/status/872275942156234752
Btl_aj;2017-06-07 02:13;0;0;"To blow us up";;;;"872275296820613124";https://twitter.com/Btl_aj/status/872275296820613124
Btl_aj;2017-06-05 08:46;0;0;"He's Muslim";;;;"871649413525114880";https://twitter.com/Btl_aj/status/871649413525114880
Btl_aj;2017-06-04 05:34;0;0;"Do you people like blacks or Puerto Rican's? Just planning my vacation";;;;"871238787300544513";https://twitter.com/Btl_aj/status/871238787300544513
Btl_aj;2017-06-04 05:33;0;0;"Can you guys show your faces? Also are you paid to do this? I need a parttime job";;;;"871238390309695488";https://twitter.com/Btl_aj/status/871238390309695488
Btl_aj;2017-06-04 05:27;0;0;"Are you in college? Can you show your face? Just curious";;;;"871236973230530561";https://twitter.com/Btl_aj/status/871236973230530561
Btl_aj;2017-06-04 05:26;0;0;"Do you like Jews? Or black people?";;;;"871236721299656704";https://twitter.com/Btl_aj/status/871236721299656704
Btl_aj;2017-06-04 05:24;0;0;"How come you were costumes at rallies? Will you be showing your faces?";;;;"871236222265556992";https://twitter.com/Btl_aj/status/871236222265556992
Btl_aj;2017-06-04 05:21;0;0;"Wolfe' ratings plummeted. I love how President Trump called him on that.";;;;"871235399426945024";https://twitter.com/Btl_aj/status/871235399426945024
Btl_aj;2017-06-04 05:19;0;0;"Fake news";;;;"871234995347763200";https://twitter.com/Btl_aj/status/871234995347763200
Btl_aj;2017-06-04 05:17;0;0;"Bill Mahar is racist";;;;"871234442894991360";https://twitter.com/Btl_aj/status/871234442894991360
Btl_aj;2017-06-04 05:15;0;0;"This is really Alec. Got it now.";;;;"871233910419709952";https://twitter.com/Btl_aj/status/871233910419709952
Btl_aj;2017-06-04 05:14;0;0;"Polliwog- hahaha another fatty like Baldwin won't show their face.";;;;"871233627157352449";https://twitter.com/Btl_aj/status/871233627157352449
Btl_aj;2017-06-04 05:12;0;0;"You're not even American. Canada is no different then Europe. Thank GOD for President Trump.";;;;"871233274143789056";https://twitter.com/Btl_aj/status/871233274143789056
Btl_aj;2017-06-04 05:10;0;0;"Why do you hate black people?";;;;"871232783804502016";https://twitter.com/Btl_aj/status/871232783804502016
Btl_aj;2017-06-04 05:10;0;0;"Why do you use the N-word";;;;"871232582784098305";https://twitter.com/Btl_aj/status/871232582784098305
Btl_aj;2017-06-04 05:09;0;0;"Agree! But why do rappers say it all the time?";;;;"871232396942880768";https://twitter.com/Btl_aj/status/871232396942880768
Btl_aj;2017-06-04 05:05;0;0;"So are you Muslim or Hindu or what? Just a curious American";;;;"871231498321526784";https://twitter.com/Btl_aj/status/871231498321526784
Btl_aj;2017-06-04 05:04;0;0;"That picture says it all- Moe, Larry and Curly";;;;"871231046016266240";https://twitter.com/Btl_aj/status/871231046016266240
Btl_aj;2017-06-04 05:03;0;0;"Another hoax.";;;;"871230783427620864";https://twitter.com/Btl_aj/status/871230783427620864
Btl_aj;2017-06-04 05:02;0;0;"You had people killed not all of us have that power!";;;;"871230634089435136";https://twitter.com/Btl_aj/status/871230634089435136
Btl_aj;2017-06-04 05:00;0;0;"You made money now go away. It's not fair for any of us to see your ugly face.";;;;"871230126989742082";https://twitter.com/Btl_aj/status/871230126989742082
Btl_aj;2017-06-04 04:58;0;0;"Antifa loser";;;;"871229690035535872";https://twitter.com/Btl_aj/status/871229690035535872
Btl_aj;2017-06-04 04:57;0;0;"Crooked guy";;;;"871229427572760576";https://twitter.com/Btl_aj/status/871229427572760576
Btl_aj;2017-06-04 04:57;0;0;"You're a has been. You're not funny and have Lyme disease. Go away";;;;"871229285004185605";https://twitter.com/Btl_aj/status/871229285004185605
Btl_aj;2017-06-04 04:56;0;0;"You needed mental help with Ireland and you obviously still never got the help. You're poor kids! Stop breeding old man";;;;"871229040589516801";https://twitter.com/Btl_aj/status/871229040589516801
Btl_aj;2017-06-04 04:54;0;0;"Ignore you! God gave you Lyme disease for a reason.";;;;"871228707880525824";https://twitter.com/Btl_aj/status/871228707880525824
Btl_aj;2017-06-04 04:53;0;0;"Wrong!!! Thank God you LOST. We would all die from Terrorism and have no jobs left";;;;"871228477718110208";https://twitter.com/Btl_aj/status/871228477718110208
Btl_aj;2017-06-04 04:52;0;0;"Please don't say another girl from Haiti for Bill";;;;"871228257684869121";https://twitter.com/Btl_aj/status/871228257684869121
Btl_aj;2017-06-04 04:52;0;0;"Haha! She won't ever blame Bill the pedophile.";;;;"871228100524351489";https://twitter.com/Btl_aj/status/871228100524351489
Btl_aj;2017-06-04 04:51;0;0;"And if your husband cheats on you remember to dump him! Life is not about money and being miserable";;;;"871227956525502464";https://twitter.com/Btl_aj/status/871227956525502464
