username;date;retweets;favorites;text;geo;mentions;hashtags;id;permalink
Btl_aj;2017-07-30 17:18;0;0;"Do you have to pay for Colin and Laura's attorney? Or just yours? Where are the kids now? Will Boys survive in prison?";;;;"891709637510262784";https://twitter.com/Btl_aj/status/891709637510262784
Btl_aj;2017-07-30 17:11;0;0;"I wish Craig washed his hands of all of them. He obviously loved his kids. It's so sad.";;;;"891707921855385600";https://twitter.com/Btl_aj/status/891707921855385600
Btl_aj;2017-07-30 17:05;0;0;"Does he get paid to do interviews or not?";;;;"891706344545374209";https://twitter.com/Btl_aj/status/891706344545374209
Btl_aj;2017-07-30 17:03;0;0;"There just seems to be something missing why these kids hated their father so much. They weren't babies. Was he abusive? No excuse to die.";;;;"891705759242870784";https://twitter.com/Btl_aj/status/891705759242870784
Btl_aj;2017-07-29 22:52;0;0;"Paul Tucci and his lawyer want to be the next Kardashians. They are on every news station.";;;;"891431207044616192";https://twitter.com/Btl_aj/status/891431207044616192
Btl_aj;2017-07-29 22:38;0;0;"Charlie's judge was up for an election.";;;;"891427755371450368";https://twitter.com/Btl_aj/status/891427755371450368
Btl_aj;2017-07-29 22:32;0;0;"Why didn't Colin just shoot Craig with the gun? Probably because Tucci killed him.";;;;"891426326099488772";https://twitter.com/Btl_aj/status/891426326099488772
Btl_aj;2017-07-29 01:38;0;0;"Colin was dressed like a ninja. They all had to be on drugs.";;;;"891110755470331905";https://twitter.com/Btl_aj/status/891110755470331905
Btl_aj;2017-07-29 01:36;0;0;"I wonder if Laura and sons see each other or talk in jail?";;;;"891110149817065472";https://twitter.com/Btl_aj/status/891110149817065472
Btl_aj;2017-07-29 01:35;0;0;"I wonder if Colin's girlfriend knew what really happened? How can he not share any of this with her??";;;;"891109797667405824";https://twitter.com/Btl_aj/status/891109797667405824
Btl_aj;2017-07-29 01:33;0;0;"I read they are with Laura's sister.";;;;"891109312495529984";https://twitter.com/Btl_aj/status/891109312495529984
Btl_aj;2017-07-29 01:25;0;0;"Maybe this will be the appeal for Laura and Colin. Craig was abusive to Laura and Charlie Tan oops Colin killed Craig to save her.";;;;"891107352216305665";https://twitter.com/Btl_aj/status/891107352216305665
Btl_aj;2017-07-29 00:48;0;0;"Can the other children be charged with anything?";;;;"891098179462197249";https://twitter.com/Btl_aj/status/891098179462197249
Btl_aj;2017-07-29 00:40;0;0;"I'm disappointed with jury's decision on Tucci. I'm glad his son was caught having children porn. A murderer and pervert! Great family";;;;"891096042971828226";https://twitter.com/Btl_aj/status/891096042971828226
Btl_aj;2017-07-29 00:33;0;1;"Charlie got away with murder. Colin wasn't as smart";;;;"891094401770041344";https://twitter.com/Btl_aj/status/891094401770041344
Btl_aj;2017-07-29 00:25;0;0;"Jane Flasch interviewed him but Brett was better. He's making the rounds because he needs the money to pay off his Soprano attorney";;;;"891092300239077376";https://twitter.com/Btl_aj/status/891092300239077376
Btl_aj;2017-07-29 00:23;0;0;"I wish they asked him how can he afford Attorney fees? Hope not from Dateline";;;;"891091763112415232";https://twitter.com/Btl_aj/status/891091763112415232
Btl_aj;2017-07-29 00:20;0;0;"Will he get paid from Dateline?";;;;"891090999023468544";https://twitter.com/Btl_aj/status/891090999023468544
Btl_aj;2017-07-28 23:48;0;0;"I bet he and his son are on a new computer having a blast! Gross!!";;;;"891082844692525056";https://twitter.com/Btl_aj/status/891082844692525056
Btl_aj;2017-07-28 23:44;0;0;"Was Laura on drugs? I read that on many comments of people who knew her.";;;;"891081861920894983";https://twitter.com/Btl_aj/status/891081861920894983
Btl_aj;2017-07-28 23:42;0;0;"Can you just share what you know? I think you want too";;;;"891081364719718400";https://twitter.com/Btl_aj/status/891081364719718400
Btl_aj;2017-07-28 23:41;0;0;"Sounds like he hated Craig to me enough to murder him";;;;"891081101330055174";https://twitter.com/Btl_aj/status/891081101330055174
Btl_aj;2017-07-28 23:39;0;0;"Did Wease or Tucci say that about Craig? That's awful and so sick.";;;;"891080722081083392";https://twitter.com/Btl_aj/status/891080722081083392
Btl_aj;2017-07-28 23:37;0;0;"Who were the Republicans?";;;;"891080147193016320";https://twitter.com/Btl_aj/status/891080147193016320
Btl_aj;2017-07-28 23:36;0;0;"Thank God he's gone. Never trusted him and that Paul Ryan";;;;"891079955538423810";https://twitter.com/Btl_aj/status/891079955538423810
Btl_aj;2017-07-28 03:38;0;0;"I agree and Craig probably had a lot on her. I wonder if all 3 see each other or talk in jail?";;;;"890778582338998273";https://twitter.com/Btl_aj/status/890778582338998273
Btl_aj;2017-07-28 01:49;0;0;"Judge Moran better throw the book at them. He knows they are murderers. The whole family should be in prison and the one in the military!";;;;"890751099174617088";https://twitter.com/Btl_aj/status/890751099174617088
Btl_aj;2017-07-28 01:46;0;0;"What a sick family! Colin and Laura got what he deserved. I'm glad about that.";;;;"890750338017501184";https://twitter.com/Btl_aj/status/890750338017501184
Btl_aj;2017-07-28 01:45;0;0;"Wow!! Julia Should have been questioned. these Rideout kids know what happened. Colin is nuttier then Laura. I wonder if fiancé knows too?";;;;"890750109444694017";https://twitter.com/Btl_aj/status/890750109444694017
Btl_aj;2017-07-28 01:31;0;0;"I think you should step down.";;;;"890746468436496384";https://twitter.com/Btl_aj/status/890746468436496384
Btl_aj;2017-07-28 01:29;0;0;"You're so handsome!! And smart";;;;"890745985449820160";https://twitter.com/Btl_aj/status/890745985449820160
Btl_aj;2017-07-28 01:28;0;0;"Something big is going to go down. My guess is Democrats and Hillary. Dump Sessions he is weak!!";;;;"890745759120994304";https://twitter.com/Btl_aj/status/890745759120994304
Btl_aj;2017-07-28 01:27;0;0;"Reince is a leaker. I'm so glad you said this. Never liked him. Trump is finally getting good people";;;;"890745460801110016";https://twitter.com/Btl_aj/status/890745460801110016
Btl_aj;2017-07-28 01:26;0;0;"Why! Be yourself. We don't want robots anymore";;;;"890745231628525569";https://twitter.com/Btl_aj/status/890745231628525569
Btl_aj;2017-07-28 01:25;0;0;"You are my all time favorite!! I'm so glad the President picked you. Keep up the great job";;;;"890745006213955585";https://twitter.com/Btl_aj/status/890745006213955585
Btl_aj;2017-07-28 01:24;0;0;"Priebus is the leaker";;;;"890744818061672448";https://twitter.com/Btl_aj/status/890744818061672448
Btl_aj;2017-07-28 01:24;0;0;"Adios McCain for many reasons";;;;"890744633843740673";https://twitter.com/Btl_aj/status/890744633843740673
Btl_aj;2017-07-28 01:23;0;0;"Best decision ever! They do not belong in the military. They are psychologically imbalanced";;;;"890744467447304192";https://twitter.com/Btl_aj/status/890744467447304192
Btl_aj;2017-07-28 01:22;0;0;"Dump Session! Something big is going to happen soon. What is it? I love Scaramucci";;;;"890744240195735552";https://twitter.com/Btl_aj/status/890744240195735552
Btl_aj;2017-07-28 01:19;0;0;"How did her part time aide make all that $. Now I know why you banned those countries. Great job!";;;;"890743390404575232";https://twitter.com/Btl_aj/status/890743390404575232
Btl_aj;2017-07-28 01:15;0;0;"I also read how possible Colin dressed like a ninja to steal Craig's keys. This was so premeditated yet run by idiots. Tucci dodge a bullet";;;;"890742528538030081";https://twitter.com/Btl_aj/status/890742528538030081
Btl_aj;2017-07-28 00:00;0;0;"Do you know if Paul and Laura were having an affair while his first wife was alive? Her obituary called Paul "loving husband"";;;;"890723603074908160";https://twitter.com/Btl_aj/status/890723603074908160
Btl_aj;2017-07-27 23:56;0;0;"The taxes will kill you! They won't stop going up";;;;"890722676339351552";https://twitter.com/Btl_aj/status/890722676339351552
Btl_aj;2017-07-27 23:54;0;0;"Wow! That explains getting in the home. Walmart makes keys.";;;;"890722200298418176";https://twitter.com/Btl_aj/status/890722200298418176
Btl_aj;2017-07-27 23:53;0;0;"Why do the kids hate him so much? And why would they want to live with Tucci over him? Just curious";;;;"890721716342751232";https://twitter.com/Btl_aj/status/890721716342751232
Btl_aj;2017-07-27 23:50;0;0;"Why did the kids hate this guy so much?";;;;"890721184547000320";https://twitter.com/Btl_aj/status/890721184547000320
Btl_aj;2017-07-27 23:38;0;0;"At least he was prepared for the sentence.";;;;"890717954144391168";https://twitter.com/Btl_aj/status/890717954144391168
Btl_aj;2017-07-27 23:37;0;0;"Colin is really weird! Did he snap? I can't believe he had a fiancé. Did these boys have a job? Who supported them?";;;;"890717798854537218";https://twitter.com/Btl_aj/status/890717798854537218
Btl_aj;2017-07-27 23:34;0;0;"Was Craig violent?";;;;"890717148426928128";https://twitter.com/Btl_aj/status/890717148426928128
Btl_aj;2017-07-27 23:32;0;0;"Stupid cops! Alex should have gotten murder!";;;;"890716637334319105";https://twitter.com/Btl_aj/status/890716637334319105
Btl_aj;2017-07-27 23:30;0;0;"I wonder if Colin loved his mom so much he would kill for her or he and the mom were into some sick sexual shit that he was blindsided.";;;;"890716173440094208";https://twitter.com/Btl_aj/status/890716173440094208
Btl_aj;2017-07-27 23:28;0;0;"God this family is f'ed up!";;;;"890715581594447872";https://twitter.com/Btl_aj/status/890715581594447872
Btl_aj;2017-07-27 23:25;0;0;"Thanks for answering me. Did you notice Laura smiling in court? What about the DNA of Paul in glove?";;;;"890714848341970944";https://twitter.com/Btl_aj/status/890714848341970944
Btl_aj;2017-07-27 10:30;0;0;"Giuliani has gun issues. Big mistake";;;;"890519650588647425";https://twitter.com/Btl_aj/status/890519650588647425
Btl_aj;2017-07-27 10:29;0;0;"He won't quit but do NOT ever use Lyin Cruz and Gulianian. Bad choices! Cruz will knife you in back. Campaign was about his lies";;;;"890519481180721153";https://twitter.com/Btl_aj/status/890519481180721153
Btl_aj;2017-07-27 10:17;0;0;"Of course he didn't go.";;;;"890516457758523392";https://twitter.com/Btl_aj/status/890516457758523392
Btl_aj;2017-07-27 10:16;0;1;"I really hope he can't make money off a book deal or Dateline.";;;;"890516329387761664";https://twitter.com/Btl_aj/status/890516329387761664
Btl_aj;2017-07-27 10:15;0;0;"The guy is weak!";;;;"890515963292024833";https://twitter.com/Btl_aj/status/890515963292024833
Btl_aj;2017-07-27 10:13;0;0;"Put them on the front line.";;;;"890515370016157697";https://twitter.com/Btl_aj/status/890515370016157697
Btl_aj;2017-07-27 10:11;0;0;"Why did you pick Sessions?";;;;"890514985201356800";https://twitter.com/Btl_aj/status/890514985201356800
Btl_aj;2017-07-27 03:17;0;0;"Paul Said he went and visited Laura and she smiled and needs reading materials. What a bizarre comment? I keep reading she was on drugs???";;;;"890410712329318401";https://twitter.com/Btl_aj/status/890410712329318401
Btl_aj;2017-07-27 03:14;0;0;"Did you see the police released Colin and Laura's texts? Colin wanted the sister to set up Craig. She didn't and Laura said to hit her!!";;;;"890410072517509120";https://twitter.com/Btl_aj/status/890410072517509120
Btl_aj;2017-07-27 03:11;0;0;"Thanks!! You're my favorite of all these reporters.";;;;"890409230511026176";https://twitter.com/Btl_aj/status/890409230511026176
Btl_aj;2017-07-27 03:10;0;0;"Those boys look like nerds Especially Alex. I bet they won't last in prison. I feel bad they had such a controlling mother.";;;;"890408931075469312";https://twitter.com/Btl_aj/status/890408931075469312
Btl_aj;2017-07-27 03:07;0;0;"Laura would be smart to drink drain cleaner in jail if she can find any. That prison sentence is going to be a long time!";;;;"890408338378412033";https://twitter.com/Btl_aj/status/890408338378412033
Btl_aj;2017-07-27 03:06;0;0;"If Colin has any brains at all he would make another garrote and use it before real prison comes!";;;;"890407967820042240";https://twitter.com/Btl_aj/status/890407967820042240
Btl_aj;2017-07-27 03:00;0;0;"Brett did an excellent interview! Did you feel he was lying and weird during interview? He looked crazy.";;;;"890406390719795204";https://twitter.com/Btl_aj/status/890406390719795204
Btl_aj;2017-07-27 02:58;0;0;"I wonder if he could name the restaurant he went too and I doubt his sink is clogged. Why did he rent a car and the car in Craig's garage?";;;;"890405932529852416";https://twitter.com/Btl_aj/status/890405932529852416
Btl_aj;2017-07-27 02:54;0;0;"Just so odd to me but you're right!";;;;"890405030855143428";https://twitter.com/Btl_aj/status/890405030855143428
Btl_aj;2017-07-27 01:14;0;0;"Guess Paul got away with murder.";;;;"890379839299039232";https://twitter.com/Btl_aj/status/890379839299039232
Btl_aj;2017-07-27 01:09;0;0;"How old is she?";;;;"890378651241512960";https://twitter.com/Btl_aj/status/890378651241512960
Btl_aj;2017-07-27 00:56;0;0;"Did you see Tucci's interview. What an idiot/goofy liar!";;;;"890375207743102976";https://twitter.com/Btl_aj/status/890375207743102976
Btl_aj;2017-07-27 00:53;0;1;"Haha! I think Paul killed Craig and carried the body.";;;;"890374571806920709";https://twitter.com/Btl_aj/status/890374571806920709
Btl_aj;2017-07-27 00:51;0;0;"The police messed up- never read Miranda Rights and a lot of evidence wasn't allowed in";;;;"890373922503495680";https://twitter.com/Btl_aj/status/890373922503495680
Btl_aj;2017-07-27 00:49;0;0;"I wish you asked him about Craig's keys in his bed. I hope it wasn't some freaky thing with Laura after killing Craig!";;;;"890373645943656449";https://twitter.com/Btl_aj/status/890373645943656449
Btl_aj;2017-07-27 00:48;0;0;"Maybe to make him squirm? But I agree like he will say yes";;;;"890373319412912129";https://twitter.com/Btl_aj/status/890373319412912129
Btl_aj;2017-07-27 00:47;0;1;"And buy it on Hudson Ave in the city. When there is a Walmart 5 minutes from his home.";;;;"890373085584609280";https://twitter.com/Btl_aj/status/890373085584609280
Btl_aj;2017-07-27 00:46;0;0;"I wish you asked him if he was having an affair with laura while his wife was alive? And why does his son like to watch children having sex?";;;;"890372763940257792";https://twitter.com/Btl_aj/status/890372763940257792
Btl_aj;2017-07-27 00:44;0;0;"What a liar! He should choke on all his lies";;;;"890372310447816704";https://twitter.com/Btl_aj/status/890372310447816704
Btl_aj;2017-07-27 00:37;0;1;"Really! I hope those kids are in counseling.";;;;"890370521925390336";https://twitter.com/Btl_aj/status/890370521925390336
Btl_aj;2017-07-27 00:36;0;0;"He looks crazy! Poor Craig must have been terrified that night!";;;;"890370319449550848";https://twitter.com/Btl_aj/status/890370319449550848
Btl_aj;2017-07-27 00:33;0;0;"They were so wrong with Paul Tucci. I lost respect for them";;;;"890369603679006720";https://twitter.com/Btl_aj/status/890369603679006720
Btl_aj;2017-07-27 00:30;0;0;"Not 1 tear. They are really hard. That's good for prison";;;;"890368848276451329";https://twitter.com/Btl_aj/status/890368848276451329
Btl_aj;2017-07-27 00:29;0;0;"Geez! Talk about planning his murder";;;;"890368455429545984";https://twitter.com/Btl_aj/status/890368455429545984
Btl_aj;2017-07-27 00:23;0;0;"She's the only one who showed emotion. I wonder if she knows what really happened?";;;;"890366946268590082";https://twitter.com/Btl_aj/status/890366946268590082
Btl_aj;2017-07-27 00:22;0;0;"Those poor women. I just think Justice wasn't completely served. I feel Paul Tucci should be in prison.";;;;"890366684078518273";https://twitter.com/Btl_aj/status/890366684078518273
Btl_aj;2017-07-27 00:17;0;0;"Someone on the jury has to know this guy? I wasn't impressed with his lawyer.";;;;"890365577960857600";https://twitter.com/Btl_aj/status/890365577960857600
Btl_aj;2017-07-27 00:16;0;0;"Did the police not give boys Miranda Rights? Why wasn't Craig's car keys in Tucci's bed allowed in court?";;;;"890365279347388417";https://twitter.com/Btl_aj/status/890365279347388417
Btl_aj;2017-07-27 00:12;0;0;"The jury messed up. I'm angry about Paul Tucci.";;;;"890364151020883970";https://twitter.com/Btl_aj/status/890364151020883970
Btl_aj;2017-07-27 00:10;0;0;"Who has custody of the children now? Will the same lawyer for Paul represent his porn loving son?";;;;"890363848015974400";https://twitter.com/Btl_aj/status/890363848015974400
Btl_aj;2017-07-27 00:07;0;0;"The jury decision has me so angry! They really messed up with Paul Tucci";;;;"890363061986619392";https://twitter.com/Btl_aj/status/890363061986619392
Btl_aj;2017-07-27 00:05;0;0;"Did you know about the Craig's car keys found in Paul Tucci's bed? Just curious";;;;"890362431901507585";https://twitter.com/Btl_aj/status/890362431901507585
Btl_aj;2017-07-27 00:03;0;0;"Someone on the jury had to know Tucci.";;;;"890362013381259265";https://twitter.com/Btl_aj/status/890362013381259265
Btl_aj;2017-07-27 00:00;0;0;"Even the police detective think he killed Craig. What a family- murderer, porn pervert and God knows what else!";;;;"890361163816595456";https://twitter.com/Btl_aj/status/890361163816595456
Btl_aj;2017-07-26 10:29;0;0;"You're kid is going to be so stupid. Maybe North can tutor Lunatic?";;;;"890156995910795264";https://twitter.com/Btl_aj/status/890156995910795264
Btl_aj;2017-07-26 10:28;0;0;"Please delete your account. You're a nothing anyways";;;;"890156774904528896";https://twitter.com/Btl_aj/status/890156774904528896
Btl_aj;2017-07-26 10:27;0;0;"Nice language! You're a mother now to Lunatic. Come on and grow up!";;;;"890156505592451073";https://twitter.com/Btl_aj/status/890156505592451073
Btl_aj;2017-07-26 10:25;0;0;"Cute? Did you see the kids never ending forehead? Ew";;;;"890156230873952256";https://twitter.com/Btl_aj/status/890156230873952256
Btl_aj;2017-07-26 10:25;0;0;"Well you do come off very stupid.";;;;"890156025856352260";https://twitter.com/Btl_aj/status/890156025856352260
Btl_aj;2017-07-26 10:23;0;0;"You're now a mother. God you're gross!";;;;"890155727708356608";https://twitter.com/Btl_aj/status/890155727708356608
Btl_aj;2017-07-26 10:23;0;0;"You have the most distorted face how can you be a model?";;;;"890155548657758208";https://twitter.com/Btl_aj/status/890155548657758208
Btl_aj;2017-07-26 10:22;0;0;"I like him. So stop lying and concentrate on kissing the Kardashians ass! You're good at that.";;;;"890155258474897408";https://twitter.com/Btl_aj/status/890155258474897408
Btl_aj;2017-07-26 10:20;0;0;"Wow that is a mega forehead on that kid!";;;;"890154795767672833";https://twitter.com/Btl_aj/status/890154795767672833
Btl_aj;2017-07-26 10:19;0;0;"Get a life. You must really be bored at home. Too bad getting knocked up didn't help you.";;;;"890154563516473344";https://twitter.com/Btl_aj/status/890154563516473344
Btl_aj;2017-07-26 02:16;0;0;"4 we know of";;;;"890032990893608963";https://twitter.com/Btl_aj/status/890032990893608963
Btl_aj;2017-07-26 02:13;0;0;"They did a great job. Just still shocked about Paul Tucci";;;;"890032415577657344";https://twitter.com/Btl_aj/status/890032415577657344
Btl_aj;2017-07-26 02:12;0;0;"Huh? Tucci's lawyer said he wanted to remove her because she was the youngest. Was that a lie?";;;;"890032061351899136";https://twitter.com/Btl_aj/status/890032061351899136
Btl_aj;2017-07-26 02:06;0;0;"Can Paul get money from Dateline or book since he is not guilty?";;;;"890030623557025792";https://twitter.com/Btl_aj/status/890030623557025792
Btl_aj;2017-07-26 01:58;0;0;"What does Jeff Sessions do?";;;;"890028474051833856";https://twitter.com/Btl_aj/status/890028474051833856
Btl_aj;2017-07-26 01:57;0;0;"I thought Bernie got that amount too";;;;"890028169314668544";https://twitter.com/Btl_aj/status/890028169314668544
Btl_aj;2017-07-26 01:56;0;0;"Huh? He's no hero";;;;"890028042734768128";https://twitter.com/Btl_aj/status/890028042734768128
Btl_aj;2017-07-26 01:55;0;0;"I feel John is evil. He and Bush got us in war and he wanted us in war again.";;;;"890027777289854976";https://twitter.com/Btl_aj/status/890027777289854976
Btl_aj;2017-07-26 01:41;0;0;"Really?";;;;"890024292506849282";https://twitter.com/Btl_aj/status/890024292506849282
Btl_aj;2017-07-26 01:41;0;0;"Can you say who it was now? Just curious";;;;"890024135673425922";https://twitter.com/Btl_aj/status/890024135673425922
Btl_aj;2017-07-26 01:40;0;0;"He must be a good lawyer even though if I was on jury I wouldn't take him serious. He looked like a used car salesman.";;;;"890023937345802240";https://twitter.com/Btl_aj/status/890023937345802240
Btl_aj;2017-07-26 01:36;0;1;"Was he physically abusive? They really hated their dad. No excuse to kill him but something was missing from this story.";;;;"890022990188089346";https://twitter.com/Btl_aj/status/890022990188089346
Btl_aj;2017-07-26 01:30;0;0;"Laura wasn't crying. She lost everything";;;;"890021447317553152";https://twitter.com/Btl_aj/status/890021447317553152
Btl_aj;2017-07-25 23:47;0;0;"Did the boys have jobs? Colin was engaged.";;;;"889995460622077952";https://twitter.com/Btl_aj/status/889995460622077952
Btl_aj;2017-07-25 23:44;0;0;"Oh!! Don't you think a lot more people knew what happened? That little fiancé, the other Rideout kids, possibly the Tucci kids.";;;;"889994899743023108";https://twitter.com/Btl_aj/status/889994899743023108
Btl_aj;2017-07-25 23:23;0;0;"Thanks!";;;;"889989400997892096";https://twitter.com/Btl_aj/status/889989400997892096
Btl_aj;2017-07-25 23:22;0;0;"I hope the family goes after him with a civil case. I also hope his kid goes to jail too!";;;;"889989304205926400";https://twitter.com/Btl_aj/status/889989304205926400
Btl_aj;2017-07-25 23:21;0;1;"That's nasty. What's wrong with people? He was involved in a murder for God Sake!";;;;"889988951578222595";https://twitter.com/Btl_aj/status/889988951578222595
Btl_aj;2017-07-25 23:18;0;0;"She didn't even look at PJ and I wonder why boys were so calm? Remember when Alex was shaking in cop car and Colin puked on himself.";;;;"889988381173788672";https://twitter.com/Btl_aj/status/889988381173788672
Btl_aj;2017-07-25 23:16;0;0;"I bet they were Tucci's friend!";;;;"889987739009110016";https://twitter.com/Btl_aj/status/889987739009110016
Btl_aj;2017-07-25 23:15;0;0;"Sickening! I just wanted someone to punch him. Who do you feel hit him with iron and used garrote?";;;;"889987435429593089";https://twitter.com/Btl_aj/status/889987435429593089
Btl_aj;2017-07-25 23:13;0;0;"Well she can wait 15-25 plus years for him unless he starts to like dudes.";;;;"889987054171545601";https://twitter.com/Btl_aj/status/889987054171545601
Btl_aj;2017-07-25 23:12;0;0;"Do you think Paul maybe talked in exchange for freedom?";;;;"889986657113567232";https://twitter.com/Btl_aj/status/889986657113567232
Btl_aj;2017-07-25 22:43;0;0;"I can't believe Laura never showed emotion for her boys.";;;;"889979463064317956";https://twitter.com/Btl_aj/status/889979463064317956
Btl_aj;2017-07-25 22:41;0;0;"Does Judge Moran decide the years they get?";;;;"889978850016468993";https://twitter.com/Btl_aj/status/889978850016468993
Btl_aj;2017-07-25 22:38;0;0;"It said Alex can get 1-4 years and Colin and Laura can get 15 years to life. I would think more?";;;;"889978180576194560";https://twitter.com/Btl_aj/status/889978180576194560
Btl_aj;2017-07-25 22:37;0;0;"Wonder who he will murder next?";;;;"889977875318939648";https://twitter.com/Btl_aj/status/889977875318939648
Btl_aj;2017-07-25 22:36;0;0;"I can't believe it? He was probably the sharpest of the bunch and his idea.";;;;"889977623371186176";https://twitter.com/Btl_aj/status/889977623371186176
Btl_aj;2017-07-25 22:34;0;0;"Laura's sons are going to prison, her children have neither parents and she's so Stone faced. She must be so evil!";;;;"889977290045739009";https://twitter.com/Btl_aj/status/889977290045739009
Btl_aj;2017-07-25 22:33;0;0;"I hope the family has a civil claim against him!";;;;"889977017709580288";https://twitter.com/Btl_aj/status/889977017709580288
Btl_aj;2017-07-25 22:32;0;0;"Was Laura close with her boys? She didn't care about them. Do you think Paul sang?";;;;"889976749227991040";https://twitter.com/Btl_aj/status/889976749227991040
Btl_aj;2017-07-25 22:06;0;0;"And the keys were in his bed!";;;;"889970182709497861";https://twitter.com/Btl_aj/status/889970182709497861
Btl_aj;2017-07-25 22:06;0;0;"I do too!";;;;"889970060353253376";https://twitter.com/Btl_aj/status/889970060353253376
Btl_aj;2017-07-25 19:40;0;0;"I bet they will never talk again.";;;;"889933271324405765";https://twitter.com/Btl_aj/status/889933271324405765
Btl_aj;2017-07-25 18:25;0;2;"You both did great work! Laura is stone faced. She's scary!!";;;;"889914450374950912";https://twitter.com/Btl_aj/status/889914450374950912
Btl_aj;2017-07-25 18:23;0;0;"Yes! Thanks for pointing that out. I wonder if the brothers will end up in same prison?";;;;"889914020421144578";https://twitter.com/Btl_aj/status/889914020421144578
Btl_aj;2017-07-25 18:20;0;1;"Thanks for answering my questions! Is Craig's mom and sister doing ok? It has to be hard since they are grandkids. Are they upset over PJ?";;;;"889913346912378884";https://twitter.com/Btl_aj/status/889913346912378884
Btl_aj;2017-07-25 18:18;0;0;"And now less mouths to feed/support. I do believe he was part of the murder and in that townhome.";;;;"889912872515641344";https://twitter.com/Btl_aj/status/889912872515641344
Btl_aj;2017-07-25 18:17;0;0;"Did Colin's fiancé cry? I wonder who will watch the younger kids now?";;;;"889912563621867521";https://twitter.com/Btl_aj/status/889912563621867521
Btl_aj;2017-07-25 18:16;0;0;"Tucci is an idiot. I'm sure he will end up in prison.";;;;"889912261392969730";https://twitter.com/Btl_aj/status/889912261392969730
Btl_aj;2017-07-25 18:00;0;0;"And Paul's DNA was everywhere, he rented the car and Craig's keys were in his bed? WTH";;;;"889908214711676929";https://twitter.com/Btl_aj/status/889908214711676929
