username;date;retweets;favorites;text;geo;mentions;hashtags;id;permalink
CarloValvassori;2017-11-03 23:52;1;7;"These leftist judges love rubbing our noses in this. There are real soldiers serving time for a lot less than desertion. Disgusting!";;;;"926598036188553216";https://twitter.com/CarloValvassori/status/926598036188553216
CarloValvassori;2017-11-03 23:49;0;1;"Shows how dense these players are. The average career in the NFL is 3.3 years and they usually end up broke anyway. Sad.";;;;"926597267561308160";https://twitter.com/CarloValvassori/status/926597267561308160
CarloValvassori;2017-11-03 20:41;1;1;"Another reason the NFL is dead to me. NFL Teams Pledge Hundreds Of Millions To Anti-Gun Groups http:// libertynewsnow.com/nfl-teams-pled ge-hundreds-millions-anti-gun-groups/article8158 … via @libertynews_now";;@libertynews_now;;"926549814917156865";https://twitter.com/CarloValvassori/status/926549814917156865
CarloValvassori;2017-11-03 18:50;0;0;"You mean what did they sell her for.";;;;"926522000608251904";https://twitter.com/CarloValvassori/status/926522000608251904
CarloValvassori;2017-11-03 18:41;1;0;"The DNC makes hardcore mafia enforcers look like a bunch of choir boys by comparison";;;;"926519643556245504";https://twitter.com/CarloValvassori/status/926519643556245504
CarloValvassori;2017-11-03 16:18;0;0;"Former FBI Director James Comey to Release Book - The Political Insider http:// lsh.re/1KM2H";;;;"926483782110195712";https://twitter.com/CarloValvassori/status/926483782110195712
CarloValvassori;2017-11-03 12:54;0;1;"I mean really? Since when did democrats give a rats @ss about debt and deficits?";;@ss;;"926432467921375232";https://twitter.com/CarloValvassori/status/926432467921375232
CarloValvassori;2017-11-03 12:50;0;1;"Me either. Or is that me neither?";;;;"926431407739752448";https://twitter.com/CarloValvassori/status/926431407739752448
CarloValvassori;2017-11-03 12:44;0;0;"That really depends on "what the meaning of is, is.";;;;"926429820350861336";https://twitter.com/CarloValvassori/status/926429820350861336
CarloValvassori;2017-11-03 11:34;0;0;"GOP’s tax bill cancels $23 billion in credits claimed by illegal immigrants http://www. 1776coalition.com/featured-conte nt/gops-tax-bill-cancels-23-billion-in-credits-claimed-by-illegal-immigrants/ …";;;;"926412299128143873";https://twitter.com/CarloValvassori/status/926412299128143873
CarloValvassori;2017-11-03 11:30;0;0;"Ah yes, "How to win friends and influence people" by democrats: call everyone who doesn't agree with their sick world view evil etc.";;;;"926411327417016321";https://twitter.com/CarloValvassori/status/926411327417016321
CarloValvassori;2017-11-02 10:57;0;0;"&#8220;Shout &#8216;Allahu Akbar,&#8217; because this strikes fear in the hearts of the non-believers.&#8221; Who http://www. theconservativeinsider.com/allahu-akbar-i tis-americas-deadly-and-debilitating-disease/ …";;;#8220 #8216 #8217 #8221;"926040533851693056";https://twitter.com/CarloValvassori/status/926040533851693056
CarloValvassori;2017-11-02 00:31;0;2;"Sono d'accordo con te";;;;"925882920300171266";https://twitter.com/CarloValvassori/status/925882920300171266
CarloValvassori;2017-11-02 00:26;0;1;"Because he wouldn't get invited to anymore swanky DC parties that's why.";;;;"925881872571346944";https://twitter.com/CarloValvassori/status/925881872571346944
CarloValvassori;2017-11-01 19:03;0;0;"Black CNN Host, Guest Openly Mock Majority of White People https:// conservativetribune.com/cnn-hosts-mock -white-people/?utm_source=Twitter&utm_medium=PostTopSharingButtons&utm_content=2017-11-01&utm_campaign=websitesharingbuttons …";;;;"925800423130267649";https://twitter.com/CarloValvassori/status/925800423130267649
CarloValvassori;2017-11-01 15:34;0;0;"Muslim Terrorists Now Using Syringes w/Detergent http://www. frontpagemag.com/point/262797/m uslim-terrorists-now-using-syringes-wdetergent-daniel-greenfield#.Wfnpjr29mCg.twitter …";;;#;"925747934754430977";https://twitter.com/CarloValvassori/status/925747934754430977
CarloValvassori;2017-11-01 10:58;0;0;""Diversity Visa" is just another racist Democrat scheme that shows their bias against European immigrants";;;;"925678467378794497";https://twitter.com/CarloValvassori/status/925678467378794497
CarloValvassori;2017-11-01 10:44;0;0;"The new "get out of jail free" card. OJ should have tried this at his last trial and he could have been doing interviews with Ellen instead.";;;;"925674963641790464";https://twitter.com/CarloValvassori/status/925674963641790464
CarloValvassori;2017-11-01 10:39;0;1;"The time is way overdue";;;;"925673767644385280";https://twitter.com/CarloValvassori/status/925673767644385280
CarloValvassori;2017-11-01 10:36;0;0;"Instead read Robert Spenser's "The Infidels Guide to the Koran" it breaks it down verse by verse.";;;;"925672855991439360";https://twitter.com/CarloValvassori/status/925672855991439360
CarloValvassori;2017-11-01 01:13;3;8;"Wow, Tapper is one delusional Utopian. Has he ever left his insular cocoon in DC? His ignorance of the way the world really is is astounding";;;;"925531302996205568";https://twitter.com/CarloValvassori/status/925531302996205568
CarloValvassori;2017-10-31 12:16;0;2;"Rhetorical question.";;;;"925335698437279744";https://twitter.com/CarloValvassori/status/925335698437279744
CarloValvassori;2017-10-31 11:01;0;0;"This is what you get when you invite cancer into your body. https:// twitter.com/steadfastloyal /status/925280192599396352 …";;;;"925316870177161217";https://twitter.com/CarloValvassori/status/925316870177161217
CarloValvassori;2017-10-31 02:44;0;0;"Nope, I was screaming from the roof tops that this guy was a Marxist and would be an unmitigated disaster. Least qualified in history.";;;;"925191811626188800";https://twitter.com/CarloValvassori/status/925191811626188800
CarloValvassori;2017-10-31 01:45;1;6;"Tom Fitton";;;;"925176862036430848";https://twitter.com/CarloValvassori/status/925176862036430848
CarloValvassori;2017-10-31 01:42;1;6;"It's a very bad SNL skit, hope this ridiculous commercial pushes a few more voters to Gillespie.";;;;"925176222707011584";https://twitter.com/CarloValvassori/status/925176222707011584
CarloValvassori;2017-10-31 01:33;2;1;"They are worse, they are a nuclear holocaust, with a little bubonic plague and cancer thrown in.";;;;"925173856490459136";https://twitter.com/CarloValvassori/status/925173856490459136
CarloValvassori;2017-10-31 01:24;0;0;"Then get it unsealed";;;;"925171631349227520";https://twitter.com/CarloValvassori/status/925171631349227520
CarloValvassori;2017-10-31 01:14;0;0;"Thanks but not interested";;;;"925169007296155648";https://twitter.com/CarloValvassori/status/925169007296155648
CarloValvassori;2017-10-31 01:07;0;0;"He has to justify the gazillions in tax payer dollars he is burning through.";;;;"925167270594318337";https://twitter.com/CarloValvassori/status/925167270594318337
CarloValvassori;2017-10-31 01:02;0;3;"He should have done time for his Keating Five scandal.";;;;"925165971735744512";https://twitter.com/CarloValvassori/status/925165971735744512
CarloValvassori;2017-10-31 01:00;0;0;"What took so long?";;;;"925165549293883392";https://twitter.com/CarloValvassori/status/925165549293883392
CarloValvassori;2017-10-31 00:58;1;4;"Good luck with that. Kasich is delusional and If I have to hear about his postman father one more time I don't think I'll be able to take it";;;;"925165048158355457";https://twitter.com/CarloValvassori/status/925165048158355457
CarloValvassori;2017-10-31 00:49;0;0;"Of course she doesn't, she is a donkey in elephants clothing.";;;;"925162828172021760";https://twitter.com/CarloValvassori/status/925162828172021760
CarloValvassori;2017-10-31 00:46;3;13;"Demoncrats have no shame.";;;;"925162119607308293";https://twitter.com/CarloValvassori/status/925162119607308293
CarloValvassori;2017-10-28 01:59;1;4;"Obama and Clintons need to have all the assets from their ill gotten gains confiscated.";;;;"924093256698421249";https://twitter.com/CarloValvassori/status/924093256698421249
CarloValvassori;2017-10-28 01:45;0;0;"How convenient.";;;;"924089708224884736";https://twitter.com/CarloValvassori/status/924089708224884736
CarloValvassori;2017-10-28 01:28;5;2;"I'm sure the Clinton crime family has already activated their "assets" to locate the informant and neutralize the problem.";;;;"924085452394717184";https://twitter.com/CarloValvassori/status/924085452394717184
CarloValvassori;2017-10-27 18:23;2;0;"Poor, stupid, fool, manipulated to stay on the democrat plantation by his democrat masters. Shame.";;;;"923978463995990019";https://twitter.com/CarloValvassori/status/923978463995990019
CarloValvassori;2017-10-27 18:17;0;1;"Just other hateful, bitter, mindless, democrat plantation dwellers, that's who.";;;;"923976973130567680";https://twitter.com/CarloValvassori/status/923976973130567680
CarloValvassori;2017-10-27 18:10;0;2;"Be nice if they also stopped waving Mexican flags in the face of patriotic Americans to push their agenda.";;;;"923975290598187008";https://twitter.com/CarloValvassori/status/923975290598187008
CarloValvassori;2017-10-27 18:06;0;1;"Maybe he just hates everyone equally and judges them on the content of their character?";;;;"923974161046831104";https://twitter.com/CarloValvassori/status/923974161046831104
CarloValvassori;2017-10-27 18:04;0;0;"Can you guys take a few million more?";;;;"923973759547138048";https://twitter.com/CarloValvassori/status/923973759547138048
CarloValvassori;2017-10-27 18:03;0;0;"Who ever thought that allowing the least educated, least skilled, least healthy, most needy, people to be in our country, was a good idea??";;;;"923973498787319808";https://twitter.com/CarloValvassori/status/923973498787319808
CarloValvassori;2017-10-27 02:51;0;0;"Wasteful:Senate Spent $10k On Floor Repairs Because Mitch McConnell Drags His Office Chair Everywhere http://www. clickhole.com/article/wastef ul-senate-spent-10000-year-floor-repairs-bec-6884 … via @clickhole";;@clickhole;;"923743993636278272";https://twitter.com/CarloValvassori/status/923743993636278272
CarloValvassori;2017-10-27 01:46;0;0;"Fine, tell them to bring it on.";;;;"923727603223203840";https://twitter.com/CarloValvassori/status/923727603223203840
CarloValvassori;2017-10-26 13:12;0;0;"Obama Justice Department’s $1 Billion ‘Slush Fund’ Boosted Liberal Groups http:// dailysign.al/2zCzi6T via @KevinMooneyDC @DailySignal";;@KevinMooneyDC @DailySignal;;"923537911752032257";https://twitter.com/CarloValvassori/status/923537911752032257
CarloValvassori;2017-10-26 13:05;0;0;"400 Scientific Papers Undermine Global Warming, and That&#8217;s Just for This Year https:// conservativetribune.com/scientific-pap ers-global-warming/?utm_source=Twitter&utm_medium=PostTopSharingButtons&utm_content=2017-10-26&utm_campaign=websitesharingbuttons …";;;#8217;"923536065612443648";https://twitter.com/CarloValvassori/status/923536065612443648
CarloValvassori;2017-10-26 13:04;0;0;"My new T-shirt to offend snowflakes. pic.twitter.com/MNlE7eClgB";;;;"923535751714869249";https://twitter.com/CarloValvassori/status/923535751714869249
CarloValvassori;2017-10-26 13:02;0;0;"Good news story. Dad Sees Sicko&#8217;s Text With His Daughter, Sets up Trap in Backyard https:// conservativetribune.com/dad-sees-text- daughter/?utm_source=Twitter&utm_medium=PostTopSharingButtons&utm_content=2017-10-26&utm_campaign=websitesharingbuttons …";;;#8217;"923535351540604928";https://twitter.com/CarloValvassori/status/923535351540604928
CarloValvassori;2017-10-26 10:49;0;0;"MSM...Crickets Another Florida Latino Islamic Convert Tries to Bomb for ISIS http://www. frontpagemag.com/fpm/268211/ano ther-florida-latino-islamic-convert-tries-bomb-daniel-greenfield#.WfG9k4ZZbLs.twitter …";;;#;"923501839429103616";https://twitter.com/CarloValvassori/status/923501839429103616
CarloValvassori;2017-10-26 03:58;0;0;"To me the term aiding and abetting comes to mind.";;;;"923398463408295937";https://twitter.com/CarloValvassori/status/923398463408295937
CarloValvassori;2017-10-26 00:08;0;0;"Obamas temporary carries the same weight as "if you like your doctor you can keep your doctor"";;;;"923340521774440454";https://twitter.com/CarloValvassori/status/923340521774440454
CarloValvassori;2017-10-26 00:04;0;1;"What could go wrong with leftist, progressive, criminal invaders indoctrinating the next generation of voters?";;;;"923339626840035328";https://twitter.com/CarloValvassori/status/923339626840035328
CarloValvassori;2017-10-25 23:59;0;0;"Obama pretty much disrespected the entire armed forces so this doesn't surprise me at all.";;;;"923338345220100096";https://twitter.com/CarloValvassori/status/923338345220100096
CarloValvassori;2017-10-25 17:02;0;0;"Unfortunately they didn't turn out to be this way, they just finally revealed who they really were all along. Sad!";;;;"923233371769237504";https://twitter.com/CarloValvassori/status/923233371769237504
CarloValvassori;2017-10-25 15:48;0;0;"Good luck with that! all the Dems think like she does and they all goose step together like the destructive lemmings they are.";;;;"923214737957154816";https://twitter.com/CarloValvassori/status/923214737957154816
CarloValvassori;2017-10-25 15:31;0;2;"Translation: he voted for Killary";;;;"923210492260339713";https://twitter.com/CarloValvassori/status/923210492260339713
CarloValvassori;2017-10-25 13:48;1;0;"If you live in FL please sign this petition to support e-verify, Thank you. https://www. floridiansforeverifynow.org/petition/";;;;"923184458274164736";https://twitter.com/CarloValvassori/status/923184458274164736
CarloValvassori;2017-10-25 13:40;0;0;"1.5 Million People off Food Stamps Since Trump Took Office https:// conservativetribune.com/1-5-million-of f-food-stamps/?utm_source=Twitter&utm_medium=PostTopSharingButtons&utm_content=2017-10-25&utm_campaign=websitesharingbuttons …";;;;"923182470446563330";https://twitter.com/CarloValvassori/status/923182470446563330