username;date;retweets;favorites;text;geo;mentions;hashtags;id;permalink
ConnellyAL;2017-02-21 08:10;13;8;"Visits by Netanyahu and Jokowi scheduled to overlap in Sydney on Saturday, a coincidence that would not have gone unnoticed by either side.";;;;"833951988190638080";https://twitter.com/ConnellyAL/status/833951988190638080
ConnellyAL;2017-02-21 06:57;6;6;"Thoughtful post by my colleague @graham_euan on the Fall of Singapore 75 years ago, and similarities to present day. https://www. lowyinstitute.org/publications/7 5-years-after-singapores-fall …";;@graham_euan;;"833933726048350208";https://twitter.com/ConnellyAL/status/833933726048350208
ConnellyAL;2017-02-21 04:23;0;0;"That might be the best we can hope for, right? Let the professionals handle Asia, no major changes to policy.";;;;"833894854870470656";https://twitter.com/ConnellyAL/status/833894854870470656
ConnellyAL;2017-02-21 04:18;0;9;"I know what I'm wearing for Purim this year. https:// twitter.com/athertonkd/sta tus/833891790470127617 …";;;;"833893707103416321";https://twitter.com/ConnellyAL/status/833893707103416321
ConnellyAL;2017-02-21 04:15;0;1;"That, and the fact that we still have no sense of personnel at sub-Cabinet level on Asia, beyond Pottinger.";;;;"833892871321247744";https://twitter.com/ConnellyAL/status/833892871321247744
ConnellyAL;2017-02-21 04:14;0;2;"Were there not similar complaints about Obama team after Donilon left? Issue to me the irregular process more than personnel.";;;;"833892650285568000";https://twitter.com/ConnellyAL/status/833892650285568000
ConnellyAL;2017-02-20 20:56;0;0;"Guess so. "Would you like to come work for me?" or "PCS My Basement.";;;;"833782368150228994";https://twitter.com/ConnellyAL/status/833782368150228994
ConnellyAL;2017-02-20 20:49;0;1;"Thought the same. Recall Powell wrote that he had some reservations about Reagan. (It was right after Iran-Contra).";;;;"833780519930208256";https://twitter.com/ConnellyAL/status/833780519930208256
ConnellyAL;2017-02-20 20:24;0;0;"@pegobry They're for service anywhere in the CENTCOM AOR since the beginning of OEF. Didn't have to be in combat.";;@pegobry;;"833774237932335104";https://twitter.com/ConnellyAL/status/833774237932335104
ConnellyAL;2017-02-20 20:10;1;0;"Can we embargo this until after he's been sworn in? https:// twitter.com/davidfrum/stat us/833767445215248385 …";;;;"833770856857755648";https://twitter.com/ConnellyAL/status/833770856857755648
ConnellyAL;2017-02-20 20:01;6;3;"I briefed Parliament's Joint Standing Committee on Foreign Affairs earlier this month. Here's what I told them: https://www. lowyinstitute.org/the-interprete r/trump-versus-american-institutions-foreign-policy-battleground … .";;;;"833768562242170884";https://twitter.com/ConnellyAL/status/833768562242170884
ConnellyAL;2017-02-20 11:29;1;0;"Liberals Are Still Angry, but Merrick Garland Has Reached Acceptance https://www. nytimes.com/2017/02/19/us/ politics/merrick-garland-supreme-court-obama-nominee.html?smprod=nytcore-iphone&smid=nytcore-iphone-share …";;;;"833639826465230848";https://twitter.com/ConnellyAL/status/833639826465230848
ConnellyAL;2017-02-20 04:25;0;1;"Thanks, Ashley";;;;"833533006149099520";https://twitter.com/ConnellyAL/status/833533006149099520
ConnellyAL;2017-02-20 01:19;0;1;"The Embassy might push it. But Indonesia is pretty unlikely to agree to coordinated patrols in any case.";;;;"833486315077328899";https://twitter.com/ConnellyAL/status/833486315077328899
ConnellyAL;2017-02-20 00:41;4;5;"US foreign policy institutions have two advantages as they face off against Trump: GEN Mattis, and process. https://www. lowyinstitute.org/the-interprete r/trump-versus-american-institutions-foreign-policy-battleground …";;;;"833476544488054784";https://twitter.com/ConnellyAL/status/833476544488054784
ConnellyAL;2017-02-19 22:34;0;2;". @RepTedYoho G'day, Congressman. You're chair of the Asia Pacific Subcommittee now. Care to stick up for America's alliances? https:// twitter.com/ConnellyAL/sta tus/833317592630652928 …";;@RepTedYoho;;"833444565344325632";https://twitter.com/ConnellyAL/status/833444565344325632
ConnellyAL;2017-02-19 14:09;3;0;"Senate Republicans made a great show of support for Australia after the Trump-Turnbull call. House GOP? Not so much. https://www. lowyinstitute.org/the-interprete r/australia-rank-and-file-house-republicans-are-nowhere-be-seen …";;;;"833317592630652928";https://twitter.com/ConnellyAL/status/833317592630652928
ConnellyAL;2017-02-19 08:08;0;1;"Yes, one would hope. But no appetite for that in Jakarta in the near term: https://www. lowyinstitute.org/publications/i ndonesia-south-china-sea-going-it-alone … . Illegal fishing an entrypoint.";;;;"833226664502898688";https://twitter.com/ConnellyAL/status/833226664502898688
ConnellyAL;2017-02-19 07:35;0;1;"Illegal fishing is the issue that most directly affects Indonesia in SCS, and therefore a natural place to offer US cooperation.";;;;"833218462730235905";https://twitter.com/ConnellyAL/status/833218462730235905
ConnellyAL;2017-02-19 07:34;1;1;"Susi is not junior, she is the most popular minister in the Cabinet. Known to take the hardest line on illegal Chinese fishing.";;;;"833218189362225152";https://twitter.com/ConnellyAL/status/833218189362225152
ConnellyAL;2017-02-19 07:28;0;1;"The mountains are high, and the emperor is far away.";;;;"833216767648428033";https://twitter.com/ConnellyAL/status/833216767648428033
ConnellyAL;2017-02-19 07:25;3;2;"Update on this: While coordinated patrols between US and Indonesia were discussed in September, there has been no movement since then.";;;;"833215955677257729";https://twitter.com/ConnellyAL/status/833215955677257729
ConnellyAL;2017-02-19 07:15;0;0;"This is a fascinating and well-written story, and you should all read it.";;;;"833213385919467520";https://twitter.com/ConnellyAL/status/833213385919467520
ConnellyAL;2017-02-19 07:02;5;5;"Nagaland, where men are bringing the state to a standstill to protest Delhi's quotas for women on town councils. http://www. smh.com.au/world/nagaland -where-men-are-on-strike-until-women-go-back-to-the-kitchen-20170214-gucdtw.html …";;;;"833210012105203712";https://twitter.com/ConnellyAL/status/833210012105203712
ConnellyAL;2017-02-19 06:11;0;0;"@USConGenSydney Love you guys, but you might want to keep this one on the down low for now.";;@USConGenSydney;;"833197413913341953";https://twitter.com/ConnellyAL/status/833197413913341953
ConnellyAL;2017-02-19 05:56;0;1;"They love Trump in Melbourne. https://www. nytimes.com/2017/02/18/us/ politics/donald-trump-rally-melbourne-florida.html?smprod=nytcore-iphone&smid=nytcore-iphone-share … (Not that Melbourne).";;;;"833193600796106752";https://twitter.com/ConnellyAL/status/833193600796106752
ConnellyAL;2017-02-19 05:05;0;0;"Thought that might be it. But an odd concession to their worldview, then, in a speech about not conceding their worldview.";;;;"833180631236440065";https://twitter.com/ConnellyAL/status/833180631236440065
ConnellyAL;2017-02-19 05:04;0;1;"Plenty of leaks under Obama, too. In any case, all political appointees were required to resign 20 January.";;;;"833180367011999744";https://twitter.com/ConnellyAL/status/833180367011999744
ConnellyAL;2017-02-19 02:50;3;13;"Bronte, Tamarama, and Bondi beaches from the air on a summer afternoon. pic.twitter.com/OO7IPGSFJT";;;;"833146679175966720";https://twitter.com/ConnellyAL/status/833146679175966720
ConnellyAL;2017-02-19 01:54;0;0;"@ishaantharoor Deeply regrettable, but not a Trump policy: http://www. telegraph.co.uk/travel/destina tions/middle-east/iran/articles/Been-on-holiday-to-Iran-It-will-make-US-trips-more-expensive-and-stressful/ … . Has been a requirement for over a year.";;@ishaantharoor;;"833132583101739008";https://twitter.com/ConnellyAL/status/833132583101739008
ConnellyAL;2017-02-19 01:33;0;0;"This has become a fashionable observation, but where's the evidence for it?";;;;"833127366327095296";https://twitter.com/ConnellyAL/status/833127366327095296
ConnellyAL;2017-02-19 01:22;3;3;"Sen. McCain calls it "the West," but he's talking about the liberal international order. Interesting choice of terms. https:// twitter.com/jaketapper/sta tus/832670725664169984 …";;;;"833124509456572417";https://twitter.com/ConnellyAL/status/833124509456572417
ConnellyAL;2017-02-18 22:10;0;2;"Americans know next to nothing about Indonesia, but hard to make a case it is more important than India for our interests.";;;;"833076362210533377";https://twitter.com/ConnellyAL/status/833076362210533377
ConnellyAL;2017-02-18 22:03;2;0;"Deare was a Trump appointee, selected by Flynn from among his DIA network. https:// twitter.com/blakehounshell /status/833048096510713857 …";;;;"833074440959320064";https://twitter.com/ConnellyAL/status/833074440959320064
ConnellyAL;2017-02-17 22:49;0;0;"Heard last night rumor in DC that he is leaving "any day now."";;;;"832723755445080064";https://twitter.com/ConnellyAL/status/832723755445080064
ConnellyAL;2017-02-17 19:47;0;0;"@AlexKOliver ? What do you reckon? https:// twitter.com/shashj/status/ 832676177852526592 …";;@AlexKOliver;;"832677749516963840";https://twitter.com/ConnellyAL/status/832677749516963840
ConnellyAL;2017-02-17 07:13;0;1;"Sounds like a job for @TrumpDraws .";;@TrumpDraws;;"832488192888623104";https://twitter.com/ConnellyAL/status/832488192888623104
ConnellyAL;2017-02-17 06:54;0;2;"Asked U Aung Thun Thet, representing ASSK today, about restrictions on free speech, hate speech in Myanmar. Response: "Please be patient."";;;;"832483356868685824";https://twitter.com/ConnellyAL/status/832483356868685824
ConnellyAL;2017-02-17 06:42;0;2;"Shrug. He's an instructed ambassador. But not when he's chatting with his old pals at News Ltd.";;;;"832480267851821058";https://twitter.com/ConnellyAL/status/832480267851821058
ConnellyAL;2017-02-17 06:37;0;0;"Yeah. Best guess, either Bannon or Priebus told Hockey that in their meeting day after the story broke, Hockey told the Oz.";;;;"832479014484729857";https://twitter.com/ConnellyAL/status/832479014484729857
ConnellyAL;2017-02-17 06:26;0;1;"Another rushed job written by political advisers, without input or consultation with the Cabinet or line agencies?";;;;"832476292540817408";https://twitter.com/ConnellyAL/status/832476292540817408
ConnellyAL;2017-02-17 06:25;4;1;"Buried in this story, news that Trump planning release of new National Security Strategy soon. http://www. thedailybeast.com/articles/2017/ 02/16/trump-s-replacement-for-flynn-says-no.html … Usually takes months.";;;;"832475987531046912";https://twitter.com/ConnellyAL/status/832475987531046912
ConnellyAL;2017-02-17 05:50;0;0;"Good catch. Poloff told me this week that Russel was only holdover, though. Perhaps there's some nuance I'm missing?";;;;"832467184781717504";https://twitter.com/ConnellyAL/status/832467184781717504
ConnellyAL;2017-02-17 03:00;5;1;"The only regional assistant secretary of state to be held over by the Trump Administration. https:// twitter.com/graham_euan/st atus/832424038379053056 …";;;;"832424542177890304";https://twitter.com/ConnellyAL/status/832424542177890304
ConnellyAL;2017-02-16 22:59;3;1;"Aung Thun Thet: Myanmar looking at Indonesia's tax amnesty, way to bring back bank deposits. (Probably best to not advertise this). #MRC2017";;;#MRC2017;"832363778456981504";https://twitter.com/ConnellyAL/status/832363778456981504
ConnellyAL;2017-02-16 22:38;2;0;"Aung Tun Thet says Myanmar dreams of three freedoms: from fear, from want, to live in human dignity. (Speech, worship too vexed?) #MRC2017";;;#MRC2017;"832358433651253248";https://twitter.com/ConnellyAL/status/832358433651253248
ConnellyAL;2017-02-16 21:49;0;1;"Mention of the liberal order mine, not RN's. @graham_euan did mention Singapore's Total Defence Day on RN Extra.";;@graham_euan;;"832346266684137472";https://twitter.com/ConnellyAL/status/832346266684137472
ConnellyAL;2017-02-16 21:48;0;0;"Will be interesting to see who has more success: Low-key Tillerson or high tempo Mattis? Might also complement each other well.";;;;"832345892938145793";https://twitter.com/ConnellyAL/status/832345892938145793
ConnellyAL;2017-02-16 21:45;1;0;"Impressed by @RadioNational 's coverage this week of the fall of Singapore, bombing of Darwin. Can't take the rules-based order for granted.";;@RadioNational;;"832345122905878528";https://twitter.com/ConnellyAL/status/832345122905878528
ConnellyAL;2017-02-16 09:59;0;1;"Don't know that it's about State being "downgraded." Perhaps just a slow start, still needs to learn the ropes.";;;;"832167624725274624";https://twitter.com/ConnellyAL/status/832167624725274624
ConnellyAL;2017-02-16 09:08;0;1;"Rex Tillerson making some unusual scheduling choices in his early days as Secretary of State. https:// mobile.nytimes.com/2017/02/15/wor ld/europe/germany-rex-tillerson.html?smid=tw-share&referer=https://t.co/n5GGVg30F3 …";;;;"832154763793805312";https://twitter.com/ConnellyAL/status/832154763793805312
ConnellyAL;2017-02-16 04:10;0;0;"Trump considering inexperienced friend to lead intel review. https:// nyti.ms/2llzxiJ Concern Feinberg being groomed for IC position.";;;;"832079770300997632";https://twitter.com/ConnellyAL/status/832079770300997632
ConnellyAL;2017-02-15 22:28;1;0;"A year out, will Abe's ingratiating approach or Turnbull's "give as good as you get" have been more effective? http://www. theaustralian.com.au/national-affai rs/foreign-affairs/donald-trump-admires-brawler-malcolm-turnbull/news-story/59a063341f2a734e599803843bdf5e57 …";;;;"831993603568267265";https://twitter.com/ConnellyAL/status/831993603568267265
ConnellyAL;2017-02-15 20:27;0;0;"Does he know what's in this rule? Requires disclosure of payments to foreign governments. Trump implies it will affect jobs in US. It won't. https:// twitter.com/realdonaldtrum p/status/831621079747723264 …";;;;"831963156721266688";https://twitter.com/ConnellyAL/status/831963156721266688
ConnellyAL;2017-02-15 09:51;1;4;"It would be easier to take Anies "seriously but not literally" than it was with Prabowo, given Anies' earlier record of liberal rhetoric.";;;;"831803134418702336";https://twitter.com/ConnellyAL/status/831803134418702336
ConnellyAL;2017-02-15 09:49;3;4;"In 2014 many thought Prabowo would govern more responsibly than he campaigned. Are some Jakartans now making same bet with Anies?";;;;"831802671568867328";https://twitter.com/ConnellyAL/status/831802671568867328
ConnellyAL;2017-02-15 05:30;0;0;"@SamRoggeveen How do you feel about Mark Felt, Sam?";;@SamRoggeveen;;"831737498544066560";https://twitter.com/ConnellyAL/status/831737498544066560
ConnellyAL;2017-02-15 01:00;1;2;"Anies has agency. He didn't have to run if Gerindra-PKS his only option. He didn't have to adopt their hard line as candidate.";;;;"831669541310656512";https://twitter.com/ConnellyAL/status/831669541310656512
ConnellyAL;2017-02-15 00:24;23;59;""Give me a ping, Vasili. One ping only." https:// twitter.com/nora_kelly/sta tus/831343474314194944 …";;;;"831660362776731648";https://twitter.com/ConnellyAL/status/831660362776731648
ConnellyAL;2017-02-15 00:14;1;0;"I've been seeing this a lot. But to be frank, I expect Menteng elite to get things wrong. Good analysts look past the noise. We failed here. https:// twitter.com/EurasianAnalys t/status/831639208301309953 …";;;;"831657853865779201";https://twitter.com/ConnellyAL/status/831657853865779201
ConnellyAL;2017-02-14 22:57;3;2;"I live tweeted parts of this last night, but it is well worth a listen. Morell was remarkably frank and very even-handed. https:// twitter.com/lowyinstitute/ status/831610720089407489 …";;;;"831638529016897536";https://twitter.com/ConnellyAL/status/831638529016897536
ConnellyAL;2017-02-14 18:26;0;0;"He cited the the declassified DNI report released in January, and emphasized that the attempts were unsuccessful.";;;;"831570322566426624";https://twitter.com/ConnellyAL/status/831570322566426624
ConnellyAL;2017-02-14 13:27;6;7;"Question of what happens to Matt Pottinger, a Flynn confidant, but who by all accounts has been a capable senior director for Asia. https:// twitter.com/colinkahl/stat us/831493657668808704 …";;;;"831495029508100097";https://twitter.com/ConnellyAL/status/831495029508100097
ConnellyAL;2017-02-14 11:51;0;0;"The most charitable interpretation: http://www. independent.co.uk/news/world/asi a/i-am-one-of-the-fukushima-fifty-one-of-the-men-who-risked-their-lives-to-prevent-a-catastrophe-8517394.html … .";;;;"831470833063243776";https://twitter.com/ConnellyAL/status/831470833063243776
ConnellyAL;2017-02-14 11:05;0;1;"Hard to believe that so many fundamental details of the disputes could elude a former envoy to China, who now runs a consulting firm there.";;;;"831459218590818304";https://twitter.com/ConnellyAL/status/831459218590818304
ConnellyAL;2017-02-14 11:03;0;1;"At best, she is doing what the Obama Administration was also doing post-13/7/16: Using measured language, seeking to reduce tensions.";;;;"831458907142791168";https://twitter.com/ConnellyAL/status/831458907142791168
ConnellyAL;2017-02-14 11:03;0;1;"4) Given the above, it is not at all clear that Julie Bishop is plotting a more independent course on the South China Sea.";;;;"831458715219812354";https://twitter.com/ConnellyAL/status/831458715219812354
ConnellyAL;2017-02-14 10:59;0;0;"3) US, Australia have never opposed dialogue between claimants. They have asserted non-claimants also have interests in upholding int'l law.";;;;"831457846248165376";https://twitter.com/ConnellyAL/status/831457846248165376
ConnellyAL;2017-02-14 10:57;0;0;"There have been signs that some in China would like to bring their position back into compliance with UNCLOS: http://www. eastasiaforum.org/2016/07/14/did -china-just-clarify-the-nine-dash-line/ … .";;;;"831457311386267648";https://twitter.com/ConnellyAL/status/831457311386267648
ConnellyAL;2017-02-14 10:55;0;0;"2) China has certainly taken notice of the ruling, feels isolated by the lack of support for its position on it: http:// nationalinterest.org/blog/the-buzz/ chinas-doves-break-cover-criticize-foreign-policy-15871 … .";;;;"831456782744592384";https://twitter.com/ConnellyAL/status/831456782744592384
ConnellyAL;2017-02-14 10:51;0;1;"Even if China were to prevail in all of its territorial claims, it does not legitimate, for example, its claims under the nine dash line.";;;;"831455789571125248";https://twitter.com/ConnellyAL/status/831455789571125248
ConnellyAL;2017-02-14 10:49;0;0;"The award did not deal with the underlying territorial disputes, only the nature of China's maritime claims.";;;;"831455258941403136";https://twitter.com/ConnellyAL/status/831455258941403136
ConnellyAL;2017-02-14 10:48;1;0;"The arbitral tribunal's award is international law, and all maritime nations have an interest in Chinese adherence to international law.";;;;"831455068205379588";https://twitter.com/ConnellyAL/status/831455068205379588
ConnellyAL;2017-02-14 10:47;1;1;"First, it is not contradictory to support the Hague's ruling on the South China Sea, and also remain neutral on the territorial disputes.";;;;"831454875632349184";https://twitter.com/ConnellyAL/status/831454875632349184
ConnellyAL;2017-02-14 10:46;7;5;"The basics of the South China Sea dispute seem to elude Raby, as he makes several false assertions in this op-ed. http://www. afr.com/opinion/column ists/julie-bishop-shifts-australias-stance-on-south-china-sea-20170211-guaw7s …";;;;"831454686410518528";https://twitter.com/ConnellyAL/status/831454686410518528
ConnellyAL;2017-02-14 07:58;0;5;"Morell: If I were foreign leader, wouldn't raise substantive issues with Trump. Would compliment him, leave substance to Cabinet level.";;;;"831412242956513280";https://twitter.com/ConnellyAL/status/831412242956513280
ConnellyAL;2017-02-14 07:57;0;2;"Morell: Much better that Trump had a bad call with Turnbull than with Xi. Always better to have a disagreement with a friend.";;;;"831411973417938944";https://twitter.com/ConnellyAL/status/831411973417938944
ConnellyAL;2017-02-14 07:51;1;1;"Morell: Taiwan call was not thought through, and "Xi Jinping played it brilliantly." Put off call until Trump reaffirmed One China Policy.";;;;"831410615881068544";https://twitter.com/ConnellyAL/status/831410615881068544
ConnellyAL;2017-02-14 07:50;0;0;"Morell: Morale at CIA will depend on whether Trump appears to appreciate IC's product, or believes what he wants. His visit did not help.";;;;"831410171465199616";https://twitter.com/ConnellyAL/status/831410171465199616
ConnellyAL;2017-02-14 07:46;0;0;"Morell: Then, Trump saw Steele dossier leaked after briefing. Trump wrong to think CIA is political, but can understand how he got there.";;;;"831409291177324544";https://twitter.com/ConnellyAL/status/831409291177324544
ConnellyAL;2017-02-14 07:44;0;0;"Morell: We have to see Trump's perspective. Saw both Hayden and myself strongly criticize him. Must have thought "Who are these CIA guys?"";;;;"831408842680393729";https://twitter.com/ConnellyAL/status/831408842680393729
ConnellyAL;2017-02-14 07:38;1;0;"Morell: Obama's response, including sanctions, was weak; did not make Russians pay a high enough price. Need an independent commission.";;;;"831407354247680000";https://twitter.com/ConnellyAL/status/831407354247680000
ConnellyAL;2017-02-14 07:36;2;5;"Morell: Russians did three things: Stole and released information, published fake news, and attempted to tamper with the vote tally.";;;;"831406851187056640";https://twitter.com/ConnellyAL/status/831406851187056640
ConnellyAL;2017-02-14 07:35;2;3;"Morell: U.S. intelligence agencies' most important partnerships by far are with the Five Eyes.";;;;"831406407077425152";https://twitter.com/ConnellyAL/status/831406407077425152
ConnellyAL;2017-02-14 07:31;1;0;"Morell: Enhanced interrogation produced more actionable intel. But morality a separate question, wouldn't want to have to make that call.";;;;"831405472481579011";https://twitter.com/ConnellyAL/status/831405472481579011
ConnellyAL;2017-02-14 07:25;1;0;"Morell: Politics has never been welcome in the Situation Room, never heard it raised except once during deliberations over OBL raid.";;;;"831404020078039041";https://twitter.com/ConnellyAL/status/831404020078039041
ConnellyAL;2017-02-14 07:22;7;6;"Morell says that Mattis, Tillerson, and anyone replacing Flynn should counsel Trump to exclude Bannon from NSC meetings.";;;;"831403242508546048";https://twitter.com/ConnellyAL/status/831403242508546048
ConnellyAL;2017-02-14 07:19;2;3;"Morell just dismissed claims by Schindler that the NSA was withholding its best intelligence from the White House before Flynn resigned.";;;;"831402411352682496";https://twitter.com/ConnellyAL/status/831402411352682496
ConnellyAL;2017-02-14 07:08;9;10;"Michael Morell, former Acting DCIA, speaking at the Lowy Institute on Flynn's resignation now. pic.twitter.com/iIwMJsEEm4";;;;"831399725836283908";https://twitter.com/ConnellyAL/status/831399725836283908
ConnellyAL;2017-02-14 07:00;0;3;"Entropy works at 20x speed in the Trump Administration. https:// twitter.com/connellyal/sta tus/821952771045801984 …";;;;"831397621419778050";https://twitter.com/ConnellyAL/status/831397621419778050
ConnellyAL;2017-02-14 06:58;51;24;"Real question is how so many foreign obervers, myself included, got Anies so wrong. We don't have a good record picking liberal reformers. https:// twitter.com/jeweltopsfield /status/831384275161272321 …";;;;"831397165763137536";https://twitter.com/ConnellyAL/status/831397165763137536
ConnellyAL;2017-02-14 06:35;0;0;"LTG Flynn was a friend to Australia, @danielflitton points out. http://www. smh.com.au/world/michael- flynns-resignation-leaves-australia-one-less-friend-in-trumps-white-house-20170214-gucpgt.html …";;@danielflitton;;"831391433038852097";https://twitter.com/ConnellyAL/status/831391433038852097
ConnellyAL;2017-02-14 05:57;0;0;"Many Cabinet nominees rejected by Senate. But fewer Cabinet-level appointees not subject to confirmation process, so small n.";;;;"831381733136175105";https://twitter.com/ConnellyAL/status/831381733136175105
ConnellyAL;2017-02-14 05:43;0;2;"Politico's photo editors suggest you jump before you're pushed. http://www. politico.com/story/2017/02/ trump-flynn-replace-kushner-234977 …";;;;"831378300324835328";https://twitter.com/ConnellyAL/status/831378300324835328
ConnellyAL;2017-02-14 04:56;0;3;"This happened much more quickly than I had anticipated. https:// twitter.com/connellyal/sta tus/821952771045801984 …";;;;"831366526326366211";https://twitter.com/ConnellyAL/status/831366526326366211
ConnellyAL;2017-02-13 12:53;1;2;"Australians concerned about economic pressure from Beijing, take note. https:// twitter.com/julianku/statu s/831015078434476033 …";;;;"831124101389365250";https://twitter.com/ConnellyAL/status/831124101389365250
ConnellyAL;2017-02-13 11:39;0;0;"Detailees, but I suppose either works.";;;;"831105438728876032";https://twitter.com/ConnellyAL/status/831105438728876032
ConnellyAL;2017-02-13 06:56;0;2;"Cephalopods are very smart: https://www. washingtonpost.com/opinions/just- how-smart-is-an-octopus/2017/01/06/a2f1ed22-acd0-11e6-8b45-f8e493f06fcd_story.html … . (Also, tasty).";;;;"831034344529551360";https://twitter.com/ConnellyAL/status/831034344529551360
ConnellyAL;2017-02-13 06:39;0;0;"Of course you let it escape, just like Howe at Brooklyn Heights";;;;"831030081988423680";https://twitter.com/ConnellyAL/status/831030081988423680
ConnellyAL;2017-02-13 06:05;4;2;"The fascinating politics of the upcoming French elections in New Caledonia: https://www. lowyinstitute.org/the-interprete r/new-caledonia-french-election-calendar-stymies-progress … .";;;;"831021530737889284";https://twitter.com/ConnellyAL/status/831021530737889284
