username;date;retweets;favorites;text;geo;mentions;hashtags;id;permalink
ConnellyAL;2016-10-04 06:41;0;0;"Not trying to be dense, but genuinely don't see why that would be required. Don't think Beijing expects it, either.";;;;"783195440703385600";https://twitter.com/ConnellyAL/status/783195440703385600
ConnellyAL;2016-10-04 06:13;0;0;"Why would it require that?";;;;"783188222021029888";https://twitter.com/ConnellyAL/status/783188222021029888
ConnellyAL;2016-10-04 05:28;0;0;"Will read your AJIA article. Looks interesting.";;;;"783176892702523392";https://twitter.com/ConnellyAL/status/783176892702523392
ConnellyAL;2016-10-04 05:23;0;0;"China welcome to increase its own activity in the Pacific. To be expected. But can be no question of exclusion of US from region.";;;;"783175783556579328";https://twitter.com/ConnellyAL/status/783175783556579328
ConnellyAL;2016-10-04 05:23;0;0;"If you want to parse the language, then PRC needs to embrace the most fundamental "rules." (This is the same as embracing a RBO).";;;;"783175622042365953";https://twitter.com/ConnellyAL/status/783175622042365953
ConnellyAL;2016-10-04 05:19;0;0;"Yes, agree completely.";;;;"783174579787182080";https://twitter.com/ConnellyAL/status/783174579787182080
ConnellyAL;2016-10-04 05:17;0;0;"There are different ways of accommodating Chinese power. Shouldn't mean that we each get a sphere of influence.";;;;"783174086599901184";https://twitter.com/ConnellyAL/status/783174086599901184
ConnellyAL;2016-10-04 05:10;1;1;"Other minor matters, like IMF quotas, are open to negotiation. China already beginning to receive greater share of power there.";;;;"783172411449417728";https://twitter.com/ConnellyAL/status/783172411449417728
ConnellyAL;2016-10-04 05:09;1;1;"That means: Beijing must demonstrate that it sincerely embraces fundamental int'l principles like state sovereignty, maritime law. Not hard.";;;;"783172058020589569";https://twitter.com/ConnellyAL/status/783172058020589569
ConnellyAL;2016-10-04 05:06;6;7;"Flaw in White's thinking: Assumption US not prepared to share power with China. http://www. straitstimes.com/opinion/choosi ng-between-america-and-china … US prepared if China embraces RBO.";;;;"783171403184865280";https://twitter.com/ConnellyAL/status/783171403184865280
ConnellyAL;2016-10-04 01:52;8;7;"Chief of Army Angus Campbell speaking now at the @LowyInstitute about the Army's shift toward a focus on amphibious operations. pic.twitter.com/jnTA38pk3H";;@LowyInstitute;;"783122607117697024";https://twitter.com/ConnellyAL/status/783122607117697024
ConnellyAL;2016-10-03 23:54;1;0;"These passages in Obama's eulogy for Peres stood out to me: http://www. lowyinterpreter.org/post/2016/10/0 4/Obama-and-the-Israeli-story.aspx … . Shanah tovah.";;;;"783092986187911169";https://twitter.com/ConnellyAL/status/783092986187911169
ConnellyAL;2016-10-03 21:26;2;0;"Philippines, Malaysia, Indonesia to explore joint air patrols http://www. straitstimes.com/asia/se-asia/p hilippines-malaysia-indonesia-to-explore-joint-air-patrols?xtor=CS3-18 … Targeting terrorist and criminal networks in Sulu Sea.";;;;"783055650561503232";https://twitter.com/ConnellyAL/status/783055650561503232
ConnellyAL;2016-10-03 20:56;0;0;"Border ceremony at Wagah takes dark turn amidst India-Pakistan tensions. http:// on.ft.com/2dUniqs";;;;"783048164773273601";https://twitter.com/ConnellyAL/status/783048164773273601
ConnellyAL;2016-10-03 20:47;0;0;"Indian soldier killed in latest Kashmir attack http:// on.ft.com/2dSJYXY";;;;"783045856727412736";https://twitter.com/ConnellyAL/status/783045856727412736
ConnellyAL;2016-10-03 14:44;4;0;"Thoughtful post on the U.S.-Australia alliance by Labor's new Shadow Foreign Minister, @SenatorWong . http://www. lowyinterpreter.org/post/2016/10/0 1/John-Curtins-turn-to-America-75-years-on.aspx …";;@SenatorWong;;"782954454022619136";https://twitter.com/ConnellyAL/status/782954454022619136
ConnellyAL;2016-10-03 10:21;0;0;"Missing from this #4Corners , a clear statement of Obama Administration policy: That concern is w/Chinese behavior in SCS, not Chinese power.";;;#4Corners;"782888265036668929";https://twitter.com/ConnellyAL/status/782888265036668929
ConnellyAL;2016-10-03 10:07;0;1;"Shouldn't US seek to prevent conflict? But contra Hugh, American commitment to Philippines' security hasn't yet been challenged. #4Corners";;;#4Corners;"782884723215339520";https://twitter.com/ConnellyAL/status/782884723215339520
ConnellyAL;2016-10-03 10:02;0;3;"Odd that Hugh would compare brief deployment of aircraft carriers (which often transit SCS) with new, permanent Chinese islands. #4Corners";;;#4Corners;"782883578245894145";https://twitter.com/ConnellyAL/status/782883578245894145
ConnellyAL;2016-10-02 23:39;0;0;"Civil penalties are always subject to negotiation. Not a criminal matter.";;;;"782726638991663104";https://twitter.com/ConnellyAL/status/782726638991663104
ConnellyAL;2016-10-02 23:13;1;1;"@PD_SDSC @TheNatlInterest And diaspora NEO scenarios.";;@PD_SDSC @TheNatlInterest;;"782720267546091521";https://twitter.com/ConnellyAL/status/782720267546091521
ConnellyAL;2016-10-02 06:54;0;4;"SNL's cold open wasn't very good. Problem: How do you parody this election when it's already theater of the absurd? http:// ow.ly/Oe3q5052mXL";;;;"782473751665385472";https://twitter.com/ConnellyAL/status/782473751665385472
ConnellyAL;2016-10-02 04:47;0;0;"First 25°+ day in a few months.";;;;"782441935608778752";https://twitter.com/ConnellyAL/status/782441935608778752
ConnellyAL;2016-10-02 04:28;0;0;"These people are curious. Everything else you could handle, but the tweets about Machado crossed the line?";;;;"782437048250531840";https://twitter.com/ConnellyAL/status/782437048250531840
ConnellyAL;2016-10-02 03:41;0;7;"Lived in Sydney two and a half years, first time to Coogee. (I know). pic.twitter.com/3m5FQaS9zx";;;;"782425161467244544";https://twitter.com/ConnellyAL/status/782425161467244544
ConnellyAL;2016-10-02 02:15;1;2;"Yes, portfolio investors like Indonesia. No other good EM options. http://www. cnbc.com/2016/09/30/ind onesian-economy-becomes-a-standout-among-emerging-markets.html … But project investors ex-China still very wary.";;;;"782403691055722496";https://twitter.com/ConnellyAL/status/782403691055722496
ConnellyAL;2016-10-02 00:54;0;0;"Yeah. You think a loss helps Trump in a given state? "We're losing our country." Win helps Clinton?";;;;"782383151729381376";https://twitter.com/ConnellyAL/status/782383151729381376
ConnellyAL;2016-10-01 15:30;1;2;"Executions in the U.S. are at a 25 year low, and Americans are abandoning their support for the death penalty. https://www. washingtonpost.com/news/post-nati on/wp/2016/09/30/states-arent-using-the-death-penalty-as-much-now-americans-are-abandoning-it-too/?utm_term=.296d76fa6a2c&wpisrc=nl_rainbow&wpmm=1 …";;;;"782241179312107520";https://twitter.com/ConnellyAL/status/782241179312107520
ConnellyAL;2016-10-01 13:41;3;2;"Singapore just the latest country to attract sustained criticism from the Global Times for South China Sea position. http://www. todayonline.com/singapore/glob al-times-continues-drumbeat-criticism-against-singapore …";;;;"782213749885153280";https://twitter.com/ConnellyAL/status/782213749885153280
ConnellyAL;2016-10-01 13:30;3;1;"Duterte's drug war echoes Thailand's fifteen years ago. The junta says that approach failed, is reversing course. https://www. buzzfeed.com/meghara/thaila nds-failed-drug-policy-is-full-of-lessons-for-the-phil?utm_term=.ltKzy0vaNn#.klB6ZYAmzj …";;;#;"782210989894676481";https://twitter.com/ConnellyAL/status/782210989894676481
ConnellyAL;2016-09-30 10:46;0;1;"@JohnBlaxland1 What risk of escalation? No indication that coordinated (not joint) patrols will take place near Natunas.";;@JohnBlaxland1;;"781807358720606209";https://twitter.com/ConnellyAL/status/781807358720606209
ConnellyAL;2016-09-30 06:43;0;0;"Prefer that we seek Pareto optimal levels of funding. "First world" strikes me as going way beyond that. We don't need 20 Changis.";;;;"781746238253244416";https://twitter.com/ConnellyAL/status/781746238253244416
ConnellyAL;2016-09-30 06:05;0;0;"The irony here is if Clinton decides to renegotiate TPP, it will be to disadvantage U.S. firms. https:// twitter.com/senwarren/stat us/781594685982801920 …";;;;"781736758564102145";https://twitter.com/ConnellyAL/status/781736758564102145
ConnellyAL;2016-09-30 05:02;1;1;""First-world" airports in the U.S. would frankly be a waste of public funds. #confessyourunpopularopinion https:// twitter.com/theeconomist/s tatus/781697863495651328 …";;;#confessyourunpopularopinion;"781720794153885696";https://twitter.com/ConnellyAL/status/781720794153885696
ConnellyAL;2016-09-30 04:26;0;1;"pic.twitter.com/dBgkQaGwNi";;;;"781711842787766277";https://twitter.com/ConnellyAL/status/781711842787766277
ConnellyAL;2016-09-30 02:19;0;1;"Who could have predicted this? http://www. latimes.com/nation/la-na-s ept11-bill-fix-20160929-snap-story.html … pic.twitter.com/lqjLuzbpc2";;;;"781679719741652992";https://twitter.com/ConnellyAL/status/781679719741652992
ConnellyAL;2016-09-30 00:05;4;0;"Tactical nukes are becoming more precise and useable. @BrendanTN_ 's new report on why that could be destabilizing. http://www. lowyinstitute.org/publications/t actical-nuclear-weapons-modern-nuclear-era …";;@BrendanTN_;;"781646201292595200";https://twitter.com/ConnellyAL/status/781646201292595200
ConnellyAL;2016-09-29 13:09;0;0;"Thread here on India's decision to cross Line of Control and go public with it. https:// twitter.com/d_jaishankar/s tatus/781469541654261760 …";;;;"781481056104882178";https://twitter.com/ConnellyAL/status/781481056104882178
ConnellyAL;2016-09-29 07:20;0;0;"Alternative interpretation: Obama upheld principle of sovereign immunity despite populist pressure not to.";;;;"781393283469586432";https://twitter.com/ConnellyAL/status/781393283469586432
ConnellyAL;2016-09-29 07:19;1;0;"Congress adjourned until after the election w/out confirming Sung Kim as ambassador to the Philippines. Nothing going on in Manila, though.";;;;"781392838508425216";https://twitter.com/ConnellyAL/status/781392838508425216
ConnellyAL;2016-09-29 06:09;6;7;"Hint: This review is not actually about Hitler. https:// twitter.com/michikokakutan i/status/780875106251841541 …";;;;"781375301871816704";https://twitter.com/ConnellyAL/status/781375301871816704
ConnellyAL;2016-09-28 12:34;4;2;"Singapore's carefully controlled succession process upended by new poll showing massive support for DPM Tharman. https:// sg.news.yahoo.com/most-singapore ans-would-choose-tharman-1523976433713206.html …";;;;"781109780458774528";https://twitter.com/ConnellyAL/status/781109780458774528
ConnellyAL;2016-09-28 11:50;0;1;"None of those factors present this time. Ahok actually is Tionghoa and Christian.";;;;"781098705617166336";https://twitter.com/ConnellyAL/status/781098705617166336
ConnellyAL;2016-09-28 11:49;1;3;"@n1ck0wen Didn't work in 2014 because Jokowi made umrah to Mecca, and PKB got the word out in kampung2.";;@n1ck0wen;;"781098475182170113";https://twitter.com/ConnellyAL/status/781098475182170113
ConnellyAL;2016-09-28 11:15;0;0;"During earlier tour, @unspun noted diff ID/MY corruption: Kapolri wears $3,000 watches to testify before Komisi III";;@unspun;;"781089967778910208";https://twitter.com/ConnellyAL/status/781089967778910208
ConnellyAL;2016-09-28 11:08;1;0;"Did @Portal_Kemlu_RI make an effort to defend ASEAN's rights in Venezuela? Does Jubir have comment on Global Times criticisms of S'pore? https:// twitter.com/janetdegibson/ status/781082702816481280 …";;@Portal_Kemlu_RI;;"781088142115770368";https://twitter.com/ConnellyAL/status/781088142115770368
ConnellyAL;2016-09-28 10:45;0;1;"In this hellish year, especially for Americans by choice like Josey, losing him this way such a gut punch. Gordon's home run a little light. https:// twitter.com/jeffpassan/sta tus/780782959422939136 …";;;;"781082433529778176";https://twitter.com/ConnellyAL/status/781082433529778176
ConnellyAL;2016-09-28 09:07;1;0;"Take away for Indonesian officials: "Ban ore exports, despite the warnings from neolibs. China will move you up the value chain."";;;;"781057724545052672";https://twitter.com/ConnellyAL/status/781057724545052672
ConnellyAL;2016-09-28 09:05;2;1;"Great analysis by @Reuters on movements in the nickel price, driven by regulatory changes in Jakarta and Manila. http:// reut.rs/2d0IOuT";;@Reuters;;"781057322873270272";https://twitter.com/ConnellyAL/status/781057322873270272
ConnellyAL;2016-09-28 09:03;0;0;"Next year in Jerusalem, Mbak";;;;"781056820299259904";https://twitter.com/ConnellyAL/status/781056820299259904
ConnellyAL;2016-09-28 08:37;1;0;"This is welcome news: SQ to fly direct from Sydney to Jakarta starting in November. http://www. ausbt.com.au/news/view/1298 4/singapore-airlines-to-launch-sydney-jakarta-singapore-flights …";;;;"781050121832112128";https://twitter.com/ConnellyAL/status/781050121832112128
ConnellyAL;2016-09-27 23:17;2;0;"Once upon a time, another tycoon stole the GOP: Wendell Willkie. http:// foreignpolicy.com/2016/09/27/onc e-upon-a-time-another-tycoon-stole-the-gop-donald-trump-wendell-willkie/ … But he won the nomination on his internationalism.";;;;"780909216496128000";https://twitter.com/ConnellyAL/status/780909216496128000
ConnellyAL;2016-09-27 13:31;0;0;"No one, not even the most alarmist PACOM staff officer, would argue China has suzerainty in the Western Pacific.";;;;"780761729840013312";https://twitter.com/ConnellyAL/status/780761729840013312
ConnellyAL;2016-09-27 13:09;1;1;"I prefer the Haftarah portion, Isaiah 40, about comfort and redemption.";;;;"780756343359549444";https://twitter.com/ConnellyAL/status/780756343359549444
ConnellyAL;2016-09-27 12:52;0;1;"Baited. Beautifully baited.";;;;"780752027164905473";https://twitter.com/ConnellyAL/status/780752027164905473
ConnellyAL;2016-09-27 12:42;0;0;"Not the way I learned them. But then: Reform. ¯\_(ツ)_/¯";;;;"780749546636705792";https://twitter.com/ConnellyAL/status/780749546636705792
ConnellyAL;2016-09-27 12:20;0;1;"Only tropes I know are for Parshah Va'etchanan. It's not a cliche if it's true. There's no equivalency between these two.";;;;"780743978152964096";https://twitter.com/ConnellyAL/status/780743978152964096
ConnellyAL;2016-09-27 12:11;0;1;"Because your party nominated a clear and present danger to the international system and American national security.";;;;"780741528528367616";https://twitter.com/ConnellyAL/status/780741528528367616
ConnellyAL;2016-09-27 12:05;0;1;"Singapore is doing what is in Singapore's interest: upholding ASEAN centrality.";;;;"780740130160058368";https://twitter.com/ConnellyAL/status/780740130160058368
ConnellyAL;2016-09-27 11:16;3;2;"Chinese press hits S'pore for objecting to Chinese-Venezuelan scheme to remove South China Sea from NAM statement. http://www. straitstimes.com/asia/east-asia /spore-envoy-refutes-china-report-on-s-china-sea …";;;;"780727799686365186";https://twitter.com/ConnellyAL/status/780727799686365186
ConnellyAL;2016-09-27 11:10;0;0;"Tell that to the bakso seller.";;;;"780726315246755841";https://twitter.com/ConnellyAL/status/780726315246755841
ConnellyAL;2016-09-27 11:04;0;0;"Looks like import permits issued via an opaque process to three firms over the weekend. Given history, raises some governance concerns. https:// twitter.com/ConnellyAL/sta tus/780723572079681536 …";;;;"780724887015030784";https://twitter.com/ConnellyAL/status/780724887015030784
ConnellyAL;2016-09-27 10:59;2;1;"New Indonesian cattle import scheme likely to reduce trade with Australia, raise beef prices in Indonesia. http://www. abc.net.au/news/2016-09-2 7/indonesia-scraps-cattle-quotas-but-introduces-breeder-protocol/7879784 …";;;;"780723572079681536";https://twitter.com/ConnellyAL/status/780723572079681536
ConnellyAL;2016-09-27 10:28;0;0;"Europeans see a lot of that, too. Increased Chinese military spending has been good for defense contractors worldwide.";;;;"780715723584700416";https://twitter.com/ConnellyAL/status/780715723584700416
ConnellyAL;2016-09-27 10:14;0;1;"As you know, Singaporeans will take that deal, and the independence that comes with it, every day of the week.";;;;"780712184548425728";https://twitter.com/ConnellyAL/status/780712184548425728
ConnellyAL;2016-09-27 09:36;4;0;"TNI has been promising upgrades to existing bases for years. Always 2-3 years away. https:// twitter.com/jakpost/status /780630546816835584 …";;;;"780702534360969216";https://twitter.com/ConnellyAL/status/780702534360969216
ConnellyAL;2016-09-27 05:02;0;6;"Disadvantage to living in this time zone: Drinking before, during, or immediately after debates not socially acceptable.";;;;"780633711813373952";https://twitter.com/ConnellyAL/status/780633711813373952
ConnellyAL;2016-09-27 04:57;0;0;"Good story, but is "progressive" really the right way to describe Ahok? Kalijodo suggests he is a developmentalist like Jokowi. https:// twitter.com/samanthahawley /status/780626703785664512 …";;;;"780632530911305728";https://twitter.com/ConnellyAL/status/780632530911305728
ConnellyAL;2016-09-26 07:18;2;1;"Reversal on liberalization pledges, lack of infrastructure holding Indonesia back. http:// on.ft.com/2dcMPuq Same old story.";;;;"780305416811008000";https://twitter.com/ConnellyAL/status/780305416811008000
ConnellyAL;2016-09-26 06:30;2;0;"A truly outstanding film, and remarkable to see it receive multiple screenings in Singapore. https:// twitter.com/kixes/status/7 80236792200957953 …";;;;"780293541843001345";https://twitter.com/ConnellyAL/status/780293541843001345
ConnellyAL;2016-09-26 06:08;0;0;"Capital can't be cowed into silence.";;;;"780287872125382656";https://twitter.com/ConnellyAL/status/780287872125382656
ConnellyAL;2016-09-26 05:59;0;0;"Probably even odds whether Australian advocacy in Veloso case would help or hurt. But very real risk it would hurt. http://www. lowyinterpreter.org/post/2016/09/2 3/Australia-should-take-a-stand-on-Veloso.aspx …";;;;"780285552574640128";https://twitter.com/ConnellyAL/status/780285552574640128
ConnellyAL;2016-09-26 01:38;0;1;"Perhaps I was too hasty. Student spent much time at his internship at the local paper, impeding his studies. A charitable 2:2.";;;;"780219888249942017";https://twitter.com/ConnellyAL/status/780219888249942017
ConnellyAL;2016-09-26 01:33;0;0;"Guess they finally found that secret footage of my time in Alpha Alpha Whatever.";;;;"780218684174241792";https://twitter.com/ConnellyAL/status/780218684174241792
ConnellyAL;2016-09-26 01:08;0;3;"@jljzen Reads like a third-class essay. Glancing familiarity with key concepts, events. Superficial analysis. Low pass.";;@jljzen;;"780212400871964672";https://twitter.com/ConnellyAL/status/780212400871964672
ConnellyAL;2016-09-25 12:26;0;1;"Australia struggles to balance liberal imperatives and popular support on trade, refugees. http://www. smh.com.au/comment/a-noni diot-abroad-malcolm-turnbull-presents-as-an-australian-global-realist-20160922-grmkp7.html … Not unique to Oz, either.";;;;"780020618053890048";https://twitter.com/ConnellyAL/status/780020618053890048
ConnellyAL;2016-09-25 12:03;1;0;"Many may tune out reports from Manila, dismiss violence as normal. But extrajudicial killings on this scale are not. http://www. smh.com.au/world/drug-sus pect-rises-from-dead-to-declare-support-for-philippine-president-rodrigo-dutertes-war-on-drugs-20160922-grmlt8.html …";;;;"780014987834118144";https://twitter.com/ConnellyAL/status/780014987834118144
ConnellyAL;2016-09-25 11:50;0;0;"Did Russia Hack The NSA? Maybe Not https:// n.pr/2cXp4Ga";;;;"780011648228524032";https://twitter.com/ConnellyAL/status/780011648228524032
ConnellyAL;2016-09-25 10:56;1;2;"Bernie Aronson was my old boss's go-to-guy on Colombia. Great to see him get some credit for his role here. https:// n.pr/2dftUMw";;;;"779998092212838400";https://twitter.com/ConnellyAL/status/779998092212838400
ConnellyAL;2016-09-25 10:00;0;0;"Knew you'd be first off the rank, Rodger. Your introduction will begin tomorrow, with a tutorial on the infield fly rule.";;;;"779983791230029824";https://twitter.com/ConnellyAL/status/779983791230029824
ConnellyAL;2016-09-25 09:24;0;0;"Apologies to non-American friends about the occasional baseball tweets over the next few weeks. (Or, read up here). http:// mlb.com/r/article?ymd= 20160924&content_id=203225618&vkey=news_was&c_id=was …";;;;"779974805642543107";https://twitter.com/ConnellyAL/status/779974805642543107
ConnellyAL;2016-09-25 05:54;0;1;""Ancient history," right? https:// twitter.com/petesouza/stat us/779832803622019072 …";;;;"779921886784348164";https://twitter.com/ConnellyAL/status/779921886784348164
ConnellyAL;2016-09-24 05:14;0;0;"Great yarn with some excellent quotes from exasperated Russia specialists. All very Tailor of Panama. https:// twitter.com/juliaioffe/sta tus/779481783888904192 …";;;;"779549429661442048";https://twitter.com/ConnellyAL/status/779549429661442048
ConnellyAL;2016-09-23 14:09;0;1;"Inside Hillary Clinton’s debate prep: http:// politi.co/2d8p4Vz .";;;;"779321865386926080";https://twitter.com/ConnellyAL/status/779321865386926080
ConnellyAL;2016-09-23 12:48;1;1;"How did you feel about Gerindra's 2012 candidates?";;;;"779301384160030721";https://twitter.com/ConnellyAL/status/779301384160030721
ConnellyAL;2016-09-23 12:45;4;0;"Fascinating turn of events. Years of effort (and all that money) spent by Sandi Uno, and he ends up as the No. 2.";;;;"779300701730054144";https://twitter.com/ConnellyAL/status/779300701730054144
ConnellyAL;2016-09-23 12:31;0;0;"Interesting @dandrezner post arguing that Clinton is better-positioned than even the worst polls suggest. https://www. washingtonpost.com/posteverything /wp/2016/09/22/nate-silver-says-i-should-be-nervous-about-the-election-heres-why-im-not-too-nervous/?utm_term=.fef4d4145c51&wpisrc=nl_rainbow&wpmm=1 …";;@dandrezner;;"779297055705407488";https://twitter.com/ConnellyAL/status/779297055705407488
ConnellyAL;2016-09-23 12:03;2;4;"Cool and balanced take by @JakobsonLinda on Australia's recent China debate. http://www. theaustralian.com.au/opinion/beware -the-china-alarmists-out-there/news-story/6c43e0e651b90e4bbd60ab7b2c8c6e6f …";;@JakobsonLinda;;"779290185678725122";https://twitter.com/ConnellyAL/status/779290185678725122
ConnellyAL;2016-09-23 11:47;1;1;"Former Bush speechwriter @MJGerson : Trump's perceived advantage on counter-terrorism is absurd. https://www. washingtonpost.com/opinions/on-fo reign-policy-trump-is-the-worst-of-all-worlds/2016/09/22/687979ce-8108-11e6-8327-f141a7beb626_story.html?utm_term=.230c1f49a590&wpisrc=nl_rainbow&wpmm=1 …";;@MJGerson;;"779285955257638913";https://twitter.com/ConnellyAL/status/779285955257638913
ConnellyAL;2016-09-23 11:29;1;0;"$14 billion in goods stuck at sea due to Hanjin's bankruptcy. Overcapacity may push other shipping firms underwater. http://www. economist.com/blogs/economis t-explains/2016/09/economist-explains-14?fsrc=scn/fb/te/bl/ed/whybillionsofdollarsofgoodsarestuckatsea …";;;;"779281519080644608";https://twitter.com/ConnellyAL/status/779281519080644608
ConnellyAL;2016-09-23 10:58;2;3;"Despite Jokowi's lack of time for "summit diplomacy" of SBY, has authorized a UNSC bid. Still wants Indonesia to have seat at the big table. https:// twitter.com/DTDjani/status /779273015091748864 …";;;;"779273752055996417";https://twitter.com/ConnellyAL/status/779273752055996417
ConnellyAL;2016-09-23 09:26;0;2;"Quite a bit of movement in Canada-China relationship. http://www. nytimes.com/2016/09/23/wor ld/americas/canada-china-trade-justin-trudeau.html?_r=0 … Wouldn't underestimate role that release of Garratt played.";;;;"779250630011396097";https://twitter.com/ConnellyAL/status/779250630011396097
ConnellyAL;2016-09-23 09:20;0;2;"Complete with celebrity endorsers: Riady, Thohir, Tommy Suharto. https:// twitter.com/jack_s_hewson/ status/779247312728051712 …";;;;"779248948976365568";https://twitter.com/ConnellyAL/status/779248948976365568
ConnellyAL;2016-09-23 09:13;0;0;"Putting the protests and unrest in Charlotte in context: http://www. nytimes.com/2016/09/23/us/ charlotte-image-police-shooting.html … . One of the most successful cities of the 'New South'.";;;;"779247286068981760";https://twitter.com/ConnellyAL/status/779247286068981760
ConnellyAL;2016-09-23 08:14;2;1;"Next week at @NGVMelbourne : Australian attitudes about the world with @AlexKOliver , @HollyRansom , and @TimWattsMP . http://www. lowyinstitute.org/events/event-a nxious-about-us-unsure-about-china-australians-and-2016-lowy-institute-poll …";;@NGVMelbourne @AlexKOliver @HollyRansom @TimWattsMP;;"779232475629268992";https://twitter.com/ConnellyAL/status/779232475629268992
ConnellyAL;2016-09-23 04:32;1;0;"I'm less skeptical about security services' judgments than @LeonBerkelmans , but agree ad hominem attacks unhelpful. http://www. lowyinterpreter.org/post/2016/09/2 2/Where-economics-fits-in-the-security-debate.aspx …";;@LeonBerkelmans;;"779176585026871296";https://twitter.com/ConnellyAL/status/779176585026871296
ConnellyAL;2016-09-23 04:23;3;2;". @MrKRudd moderating panel on ASEAN at @AsiaSociety today. http:// asiasociety.org/new-york/event s/asean-next-50-years … Post of ASEAN secretary general comes open next year....";;@MrKRudd @AsiaSociety;;"779174408371916800";https://twitter.com/ConnellyAL/status/779174408371916800
ConnellyAL;2016-09-23 03:44;0;1;"He traveled with the campaign team and liaised with the police. He may have been retired, but his networks are still good.";;;;"779164576549961728";https://twitter.com/ConnellyAL/status/779164576549961728
ConnellyAL;2016-09-23 03:43;1;0;"Seemingly well-sourced inside look at the UN Secretary General race, with a lot of good color. http://www. politico.eu/article/how-no t-to-pick-the-un-secretary-general-ban-ki-moon-antonio-guterres/ …";;;;"779164186551001088";https://twitter.com/ConnellyAL/status/779164186551001088
