username;date;retweets;favorites;text;geo;mentions;hashtags;id;permalink
DroneDeploy;2017-11-03 23:54;0;2;"Store, organize, and share all your maps and plans with #Folders . https:// hubs.ly/H094VYc0 pic.twitter.com/mBFpoqkg4E";;;#Folders;"926598389038448646";https://twitter.com/DroneDeploy/status/926598389038448646
DroneDeploy;2017-11-03 21:09;3;15;"Think #drones won't help your #construction team save time and money? Think again. https:// hubs.ly/H094RD80 pic.twitter.com/gqRnoJWynz";;;#drones #construction;"926556848173600769";https://twitter.com/DroneDeploy/status/926556848173600769
DroneDeploy;2017-11-03 18:11;0;3;"3 features for managing and sharing drone data with your team. https:// hubs.ly/H094LPL0 #drones #UAV #sUAS";;;#drones #UAV #sUAS;"926512190391242753";https://twitter.com/DroneDeploy/status/926512190391242753
DroneDeploy;2017-11-03 17:31;0;1;"Hope you'll be swinging by Booth 8!";;;;"926502020537769985";https://twitter.com/DroneDeploy/status/926502020537769985
DroneDeploy;2017-11-03 16:33;1;4;"Meet us at booth 8 and hear about our newest features and partnerships. https:// twitter.com/DJIEnterprise/ status/926433991170850816 …";;;;"926487554756452353";https://twitter.com/DroneDeploy/status/926487554756452353
DroneDeploy;2017-11-03 04:59;3;2;"We've partnered with industry leaders to provide best-in-class solutions for everyone. https:// hubs.ly/H094dnq0 pic.twitter.com/gBLPBNyD3M";;;;"926312736405032960";https://twitter.com/DroneDeploy/status/926312736405032960
DroneDeploy;2017-11-02 23:52;4;8;"Plan #flights with more confidence. Get Auto Flight Modes for free in our App Market. https:// hubs.ly/H0948_n0 #drones #UAV pic.twitter.com/naivISqKkE";;;#flights #drones #UAV;"926235487257464833";https://twitter.com/DroneDeploy/status/926235487257464833
DroneDeploy;2017-11-02 21:07;4;5;"Not too late to buy your tix to @DJIEnterprise #AirWorks . Use code "MD9S2G6N" to get 20% off a conference ticket. https:// hubs.ly/H093Qtb0 pic.twitter.com/IBAtfVFBB0";;@DJIEnterprise;#AirWorks;"926194048196587521";https://twitter.com/DroneDeploy/status/926194048196587521
DroneDeploy;2017-11-02 19:15;0;1;"We'd love for these ladies to stop by Booth 8 at AirWorks.";;;;"926165827841224704";https://twitter.com/DroneDeploy/status/926165827841224704
DroneDeploy;2017-11-02 19:03;2;5;"The latest and greatest in women using #dronesforgood . https:// twitter.com/AliMoSphere/st atus/923279220696117248 …";;;#dronesforgood;"926162796705857536";https://twitter.com/DroneDeploy/status/926162796705857536
DroneDeploy;2017-11-02 18:07;6;6;"Store, analyze, & share #inspections of power lines, #roofs , & more w/ @ScopitoApS in our App Market: https:// hubs.ly/H093NGd0 pic.twitter.com/jW8As304m9";;@ScopitoApS;#inspections #roofs;"926148828578885633";https://twitter.com/DroneDeploy/status/926148828578885633
DroneDeploy;2017-11-02 16:47;0;1;"We hope you enjoy these new features and improvements, Kyle.";;;;"926128656795164674";https://twitter.com/DroneDeploy/status/926128656795164674
DroneDeploy;2017-11-02 16:37;0;0;"Love that you're as excited as we are about our future, Kevin.";;;;"926126051763167232";https://twitter.com/DroneDeploy/status/926126051763167232
DroneDeploy;2017-11-02 16:19;0;1;"There will definitely be more to come!";;;;"926121601677926401";https://twitter.com/DroneDeploy/status/926121601677926401
DroneDeploy;2017-11-01 23:50;6;7;"Drum roll please! Introducing: our Mapping #Software Package for small to large businesses alike. https:// hubs.ly/H093NC00 #drones #UAV";;;#Software #drones #UAV;"925872599745392643";https://twitter.com/DroneDeploy/status/925872599745392643
DroneDeploy;2017-11-01 21:05;5;2;"Maps not accurate enough? Consider these 7 practices. https:// hubs.ly/H093FqH0 #drones #UAV #sUAS";;;#drones #UAV #sUAS;"925831107626635264";https://twitter.com/DroneDeploy/status/925831107626635264
DroneDeploy;2017-11-01 20:10;0;1;"We hope you make a pit stop at Booth 8, Colin.";;;;"925817405330169856";https://twitter.com/DroneDeploy/status/925817405330169856
DroneDeploy;2017-11-01 20:09;0;2;"All our hands are raised. Come by Booth 8 for the latest and greatest news - we have a lot to share. https:// twitter.com/DJIEnterprise/ status/925709571154464775 …";;;;"925817090774261760";https://twitter.com/DroneDeploy/status/925817090774261760
DroneDeploy;2017-11-01 20:08;1;2;"We think yes! https:// twitter.com/AgremoApp/stat us/925771495690981376 …";;;;"925816789505732609";https://twitter.com/DroneDeploy/status/925816789505732609
DroneDeploy;2017-11-01 18:28;0;1;"Thanks! We're glad to have you a part of our team too.";;;;"925791728593805312";https://twitter.com/DroneDeploy/status/925791728593805312
DroneDeploy;2017-11-01 18:05;1;3;"What are the need-to-knows to get your foot in the door? https:// hubs.ly/H093BTV0";;;;"925785801203515392";https://twitter.com/DroneDeploy/status/925785801203515392
DroneDeploy;2017-11-01 01:49;0;0;"DroneDeploy Releases Fortune 500 Enterprise Mapping Software - @WBJonline https:// hubs.ly/H0933rK0";;@WBJonline;;"925540142433136640";https://twitter.com/DroneDeploy/status/925540142433136640
DroneDeploy;2017-10-31 22:04;19;19;"4 tips to take your #drone map to the next level. https:// hubs.ly/H0930S70 #sUAS #UAV";;;#drone #sUAS #UAV;"925483524676882432";https://twitter.com/DroneDeploy/status/925483524676882432
DroneDeploy;2017-10-31 21:07;0;0;"You can try our software for free. https://www. dronedeploy.com /";;;;"925469382805000192";https://twitter.com/DroneDeploy/status/925469382805000192
DroneDeploy;2017-10-31 19:59;1;1;"@NyCalKid Thank you, we're happy to hear you're as excited as us!";;@NyCalKid;;"925452073768013825";https://twitter.com/DroneDeploy/status/925452073768013825
DroneDeploy;2017-10-31 19:58;0;0;"Great having you there!";;;;"925451852115689473";https://twitter.com/DroneDeploy/status/925451852115689473
DroneDeploy;2017-10-31 18:57;4;3;"Survey-grade maps just got a whole lot easier. https:// hubs.ly/H092_8F0";;;;"925436624594526209";https://twitter.com/DroneDeploy/status/925436624594526209
DroneDeploy;2017-10-31 18:15;2;12;"Things are getting kind of spooky around here... #HappyHalloween pic.twitter.com/LeSZxlapD8";;;#HappyHalloween;"925426027500789760";https://twitter.com/DroneDeploy/status/925426027500789760
DroneDeploy;2017-10-31 01:02;9;10;"Get a peek at the best tools for your #drone biz. https:// hubs.ly/H092x_y0 #drones #sUAS #UAV";;;#drone #drones #sUAS #UAV;"925166108411416577";https://twitter.com/DroneDeploy/status/925166108411416577
DroneDeploy;2017-10-30 22:17;4;6;"What can you gain by spending less than an hr per week mapping your jobsite? https:// hubs.ly/H092vzQ0";;;;"925124608994545664";https://twitter.com/DroneDeploy/status/925124608994545664
DroneDeploy;2017-10-30 22:00;2;6;"Who else has tried FieldScanner 2? https:// twitter.com/TheChadColby/s tatus/924397872249954305 …";;;;"925120354334285824";https://twitter.com/DroneDeploy/status/925120354334285824
DroneDeploy;2017-10-30 22:00;0;2;"Look at it go!";;;;"925120180371447808";https://twitter.com/DroneDeploy/status/925120180371447808
DroneDeploy;2017-10-30 18:14;4;8;"Anyone else test out our new features and improvements? We'd love to hear your thoughts. https:// twitter.com/TheChadColby/s tatus/924615705613426689 …";;;;"925063267185180674";https://twitter.com/DroneDeploy/status/925063267185180674
DroneDeploy;2017-10-30 18:06;6;7;"How are big names in the #construction industry using #drones ? https:// hubs.ly/H091RM10 #UAV #sUAS";;;#construction #drones #UAV #sUAS;"925061387948306432";https://twitter.com/DroneDeploy/status/925061387948306432
DroneDeploy;2017-10-30 05:43;1;1;"When should you be using Ground Control Points? https:// hubs.ly/H091S250";;;;"924874322879098880";https://twitter.com/DroneDeploy/status/924874322879098880
DroneDeploy;2017-10-29 18:10;9;18;"What are these 5 industries looking for in #drone pilots? https:// hubs.ly/H091Ltl0 #drones #UAV";;;#drone #drones #UAV;"924700092614950912";https://twitter.com/DroneDeploy/status/924700092614950912
DroneDeploy;2017-10-28 23:05;1;2;"DroneDeploy Day is done, which means it's time to focus on our next show: #DJI #AirWorks . https:// hubs.ly/H091J_50 pic.twitter.com/11KYWO0zOt";;;#DJI #AirWorks;"924411712354377728";https://twitter.com/DroneDeploy/status/924411712354377728
DroneDeploy;2017-10-28 19:05;1;3;"A retrospective on #drones in #ag . https:// hubs.ly/H091GjS0 #AgTech";;;#drones #ag #AgTech;"924351527132778501";https://twitter.com/DroneDeploy/status/924351527132778501
DroneDeploy;2017-10-28 16:03;0;2;"https:// twitter.com/meggsiek/statu s/924229261224849412 …";;;;"924305676771323904";https://twitter.com/DroneDeploy/status/924305676771323904
DroneDeploy;2017-10-28 15:05;1;2;"Is fixed-wing or multi-rotor the right #UAV model for you? https:// hubs.ly/H091HZD0 #drones";;;#UAV #drones;"924291095642681345";https://twitter.com/DroneDeploy/status/924291095642681345
DroneDeploy;2017-10-28 04:46;3;12;"Thank you to everyone who came to #DroneDeployDay17 ! We owe it all to you. pic.twitter.com/khBMRomiAu";;;#DroneDeployDay17;"924135258500489217";https://twitter.com/DroneDeploy/status/924135258500489217
DroneDeploy;2017-10-27 23:35;2;7;"Solar power + drones =";;;;"924057050002288640";https://twitter.com/DroneDeploy/status/924057050002288640
DroneDeploy;2017-10-27 23:31;3;9;"Kingsley Chen of @SunPower shares how his team uses drones. #DroneDeployDay17 pic.twitter.com/IMs1XNWC2F";;@SunPower;#DroneDeployDay17;"924055896090537984";https://twitter.com/DroneDeploy/status/924055896090537984
DroneDeploy;2017-10-27 23:22;3;2;"Trust us, you want to try our self-serve GCPs. #DroneDeployDay17 https:// twitter.com/anyalamb/statu s/924047813427605504 …";;;#DroneDeployDay17;"924053740360888321";https://twitter.com/DroneDeploy/status/924053740360888321
DroneDeploy;2017-10-27 23:20;1;0;"Haha! We recommend getting a full night's rest before a day out on the field or on our app.";;;;"924053285224439809";https://twitter.com/DroneDeploy/status/924053285224439809
DroneDeploy;2017-10-27 23:01;0;0;"Would love to hear your feedback after trying out some of our new features.";;;;"924048452979326977";https://twitter.com/DroneDeploy/status/924048452979326977
DroneDeploy;2017-10-27 22:56;0;1;"And we’re just as excited to have you join us.";;;;"924047117391355904";https://twitter.com/DroneDeploy/status/924047117391355904
DroneDeploy;2017-10-27 22:55;2;9;"It’s amazing what can happen in a year. https:// twitter.com/jonomillin/sta tus/924042883388227584 …";;;;"924046923480236032";https://twitter.com/DroneDeploy/status/924046923480236032
DroneDeploy;2017-10-27 22:02;0;0;"Thank you for your support!";;;;"924033630506123264";https://twitter.com/DroneDeploy/status/924033630506123264
DroneDeploy;2017-10-27 21:42;4;8;"We have @TheChadColby and Justin Metz from @BowlesFarming in the house! #DroneDeployDay17 pic.twitter.com/abu8pm7E6j";;@TheChadColby @BowlesFarming;#DroneDeployDay17;"924028526084349952";https://twitter.com/DroneDeploy/status/924028526084349952
DroneDeploy;2017-10-27 21:35;0;1;"This is music to our ears. We do what we do for people like you!";;;;"924026851369947136";https://twitter.com/DroneDeploy/status/924026851369947136
DroneDeploy;2017-10-27 21:31;1;2;"Thanks for being a part of #DroneDeployDay17 , Colin.";;;#DroneDeployDay17;"924025834444169216";https://twitter.com/DroneDeploy/status/924025834444169216
DroneDeploy;2017-10-27 21:23;0;0;"Happy to hear this, Jeremy. What was your favorite?";;;;"924023794875875328";https://twitter.com/DroneDeploy/status/924023794875875328
DroneDeploy;2017-10-27 18:36;1;7;"The doctors are in! Have you made your appointment? #DroneDeployDay17 pic.twitter.com/xwpKt8vGCN";;;#DroneDeployDay17;"923981850342604800";https://twitter.com/DroneDeploy/status/923981850342604800
DroneDeploy;2017-10-27 18:23;0;1;"";;;;"923978465409318912";https://twitter.com/DroneDeploy/status/923978465409318912
DroneDeploy;2017-10-27 18:19;3;5;"“We doubled our APIs from the last year.” - App Market master @SkyCapture #DroneDeployDay17 pic.twitter.com/UDbPLv81Y8";;@SkyCapture;#DroneDeployDay17;"923977441076318208";https://twitter.com/DroneDeploy/status/923977441076318208
DroneDeploy;2017-10-27 18:13;11;12;"Just another one of many exciting announcements today. https:// twitter.com/thechadcolby/s tatus/923972414886748160 …";;;;"923975865163059200";https://twitter.com/DroneDeploy/status/923975865163059200
DroneDeploy;2017-10-27 17:56;1;9;"It’s true! https:// twitter.com/thechadcolby/s tatus/923970363666526208 …";;;;"923971761959452672";https://twitter.com/DroneDeploy/status/923971761959452672
DroneDeploy;2017-10-27 17:43;0;1;"Our co-founder @jonomillin ’s about to make some exciting announcements! #DroneDeployDay17 pic.twitter.com/BrcArf1djT";;@jonomillin;#DroneDeployDay17;"923968285804150784";https://twitter.com/DroneDeploy/status/923968285804150784
DroneDeploy;2017-10-27 16:52;0;3;"Colin Snow aka @droneanalyst is about to share some juicy info! #DroneDeployDay17 pic.twitter.com/9RerK5Sufa";;@droneanalyst;#DroneDeployDay17;"923955456493551616";https://twitter.com/DroneDeploy/status/923955456493551616
DroneDeploy;2017-10-27 16:46;0;1;"Stop by Booth 8 and find out.";;;;"923954105189507072";https://twitter.com/DroneDeploy/status/923954105189507072
DroneDeploy;2017-10-27 16:34;6;10;"And we don’t plan on stopping. https:// twitter.com/thechadcolby/s tatus/923949504411222021 …";;;;"923951113526636544";https://twitter.com/DroneDeploy/status/923951113526636544
DroneDeploy;2017-10-27 16:34;1;7;"Wonder what info Michael Perry of @DJIEnterprise will share? #DroneDeployDay17 pic.twitter.com/WqX6khH6V0";;@DJIEnterprise;#DroneDeployDay17;"923950930734727169";https://twitter.com/DroneDeploy/status/923950930734727169
DroneDeploy;2017-10-27 16:22;1;5;"Oh hey, it’s co-founder Nick Pilkington talking about our future. #DroneDeployDay17 pic.twitter.com/yXUxcBjop3";;;#DroneDeployDay17;"923947937561960448";https://twitter.com/DroneDeploy/status/923947937561960448
DroneDeploy;2017-10-27 16:10;3;6;"Welcome CEO @mikewinn to the stage! #DroneDeployDay17 pic.twitter.com/x180XznQor";;@mikewinn;#DroneDeployDay17;"923945066573398021";https://twitter.com/DroneDeploy/status/923945066573398021
DroneDeploy;2017-10-27 16:07;0;2;"We’re getting started y’all! #DroneDeployDay17 pic.twitter.com/MNSioLVjIj";;;#DroneDeployDay17;"923944250378633217";https://twitter.com/DroneDeploy/status/923944250378633217
DroneDeploy;2017-10-27 15:00;1;7;"Doors are open! #DroneDeployDay17 pic.twitter.com/WnaUHTGy9y";;;#DroneDeployDay17;"923927375246528512";https://twitter.com/DroneDeploy/status/923927375246528512
DroneDeploy;2017-10-26 23:46;1;4;"We asked biz leaders what they want from you. Here's how you should pitch your #drone mapping services. https:// hubs.ly/H0909TX0 #sUAS";;;#drone #sUAS;"923697251997716480";https://twitter.com/DroneDeploy/status/923697251997716480
DroneDeploy;2017-10-26 21:01;5;5;"Catch up on #DroneDeployDay17 speaker Ryan Moret of @McCarthyBuild 's tips on building an enterprise #UAV program. https:// hubs.ly/H090bTW0";;@McCarthyBuild;#DroneDeployDay17 #UAV;"923655730607116288";https://twitter.com/DroneDeploy/status/923655730607116288
DroneDeploy;2017-10-26 20:36;0;2;"Thanks for sharing this, Peter. Looks great!";;;;"923649483971354624";https://twitter.com/DroneDeploy/status/923649483971354624
DroneDeploy;2017-10-26 18:04;0;1;"Countin' down the hrs 'til #DroneDeployDay17 . Tune in for live tweets + follow our Instagram for more treats. https:// hubs.ly/H090b9s0 pic.twitter.com/z4ppxdvpKX";;;#DroneDeployDay17;"923611371496984577";https://twitter.com/DroneDeploy/status/923611371496984577
DroneDeploy;2017-10-26 17:54;0;1;"See ya soon!";;;;"923608869284167680";https://twitter.com/DroneDeploy/status/923608869284167680
DroneDeploy;2017-10-26 16:59;0;0;"Hi there, we've sent you a DM with some instructions.";;;;"923595016768860160";https://twitter.com/DroneDeploy/status/923595016768860160
DroneDeploy;2017-10-26 16:55;1;4;"#DroneDeployDay17 is less than 24 hours away! Chad is coming, are you? https:// twitter.com/TheChadColby/s tatus/923489001595658240 …";;;#DroneDeployDay17;"923593959355510784";https://twitter.com/DroneDeploy/status/923593959355510784
DroneDeploy;2017-10-26 16:51;0;2;"And visit us at Booth 622. #ExpoUAV17";;;#ExpoUAV17;"923592869650165760";https://twitter.com/DroneDeploy/status/923592869650165760
DroneDeploy;2017-10-26 00:10;3;5;"Pre-plan for weather conditions at your flight location w/ @DarkSkyApp . What other apps can help your maps? https:// hubs.ly/H0909sr0 pic.twitter.com/Kcl9dJGxls";;@DarkSkyApp;;"923341105604767744";https://twitter.com/DroneDeploy/status/923341105604767744
DroneDeploy;2017-10-25 23:31;0;1;"Yep! We're an app and you can try us for free. https://www. dronedeploy.com/features.html";;;;"923331178718830592";https://twitter.com/DroneDeploy/status/923331178718830592
DroneDeploy;2017-10-25 21:21;0;1;"And you can find 'em on our App Market: https://www. dronedeploy.com/app-market/ind ex.html …";;;;"923298572623167488";https://twitter.com/DroneDeploy/status/923298572623167488
DroneDeploy;2017-10-25 21:19;1;0;"Have you stopped by Booth 622 to say hello to our team yet? We'd love to say hello.";;;;"923297883964653570";https://twitter.com/DroneDeploy/status/923297883964653570
DroneDeploy;2017-10-25 21:11;4;5;"Teamwork! https:// twitter.com/AgremoApp/stat us/923265417828818944 …";;;;"923295879632625664";https://twitter.com/DroneDeploy/status/923295879632625664
DroneDeploy;2017-10-25 21:09;4;10;"Say hello to the gang at Booth #622 and tag us in your best DroneDeploy booth photos. #ExpoUAV17 https:// hubs.ly/H08_TZL0 pic.twitter.com/vFdCyr07O2";;;#622 #ExpoUAV17;"923295381890383872";https://twitter.com/DroneDeploy/status/923295381890383872
DroneDeploy;2017-10-25 18:42;0;0;"We're thrilled to have @grant_hagen as a part of #DroneDeployDay17 this Friday too!";;@grant_hagen;#DroneDeployDay17;"923258447650439168";https://twitter.com/DroneDeploy/status/923258447650439168
DroneDeploy;2017-10-25 18:12;11;12;"How can #drones help improve communication on your team? We have 3 ways to share. https:// hubs.ly/H08_SzP0";;;#drones;"923250862360875010";https://twitter.com/DroneDeploy/status/923250862360875010
DroneDeploy;2017-10-25 17:56;0;3;"Can't wait to hear more insights from one of our #DroneDeployDay17 speakers, @droneanalyst . https:// twitter.com/TheDroneGirl/s tatus/923133033158295552 …";;@droneanalyst;#DroneDeployDay17;"923246903457808385";https://twitter.com/DroneDeploy/status/923246903457808385
DroneDeploy;2017-10-25 17:48;0;1;"Have you stopped by Booth 622 yet, Colin?";;;;"923245008026615808";https://twitter.com/DroneDeploy/status/923245008026615808
DroneDeploy;2017-10-25 17:12;0;0;"Hi there, please post your issue in our official community at http:// forum.dronedeploy.com and someone from our team will be glad to assist.";;;;"923235761146642432";https://twitter.com/DroneDeploy/status/923235761146642432
DroneDeploy;2017-10-25 16:33;3;12;"Check out our CEO @mikewinn with Grant Hagen of @BeckGroup and Hunter Cole of @BrasfieldGorrie ! #ExpoUAV17 https:// twitter.com/jeremiahkarp/s tatus/923225121191374848 …";;@mikewinn @BeckGroup @BrasfieldGorrie;#ExpoUAV17;"923226054650503169";https://twitter.com/DroneDeploy/status/923226054650503169
DroneDeploy;2017-10-25 06:47;1;4;"Planning on introducing #drones into your #construction team? Get the best tips + tricks from industry pros: https:// hubs.ly/H08_5Lg0";;;#drones #construction;"923078421214892032";https://twitter.com/DroneDeploy/status/923078421214892032
DroneDeploy;2017-10-25 00:22;4;8;"Why a #UAV program is key to designing #solar farms. https:// hubs.ly/H08_4YJ0";;;#UAV #solar;"922981571833065472";https://twitter.com/DroneDeploy/status/922981571833065472
DroneDeploy;2017-10-24 21:49;2;3;"What models have you made with us lately? https:// twitter.com/AngelTadey/sta tus/922788973394632706 …";;;;"922943084488298496";https://twitter.com/DroneDeploy/status/922943084488298496
DroneDeploy;2017-10-24 21:07;2;3;"3 Ways to Improve Communication on Your Jobsite w/ #Drones https:// hubs.ly/H08_45j0";;;#Drones;"922932619741945862";https://twitter.com/DroneDeploy/status/922932619741945862
DroneDeploy;2017-10-24 20:45;4;10;"Hey look, it's @SkyCapture aka the host of @DronesPodcast . Make sure to stop by Booth 622 too. #ExpoUAV17 https:// twitter.com/AV8Droneworx/s tatus/922924844450062337 …";;@SkyCapture @DronesPodcast;#ExpoUAV17;"922927021495169024";https://twitter.com/DroneDeploy/status/922927021495169024
DroneDeploy;2017-10-24 18:09;1;2;"Kicking off a busy week at Booth 622 at #ExpoUAV17 & ending it w/ #DroneDeployDay17 at our HQ. https:// hubs.ly/H08-yzP0 pic.twitter.com/aFUUDhRT2t";;;#ExpoUAV17 #DroneDeployDay17;"922887814605361152";https://twitter.com/DroneDeploy/status/922887814605361152
DroneDeploy;2017-10-23 23:50;2;3;"See how our friends at @OceansUnmanned used #drone maps to survey shipwrecks. https:// hubs.ly/H08-wMQ0";;@OceansUnmanned;#drone;"922611139669905409";https://twitter.com/DroneDeploy/status/922611139669905409
DroneDeploy;2017-10-23 21:47;0;0;"We hope you can make a stop at Booth 622.";;;;"922580147026325504";https://twitter.com/DroneDeploy/status/922580147026325504
DroneDeploy;2017-10-23 21:37;0;0;"Thanks for sharing!";;;;"922577728183844864";https://twitter.com/DroneDeploy/status/922577728183844864
DroneDeploy;2017-10-23 21:05;5;10;"We're heading east for #ExpoUAV17 . Don't miss CEO @mikewinn 's keynote with special guests Hunter Cole & Grant Hagen. https:// hubs.ly/H08-r1b0 pic.twitter.com/vf7Vy0Yki3";;@mikewinn;#ExpoUAV17;"922569586796412930";https://twitter.com/DroneDeploy/status/922569586796412930
DroneDeploy;2017-10-23 19:38;2;4;"Mark your calendars! We'll be at Booth 8. https:// twitter.com/DJIEnterprise/ status/920814004271906816 …";;;;"922547728722227200";https://twitter.com/DroneDeploy/status/922547728722227200
DroneDeploy;2017-10-23 19:34;4;5;"We've got loads more on our App Market here: https://www. dronedeploy.com/app-market/ind ex.html … https:// twitter.com/ExpoUAV/status /922541382337744897 …";;;;"922546900904972288";https://twitter.com/DroneDeploy/status/922546900904972288
DroneDeploy;2017-10-23 18:38;0;1;"Tag us in your maps for a chance to be featured on our channel - we quite like this one! https:// twitter.com/OceansUnmanned /status/920067024524541963 …";;;;"922532605513293824";https://twitter.com/DroneDeploy/status/922532605513293824
DroneDeploy;2017-10-23 18:06;3;6;"What types of imagery are there and what #cameras make it possible? https:// hubs.ly/H08-l5j0 #drones #sUAS pic.twitter.com/pvCpXJ5GD9";;;#cameras #drones #sUAS;"922524621894832128";https://twitter.com/DroneDeploy/status/922524621894832128
DroneDeploy;2017-10-23 16:25;0;1;"@DARTdrones will also be doing another session this Saturday! https:// twitter.com/AgremoApp/stat us/922495667838291968 …";;@DARTdrones;;"922499127807635456";https://twitter.com/DroneDeploy/status/922499127807635456
DroneDeploy;2017-10-22 23:48;6;14;"The best #apps for your #UAV business are one tap away. https:// hubs.ly/H08ZCbB0 #sUAS #drones";;;#apps #UAV #sUAS #drones;"922248206003658754";https://twitter.com/DroneDeploy/status/922248206003658754
DroneDeploy;2017-10-22 21:03;6;7;"Don't forget to make your appt w/ us for @DJIEnterprise #AirWorks ! Use code UTW4ABCV for 20% off VIP tix. https:// hubs.ly/H08ZC9Z0 pic.twitter.com/ZtKoHICpIH";;@DJIEnterprise;#AirWorks;"922206681630695424";https://twitter.com/DroneDeploy/status/922206681630695424
DroneDeploy;2017-10-22 18:03;2;3;"How are #construction folks using #drones in their workflow? https:// hubs.ly/H08ZFBD0";;;#construction #drones;"922161400147038210";https://twitter.com/DroneDeploy/status/922161400147038210
DroneDeploy;2017-10-21 23:53;2;4;"Monitor, Measure, + Communicate w/ #Drones in #Construction https:// hubs.ly/H08ZBLj0 pic.twitter.com/3iKtnMa2J5";;;#Drones #Construction;"921887080178966529";https://twitter.com/DroneDeploy/status/921887080178966529
DroneDeploy;2017-10-21 21:08;8;17;". @AirMapIO , @SkywardIO , + @flyte_app , are just a few apps to power your biz. See what else we have on our list. https:// hubs.ly/H08YYpB0";;@AirMapIO @SkywardIO @flyte_app;;"921845574957195265";https://twitter.com/DroneDeploy/status/921845574957195265
DroneDeploy;2017-10-21 18:09;4;6;"Don't put your #drone away after #Harvest17 , put it to work. https:// hubs.ly/H08YTWj0";;;#drone #Harvest17;"921800729706287104";https://twitter.com/DroneDeploy/status/921800729706287104
DroneDeploy;2017-10-21 14:06;2;1;"Psst! Use "MD9S2G6N" to get 20% off conference tix for @DJIGlobal 's #AirWorks : https:// hubs.ly/H08ZDTJ0 pic.twitter.com/umAN8oXRVK";;@DJIGlobal;#AirWorks;"921739353944141824";https://twitter.com/DroneDeploy/status/921739353944141824
DroneDeploy;2017-10-21 06:56;0;3;"We're taking requests for 1:1 chats at #ExpoUAV17 . Send a message to marketing@dronedeploy.com to reserve your slot. https:// hubs.ly/H08YTXZ0 pic.twitter.com/LS6vStbHoY";;@dronedeploy;#ExpoUAV17;"921631138497613824";https://twitter.com/DroneDeploy/status/921631138497613824
DroneDeploy;2017-10-20 23:52;0;7;"What you need to know to market your drone mapping services in 5 industries. https:// hubs.ly/H08ZFxH0 pic.twitter.com/VMaq9JG41M";;;;"921524464952774656";https://twitter.com/DroneDeploy/status/921524464952774656
DroneDeploy;2017-10-20 21:24;0;0;"Hi there, we suggest taking a look at our "Understanding NDVI" article to learn more about plant health: https:// support.dronedeploy.com/docs/understan ding-ndvi-data …";;;;"921487353075691520";https://twitter.com/DroneDeploy/status/921487353075691520
DroneDeploy;2017-10-20 21:18;0;4;"Catch us at Booth #622 and our CEO @mikewinn 's keynote on Oct. 25 @9AM! https:// twitter.com/ExpoUAV/status /921479349035044864 …";;@mikewinn @9AM;#622;"921485696371707909";https://twitter.com/DroneDeploy/status/921485696371707909
