username;date;retweets;favorites;text;geo;mentions;hashtags;id;permalink
Janetlynne211;2017-08-12 22:44;0;0;"He had armies of men looking for him and it was his sick lust for young girls that got that pervert caught. The bunker he was in was down";;;;"896502627088949249";https://twitter.com/Janetlynne211/status/896502627088949249
Janetlynne211;2017-08-12 22:39;0;1;"I know what I have been told my husbands family they fought in ww2 both are still alive they knew hitler was crazy I know how he died";;;;"896501354738397185";https://twitter.com/Janetlynne211/status/896501354738397185
Janetlynne211;2017-08-12 22:30;0;1;"I just knew you would know your very intelligent";;;;"896499246337105922";https://twitter.com/Janetlynne211/status/896499246337105922
Janetlynne211;2017-08-12 22:27;0;0;"That's it thank you";;;;"896498364593967106";https://twitter.com/Janetlynne211/status/896498364593967106
Janetlynne211;2017-08-12 22:25;0;0;"@adair1946 I want to learn more regarding the rise and fall of Hitler it will help to understand what is in that little brain of trumps";;@adair1946;;"896497975811166208";https://twitter.com/Janetlynne211/status/896497975811166208
Janetlynne211;2017-08-12 22:21;0;0;"@adair1946 yes that's the book ivanka said in an article not to be mean that Trump read all those speeches and other Hitler books";;@adair1946;;"896496995740856320";https://twitter.com/Janetlynne211/status/896496995740856320
Janetlynne211;2017-08-12 22:16;0;1;"Yes there was a saying about the importance of learning from history so you don't have to repeat it can't remember the quote word for word";;;;"896495742948212736";https://twitter.com/Janetlynne211/status/896495742948212736
Janetlynne211;2017-08-12 21:59;2;2;"People shouldn't get mad at you read the article I posted regarding trump and Hitler they can get mad at me all-day long the truth is";;;;"896491459326558208";https://twitter.com/Janetlynne211/status/896491459326558208
Janetlynne211;2017-08-12 21:54;0;0;"Seven times the media compared Trump to Hitler http:// washex.am/2hrsbI0 via @dcexaminer";;@dcexaminer;;"896489980310245376";https://twitter.com/Janetlynne211/status/896489980310245376
Janetlynne211;2017-08-12 21:51;0;0;"10 people followed me today tracked by http:// unfollowspy.com";;;;"896489461902589953";https://twitter.com/Janetlynne211/status/896489461902589953
Janetlynne211;2017-08-12 21:20;0;0;"I actually can't listen to him anymore";;;;"896481622459068416";https://twitter.com/Janetlynne211/status/896481622459068416
Janetlynne211;2017-08-12 21:20;0;0;"@adair1946 sorry I just got back to you busy day if you google those books you'll find them to be interesting";;@adair1946;;"896481428501823488";https://twitter.com/Janetlynne211/status/896481428501823488
Janetlynne211;2017-08-12 21:17;0;1;"@adair1946 book is my new order it was a collection of speeches that was written by Hitler and was rewritten in 2016 the 1st one trump read";;@adair1946;;"896480727117815808";https://twitter.com/Janetlynne211/status/896480727117815808
Janetlynne211;2017-08-12 20:17;0;0;"@Olivianuzzi I honestly can't stand listening to anything that comes out of that man's sick mouth";;@Olivianuzzi;;"896465628718137344";https://twitter.com/Janetlynne211/status/896465628718137344
Janetlynne211;2017-08-12 20:14;0;1;"You said it trump needs help he is playing president what a sick man";;;;"896464886594760705";https://twitter.com/Janetlynne211/status/896464886594760705
Janetlynne211;2017-08-12 20:10;0;0;"He's probably hiding in a private room watching this on TV and can't get that look off his face";;;;"896463853130788864";https://twitter.com/Janetlynne211/status/896463853130788864
Janetlynne211;2017-08-12 20:02;0;0;"I will try and google it not 100% sure there was more than one book on the subject not hate look like what just happened in the south";;;;"896461835687399424";https://twitter.com/Janetlynne211/status/896461835687399424
Janetlynne211;2017-08-12 19:54;3;10;"just horrible trump's mouth causes this the man driving this car was full of hatred";;;;"896460010900914176";https://twitter.com/Janetlynne211/status/896460010900914176
Janetlynne211;2017-08-12 19:36;1;0;"If only he never will Scott only can wish";;;;"896455359203856384";https://twitter.com/Janetlynne211/status/896455359203856384
Janetlynne211;2017-08-12 19:33;0;0;"No not at all sometimes misunderstanding​s happen I think your very beautiful inside and out";;;;"896454577767284737";https://twitter.com/Janetlynne211/status/896454577767284737
Janetlynne211;2017-08-12 17:24;1;3;"He probably is but the problem is his speeches can get innocent people killed and nobody can talk sense to him";;;;"896422262257197056";https://twitter.com/Janetlynne211/status/896422262257197056
Janetlynne211;2017-08-12 14:49;0;1;"Hey I am from the Pittsburgh area just wanted to say hi neighbor";;;;"896383179380207617";https://twitter.com/Janetlynne211/status/896383179380207617
Janetlynne211;2017-08-12 14:43;0;0;"Someone got really good pictures of really gross men small penis no girlfriends LMAO";;;;"896381647804870656";https://twitter.com/Janetlynne211/status/896381647804870656
Janetlynne211;2017-08-12 14:36;0;0;"I'm embarrassed these white men don't speak for me crazy assholes";;;;"896379749861384192";https://twitter.com/Janetlynne211/status/896379749861384192
Janetlynne211;2017-08-12 14:29;1;2;"Yes we just entered 1960 again As a child I was told how horrible it was back then and in a short time Trump took us back";;;;"896378087285424128";https://twitter.com/Janetlynne211/status/896378087285424128
Janetlynne211;2017-08-12 14:24;0;0;"I'm sickened by this what year is this";;;;"896376862334746627";https://twitter.com/Janetlynne211/status/896376862334746627
Janetlynne211;2017-08-12 13:57;0;1;"Agreed";;;;"896369979205050368";https://twitter.com/Janetlynne211/status/896369979205050368
Janetlynne211;2017-08-12 04:25;0;1;"You know you are often inspired by People you meet and it comes unexpected be on your toe's you just don't know what you will miss";;;;"896226222975397888";https://twitter.com/Janetlynne211/status/896226222975397888
Janetlynne211;2017-08-12 04:05;1;2;"Very educated woman I can tell by reading your tweets. Good night thing's will get better with each day";;;;"896221062358331392";https://twitter.com/Janetlynne211/status/896221062358331392
Janetlynne211;2017-08-12 03:58;0;1;"1990 give me some time I will think about it I see you did the right thing by surrounding yourself with good people I will pray for you";;;;"896219416194674689";https://twitter.com/Janetlynne211/status/896219416194674689
Janetlynne211;2017-08-12 03:40;0;1;"@adair1946 you seem like a very strong woman God bless you and your family";;@adair1946;;"896214850887716864";https://twitter.com/Janetlynne211/status/896214850887716864
Janetlynne211;2017-08-12 03:16;0;0;"I agree it has worked for me";;;;"896208717645053953";https://twitter.com/Janetlynne211/status/896208717645053953
Janetlynne211;2017-08-12 02:52;0;1;"@zacharyscottme European diplomats look at trump as a big joke they laugh at him I hope they know American people feel the same way";;@zacharyscottme;;"896202586046570497";https://twitter.com/Janetlynne211/status/896202586046570497
Janetlynne211;2017-08-12 02:48;0;1;"Trump actually thinks we the people trust him more than President Obama someone better better wake Dorothy up from his dream";;;;"896201580260864000";https://twitter.com/Janetlynne211/status/896201580260864000
Janetlynne211;2017-08-12 02:39;0;1;"@timbell72 Trumps mouth is going to get people killed. He needs to be drug out of the White House and put in a straight jacket Not joking";;@timbell72;;"896199409662349313";https://twitter.com/Janetlynne211/status/896199409662349313
Janetlynne211;2017-08-12 01:56;0;0;"we miss you so much gone never forgotten";;;;"896188526664044544";https://twitter.com/Janetlynne211/status/896188526664044544
Janetlynne211;2017-08-12 01:51;0;0;"@u69LVqR5X0DaAsK do you know any English sir";;@u69LVqR5X0DaAsK;;"896187311423148034";https://twitter.com/Janetlynne211/status/896187311423148034
Janetlynne211;2017-08-12 01:48;0;1;"shalom";;;;"896186487326334977";https://twitter.com/Janetlynne211/status/896186487326334977
Janetlynne211;2017-08-12 01:46;0;1;"We don't want to repeat history either";;;;"896186186628255744";https://twitter.com/Janetlynne211/status/896186186628255744
Janetlynne211;2017-08-12 00:34;0;2;"He's one sick mf just the thought of him makes me so nauseous and I mean it I know to much he loves to brag";;;;"896167961559523328";https://twitter.com/Janetlynne211/status/896167961559523328
Janetlynne211;2017-08-11 23:51;1;1;"@mitzysmom819 do you know if trump has any siblings and his parents was there real name was it trump or was his mother a Jackel";;@mitzysmom819;;"896157227328745472";https://twitter.com/Janetlynne211/status/896157227328745472
Janetlynne211;2017-08-11 23:46;0;0;"I like the last four presidents because I felt safe sorry I don't feel that way with trump and he is a lot like Hitler #resistance";;;#resistance;"896155791236792321";https://twitter.com/Janetlynne211/status/896155791236792321
Janetlynne211;2017-08-11 22:30;0;0;"A federal prosecutor seldom kills himself in public just saying highly unlikely";;;;"896136696693010432";https://twitter.com/Janetlynne211/status/896136696693010432
Janetlynne211;2017-08-11 22:26;0;1;"Both gone way too soon";;;;"896135680891305984";https://twitter.com/Janetlynne211/status/896135680891305984
Janetlynne211;2017-08-11 22:21;0;0;"Don't care about trump I don't even know if he has any siblings was his parents last name really trump or was he born of a Jackel";;;;"896134418300928000";https://twitter.com/Janetlynne211/status/896134418300928000
Janetlynne211;2017-08-11 21:53;0;0;"5 Followed, 1 Unfollowed me (monitored by http:// unfollowspy.com )";;;;"896127420545196032";https://twitter.com/Janetlynne211/status/896127420545196032
Janetlynne211;2017-08-11 21:38;1;2;"Trumps had so much in common with Hitler it is sickeńing";;;;"896123707160092672";https://twitter.com/Janetlynne211/status/896123707160092672
Janetlynne211;2017-08-11 21:31;1;1;"all about greed and dirty men so this is Why he gets away with all he does and it sickens me taken the world to God help us";;;;"896121922219515904";https://twitter.com/Janetlynne211/status/896121922219515904
Janetlynne211;2017-08-11 21:22;0;5;"I am shocked trump got 8% really I thought he'd get 3% Obama 97% trump 3% and I was being nice";;;;"896119604631580672";https://twitter.com/Janetlynne211/status/896119604631580672
Janetlynne211;2017-08-11 20:30;0;2;"He's a nut not a madman he is an honest to goodness mentally unstable nut so whoever has the authority please don't let him start a war";;;;"896106488799780864";https://twitter.com/Janetlynne211/status/896106488799780864
Janetlynne211;2017-08-11 18:21;0;1;"I only follow resistance -impeach trump-and all who wants him out yesterday";;;;"896074086593347584";https://twitter.com/Janetlynne211/status/896074086593347584
Janetlynne211;2017-08-11 17:50;0;2;"Can I retweet more than once lol";;;;"896066404595539968";https://twitter.com/Janetlynne211/status/896066404595539968
Janetlynne211;2017-08-11 17:40;0;1;"oh the memories";;;;"896063815711834113";https://twitter.com/Janetlynne211/status/896063815711834113
Janetlynne211;2017-08-11 02:52;0;0;"Question with all the lies trump puts out there does he have any siblings and were is his parents from and is his birth name really trump";;;;"895840206473097216";https://twitter.com/Janetlynne211/status/895840206473097216
Janetlynne211;2017-08-11 02:34;0;0;"@brominski how much do you know about trumps family siblings were was his parents from was his name Trump or did he change it wondering";;@brominski;;"895835843277062144";https://twitter.com/Janetlynne211/status/895835843277062144
Janetlynne211;2017-08-11 02:24;0;0;"Yes he is and I have been wondering any siblings were was his parents from anyone hear anything";;;;"895833310647255041";https://twitter.com/Janetlynne211/status/895833310647255041
Janetlynne211;2017-08-11 02:18;0;0;"Didn't he want to trademark your fired and said he made it a whatever you call it they said no and he was pissed off strange man";;;;"895831712881676288";https://twitter.com/Janetlynne211/status/895831712881676288
Janetlynne211;2017-08-10 23:50;0;0;"Sorry but twitter don't give enough room God bless you and don't matter what you are man woman he just want you to love help treat kindness";;;;"895794505064087553";https://twitter.com/Janetlynne211/status/895794505064087553
Janetlynne211;2017-08-10 23:47;0;0;"My God loves everyone even you I don't know what you read that made you think we were putting fear into anyone God loves us all sin is";;;;"895793743047077888";https://twitter.com/Janetlynne211/status/895793743047077888
Janetlynne211;2017-08-10 23:42;0;1;"You tell them I couldn't of said that better myself angels live among us and we know greed and all that is will never set eyes on God";;;;"895792448454242306";https://twitter.com/Janetlynne211/status/895792448454242306
Janetlynne211;2017-08-10 22:04;0;0;"Dump the trump he is leading us into I don't believe the people that can do something isn't even making any changes";;;;"895767896630202368";https://twitter.com/Janetlynne211/status/895767896630202368
Janetlynne211;2017-08-10 20:32;0;0;"@GrandmaStormy my uncle is 92yrs old and use to be an animal Humane officer many years some of the things he seen more important change laws";;@GrandmaStormy;;"895744573330378752";https://twitter.com/Janetlynne211/status/895744573330378752
Janetlynne211;2017-08-10 18:34;0;0;"WE Are with you Taylor power for women everywhere https:// twitter.com/CNN/status/895 673762200342530 …";;;;"895714877121191936";https://twitter.com/Janetlynne211/status/895714877121191936
Janetlynne211;2017-08-10 18:25;0;2;"Those are the people that really need to open there eyes Or trouble will really follow them";;;;"895712780845797378";https://twitter.com/Janetlynne211/status/895712780845797378
Janetlynne211;2017-08-10 18:11;0;1;"On second thought he's not in trumps eyes the ah wrong ah religion?";;;;"895709141154639872";https://twitter.com/Janetlynne211/status/895709141154639872
Janetlynne211;2017-08-10 18:05;0;1;"This is the man that Trump would hire";;;;"895707772326739968";https://twitter.com/Janetlynne211/status/895707772326739968
Janetlynne211;2017-08-10 03:43;0;0;"@GrandmaStormy so happy to see you don't like bad b readers I don't like them either so right animal abuse #voice for the voiceless";;@GrandmaStormy;#voice;"895490809176444928";https://twitter.com/Janetlynne211/status/895490809176444928
Janetlynne211;2017-08-10 02:08;1;1;"@Amoney666 you seem like a nice honest person let's work together to make America better than it is trump sucks mentally unstable";;@Amoney666;;"895466940508110849";https://twitter.com/Janetlynne211/status/895466940508110849
Janetlynne211;2017-08-10 02:05;0;0;"@Amoney666";;@Amoney666;;"895466150238310400";https://twitter.com/Janetlynne211/status/895466150238310400
Janetlynne211;2017-08-10 02:00;1;5;"It appears that protesters came up with a great idea";;;;"895464966467276800";https://twitter.com/Janetlynne211/status/895464966467276800
Janetlynne211;2017-08-10 01:24;0;1;"someone looks like their headed for hell";;;;"895455685344804864";https://twitter.com/Janetlynne211/status/895455685344804864
Janetlynne211;2017-08-10 00:46;0;0;"Trump going wild on twitter should never stop the FBI from doing there job";;;;"895446286631030786";https://twitter.com/Janetlynne211/status/895446286631030786
Janetlynne211;2017-08-10 00:27;1;1;"Every picture of Ryan with trump ryan has a devilish smile on his face";;;;"895441410861682689";https://twitter.com/Janetlynne211/status/895441410861682689
Janetlynne211;2017-08-10 00:18;0;0;"So he's a nut just like trumpturf";;;;"895439271305199616";https://twitter.com/Janetlynne211/status/895439271305199616
Janetlynne211;2017-08-10 00:09;1;2;"That makes a lot of sense to me";;;;"895436786608087045";https://twitter.com/Janetlynne211/status/895436786608087045
Janetlynne211;2017-08-10 00:06;0;1;"That's his problem his father never beat his ass";;;;"895436185719517184";https://twitter.com/Janetlynne211/status/895436185719517184
Janetlynne211;2017-08-09 22:50;0;0;"Get me Mary";;;;"895416918819188737";https://twitter.com/Janetlynne211/status/895416918819188737
Janetlynne211;2017-08-09 22:43;0;0;"";;;;"895415178434457601";https://twitter.com/Janetlynne211/status/895415178434457601
Janetlynne211;2017-08-09 22:39;0;0;"Yes she is full of https:// twitter.com/MrVertigo13/st atus/895352935873482765 …";;;;"895414305847484416";https://twitter.com/Janetlynne211/status/895414305847484416
Janetlynne211;2017-08-09 22:33;0;0;"I have to say it now West Virginia governor is a dumb hillbilly";;;;"895412847815135234";https://twitter.com/Janetlynne211/status/895412847815135234
Janetlynne211;2017-08-09 22:27;0;0;"With all this evil going on in the world I am thankful I have Jesus";;;;"895411232131383297";https://twitter.com/Janetlynne211/status/895411232131383297
Janetlynne211;2017-08-09 22:11;0;0;"Sometimes you don't know what you got till it's gone https:// twitter.com/TearsInHeaven0 9/status/895388035868631041 …";;;;"895407336206082049";https://twitter.com/Janetlynne211/status/895407336206082049
Janetlynne211;2017-08-09 22:01;0;1;"@lolaa1956 Delores you have touched my we all as Christians have rough days and I believe God uses the internet to let on to be for";;@lolaa1956;;"895404616489349120";https://twitter.com/Janetlynne211/status/895404616489349120
Janetlynne211;2017-08-09 20:09;0;1;"Americans these are all facts not rumors these low life hungry disgusting perverts can't just be laughed at anymore there ruining us all https:// twitter.com/TheCentryst/st atus/893322281539313666 …";;;;"895376572139622401";https://twitter.com/Janetlynne211/status/895376572139622401
Janetlynne211;2017-08-09 19:43;0;1;"I believe anybody that can hear or read lips know this who would believe anything he even says";;;;"895369941377064961";https://twitter.com/Janetlynne211/status/895369941377064961
Janetlynne211;2017-08-09 19:39;0;1;"@lolaa1956 Delores you have a beautiful family inside and outside bless you";;@lolaa1956;;"895369037882023936";https://twitter.com/Janetlynne211/status/895369037882023936
Janetlynne211;2017-08-09 17:49;0;0;"fat lazy slob and he's the worst POTUS his wife may be attractive but for a first lady she don't act like it";;;;"895341326492946432";https://twitter.com/Janetlynne211/status/895341326492946432
Janetlynne211;2017-08-09 17:45;0;0;"Makes me feel like #"$@)"'/ I feel better now";;@;#;"895340221616852998";https://twitter.com/Janetlynne211/status/895340221616852998
Janetlynne211;2017-08-09 17:43;0;1;"don't we all";;;;"895339872017420293";https://twitter.com/Janetlynne211/status/895339872017420293
Janetlynne211;2017-08-09 16:50;0;1;"@lolaa1956";;@lolaa1956;;"895326337354784769";https://twitter.com/Janetlynne211/status/895326337354784769
Janetlynne211;2017-08-09 16:49;0;1;"@lolaa1956 yes your so right and as a Christian I say thank-you so much we sometimes need reminded when life gets tough just harder";;@lolaa1956;;"895326115270500352";https://twitter.com/Janetlynne211/status/895326115270500352
Janetlynne211;2017-08-09 16:01;0;0;"God help us all";;;;"895314207570239488";https://twitter.com/Janetlynne211/status/895314207570239488
Janetlynne211;2017-08-09 14:38;0;3;"He has the nerve to give those who are filthy rich even more tax breaks what a piece of #Resistance #Not my president";;;#Resistance #Not;"895293247559520256";https://twitter.com/Janetlynne211/status/895293247559520256
Janetlynne211;2017-08-09 14:32;0;1;"He is going to have American in big trouble if we don't get him out of office #Resistance #Impeach He takes hate, violence, and evil to us";;;#Resistance #Impeach;"895291597054783490";https://twitter.com/Janetlynne211/status/895291597054783490
Janetlynne211;2017-08-09 14:16;0;0;"You are so beautiful and that was funny, honest, and done with style keep up the good work.";;;;"895287729893892097";https://twitter.com/Janetlynne211/status/895287729893892097
Janetlynne211;2017-08-09 13:59;0;0;"Lol";;;;"895283448679739393";https://twitter.com/Janetlynne211/status/895283448679739393
Janetlynne211;2017-08-09 13:58;0;1;"I participated in the poll and actually I pray for out of office time will tell";;;;"895283115584782336";https://twitter.com/Janetlynne211/status/895283115584782336
Janetlynne211;2017-08-09 02:31;0;1;"Some people just don't listen https:// twitter.com/ProudResister/ status/894970953284767744 …";;;;"895110197944995840";https://twitter.com/Janetlynne211/status/895110197944995840
Janetlynne211;2017-08-09 02:01;0;3;"Perfect picture";;;;"895102655021936641";https://twitter.com/Janetlynne211/status/895102655021936641
Janetlynne211;2017-08-09 02:00;1;2;"Error 404 bad link LMAO";;;;"895102490622005248";https://twitter.com/Janetlynne211/status/895102490622005248
Janetlynne211;2017-08-09 00:46;1;1;"pictures are worth a thousand words";;;;"895083897653952512";https://twitter.com/Janetlynne211/status/895083897653952512
Janetlynne211;2017-08-09 00:23;1;1;"Yes it does lol";;;;"895078162241126402";https://twitter.com/Janetlynne211/status/895078162241126402
Janetlynne211;2017-08-09 00:12;1;0;"They're ugly and I can say so much more";;;;"895075221434191872";https://twitter.com/Janetlynne211/status/895075221434191872
Janetlynne211;2017-08-08 23:12;0;0;"I agree that article makes it easier for Trump to get away with a whole hell of a lot dam what's Trump got on some politicians??";;;;"895060219260268544";https://twitter.com/Janetlynne211/status/895060219260268544
Janetlynne211;2017-08-08 23:04;0;0;"The article did say Muller was going to far since he's suppose to only be investigating Trumprussia ties and if money was spent illegally...";;;;"895058257768787969";https://twitter.com/Janetlynne211/status/895058257768787969
Janetlynne211;2017-08-08 22:27;1;2;"You're so correct in this situation nobody wins trumpsters aren't bright at all";;;;"895048941489860608";https://twitter.com/Janetlynne211/status/895048941489860608
Janetlynne211;2017-08-08 22:19;0;1;"Any other president would be so under investigation that he'd be ing his pants and I meant shi*ing";;;;"895046751371091968";https://twitter.com/Janetlynne211/status/895046751371091968
Janetlynne211;2017-08-08 22:12;1;2;"Thank you a woman who knows the truth I say stop the blame game trumpsters";;;;"895045191207452673";https://twitter.com/Janetlynne211/status/895045191207452673
Janetlynne211;2017-08-08 22:10;0;0;"I really don't know how far back bs went with North Korea but if we can't see how many problems that Trump is causing and dividing our";;;;"895044455933390849";https://twitter.com/Janetlynne211/status/895044455933390849
Janetlynne211;2017-08-08 22:02;0;0;"We need to get Trump out we're he can't create these horrific problems";;;;"895042463089426432";https://twitter.com/Janetlynne211/status/895042463089426432
Janetlynne211;2017-08-08 21:02;0;3;"You have a great sense of humor oh with trump as president we all need a sense of humor";;;;"895027521149861888";https://twitter.com/Janetlynne211/status/895027521149861888
Janetlynne211;2017-08-08 21:00;0;1;"That's one of the funniest tweets LMAO made my day";;;;"895026837075709953";https://twitter.com/Janetlynne211/status/895026837075709953
Janetlynne211;2017-08-08 19:17;0;0;"This is sick we are taking about the children we hold dearly this magazine needs to be held accountable";;;;"895001084900642816";https://twitter.com/Janetlynne211/status/895001084900642816
Janetlynne211;2017-08-08 17:39;0;1;"This is criminal our youth have enough with being bullied teen suicide and a magazine needs to be held responsible for their own garbage";;;;"894976386737348608";https://twitter.com/Janetlynne211/status/894976386737348608
Janetlynne211;2017-08-08 15:36;0;1;"Okay";;;;"894945477766074371";https://twitter.com/Janetlynne211/status/894945477766074371
Janetlynne211;2017-08-08 15:36;0;1;"Tom I do I only brought up u tube in reference to something now let's move on to getting that nut #impeached";;;#impeached;"894945440524795904";https://twitter.com/Janetlynne211/status/894945440524795904
Janetlynne211;2017-08-08 15:05;0;1;"I have seen some nice things on u tube";;;;"894937627706761216";https://twitter.com/Janetlynne211/status/894937627706761216
Janetlynne211;2017-08-08 13:40;0;1;"I love the pay it forward just keep it going and keep up the great work Donna";;;;"894916262442266624";https://twitter.com/Janetlynne211/status/894916262442266624
Janetlynne211;2017-08-08 13:24;0;1;"Ok point taken";;;;"894912306949349376";https://twitter.com/Janetlynne211/status/894912306949349376
Janetlynne211;2017-08-08 13:22;0;1;"Now Tom doing be mean I was nice to you";;;;"894911696376131585";https://twitter.com/Janetlynne211/status/894911696376131585
Janetlynne211;2017-08-08 12:40;0;2;"That's a down right lie and it's been proven He shouldn't of had to go thru any of that twenty some times if not more was a great president";;;;"894901033805074434";https://twitter.com/Janetlynne211/status/894901033805074434
Janetlynne211;2017-08-08 12:35;0;0;"You remember that one Tom? I will find it and get it on twitter";;;;"894899978681843712";https://twitter.com/Janetlynne211/status/894899978681843712
Janetlynne211;2017-08-08 12:31;0;0;"I will look it up";;;;"894898825298628608";https://twitter.com/Janetlynne211/status/894898825298628608
Janetlynne211;2017-08-08 12:30;0;0;"My God he went to school with the mooch remember that conference just shown on utube when Obama was president and stock market was the subj.";;;;"894898667873857538";https://twitter.com/Janetlynne211/status/894898667873857538
Janetlynne211;2017-08-08 12:06;0;1;"Honestly who is sleeping with either of those men(tally)and who's telling them they have nice hair a bag wouldn't help keep your multi.....";;;;"894892635583692800";https://twitter.com/Janetlynne211/status/894892635583692800
