username;date;retweets;favorites;text;geo;mentions;hashtags;id;permalink
Janetlynne211;2017-09-21 00:13;0;1;"What a crew of criminals";;;;"910658201338748931";https://twitter.com/Janetlynne211/status/910658201338748931
Janetlynne211;2017-09-21 00:12;0;1;"Yes I am way too kind";;;;"910657928344080384";https://twitter.com/Janetlynne211/status/910657928344080384
Janetlynne211;2017-09-21 00:02;0;0;"Yes there just a bunch of criminals https:// twitter.com/OceanPkwyKid/s tatus/910652185884725248 …";;;;"910655519051911168";https://twitter.com/Janetlynne211/status/910655519051911168
Janetlynne211;2017-09-21 00:00;0;2;"Perfect Catch me if you can and yes we can";;;;"910654913943883777";https://twitter.com/Janetlynne211/status/910654913943883777
Janetlynne211;2017-09-20 23:56;0;1;"He looks just like a puppet.";;;;"910653933231722496";https://twitter.com/Janetlynne211/status/910653933231722496
Janetlynne211;2017-09-20 23:51;2;3;"WorldVisionUSA a trustworthy org. We all must give even if it's a small amount we could be in there shoes think about it";;;;"910652673506074624";https://twitter.com/Janetlynne211/status/910652673506074624
Janetlynne211;2017-09-20 23:46;0;0;"Hot dogs and beans yes";;;;"910651529698344960";https://twitter.com/Janetlynne211/status/910651529698344960
Janetlynne211;2017-09-20 18:34;0;1;"@SaintStinky how have you been doing lately my Twitter friend";;@SaintStinky;;"910572840004521985";https://twitter.com/Janetlynne211/status/910572840004521985
Janetlynne211;2017-09-20 18:11;0;1;"Our prayers are with all of the good people";;;;"910567073105022976";https://twitter.com/Janetlynne211/status/910567073105022976
Janetlynne211;2017-09-20 18:09;0;1;"LMAO";;;;"910566571332050944";https://twitter.com/Janetlynne211/status/910566571332050944
Janetlynne211;2017-09-20 12:35;0;0;"Gained 7 followers and lost 5 (stats by http:// unfollowspy.com )";;;;"910482448240095232";https://twitter.com/Janetlynne211/status/910482448240095232
Janetlynne211;2017-09-20 02:12;1;1;"@HiddenStarfish what type of jewelry do you sale";;@HiddenStarfish;;"910325779107545089";https://twitter.com/Janetlynne211/status/910325779107545089
Janetlynne211;2017-09-19 15:41;0;1;"@dclark40 Dana why is it that we can see these things and the intellectual people that can't I mean stupidity is one thing and some don't";;@dclark40;;"910166895055327232";https://twitter.com/Janetlynne211/status/910166895055327232
Janetlynne211;2017-09-19 15:37;0;0;"@dclark40 Trump never knows when to stop talking and that's when he does the most harm";;@dclark40;;"910165920127086592";https://twitter.com/Janetlynne211/status/910165920127086592
Janetlynne211;2017-09-19 15:35;1;2;"@dclark40 Dana you are so right the educated people that believe in him is who shocks me!!!";;@dclark40;;"910165573379788800";https://twitter.com/Janetlynne211/status/910165573379788800
Janetlynne211;2017-09-19 14:12;2;1;"Trump speech to the United Nations- --He needed to wear a much bigger because all those feathers he was putting in it didn't fit watch him";;;;"910144525884116992";https://twitter.com/Janetlynne211/status/910144525884116992
Janetlynne211;2017-09-18 20:48;0;0;"@gregmurphy39 that's so nice how your dog seems to get along with all animals";;@gregmurphy39;;"909881864193748993";https://twitter.com/Janetlynne211/status/909881864193748993
Janetlynne211;2017-09-18 17:58;0;0;"You met big lol I can see he's a good dog";;;;"909838973975056385";https://twitter.com/Janetlynne211/status/909838973975056385
Janetlynne211;2017-09-18 16:16;0;0;"@gregmurphy39 your dog is awesome must cost a great deal to feed";;@gregmurphy39;;"909813275604455424";https://twitter.com/Janetlynne211/status/909813275604455424
Janetlynne211;2017-09-18 14:01;0;2;"I can't believe why he hasn't been impeached";;;;"909779363926876160";https://twitter.com/Janetlynne211/status/909779363926876160
Janetlynne211;2017-09-18 13:59;0;1;"Go for it you can do it remember when there was no internet";;;;"909778872174080001";https://twitter.com/Janetlynne211/status/909778872174080001
Janetlynne211;2017-09-18 12:40;0;0;"3 people followed me today tracked by http:// unfollowspy.com";;;;"909759129308164096";https://twitter.com/Janetlynne211/status/909759129308164096
Janetlynne211;2017-09-17 19:39;0;0;"I can't give a reason other than I wasn't born so I would not have to see his BS";;;;"909502132000260099";https://twitter.com/Janetlynne211/status/909502132000260099
Janetlynne211;2017-09-17 18:32;1;2;"I can't believe the stupidity of the not sure votes. I know hes been doing a lousy job since day one so the yes votes are crazy wake up";;;;"909485127859867649";https://twitter.com/Janetlynne211/status/909485127859867649
Janetlynne211;2017-09-17 17:23;0;1;"Peter I know what you mean but the truth is God knows your heart and he is merciful after all we are all sinner's. God bless us all";;;;"909467789466963973";https://twitter.com/Janetlynne211/status/909467789466963973
Janetlynne211;2017-09-17 13:09;0;0;"We don't want to repeat history either";;;;"909403833444569088";https://twitter.com/Janetlynne211/status/909403833444569088
Janetlynne211;2017-09-17 13:07;0;0;"If u see me in public wink then I will know you despise trump as much as i do";;;;"909403331591843840";https://twitter.com/Janetlynne211/status/909403331591843840
Janetlynne211;2017-09-17 12:40;0;0;"Gained 2 followers and lost 2 (stats by http:// unfollowspy.com )";;;;"909396765132054528";https://twitter.com/Janetlynne211/status/909396765132054528
Janetlynne211;2017-09-16 20:02;0;1;"You should get that copy write law twitter could use it for marketing and you can make yourself some money. I am being honest in my opinion";;;;"909145532022624257";https://twitter.com/Janetlynne211/status/909145532022624257
Janetlynne211;2017-09-16 18:18;0;1;"We still are in the world and we must remind ourselves that we don't want to be come part of this world 2/2";;;;"909119269912399872";https://twitter.com/Janetlynne211/status/909119269912399872
Janetlynne211;2017-09-16 18:16;0;1;"I am a christian but Patty I really needed to make that note to myself because we think we are following God and putting him first but 1/2";;;;"909118813513371649";https://twitter.com/Janetlynne211/status/909118813513371649
Janetlynne211;2017-09-16 12:40;0;0;"Gained 10 followers and lost 2 (stats by http:// unfollowspy.com )";;;;"909034180830314496";https://twitter.com/Janetlynne211/status/909034180830314496
Janetlynne211;2017-09-16 00:20;0;1;"Trump president or not has to reply to a court order first impeach his ass then prison will be next";;;;"908847983457918976";https://twitter.com/Janetlynne211/status/908847983457918976
Janetlynne211;2017-09-15 21:03;0;0;"I am here for the truth";;;;"908798374345879554";https://twitter.com/Janetlynne211/status/908798374345879554
Janetlynne211;2017-09-15 20:30;0;1;"So true and yet some can be open to changes";;;;"908790105678204929";https://twitter.com/Janetlynne211/status/908790105678204929
Janetlynne211;2017-09-15 20:27;0;0;"@hrhprincefazz01 God put us here to take care of children";;@hrhprincefazz01;;"908789333561368580";https://twitter.com/Janetlynne211/status/908789333561368580
Janetlynne211;2017-09-15 20:25;0;1;"Always stay pure at heart you will stay close to God";;;;"908788938130825217";https://twitter.com/Janetlynne211/status/908788938130825217
Janetlynne211;2017-09-15 20:22;0;0;"@PrinceH37359946 God bless you for loving children. They are awesome";;@PrinceH37359946;;"908788137677160456";https://twitter.com/Janetlynne211/status/908788137677160456
Janetlynne211;2017-09-15 19:09;0;0;"@xashee I love that you tweet everyone the same Twitter should buy that as an advertising quote did you come up with it";;@xashee;;"908769773273698304";https://twitter.com/Janetlynne211/status/908769773273698304
Janetlynne211;2017-09-15 17:32;0;0;"Without a doubt https:// twitter.com/funder/status/ 908737800429764609 …";;;;"908745426781851648";https://twitter.com/Janetlynne211/status/908745426781851648
Janetlynne211;2017-09-15 17:02;0;0;"@LawyerRogelio So this question is on everyone's mind. Can Trump be impeached with all the things he has said before using his brain?";;@LawyerRogelio;;"908737779693182978";https://twitter.com/Janetlynne211/status/908737779693182978
Janetlynne211;2017-09-15 12:40;0;0;"Latest Stats = 7 Followers and 3 Unfollowers (tracked by http:// unfollowspy.com )";;;;"908671864343478273";https://twitter.com/Janetlynne211/status/908671864343478273
Janetlynne211;2017-09-15 01:18;0;0;"Irma took everything we own https://www. gofundme.com/irma-took-ever ything-we-own?pc=tw_dn_cpgnsharemore_r&rcid=r01-150543826006-fbda38a53a5d4e7d …";;;;"908500302168559617";https://twitter.com/Janetlynne211/status/908500302168559617
Janetlynne211;2017-09-15 00:49;0;1;"@StacyZzz Were praying for you Stacy Twitter won't let you down and it's through Jesus that help will come";;@StacyZzz;;"908493008844263424";https://twitter.com/Janetlynne211/status/908493008844263424
Janetlynne211;2017-09-15 00:46;0;1;"This nice lady her name is Stacy Zarecki she helps and prayers for everyone please rt this get her help please #FloridaStrong https:// twitter.com/StacyZzz/statu s/908439041456123904 …";;;#FloridaStrong;"908492293044350977";https://twitter.com/Janetlynne211/status/908492293044350977
Janetlynne211;2017-09-15 00:43;0;0;"We need to remember our FL friends they are in need of the red Cross and all the help we can send to them#HelpFlorida";;;#HelpFlorida;"908491453957058561";https://twitter.com/Janetlynne211/status/908491453957058561
Janetlynne211;2017-09-15 00:40;0;1;"@StacyZzz Stacy I am praying for you I didn't know you were hit that hard please if there is anything you need please let me know";;@StacyZzz;;"908490797456207872";https://twitter.com/Janetlynne211/status/908490797456207872
Janetlynne211;2017-09-15 00:34;0;0;"@MargoBurkhalter hello Margo it's always nice to hear what you are saying have a blessed day";;@MargoBurkhalter;;"908489248537489409";https://twitter.com/Janetlynne211/status/908489248537489409
Janetlynne211;2017-09-15 00:32;0;3;"The best one in a long time";;;;"908488763860553728";https://twitter.com/Janetlynne211/status/908488763860553728
Janetlynne211;2017-09-15 00:31;0;0;"@QueenMaday Thank you Maddy I enjoy your tweets all the time.";;@QueenMaday;;"908488298913566720";https://twitter.com/Janetlynne211/status/908488298913566720
Janetlynne211;2017-09-15 00:29;0;0;"Mrs. Trump can read it to him that way he won't be reading A.Hitlers Book of Speeches";;;;"908487892904931329";https://twitter.com/Janetlynne211/status/908487892904931329
Janetlynne211;2017-09-15 00:25;0;0;"But can Donald read that's the real question. I believe he does have intellect problems. Sorry I call what I see....";;;;"908486971852492800";https://twitter.com/Janetlynne211/status/908486971852492800
Janetlynne211;2017-09-15 00:22;0;0;"What a great president he is I still love all the good things he does A big Thank You to President Obama";;;;"908486250168029184";https://twitter.com/Janetlynne211/status/908486250168029184
Janetlynne211;2017-09-14 22:28;0;0;"Shame on Facebook I bet your stock price goes down";;;;"908457383206227969";https://twitter.com/Janetlynne211/status/908457383206227969
Janetlynne211;2017-09-14 22:26;0;0;"Facebook enabled advertisers to reach “Jew haters” https://www. propublica.org/article/facebo ok-enabled-advertisers-to-reach-jew-haters …";;;;"908456966372110336";https://twitter.com/Janetlynne211/status/908456966372110336
Janetlynne211;2017-09-14 22:17;0;0;"No";;;;"908454809505861632";https://twitter.com/Janetlynne211/status/908454809505861632
Janetlynne211;2017-09-14 19:53;0;0;"You must put Jesus first it works no other way.";;;;"908418391089786881";https://twitter.com/Janetlynne211/status/908418391089786881
Janetlynne211;2017-09-14 19:44;0;0;"I so agree";;;;"908416191760359424";https://twitter.com/Janetlynne211/status/908416191760359424
Janetlynne211;2017-09-14 19:43;0;0;"A great place to visit when you're in Pittsburgh https:// twitter.com/WTAE/status/90 8366654895095809 …";;;;"908415937002508289";https://twitter.com/Janetlynne211/status/908415937002508289
Janetlynne211;2017-09-14 19:42;0;1;"I agree it's fun on a hot day you get cooled off.";;;;"908415596223696901";https://twitter.com/Janetlynne211/status/908415596223696901
Janetlynne211;2017-09-14 19:40;1;0;"Anyone from the Pittsburgh area heard of Kennywood Park. It's a huge roller coaster scary theme park. A must visit if you're coming here.";;;;"908415296087756802";https://twitter.com/Janetlynne211/status/908415296087756802
Janetlynne211;2017-09-14 12:40;0;0;"6 Followed, 7 Unfollowed me (monitored by http:// unfollowspy.com )";;;;"908309528390725632";https://twitter.com/Janetlynne211/status/908309528390725632
Janetlynne211;2017-09-14 00:54;0;1;"My heart says if you're in search of Christ you need no church for he lives in your if you open the door to him";;;;"908131799502639104";https://twitter.com/Janetlynne211/status/908131799502639104
Janetlynne211;2017-09-14 00:50;0;0;"@LeahRemini why do people get onto scientology I am a Christian and I believe in spirituality starts and stays in the home. I know Jesus....";;@LeahRemini;;"908130729904787456";https://twitter.com/Janetlynne211/status/908130729904787456
Janetlynne211;2017-09-13 21:45;0;0;"Is it that bad Jonnie";;;;"908084201295171587";https://twitter.com/Janetlynne211/status/908084201295171587
Janetlynne211;2017-09-13 12:41;0;0;"10 Followed, 3 Unfollowed me (monitored by http:// unfollowspy.com )";;;;"907947320754311168";https://twitter.com/Janetlynne211/status/907947320754311168
Janetlynne211;2017-09-12 14:12;0;0;"I can't watch this video if it's what I think it is.";;;;"907607753757257728";https://twitter.com/Janetlynne211/status/907607753757257728
Janetlynne211;2017-09-12 14:10;0;1;"No but I did see an advertisment I will have to start. Catch reruns I believe that some religion's can mess up your life must learn more.";;;;"907607436890136576";https://twitter.com/Janetlynne211/status/907607436890136576
Janetlynne211;2017-09-12 01:48;0;0;"He should be impeached and not even thinking about getting re elected nut";;;;"907420541795160064";https://twitter.com/Janetlynne211/status/907420541795160064
Janetlynne211;2017-09-12 01:45;0;0;"I can bet his place in Florida wasn't even touched";;;;"907419963924926464";https://twitter.com/Janetlynne211/status/907419963924926464
Janetlynne211;2017-09-12 01:43;0;0;"God bless Sam and all who donated https:// twitter.com/SamMartin_6/st atus/904007022110281728 …";;;;"907419357155876864";https://twitter.com/Janetlynne211/status/907419357155876864
Janetlynne211;2017-09-12 01:41;0;1;"Thank you Sam";;;;"907418949310185472";https://twitter.com/Janetlynne211/status/907418949310185472
Janetlynne211;2017-09-12 01:39;0;0;"@pacajama thanks Kerry and I hope you like Twitter. I'm an animal lover also I always said the voice for the voiceless";;@pacajama;;"907418378649862144";https://twitter.com/Janetlynne211/status/907418378649862144
Janetlynne211;2017-09-12 01:31;0;1;"Thank you Anita bless you and your family";;;;"907416333238841344";https://twitter.com/Janetlynne211/status/907416333238841344
Janetlynne211;2017-09-12 01:22;0;3;"Yes the history channel ran a video on 911 and I could not stop crying but we must never forget all the people we lost that day";;;;"907414051461980161";https://twitter.com/Janetlynne211/status/907414051461980161
Janetlynne211;2017-09-11 21:35;0;0;"If you can get him to the shelter in Pittsburgh that cat would have a home with me please I have a great feeling about this cat";;;;"907356982050529286";https://twitter.com/Janetlynne211/status/907356982050529286
Janetlynne211;2017-09-11 21:32;0;0;"I would love to look into adopting this cat but I live in pennsylvania how can I get this cat";;;;"907356273917788161";https://twitter.com/Janetlynne211/status/907356273917788161
Janetlynne211;2017-09-11 03:42;1;1;"Thank you we have a dog and two cats we are animal lovers God bless you and have a good night";;;;"907086916528549888";https://twitter.com/Janetlynne211/status/907086916528549888
Janetlynne211;2017-09-11 03:30;1;1;"The black one that's on your profile. She loves all animals good bless her. Have a wonderful night";;;;"907083836726681601";https://twitter.com/Janetlynne211/status/907083836726681601
Janetlynne211;2017-09-11 02:22;0;0;"To anyone who cares the Lord gave us all common sense stop giving to those who don't need it give to the needy they never ask. God wants you";;;;"907066670371524608";https://twitter.com/Janetlynne211/status/907066670371524608
Janetlynne211;2017-09-11 02:16;1;1;"Please read I Know people think pastors are just preaching for money give your eyes and ears to God forget Money look up to God he answers";;;;"907065268140158976";https://twitter.com/Janetlynne211/status/907065268140158976
Janetlynne211;2017-09-11 02:00;1;1;"@chortletown my little 6yr old granddaughter fell in love with your dog";;@chortletown;;"907061193050816513";https://twitter.com/Janetlynne211/status/907061193050816513
Janetlynne211;2017-09-11 00:19;0;2;"In the fall I love to make turkey with cranberry sauce it has Bisquick dumplings also it's yummy!!!";;;;"907035899757776896";https://twitter.com/Janetlynne211/status/907035899757776896
Janetlynne211;2017-09-10 02:07;0;0;"I want one so small and sweet. His poop probably don't even smell lol";;;;"906700556990906368";https://twitter.com/Janetlynne211/status/906700556990906368
Janetlynne211;2017-09-10 02:04;0;0;"So so so cute";;;;"906699865769562121";https://twitter.com/Janetlynne211/status/906699865769562121
Janetlynne211;2017-09-10 01:41;0;2;"You said it Jack give to your own local church so you can help your neighbors.";;;;"906694204688134145";https://twitter.com/Janetlynne211/status/906694204688134145
Janetlynne211;2017-09-10 01:40;0;1;"Yes Elizabeth they succor the poor, weak, and lonely. I was taught not to take from the weak but to give to them. Shame on you Mr. Olsteen";;;;"906693753846616064";https://twitter.com/Janetlynne211/status/906693753846616064
Janetlynne211;2017-09-10 01:32;0;0;"This is a man holding on to money not God money and he always will. I find it ridiculous to pay anybody money to hear them talk. LMAO https:// twitter.com/DearAuntCrabby /status/906661075520716801 …";;;;"906691795609931777";https://twitter.com/Janetlynne211/status/906691795609931777
Janetlynne211;2017-09-10 01:27;0;0;"Joel and Victor Olsteen can make excuses for all the money they take and don't give back but they know how Jesus feels about money & greed";;;;"906690578557095937";https://twitter.com/Janetlynne211/status/906690578557095937
Janetlynne211;2017-09-09 19:39;1;1;"Please say safe God is with you.";;;;"906602973693923328";https://twitter.com/Janetlynne211/status/906602973693923328
Janetlynne211;2017-09-09 17:42;0;0;"As long as nobody gets hurt innocent victim you get my message I am so sure";;;;"906573586344882176";https://twitter.com/Janetlynne211/status/906573586344882176
Janetlynne211;2017-09-09 12:47;0;0;"7 Followed, 7 Unfollowed me (monitored by http:// unfollowspy.com )";;;;"906499413752799232";https://twitter.com/Janetlynne211/status/906499413752799232
Janetlynne211;2017-09-09 00:23;0;1;"To anyone who is staying in Florida our prayers are with you stay as safe as you can and God has you in his hand";;;;"906312125282488320";https://twitter.com/Janetlynne211/status/906312125282488320
Janetlynne211;2017-09-09 00:17;0;1;"Our prayers are with you and the kitties stay in touch with us";;;;"906310479974465536";https://twitter.com/Janetlynne211/status/906310479974465536
Janetlynne211;2017-09-08 16:50;0;0;"Let's all pray for our Floridian neighbors yes I lived in West Palm for three years and we Know hurricanes are scary.";;;;"906198063391367169";https://twitter.com/Janetlynne211/status/906198063391367169
Janetlynne211;2017-09-08 12:47;0;0;"5 Followed, 1 Unfollowed me (monitored by http:// unfollowspy.com )";;;;"906137037799006208";https://twitter.com/Janetlynne211/status/906137037799006208
Janetlynne211;2017-09-07 12:50;0;0;"7 Followed, 2 Unfollowed me (monitored by http:// unfollowspy.com )";;;;"905775186338652160";https://twitter.com/Janetlynne211/status/905775186338652160
Janetlynne211;2017-09-07 02:05;0;0;"Welcome to Twitter were we care about what you say and try and help each other";;;;"905612928170250240";https://twitter.com/Janetlynne211/status/905612928170250240
Janetlynne211;2017-09-07 02:00;0;1;"Those people with that kind of money should give it to a good cause some people don't deserve to be near beautiful animals";;;;"905611586798268416";https://twitter.com/Janetlynne211/status/905611586798268416
Janetlynne211;2017-09-07 01:54;0;1;"Thank you for giving me the opportunity to sign this";;;;"905610231635423232";https://twitter.com/Janetlynne211/status/905610231635423232
Janetlynne211;2017-09-07 01:53;0;0;"@mondjomorris I love that dog got there own bed now that's the way you treat a dog";;@mondjomorris;;"905610062416236544";https://twitter.com/Janetlynne211/status/905610062416236544
Janetlynne211;2017-09-06 13:57;0;0;"Not giving a cent to 911 is typical of Trump";;;;"905429651627147264";https://twitter.com/Janetlynne211/status/905429651627147264
Janetlynne211;2017-09-06 13:56;0;0;"Remember Trump being an ass before he was really famous he loved publicity divorced his wife he was an ass then I was shocked he made potus";;;;"905429411633225729";https://twitter.com/Janetlynne211/status/905429411633225729
Janetlynne211;2017-09-06 12:49;0;0;"Latest Stats = 6 Followers and 1 Unfollowers (tracked by http:// unfollowspy.com )";;;;"905412537067253760";https://twitter.com/Janetlynne211/status/905412537067253760
Janetlynne211;2017-09-06 02:18;0;1;"They are loving dogs depends on how you treat them and like any big to dog you must be careful with children use commensense two male dogs";;;;"905253937678299136";https://twitter.com/Janetlynne211/status/905253937678299136
Janetlynne211;2017-09-05 23:56;1;1;"No violence please we must do this with God above in charge";;;;"905218062621831173";https://twitter.com/Janetlynne211/status/905218062621831173
Janetlynne211;2017-09-05 23:54;0;0;"We do the power is in the American people I don't descibe anyone by color, religion ECT I say again we the American people are the power";;;;"905217640792252416";https://twitter.com/Janetlynne211/status/905217640792252416
Janetlynne211;2017-09-05 23:49;0;1;"@MargoBurkhalter Thank to you Margo I just can't see this happening we have come to far as American people. I descibe everyone the same";;@MargoBurkhalter;;"905216447261151234";https://twitter.com/Janetlynne211/status/905216447261151234
Janetlynne211;2017-09-05 21:16;0;0;"Thank you Ed";;;;"905177853179953153";https://twitter.com/Janetlynne211/status/905177853179953153
Janetlynne211;2017-09-05 19:42;0;1;"Clown always keep your sense of humor";;;;"905154124794253312";https://twitter.com/Janetlynne211/status/905154124794253312
Janetlynne211;2017-09-05 16:58;0;0;"We will in Florida when Wilma hit my daughter was in ft Lauderdale living and I stayed to be with her";;;;"905112858387771392";https://twitter.com/Janetlynne211/status/905112858387771392
Janetlynne211;2017-09-05 16:54;0;0;"Bunch of bullshit is all I can say....";;;;"905111877205811201";https://twitter.com/Janetlynne211/status/905111877205811201
Janetlynne211;2017-09-05 16:24;0;1;"Thank you for being smart because trump followers need to hear all this but will it to any good?? We can only pray and keep telling them.";;;;"905104442550312960";https://twitter.com/Janetlynne211/status/905104442550312960
Janetlynne211;2017-09-05 14:54;0;0;"I think it will be a man's name with a j";;;;"905081799650537472";https://twitter.com/Janetlynne211/status/905081799650537472
Janetlynne211;2017-09-05 14:52;1;2;"Let's pray for everyone in the path of that hurricane";;;;"905081292584255493";https://twitter.com/Janetlynne211/status/905081292584255493
Janetlynne211;2017-09-05 14:33;0;0;"Oh God help us all she's a big one";;;;"905076520573685760";https://twitter.com/Janetlynne211/status/905076520573685760
Janetlynne211;2017-09-05 14:31;1;0;"I have family in Florida there on there way to Pennsylvania there not taking any chances pray for everyone in the hurricanes path";;;;"905075996990345216";https://twitter.com/Janetlynne211/status/905075996990345216
Janetlynne211;2017-09-05 04:11;0;0;"Lol you like that Harriet";;;;"904919956260827136";https://twitter.com/Janetlynne211/status/904919956260827136
Janetlynne211;2017-09-04 22:52;0;2;"Victoria and Joel give all your possessions to the people that lost all and I bet you both will feel good and the cars also https:// twitter.com/democraticbear /status/904655591574040577 …";;;;"904839712090804225";https://twitter.com/Janetlynne211/status/904839712090804225
Janetlynne211;2017-09-04 18:24;0;0;"thanks I learned the hard way but I know better now";;;;"904772226498654208";https://twitter.com/Janetlynne211/status/904772226498654208
Janetlynne211;2017-09-04 18:13;0;2;"I'm from Pennsylvania and would love to say we don't need men going down in dangerous mines that why we make robotic machines https:// twitter.com/Unpersuaded112 /status/904766734774804480 …";;;;"904769384773799937";https://twitter.com/Janetlynne211/status/904769384773799937
Janetlynne211;2017-09-04 12:59;0;0;"Latest Stats = 2 Followers and 1 Unfollowers (tracked by http:// unfollowspy.com )";;;;"904690340854022144";https://twitter.com/Janetlynne211/status/904690340854022144
Janetlynne211;2017-09-04 05:59;0;0;"@RevWayneOASM yes it is time we open out eyes God is still blessings us even though we have been wrong and with sin thank you God";;@RevWayneOASM;;"904584589460549632";https://twitter.com/Janetlynne211/status/904584589460549632
Janetlynne211;2017-09-04 05:37;1;0;"I love butterflies pic.twitter.com/TY65VQYJ92";;;;"904579084608516096";https://twitter.com/Janetlynne211/status/904579084608516096
