username;date;retweets;favorites;text;geo;mentions;hashtags;id;permalink
mionsgf;2017-09-04 11:07;0;0;"think less cultured";;;;"904662202065575940";https://twitter.com/mionsgf/status/904662202065575940
mionsgf;2017-09-04 11:05;0;0;"first person who gets this joke gets. to hold a moment of silence for my sense of humour";;;;"904661763060375552";https://twitter.com/mionsgf/status/904661763060375552
mionsgf;2017-09-04 11:05;0;0;"i love satoshi pic.twitter.com/PNzNlbA7FE";;;;"904661646127312898";https://twitter.com/mionsgf/status/904661646127312898
mionsgf;2017-09-04 11:03;0;2;"camera roll is dedicated to my girlfriends @anpatisserie pic.twitter.com/dc1NpyGUAA";;@anpatisserie;;"904661104231677952";https://twitter.com/mionsgf/status/904661104231677952
mionsgf;2017-09-04 10:58;0;1;"all i do is write to do lists in abbreviations and forget what they mean an hour later";;;;"904659861044121601";https://twitter.com/mionsgf/status/904659861044121601
mionsgf;2017-09-04 10:49;0;0;"can more people Please watch shiki. rly one of my fave anime if u want fantastic horror >>> https://www. youtube.com/watch?v=3VSdQO _Z5Cw …";;;;"904657705272569856";https://twitter.com/mionsgf/status/904657705272569856
mionsgf;2017-09-04 10:47;0;0;"sorry the old kyoani cant come 2 the phone right now https://www. youtube.com/watch?v=AMI72V PAZcs …";;;;"904657276283314176";https://twitter.com/mionsgf/status/904657276283314176
mionsgf;2017-09-04 10:44;0;0;"i live in a perpetual state of nostalgia 4 soul society arc also thanx yourichi/yukino satsuki for the gay awakening https://www. youtube.com/watch?v=YTMrvn yhMac …";;;;"904656449351102464";https://twitter.com/mionsgf/status/904656449351102464
mionsgf;2017-09-04 10:42;0;0;"generally one of my fave songs, so beautiful https://www. youtube.com/watch?v=MTw9tY s5bEQ …";;;;"904656004381638656";https://twitter.com/mionsgf/status/904656004381638656
mionsgf;2017-09-04 10:42;0;0;"i never talk abt it but haruhi is acc one of my all-time fave series T__T miss these kids https://www. youtube.com/watch?v=C337sh IT9LI …";;;;"904655834709458944";https://twitter.com/mionsgf/status/904655834709458944
mionsgf;2017-09-04 10:40;0;0;"capitalise the G in God: Gshikata Gakiko https://www. youtube.com/watch?v=wBtH1k gaa10 …";;;;"904655515237613568";https://twitter.com/mionsgf/status/904655515237613568
mionsgf;2017-09-04 10:39;0;0;"u already kno what it is https://www. youtube.com/watch?v=JDQbwv YA9IQ …";;;;"904655139889348608";https://twitter.com/mionsgf/status/904655139889348608
mionsgf;2017-09-04 10:38;0;0;"ok 1 per series n only anime i've seen";;;;"904654889921503233";https://twitter.com/mionsgf/status/904654889921503233
mionsgf;2017-09-04 10:35;0;1;"this made me think of u @topgirI https:// twitter.com/meakoopa/statu s/812718502528372737 …";;@topgirI;;"904654222544732160";https://twitter.com/mionsgf/status/904654222544732160
mionsgf;2017-09-04 10:34;1;1;"i cant find my fucken thread but here's my sdr2 chara ranking as of the end of ch2 (playing on @festivalgoing) pic.twitter.com/EtHNYRFqQC";;@festivalgoing;;"904653887302455296";https://twitter.com/mionsgf/status/904653887302455296
mionsgf;2017-09-04 10:12;0;0;"SDGGDDFFD";;;;"904648362309419008";https://twitter.com/mionsgf/status/904648362309419008
mionsgf;2017-09-04 10:08;0;0;"i decided watanagashi is my fave q arc";;;;"904647446390648832";https://twitter.com/mionsgf/status/904647446390648832
mionsgf;2017-09-04 10:08;0;0;"still tempted to get watanagashi tho.. n tsumi";;;;"904647390732443648";https://twitter.com/mionsgf/status/904647390732443648
mionsgf;2017-09-04 10:08;0;0;"i cant decide whether 2 buy any of the lns cuz it would only be for the illusts n idk how many r in each vol :x";;;;"904647359967186944";https://twitter.com/mionsgf/status/904647359967186944
mionsgf;2017-09-04 10:00;0;0;"i rly cant deal w the fact that it is midday n i have actually been awake for hours already";;;;"904645394793197568";https://twitter.com/mionsgf/status/904645394793197568
mionsgf;2017-09-04 09:59;0;0;"i just used >:3 in 2017 but you know.. You know";;;;"904645064265261056";https://twitter.com/mionsgf/status/904645064265261056
mionsgf;2017-09-04 09:59;0;0;"gaaah im so happy here u go! http:// furudes.tumblr.com/post/164966238 173/read-higurashi-the-post … pls do tweet abt it or hmu when you get started >:3";;;;"904644972489707520";https://twitter.com/mionsgf/status/904644972489707520
mionsgf;2017-09-04 09:58;0;0;"dont i got ur back n im sure lots of others do too";;;;"904644723868127233";https://twitter.com/mionsgf/status/904644723868127233
mionsgf;2017-09-04 09:57;0;0;"i'm really glad ;__; yeah!! i also had a tricky and painful few yrs making that transition from I like women And men to Hold on no i fucking";;;;"904644691613933569";https://twitter.com/mionsgf/status/904644691613933569
mionsgf;2017-09-04 09:51;1;0;"lrt pic.twitter.com/4lPeWueSY3";;;;"904642950491238400";https://twitter.com/mionsgf/status/904642950491238400
mionsgf;2017-09-04 09:50;0;1;"this is the best pairing of this sprite w the text ive seen";;;;"904642823701614592";https://twitter.com/mionsgf/status/904642823701614592
mionsgf;2017-09-04 09:48;0;1;"ppl who've had the same confusion bc of sexual trauma it doesn't make you being whatever you are any less valid whatsoever";;;;"904642227724484610";https://twitter.com/mionsgf/status/904642227724484610
mionsgf;2017-09-04 09:47;0;1;"i hope that makes sense and helps a little :x take ur time nbd should begrudge you for being unsure or switching btwn things! i know various";;;;"904642146791194624";https://twitter.com/mionsgf/status/904642146791194624
mionsgf;2017-09-04 09:47;0;1;"yourself that then i think you are one? if ur more comfortable with + feel like it's more true to you to call yourself that that's what u r";;;;"904642082597462016";https://twitter.com/mionsgf/status/904642082597462016
mionsgf;2017-09-04 09:46;0;1;"what matters is what you're comfortable w and feel like describes you like it's hard 2 explain but if you feel like a lesbian/want to call";;;;"904641843467571200";https://twitter.com/mionsgf/status/904641843467571200
mionsgf;2017-09-04 02:49;0;0;"i rly woke up at 3am n decided going back 2 sleep was too boring n here we are.. big miss steak";;;;"904536748901969926";https://twitter.com/mionsgf/status/904536748901969926
mionsgf;2017-09-04 02:47;0;0;"maybe i'll make an eng mion bot";;;;"904536405417877505";https://twitter.com/mionsgf/status/904536405417877505
mionsgf;2017-09-04 02:45;0;1;"past few days have been hard";;;;"904535818374610944";https://twitter.com/mionsgf/status/904535818374610944
mionsgf;2017-09-04 02:43;0;3;"depression is truly the emotional equivalent of being stuck in quicksand";;;;"904535280299933696";https://twitter.com/mionsgf/status/904535280299933696
mionsgf;2017-09-04 02:35;0;0;"i'm also very introverted and all in all can't promise to always be very social but please don't let that deter you";;;;"904533400207360000";https://twitter.com/mionsgf/status/904533400207360000
mionsgf;2017-09-04 02:34;0;0;"follow me and think we'll get along you are always very welcome to talk to me on here be it about higurashi or anything else";;;;"904533007398252544";https://twitter.com/mionsgf/status/904533007398252544
mionsgf;2017-09-04 02:33;0;1;"and on that note i am very weary after all these years but i know a lot of people have expressed an interest in talking to me more so if you";;;;"904532810727383041";https://twitter.com/mionsgf/status/904532810727383041
mionsgf;2017-09-04 02:32;0;1;"this point. i at least want to make the space i occupy online somewhere for people to share love, kindness and joy";;;;"904532539079053316";https://twitter.com/mionsgf/status/904532539079053316
mionsgf;2017-09-04 02:30;0;0;"don't want to be friends with someone doesn't mean you need to make them an enemy. i don't mind if these sound like naive goals to push at";;;;"904532164687130629";https://twitter.com/mionsgf/status/904532164687130629
mionsgf;2017-09-04 02:30;0;0;"anyway i just want people to work together to make all online spaces safe and welcoming and for them to be a little kinder. just because you";;;;"904531963884826624";https://twitter.com/mionsgf/status/904531963884826624
mionsgf;2017-09-04 02:28;0;0;"just because something happens online doesn't mean it doesn't have the capacity to really make someone unhappy.";;;;"904531621914832897";https://twitter.com/mionsgf/status/904531621914832897
mionsgf;2017-09-04 02:27;0;0;"lot of people act and treat others online i guess they're not like that. i think people who aren't as sensitive as me don't realise that";;;;"904531353617784832";https://twitter.com/mionsgf/status/904531353617784832
mionsgf;2017-09-04 02:26;0;0;"there's the fact that i have various mental health issues but perhaps even more importantly i am just very emotional. and the way i see a";;;;"904531183014436865";https://twitter.com/mionsgf/status/904531183014436865
mionsgf;2017-09-04 02:26;0;0;"i don't have a closing point and this is already a bit more open than i usually am on this account but i'm a very emotional person";;;;"904530998536396800";https://twitter.com/mionsgf/status/904530998536396800
mionsgf;2017-09-04 02:25;0;0;"it makes me very upset to have any negative feelings to associate with higurashi when i love it more than anything";;;;"904530739835920385";https://twitter.com/mionsgf/status/904530739835920385
mionsgf;2017-09-04 02:24;0;0;"kind of ruined that thing i once loved so entirely for me";;;;"904530589872779264";https://twitter.com/mionsgf/status/904530589872779264
mionsgf;2017-09-04 02:24;0;0;"the last time i engaged with a fandom for something i loved i ended up with some terrible experiences and in general the fandom itself";;;;"904530493420515331";https://twitter.com/mionsgf/status/904530493420515331
mionsgf;2017-09-04 02:22;0;0;"it's important for me to remember that when negative experiences threaten to overwhelm it";;;;"904530152041963520";https://twitter.com/mionsgf/status/904530152041963520
mionsgf;2017-09-04 02:20;0;0;"made through it are no exception to that";;;;"904529677594841089";https://twitter.com/mionsgf/status/904529677594841089
mionsgf;2017-09-04 02:20;0;0;"share our love of this series. higurashi has always been something to provide me with happiness and a sense of safety and the friends i've";;;;"904529619109502977";https://twitter.com/mionsgf/status/904529619109502977
mionsgf;2017-09-04 02:19;0;0;"and i've said it before but i'm so grateful for all the friends i've made who've welcomed me and who've shown me how wonderful it is to";;;;"904529408630902784";https://twitter.com/mionsgf/status/904529408630902784
mionsgf;2017-09-04 02:18;0;0;"but to flip this around, higurashi has been my favourite series for a decade but this year was the first time i engaged with the fandom";;;;"904529006682361856";https://twitter.com/mionsgf/status/904529006682361856
mionsgf;2017-09-04 02:17;0;0;"extent to which their actions can negatively affect others.";;;;"904528783864209409";https://twitter.com/mionsgf/status/904528783864209409
mionsgf;2017-09-04 02:16;0;0;"really i have more to say but i can't go more in depth for various reasons. i just wonder if the people who act like this realise the sheer";;;;"904528672803184640";https://twitter.com/mionsgf/status/904528672803184640
mionsgf;2017-09-04 02:13;0;0;"rather than making this an unpleasant place.";;;;"904527901739114496";https://twitter.com/mionsgf/status/904527901739114496
mionsgf;2017-09-04 02:13;0;0;"most especially for a fandom as small as this where we all care so deeply about this series - i'd like it if we could share that together";;;;"904527844310691841";https://twitter.com/mionsgf/status/904527844310691841
mionsgf;2017-09-04 02:13;0;0;"online space because of this is another thing entirely.";;;;"904527695253573633";https://twitter.com/mionsgf/status/904527695253573633
mionsgf;2017-09-04 02:12;0;0;"however trying to make others feel uncomfortable, threatened - generally being horrible, trying to monopolize and push others out of an";;;;"904527597014536194";https://twitter.com/mionsgf/status/904527597014536194
mionsgf;2017-09-04 02:09;0;0;"should be comfortable for you i would never begrudge someone for that and also have some similar feelings i think it makes perfect sense";;;;"904526811983425538";https://twitter.com/mionsgf/status/904526811983425538
mionsgf;2017-09-04 02:09;0;0;"i totally understand people not wanting to interact with others who talk about a chara the same way as them it's your online space and it";;;;"904526758376079360";https://twitter.com/mionsgf/status/904526758376079360
mionsgf;2017-09-04 02:05;0;0;"comfort without targetting others";;;;"904525801101590528";https://twitter.com/mionsgf/status/904525801101590528
mionsgf;2017-09-04 02:05;0;0;"it's a beautiful series with wonderful charas and i wish we could all just mutually appreciate that and enforce boundaries for our own";;;;"904525777739407360";https://twitter.com/mionsgf/status/904525777739407360
mionsgf;2017-09-04 02:04;0;0;"towards others who feel the same which is really sad but. it makes me so nervous lol";;;;"904525553709047808";https://twitter.com/mionsgf/status/904525553709047808
mionsgf;2017-09-04 02:04;0;0;"i feel so weary when i see someone who's kin w or just rly attached to a wtc chara at this pt bc i don't know if they're really hostile";;;;"904525528740372482";https://twitter.com/mionsgf/status/904525528740372482
mionsgf;2017-09-04 01:31;0;0;"";;;;"904517217945079808";https://twitter.com/mionsgf/status/904517217945079808
mionsgf;2017-09-03 16:53;4;9;"This is how it ought to be, despite what your gender studies professor says pic.twitter.com/uRAKREMgfM";;;;"904386848675557377";https://twitter.com/mionsgf/status/904386848675557377
mionsgf;2017-09-03 16:42;0;0;"shes so beautiful?";;;;"904384147472490498";https://twitter.com/mionsgf/status/904384147472490498
mionsgf;2017-09-03 16:07;0;0;"";;;;"904375395578982400";https://twitter.com/mionsgf/status/904375395578982400
mionsgf;2017-09-03 15:34;0;3;"idt there could be a better testament to haruhis legacy that it Exists n that so many ppl myself included watched it";;;;"904366985731076100";https://twitter.com/mionsgf/status/904366985731076100
mionsgf;2017-09-03 15:32;0;0;"ASDFDSSFTFX";;;;"904366611133542401";https://twitter.com/mionsgf/status/904366611133542401
mionsgf;2017-09-03 15:22;0;10;"humour me pic.twitter.com/4Gtbsjv8hQ";;;;"904363949386326018";https://twitter.com/mionsgf/status/904363949386326018
mionsgf;2017-09-03 14:52;0;1;"how Can they.. akane best girl";;;;"904356465288376320";https://twitter.com/mionsgf/status/904356465288376320
mionsgf;2017-09-03 14:51;0;1;"visual novels legit my fave medium read em";;;;"904356216851320832";https://twitter.com/mionsgf/status/904356216851320832
mionsgf;2017-09-03 14:42;0;1;"big mood mion pic.twitter.com/0M9KlaXPWF";;;;"904353884747026432";https://twitter.com/mionsgf/status/904353884747026432
mionsgf;2017-09-03 14:42;1;5;"invented folding arms pic.twitter.com/U4wIRQO2iP";;;;"904353832603459585";https://twitter.com/mionsgf/status/904353832603459585
mionsgf;2017-09-03 14:36;0;0;"ur a 17754337763w46775e4";;;;"904352335857668096";https://twitter.com/mionsgf/status/904352335857668096
mionsgf;2017-09-03 14:16;0;1;"im depresion so im gonna go cap mions";;;;"904347255800508416";https://twitter.com/mionsgf/status/904347255800508416
mionsgf;2017-09-03 14:15;0;1;"pic.twitter.com/NupSDv5XS5";;;;"904347212137758720";https://twitter.com/mionsgf/status/904347212137758720
mionsgf;2017-09-03 14:09;0;2;"thts because i forgot there Was a higurashi opera";;;;"904345648035749888";https://twitter.com/mionsgf/status/904345648035749888
mionsgf;2017-09-03 13:15;0;2;"guys https://www. youtube.com/watch?v=nr0E9f 96EMw …";;;;"904332116174962688";https://twitter.com/mionsgf/status/904332116174962688
mionsgf;2017-09-03 11:03;0;2;"ill be back to normal tomorrow also my rice started burning as i typed that tweet";;;;"904298728286248960";https://twitter.com/mionsgf/status/904298728286248960
mionsgf;2017-09-03 11:02;0;4;"its 1pm and i am not only awake but showered n am cooking a proper meal sorry the old bess cant come to the phone right now Why oh cuz shes";;;;"904298450912759808";https://twitter.com/mionsgf/status/904298450912759808
mionsgf;2017-09-03 09:53;0;0;":3";;;;"904281298482728960";https://twitter.com/mionsgf/status/904281298482728960
mionsgf;2017-09-03 07:59;0;0;":d";;;;"904252430803759105";https://twitter.com/mionsgf/status/904252430803759105
mionsgf;2017-09-02 17:46;0;0;"i wana stay on n talk abt wtc but ive been awake for like 20 hrs so bonne nuit";;;;"904037860763951105";https://twitter.com/mionsgf/status/904037860763951105
mionsgf;2017-09-02 17:24;0;0;"NOTHIN just.. thinkin bout the fact its going to exist dvhds";;;;"904032178471927812";https://twitter.com/mionsgf/status/904032178471927812
mionsgf;2017-09-02 17:19;0;0;"wtc5..wtf";;;;"904031104532967424";https://twitter.com/mionsgf/status/904031104532967424
mionsgf;2017-09-02 17:09;1;3;"IM NOT READT! OG MY GOD LOOKBWHAY JUST CAME ON AUTOPLAY AS I TYPED THAT pic.twitter.com/FvJRq7Pkzt";;;;"904028454915645447";https://twitter.com/mionsgf/status/904028454915645447
mionsgf;2017-09-02 16:57;1;3;"#OrangeJuice2017";;;#OrangeJuice2017;"904025499894255617";https://twitter.com/mionsgf/status/904025499894255617
mionsgf;2017-09-02 16:48;0;1;"keimii domestic fluff is here";;;;"904023269208150016";https://twitter.com/mionsgf/status/904023269208150016
mionsgf;2017-09-02 16:48;1;0;"petit a petit by butterflyswimmer - Higurashi no Naku Koro Ni | Higurashi When They Cry http:// archiveofourown.org/works/11977725 via @ao3org";;@ao3org;;"904023182268657665";https://twitter.com/mionsgf/status/904023182268657665
mionsgf;2017-09-02 16:45;0;1;"me listwning to lit any part of the voice patcg";;;;"904022371350134785";https://twitter.com/mionsgf/status/904022371350134785
mionsgf;2017-09-02 16:42;0;1;"https:// twitter.com/mionsgf/status /890945093653467137 … the";;;;"904021645014249474";https://twitter.com/mionsgf/status/904021645014249474
mionsgf;2017-09-02 16:40;0;1;"pic.twitter.com/uu3k4zDyJk";;;;"904021246026899456";https://twitter.com/mionsgf/status/904021246026899456
mionsgf;2017-09-02 15:16;0;0;"honestly. youre doing better than me i got up at like midnight";;;;"904000187361787905";https://twitter.com/mionsgf/status/904000187361787905
mionsgf;2017-09-02 15:14;0;1;"dont know what this says about either of us or our sleeping scheds that this tweet made me check the time n that it being 5pm didnt shock me";;;;"903999600465465344";https://twitter.com/mionsgf/status/903999600465465344
mionsgf;2017-09-02 15:12;0;1;"how genuinely and with your entire heart can you love a bunch of fictional kids The answer will shock you";;;;"903999121266270209";https://twitter.com/mionsgf/status/903999121266270209
mionsgf;2017-09-02 15:10;0;1;"higurashi hyperfixating at 100eps (emotions per second)";;;;"903998679627034631";https://twitter.com/mionsgf/status/903998679627034631
mionsgf;2017-09-02 15:04;0;1;"i will cry real tears";;;;"903997106825957376";https://twitter.com/mionsgf/status/903997106825957376
mionsgf;2017-09-02 14:21;0;0;"these r much appreciated";;;;"903986316005793792";https://twitter.com/mionsgf/status/903986316005793792
mionsgf;2017-09-02 13:58;0;0;"r/unsolvedmysteries maybe?";;;;"903980420357906432";https://twitter.com/mionsgf/status/903980420357906432
mionsgf;2017-09-02 13:46;0;0;"god bless";;;;"903977414497366016";https://twitter.com/mionsgf/status/903977414497366016
mionsgf;2017-09-02 13:41;0;0;"keiichi https:// vine.co/v/MHvz0tzUzVa";;;;"903976199512363008";https://twitter.com/mionsgf/status/903976199512363008
mionsgf;2017-09-02 13:39;0;0;"shion and mion https:// vine.co/v/hB1muT3mnrA";;;;"903975788898377728";https://twitter.com/mionsgf/status/903975788898377728
mionsgf;2017-09-02 13:36;0;0;"hanyuu https:// vine.co/v/eATx6LIDiK7";;;;"903975014059442176";https://twitter.com/mionsgf/status/903975014059442176
mionsgf;2017-09-02 13:34;0;3;"this pic.twitter.com/Oi6W3sTC1B";;;;"903974524944834561";https://twitter.com/mionsgf/status/903974524944834561
mionsgf;2017-09-02 13:28;0;0;"i hope all goes well and you're on the mend soon sunny! you're in my thoughts";;;;"903972896976068608";https://twitter.com/mionsgf/status/903972896976068608
mionsgf;2017-09-02 13:25;0;1;"im netflix light";;;;"903972101736062976";https://twitter.com/mionsgf/status/903972101736062976
mionsgf;2017-09-02 12:59;0;0;"i just found dl links for all the higu lns only to find the files had been deleted ive never experienced such a rollercoaster of emotions";;;;"903965601177235456";https://twitter.com/mionsgf/status/903965601177235456
mionsgf;2017-09-02 12:42;0;2;"literally have done almost nothing but re-read/watch bits of it since i finished months ago and. it never. stops being a novelty";;;;"903961404331270144";https://twitter.com/mionsgf/status/903961404331270144
mionsgf;2017-09-02 12:41;0;2;"ill literally never be able to process how brilliant this story is nor how much i love it";;;;"903961094275915776";https://twitter.com/mionsgf/status/903961094275915776
mionsgf;2017-09-02 12:41;0;1;"i jst skimmed the entirety of onikakushi again in one sitting then opened a matsuribayashi vid to watch another scene and heard festival.mp3";;;;"903960999102959616";https://twitter.com/mionsgf/status/903960999102959616
mionsgf;2017-09-02 12:40;0;1;"i love higurashi so fcking much";;;;"903960781217304578";https://twitter.com/mionsgf/status/903960781217304578
mionsgf;2017-09-02 04:52;1;2;"@KAMIKITAS https://www. youtube.com/watch?v=IrplRw GKAqY …";;@KAMIKITAS;;"903843004028510209";https://twitter.com/mionsgf/status/903843004028510209
mionsgf;2017-09-02 01:54;0;1;"bc u usually have prior notice it's mostly just evacuation advice etc :0";;;;"903798133032984576";https://twitter.com/mionsgf/status/903798133032984576
mionsgf;2017-09-02 01:46;0;3;"when google autofills w smth entirely different 2 what u were actually going 2 look up n u end up reading abt what 2 do if a volcano erupts";;;;"903796235714351108";https://twitter.com/mionsgf/status/903796235714351108
mionsgf;2017-09-02 01:02;0;1;"sunmi";;;;"903785171463401474";https://twitter.com/mionsgf/status/903785171463401474
mionsgf;2017-09-02 00:36;0;1;"throwback";;;;"903778616827314179";https://twitter.com/mionsgf/status/903778616827314179
mionsgf;2017-09-02 00:36;0;0;"SFGDAS";;;;"903778572896227329";https://twitter.com/mionsgf/status/903778572896227329
mionsgf;2017-09-02 00:10;0;0;"!!!";;;;"903771971288227840";https://twitter.com/mionsgf/status/903771971288227840
mionsgf;2017-09-01 23:32;0;1;"";;;;"903762603574534144";https://twitter.com/mionsgf/status/903762603574534144
mionsgf;2017-09-01 23:14;0;0;"";;;;"903758085977722885";https://twitter.com/mionsgf/status/903758085977722885
mionsgf;2017-09-01 23:14;0;1;"IM SCREAMING @BESSMION keimiirena..";;@BESSMION;;"903757952074616832";https://twitter.com/mionsgf/status/903757952074616832
mionsgf;2017-09-01 23:05;0;1;"thst mion art pic.twitter.com/3Sl35mBtCO";;;;"903755838829056000";https://twitter.com/mionsgf/status/903755838829056000
mionsgf;2017-09-01 22:30;0;0;"lrt the first meme i have ever been able 2 share w my picture book author dad";;;;"903746960632446976";https://twitter.com/mionsgf/status/903746960632446976
mionsgf;2017-09-01 22:28;0;0;"lrt anyine else screaminh";;;;"903746448034074624";https://twitter.com/mionsgf/status/903746448034074624
mionsgf;2017-09-01 09:48;1;3;"keiichi https:// twitter.com/LiamPayne/stat us/257411606663794688 …";;;;"903555236891123712";https://twitter.com/mionsgf/status/903555236891123712
mionsgf;2017-09-01 09:46;0;0;"when mion calls rena up in the middle of the night crying cuz keiichi didnt give her the doll.. im dad inside";;;;"903554768647462912";https://twitter.com/mionsgf/status/903554768647462912
mionsgf;2017-09-01 09:35;0;1;"cant argue w that";;;;"903551992462807040";https://twitter.com/mionsgf/status/903551992462807040
mionsgf;2017-09-01 08:37;0;0;"lrt the dress...";;;;"903537290986868736";https://twitter.com/mionsgf/status/903537290986868736
mionsgf;2017-09-01 07:01;0;1;"wb bel! i was gnna message to see if u were ok";;;;"903513120290856960";https://twitter.com/mionsgf/status/903513120290856960
mionsgf;2017-09-01 06:58;0;1;"pic.twitter.com/LQP9Z5VVA4";;;;"903512416985784320";https://twitter.com/mionsgf/status/903512416985784320
mionsgf;2017-09-01 05:06;0;0;"rmb why i wade thru all that shit";;;;"903484220072271874";https://twitter.com/mionsgf/status/903484220072271874
mionsgf;2017-09-01 05:06;0;0;"90% of anime analysis yt doesnt seem to understand you can construct a sentence w/o using a slur but then i come across stuff like this and";;;;"903484179190505472";https://twitter.com/mionsgf/status/903484179190505472
mionsgf;2017-09-01 05:05;0;1;"that video shook me to my core and it looks like everyone in the comments had the same experience lol";;;;"903483826969522177";https://twitter.com/mionsgf/status/903483826969522177
mionsgf;2017-09-01 05:04;0;0;"also if you want to support a trans content creator then!";;;;"903483601068507136";https://twitter.com/mionsgf/status/903483601068507136
mionsgf;2017-09-01 05:03;0;0;"if you do anything today give ceicocat's channel a look. they deserve a wider audience and you deserve to experience they're wonderful work";;;;"903483508210917376";https://twitter.com/mionsgf/status/903483508210917376
mionsgf;2017-09-01 05:02;0;0;"i can't not share this i haven't even seen knk and i just sobbed for half an hour";;;;"903483198620893184";https://twitter.com/mionsgf/status/903483198620893184
mionsgf;2017-09-01 05:01;0;0;"Koe no Katachi: A Personal Exploration https:// youtu.be/Sfr9VnZrGmQ via @YouTube";;@YouTube;;"903483035311415296";https://twitter.com/mionsgf/status/903483035311415296
mionsgf;2017-09-01 05:00;0;0;"";;;;"903482704460619777";https://twitter.com/mionsgf/status/903482704460619777
