username;date;retweets;favorites;text;geo;mentions;hashtags;id;permalink
mionsgf;2017-10-08 01:58;0;3;"THERES A PAIR OF TEETH IN MY TEETH AND GUMS SWEETS BUT THERES NO GUMS CBGXXAFCXHG pic.twitter.com/MwLhSXqW4s";;;;"916845312609849345";https://twitter.com/mionsgf/status/916845312609849345
mionsgf;2017-10-08 01:15;0;0;"i dont even go there but im gay for every v3 girl";;;;"916834451111469056";https://twitter.com/mionsgf/status/916834451111469056
mionsgf;2017-10-08 00:45;0;0;"she came into my room the other day n pointed at my figures like "we are watching this"";;;;"916826750813921280";https://twitter.com/mionsgf/status/916826750813921280
mionsgf;2017-10-08 00:44;0;0;"keiichi: no matter what happens nothing will change the fact that sonozaki mion is my best friend tania: (whispering) its what i deserve";;;;"916826631863504896";https://twitter.com/mionsgf/status/916826631863504896
mionsgf;2017-10-07 23:57;0;1;"best movie";;;;"916814683285241857";https://twitter.com/mionsgf/status/916814683285241857
mionsgf;2017-10-07 23:56;0;0;"i got spaghetti hoops on someones eyeshadow palette but thats what happens";;;;"916814511125938176";https://twitter.com/mionsgf/status/916814511125938176
mionsgf;2017-10-07 23:37;0;0;"everyonr.. everyone";;;;"916809796891873280";https://twitter.com/mionsgf/status/916809796891873280
mionsgf;2017-10-07 23:32;0;2;"interesting scenes in our kitchen tonight pic.twitter.com/3hwMIgSC8j";;;;"916808466538336256";https://twitter.com/mionsgf/status/916808466538336256
mionsgf;2017-10-07 22:00;0;0;"which is actually a lot more involved than youd think my CV is shook";;;;"916785303863603203";https://twitter.com/mionsgf/status/916785303863603203
mionsgf;2017-10-07 21:56;0;1;"ppl just hate RM In General sfgda we have a module on it";;;;"916784279761379330";https://twitter.com/mionsgf/status/916784279761379330
mionsgf;2017-10-07 21:55;0;3;"btw i work as a research assistant for my lecturer now pic.twitter.com/DIMTUvnZzo";;;;"916784092259201024";https://twitter.com/mionsgf/status/916784092259201024
mionsgf;2017-10-07 21:53;0;0;"i actually want to do research so pic.twitter.com/gDWdzmyrXJ";;;;"916783569254670336";https://twitter.com/mionsgf/status/916783569254670336
mionsgf;2017-10-07 21:52;0;0;"psychology students more like Data Frightens Us";;;;"916783209882546177";https://twitter.com/mionsgf/status/916783209882546177
mionsgf;2017-10-07 21:51;0;0;"the past two weeks have just been our lecturers going "we KNOW you dont want to do research methods now shut the fuck up and listen"";;;;"916783018785812480";https://twitter.com/mionsgf/status/916783018785812480
mionsgf;2017-10-07 21:50;0;1;"go in pic.twitter.com/7cXZZYlibU";;;;"916782749092122625";https://twitter.com/mionsgf/status/916782749092122625
mionsgf;2017-10-07 21:44;0;1;"this = good";;;;"916781254963531778";https://twitter.com/mionsgf/status/916781254963531778
mionsgf;2017-10-07 21:29;0;1;"queen of consistency in my type for the past decade at least";;;;"916777562973638656";https://twitter.com/mionsgf/status/916777562973638656
mionsgf;2017-10-07 21:27;0;1;"";;;;"916777089013092352";https://twitter.com/mionsgf/status/916777089013092352
mionsgf;2017-10-07 21:24;0;1;"um im in love shes so snexy";;;;"916776253763571713";https://twitter.com/mionsgf/status/916776253763571713
mionsgf;2017-10-07 21:15;0;1;"pic.twitter.com/bUqhR9wY6Q";;;;"916773913757134848";https://twitter.com/mionsgf/status/916773913757134848
mionsgf;2017-10-07 20:55;0;0;"i think everyone left this part of the library and its just me are you saying you have somewhere else to be at 10pm on a saturday";;;;"916769088080416768";https://twitter.com/mionsgf/status/916769088080416768
mionsgf;2017-10-07 20:54;0;1;"every time someone tries to guess my age based on my appearance it gets lower Hello i have 3 days left of being a teenager";;;;"916768709611589633";https://twitter.com/mionsgf/status/916768709611589633
mionsgf;2017-10-07 20:52;0;0;"";;;;"916768319696506880";https://twitter.com/mionsgf/status/916768319696506880
mionsgf;2017-10-07 20:51;0;0;"this is the best thing that happened for my birthday and my birthday didnt even happen yet";;;;"916767973284642816";https://twitter.com/mionsgf/status/916767973284642816
mionsgf;2017-10-07 20:49;0;2;"the dream is dead pic.twitter.com/KmtLw2soXm";;;;"916767410711080960";https://twitter.com/mionsgf/status/916767410711080960
mionsgf;2017-10-07 20:25;0;0;"every time my txtbks mention forensic psych im like that me -_- in 7 yrs -_-";;;;"916761418468417536";https://twitter.com/mionsgf/status/916761418468417536
mionsgf;2017-10-07 20:25;0;1;"no homo but anyone else love their degree. where my psychology bitchss";;;;"916761316257386496";https://twitter.com/mionsgf/status/916761316257386496
mionsgf;2017-10-07 20:23;0;7;"i was actually making progress before i stopped to take these pic.twitter.com/V8aA7Plz2u";;;;"916760848705769478";https://twitter.com/mionsgf/status/916760848705769478
mionsgf;2017-10-07 17:16;0;1;"STOOPPPPP";;;;"916713782642126850";https://twitter.com/mionsgf/status/916713782642126850
mionsgf;2017-10-07 15:06;0;0;"btob r so ducking funny they love each other so much.";;;;"916681163984572416";https://twitter.com/mionsgf/status/916681163984572416
mionsgf;2017-10-07 15:06;0;0;"lrt me captioning my selfies";;;;"916681072561270786";https://twitter.com/mionsgf/status/916681072561270786
mionsgf;2017-10-07 12:53;0;1;"hello";;;;"916647646152060928";https://twitter.com/mionsgf/status/916647646152060928
mionsgf;2017-10-07 12:52;0;0;"yesterday i bought 18 packets of smoky bacon crisps asda is dangerous";;;;"916647506020392960";https://twitter.com/mionsgf/status/916647506020392960
mionsgf;2017-10-07 12:51;0;4;"god shes so valid. pic.twitter.com/qR1PyR44yT";;;;"916647280740093953";https://twitter.com/mionsgf/status/916647280740093953
mionsgf;2017-10-07 12:42;0;0;"my friend has had like 2 shifts at mcds and this is already true";;;;"916644824626946048";https://twitter.com/mionsgf/status/916644824626946048
mionsgf;2017-10-07 01:50;0;1;"i have never experienced such devestation";;;;"916480795556175872";https://twitter.com/mionsgf/status/916480795556175872
mionsgf;2017-10-07 01:39;0;0;"WHAT IS THAT";;;;"916478101600776194";https://twitter.com/mionsgf/status/916478101600776194
mionsgf;2017-10-07 00:40;0;4;"pic.twitter.com/jnX8jNMjEc";;;;"916463276128694273";https://twitter.com/mionsgf/status/916463276128694273
mionsgf;2017-10-07 00:11;0;0;"IT IS NOT";;;;"916455951628226560";https://twitter.com/mionsgf/status/916455951628226560
mionsgf;2017-10-07 00:10;1;1;"SHE WANTED TO KNPW WHAT A TURTLES SHELL WAS CALLED N SHE TAPPED MY BACK LIKE "HOW DO YOU CALL IT, THEIR HOME?"";;;;"916455540452151296";https://twitter.com/mionsgf/status/916455540452151296
mionsgf;2017-10-07 00:04;1;1;"tania: what is this called (gesturing to neck) me: a lanyard...? tania: me: it's called a lanyard tania: (quietly) im so shook";;;;"916454135834251264";https://twitter.com/mionsgf/status/916454135834251264
mionsgf;2017-10-06 23:07;0;6;"day 21, my flatmates have learnt how to lure me out of my room pic.twitter.com/RwgWt9blSi";;;;"916439844515086338";https://twitter.com/mionsgf/status/916439844515086338
mionsgf;2017-10-06 22:09;0;1;"it took me a moment 2 place ac as animal crossing xuz this is so dif tonally fhfsxgd";;;;"916425147954982915";https://twitter.com/mionsgf/status/916425147954982915
mionsgf;2017-10-06 22:08;0;0;"LRTGFDXVHG";;;;"916425046360551424";https://twitter.com/mionsgf/status/916425046360551424
mionsgf;2017-10-06 17:38;0;2;"same gay satan";;;;"916357129774170112";https://twitter.com/mionsgf/status/916357129774170112
mionsgf;2017-10-06 17:28;0;3;"anyone else shook pic.twitter.com/l6h6gQmSPT";;;;"916354581059244032";https://twitter.com/mionsgf/status/916354581059244032
mionsgf;2017-10-06 15:51;1;0;"alternately http:// ko-fi.com/butterflyswimm er …";;;;"916330144423464960";https://twitter.com/mionsgf/status/916330144423464960
mionsgf;2017-10-06 15:51;0;1;"hey it's my birthda on tuesday http://www. amazon.co.uk/registry/wishl ist/1X6426EAFS0AO/ref=cm_sw_r_tw_ws_x_5y61zbXZQCW53 …";;;;"916330009580789760";https://twitter.com/mionsgf/status/916330009580789760
mionsgf;2017-10-06 15:40;0;2;"pic.twitter.com/ba8kkQpqtm";;;;"916327201729114113";https://twitter.com/mionsgf/status/916327201729114113
mionsgf;2017-10-06 14:44;0;0;"@choupaper https:// twitter.com/AsikIkisa/stat us/916292462200676354 …";;@choupaper;;"916313152832327680";https://twitter.com/mionsgf/status/916313152832327680
mionsgf;2017-10-06 12:46;0;6;"oh she pic.twitter.com/CODkmpE1N3";;;;"916283511342026752";https://twitter.com/mionsgf/status/916283511342026752
mionsgf;2017-10-06 12:06;0;0;"#LGBT";;;#LGBT;"916273557923094528";https://twitter.com/mionsgf/status/916273557923094528
mionsgf;2017-10-06 03:16;0;1;"hi everyone this is the worlds cutest girl and i love her sooooooo much goodnight pic.twitter.com/vfZ8uxLKRy";;;;"916140195367538688";https://twitter.com/mionsgf/status/916140195367538688
mionsgf;2017-10-06 03:13;0;1;"i rly used 2 pretend i h8ed pink when i was like 8 cuz of som internalised misogyny bs like bitcg. baby pink is best colour..apart frm green";;;;"916139231805890561";https://twitter.com/mionsgf/status/916139231805890561
mionsgf;2017-10-06 03:08;0;1;"i have like 8 things coming in the mail over the next week its called swag.. name a more iconic duo than me n the uni post room";;;;"916138185490665472";https://twitter.com/mionsgf/status/916138185490665472
mionsgf;2017-10-06 03:07;0;0;"im so hapy my suitcase arrived cuz i can hug my penguin";;;;"916137922625261569";https://twitter.com/mionsgf/status/916137922625261569
mionsgf;2017-10-06 03:05;0;0;"i didn evn want a fruit difuser it was just the 1st water bottle i sw.. but when life gives u lemons....pretend this is clever n makes sense";;;;"916137216979689472";https://twitter.com/mionsgf/status/916137216979689472
mionsgf;2017-10-06 03:02;0;1;"@majimalovemail riaaah im so late but i hope u had a really good birthday bud!! n that u got.. kiryus undying love 4 all eternity";;@majimalovemail;;"916136631618473984";https://twitter.com/mionsgf/status/916136631618473984
mionsgf;2017-10-06 03:01;0;0;"i cant wait 2 get Fruit 2 try out in my Fruit Difüsèr";;;;"916136277916946432";https://twitter.com/mionsgf/status/916136277916946432
mionsgf;2017-10-06 02:57;0;0;"OTM (One True Mum)";;;;"916135405497520129";https://twitter.com/mionsgf/status/916135405497520129
mionsgf;2017-10-06 02:49;0;0;"i got some new stuf for my room n hoovered Feels gud";;;;"916133372505837568";https://twitter.com/mionsgf/status/916133372505837568
mionsgf;2017-10-06 02:49;0;3;"look at my cute water fruit difuser thing pic.twitter.com/OjY4t8H1fk";;;;"916133322367041537";https://twitter.com/mionsgf/status/916133322367041537
mionsgf;2017-10-06 02:46;0;1;"pic.twitter.com/DB4pJuSSoJ";;;;"916132571829895168";https://twitter.com/mionsgf/status/916132571829895168
mionsgf;2017-10-06 02:41;0;1;"student living (digital, 2017) pic.twitter.com/Bhx9Os0rS6";;;;"916131198107340800";https://twitter.com/mionsgf/status/916131198107340800
mionsgf;2017-10-06 02:32;0;0;"omg i love tortoises so much i want one";;;;"916129117833179141";https://twitter.com/mionsgf/status/916129117833179141
mionsgf;2017-10-06 02:07;0;1;"pic.twitter.com/H05X15AafY";;;;"916122809058975744";https://twitter.com/mionsgf/status/916122809058975744
mionsgf;2017-10-06 02:01;0;2;"when you think about mion sonozaki.. am i right ladies pic.twitter.com/IJDamy1DVa";;;;"916121110151909376";https://twitter.com/mionsgf/status/916121110151909376
mionsgf;2017-10-06 01:58;0;1;"when you remember keiichi gave mion the doll pic.twitter.com/cZXy8WMD6V";;;;"916120483237629952";https://twitter.com/mionsgf/status/916120483237629952
mionsgf;2017-10-06 00:30;0;1;"i won cards against humanity";;;;"916098274339246081";https://twitter.com/mionsgf/status/916098274339246081
mionsgf;2017-10-06 00:26;0;1;"if any1 wants to add me on sc its soundsmarket";;;;"916097296848379904";https://twitter.com/mionsgf/status/916097296848379904
mionsgf;2017-10-06 00:18;4;6;"RLY GOOD THREAD! read umineko https:// twitter.com/bleukitsune/st atus/916066290518974465 …";;;;"916095219627692032";https://twitter.com/mionsgf/status/916095219627692032
mionsgf;2017-10-06 00:06;0;1;"im a big fan of the middle one but guess what i won for pic.twitter.com/jJp3xxPyhi";;;;"916092383892312064";https://twitter.com/mionsgf/status/916092383892312064
mionsgf;2017-10-05 23:35;0;1;"theyre soo fun i love their performances";;;;"916084578917519360";https://twitter.com/mionsgf/status/916084578917519360
mionsgf;2017-10-05 22:54;0;0;"pristin or is this a jpop group? :o";;;;"916074159909888000";https://twitter.com/mionsgf/status/916074159909888000
mionsgf;2017-10-05 21:23;0;2;"the only thing i enjoy more than seeing other ppl enjoy wtc is enjoying it myself";;;;"916051338387173376";https://twitter.com/mionsgf/status/916051338387173376
mionsgf;2017-10-05 19:54;0;3;"thank you ryukishi07 for making every girl in wtc so fucking gay";;;;"916028942489980928";https://twitter.com/mionsgf/status/916028942489980928
mionsgf;2017-10-05 19:51;0;0;"keimiirena r so in love let them be happy together";;;;"916028081650855937";https://twitter.com/mionsgf/status/916028081650855937
mionsgf;2017-10-05 19:25;0;1;"i love mion sonozaki so much!";;;;"916021661459210240";https://twitter.com/mionsgf/status/916021661459210240
mionsgf;2017-10-05 19:24;0;1;"watanagashi (11/ ) pic.twitter.com/m6vqe2q2Nh";;;;"916021257774227456";https://twitter.com/mionsgf/status/916021257774227456
mionsgf;2017-10-05 19:23;0;0;"watanagashi (10/ ) pic.twitter.com/LfD85TdddN";;;;"916021091834793985";https://twitter.com/mionsgf/status/916021091834793985
mionsgf;2017-10-05 19:22;0;0;"watanagashi (9/ ) pic.twitter.com/ioYVQINCCe";;;;"916020672131977222";https://twitter.com/mionsgf/status/916020672131977222
mionsgf;2017-10-05 01:53;0;1;"pic.twitter.com/WxQHKGjQPR";;;;"915756917615681536";https://twitter.com/mionsgf/status/915756917615681536
mionsgf;2017-10-05 01:17;0;0;"cant believe ryukishi07 invented me being a lesbian";;;;"915747713475579904";https://twitter.com/mionsgf/status/915747713475579904
mionsgf;2017-10-05 01:16;0;0;"rmb when ryukishi wrote hinamizawa bus stop about me n my girlfriend pic.twitter.com/5KoojJeuUk";;;;"915747552263376896";https://twitter.com/mionsgf/status/915747552263376896
mionsgf;2017-10-05 00:42;0;1;"not as cute as u!";;;;"915738947720024069";https://twitter.com/mionsgf/status/915738947720024069
mionsgf;2017-10-05 00:40;0;0;"this is fake news";;;;"915738491774013441";https://twitter.com/mionsgf/status/915738491774013441
mionsgf;2017-10-05 00:37;0;1;"kin";;;;"915737563557777409";https://twitter.com/mionsgf/status/915737563557777409
mionsgf;2017-10-05 00:36;0;1;"good evening you may all be surprised to know.. i would love to kiss mion sonozaki";;;;"915737519442014209";https://twitter.com/mionsgf/status/915737519442014209
mionsgf;2017-10-04 21:11;0;5;"i was talking abt how annoying straight ppl r earlier n everyone found it so funny like guys.. you think im joking";;;;"915685755527270400";https://twitter.com/mionsgf/status/915685755527270400
mionsgf;2017-10-04 19:43;0;2;"t may is an utter joke";;;;"915663802615681025";https://twitter.com/mionsgf/status/915663802615681025
mionsgf;2017-10-04 14:54;0;1;"ran ran ruu";;;;"915591013552590848";https://twitter.com/mionsgf/status/915591013552590848
mionsgf;2017-10-04 13:27;0;0;"i typo my name as Beds in every email and its only a matter of time until i accidentally send one";;;;"915569077573361664";https://twitter.com/mionsgf/status/915569077573361664
mionsgf;2017-10-04 12:56;0;0;"what is ther to talk about.";;;;"915561171419353090";https://twitter.com/mionsgf/status/915561171419353090
mionsgf;2017-10-04 12:48;8;12;"youre not a real umineko fan unless you massacre basically your entire family over the next two days";;;;"915559288508223491";https://twitter.com/mionsgf/status/915559288508223491
mionsgf;2017-10-04 02:07;0;0;"how is it actyally possible to be this beautiful i cant process it. https:// twitter.com/mionsgf/status /914965836263301120 …";;;;"915397963505074176";https://twitter.com/mionsgf/status/915397963505074176
mionsgf;2017-10-04 02:05;0;0;"there is nothing i could want my fic to do more";;;;"915397452986974210";https://twitter.com/mionsgf/status/915397452986974210
mionsgf;2017-10-04 01:53;0;0;"watanagashi (8/ ) pic.twitter.com/ETpc3ERvQt";;;;"915394301865185280";https://twitter.com/mionsgf/status/915394301865185280
mionsgf;2017-10-04 01:51;0;0;"watanagashi (7/ ) pic.twitter.com/Ke3vLoPX2c";;;;"915393852521017349";https://twitter.com/mionsgf/status/915393852521017349
mionsgf;2017-10-04 01:50;0;0;"https://www. youtube.com/watch?v=INz3DV QXE1s …";;;;"915393552674381829";https://twitter.com/mionsgf/status/915393552674381829
mionsgf;2017-10-04 00:55;0;1;"i cant stop listening n go to bed";;;;"915379841196859393";https://twitter.com/mionsgf/status/915379841196859393
mionsgf;2017-10-04 00:32;0;3;"15th anni aa concert is healing my soul";;;;"915373954910605312";https://twitter.com/mionsgf/status/915373954910605312
mionsgf;2017-10-04 00:30;0;2;"i love her. pic.twitter.com/NXxQ0vBBL1";;;;"915373445713743872";https://twitter.com/mionsgf/status/915373445713743872
mionsgf;2017-10-03 22:50;0;1;"i havent watched any of gbbo my life is spiralling out of control";;;;"915348453311549441";https://twitter.com/mionsgf/status/915348453311549441
mionsgf;2017-10-03 22:50;0;0;"atashi wa mou shindeiru";;;;"915348266069430272";https://twitter.com/mionsgf/status/915348266069430272
mionsgf;2017-10-03 22:34;0;1;"im not dr so i only saw 1 person but i think it's young ppl who r most at risk from it?";;;;"915344236047978498";https://twitter.com/mionsgf/status/915344236047978498
mionsgf;2017-10-03 22:17;0;1;"sory but like.. i do not envy you";;;;"915340040800260096";https://twitter.com/mionsgf/status/915340040800260096
mionsgf;2017-10-03 22:17;0;2;"someone: crying abt their bf in a dif country me, an intellectual: i have four of my girlfriend in my ROOM";;;;"915339985997484040";https://twitter.com/mionsgf/status/915339985997484040
mionsgf;2017-10-03 22:01;0;5;"everyone here has long distance bfs/gfs so im just gonna start talking about mion";;;;"915336123009740800";https://twitter.com/mionsgf/status/915336123009740800
mionsgf;2017-10-03 21:52;0;1;"neway everyone love the things you love n i will love you";;;;"915333866449260544";https://twitter.com/mionsgf/status/915333866449260544
mionsgf;2017-10-03 21:50;1;1;"biggest fans of telling ppl to read higurashi @kamikitas";;@kamikitas;;"915333375237480448";https://twitter.com/mionsgf/status/915333375237480448
mionsgf;2017-10-03 21:50;0;2;"i rly dont have an issue w anyone entering them i just see them n think about how much could go wrong -_-; playing w ppls feelings like that";;;;"915333146337521665";https://twitter.com/mionsgf/status/915333146337521665
mionsgf;2017-10-03 21:48;0;1;"nyes..";;;;"915332777998012416";https://twitter.com/mionsgf/status/915332777998012416
mionsgf;2017-10-03 21:48;1;2;"Biggest Mion Sonozaki's Girlfriend";;;;"915332684855087106";https://twitter.com/mionsgf/status/915332684855087106
mionsgf;2017-10-03 21:47;0;1;"just saw em mentioned :p";;;;"915332562817572876";https://twitter.com/mionsgf/status/915332562817572876
mionsgf;2017-10-03 21:42;0;1;"couldntve put it better myself";;;;"915331340333174784";https://twitter.com/mionsgf/status/915331340333174784
mionsgf;2017-10-03 21:42;0;0;"get rly ugly then";;;;"915331251099365377";https://twitter.com/mionsgf/status/915331251099365377
mionsgf;2017-10-03 21:42;0;0;"n prolly some ppl would say Oh its just for fun but i just know there r way too many ppl who would rly. Not see it that way. n things can";;;;"915331218832596999";https://twitter.com/mionsgf/status/915331218832596999
mionsgf;2017-10-03 21:41;0;2;"Hundreds of hours into producing stuff for this ship, have loved it for half their lives etc";;;;"915330935184293888";https://twitter.com/mionsgf/status/915330935184293888
mionsgf;2017-10-03 21:40;0;2;"i mean theres aa awards n theres a biggest narumitsu fan one and its so dumb bc i can easily list tens of people like myself whove put";;;;"915330828670001152";https://twitter.com/mionsgf/status/915330828670001152
mionsgf;2017-10-03 21:39;0;1;"else to win this over me" one lol";;;;"915330566467276800";https://twitter.com/mionsgf/status/915330566467276800
mionsgf;2017-10-03 21:39;0;1;"n if my stance is not obvious its absolutely one of everyones love for a chara or ship is valid and to be celebrated, not the "id hate some1";;;;"915330509873516547";https://twitter.com/mionsgf/status/915330509873516547
mionsgf;2017-10-03 21:38;0;1;"but not 2 rain on ppls parade ive never been in one so idk they just seem like a bad idea";;;;"915330183674068994";https://twitter.com/mionsgf/status/915330183674068994
mionsgf;2017-10-03 21:37;0;1;"of ppls feelings probably and unfortunately there r a lot of ppl in fandom whod absolutely use those kinds of events to cause problems";;;;"915330052203667456";https://twitter.com/mionsgf/status/915330052203667456
mionsgf;2017-10-03 21:36;0;1;"i have nothing against ppl who enter then they just leave a bad taste in my mouth bc it just doesnt achieve anything besides hurting a bunch";;;;"915329773186031617";https://twitter.com/mionsgf/status/915329773186031617
mionsgf;2017-10-03 21:35;0;2;"the most followers to vote for them bc lbr its just a popularity contest";;;;"915329553375035392";https://twitter.com/mionsgf/status/915329553375035392
mionsgf;2017-10-03 21:35;0;2;"like nbd needs some1 declared as a chara/ships biggest fan when theyre sure to be very important to many other ppl just bc said person has";;;;"915329482441068544";https://twitter.com/mionsgf/status/915329482441068544
mionsgf;2017-10-03 21:34;0;4;"sure ive shared these opinions b4 but i rly dont like fandom awards :x i think theyre just fuel for conflict";;;;"915329130035638272";https://twitter.com/mionsgf/status/915329130035638272
mionsgf;2017-10-03 20:41;0;2;"i love aa :/ i wonder when we're getting news on 7 i cant believe its been a yr since 6 tf";;;;"915315962680930310";https://twitter.com/mionsgf/status/915315962680930310
mionsgf;2017-10-03 20:40;0;3;"in typical bess fashion i spent all summer idk. thinking about mion and Now i have no time i wanna play stuff";;;;"915315683738648576";https://twitter.com/mionsgf/status/915315683738648576
mionsgf;2017-10-03 20:39;0;1;"but where are gumshoe and fran.. so many questions";;;;"915315517266829313";https://twitter.com/mionsgf/status/915315517266829313
mionsgf;2017-10-03 20:39;0;1;"this is presuming he wont feature in the main game ow that hurt to type but i have no clue where theyre taking the series from here";;;;"915315315826929664";https://twitter.com/mionsgf/status/915315315826929664
mionsgf;2017-10-03 20:38;0;1;"using aa6's dlc case to bring back the trilogy crew was rly clever n they should do it for aa7 w the aa4 peeps (klavier) js";;;;"915315196746493954";https://twitter.com/mionsgf/status/915315196746493954
mionsgf;2017-10-03 20:31;0;1;"im gonna listen 2 the whole concert next time i sit down 2 study";;;;"915313482102378497";https://twitter.com/mionsgf/status/915313482102378497
mionsgf;2017-10-03 20:31;0;1;"i just realised this concert means we'll have the orchestral ver of nahyuta's theme ive been waiting for since the trailer last summer";;;;"915313321439645697";https://twitter.com/mionsgf/status/915313321439645697
mionsgf;2017-10-03 19:48;0;0;"is aoty brother act up for pre-order yet";;;;"915302472482217984";https://twitter.com/mionsgf/status/915302472482217984
mionsgf;2017-10-03 19:40;0;0;"http:// store.steampowered.com/app/406550/Umi neko_When_They_Cry_Question_Arc/ … play! it!";;;;"915300541781217283";https://twitter.com/mionsgf/status/915300541781217283
mionsgf;2017-10-03 19:39;1;1;"http:// bizarrequazar.tumblr.com/post/162346518 884/reasons-why-you-should-read-umineko … please.";;;;"915300228496052224";https://twitter.com/mionsgf/status/915300228496052224
mionsgf;2017-10-03 19:37;0;0;"same tears";;;;"915299728123932672";https://twitter.com/mionsgf/status/915299728123932672
mionsgf;2017-10-03 19:37;0;0;"same hat? same hat!";;;;"915299712869289986";https://twitter.com/mionsgf/status/915299712869289986
mionsgf;2017-10-03 19:36;0;0;"the ??? rather";;;;"915299582929702913";https://twitter.com/mionsgf/status/915299582929702913
mionsgf;2017-10-03 19:36;0;1;"im sure ive said it plenty of times but the end of ep7 tea party is my fave umi scene";;;;"915299549136244736";https://twitter.com/mionsgf/status/915299549136244736
mionsgf;2017-10-03 19:36;0;0;"im listening to resurrected replayer and im emotional.";;;;"915299453413838853";https://twitter.com/mionsgf/status/915299453413838853
mionsgf;2017-10-03 19:35;0;0;"2 get my new laptop and load up my ipod w wtc osts and nothing else";;;;"915299296299405312";https://twitter.com/mionsgf/status/915299296299405312
mionsgf;2017-10-03 19:35;0;0;"i never have time to listen to music any more cuz i usually do when im going somewhere n i live 1 min from my lectures but i still cant wait";;;;"915299211276627968";https://twitter.com/mionsgf/status/915299211276627968
mionsgf;2017-10-03 19:33;0;1;"umineko ost has given me a new lease of life this the best ive felt in like a week";;;;"915298722417922048";https://twitter.com/mionsgf/status/915298722417922048
mionsgf;2017-10-03 19:29;4;6;"i hope ryukishi07 is having a good day pic.twitter.com/tIutbwNu8u";;;;"915297848757014528";https://twitter.com/mionsgf/status/915297848757014528
mionsgf;2017-10-03 19:29;0;0;"ugh i love when they cry more than LITERALLY ANYTHING!";;;;"915297728703418368";https://twitter.com/mionsgf/status/915297728703418368
mionsgf;2017-10-03 19:27;0;1;""times when golcha stans" didnt they debut like 20 minutes ago";;;;"915297337932689408";https://twitter.com/mionsgf/status/915297337932689408
