username;date;retweets;favorites;text;geo;mentions;hashtags;id;permalink
mionsgf;2017-08-11 12:57;0;0;"yepp unless you're a fast reader";;;;"895992630500306949";https://twitter.com/mionsgf/status/895992630500306949
mionsgf;2017-08-11 03:04;0;0;"DYFDDHJGX";;;;"895843223524044802";https://twitter.com/mionsgf/status/895843223524044802
mionsgf;2017-08-11 03:01;0;2;"pic.twitter.com/y64RwG8AsM";;;;"895842631825199105";https://twitter.com/mionsgf/status/895842631825199105
mionsgf;2017-08-11 01:05;0;1;"*trying to work out how many pence i just wasted*";;;;"895813401481445381";https://twitter.com/mionsgf/status/895813401481445381
mionsgf;2017-08-11 01:02;0;1;"i spilt apple juice all over me bed";;;;"895812709631000579";https://twitter.com/mionsgf/status/895812709631000579
mionsgf;2017-08-11 01:02;0;0;"most importantly pic.twitter.com/zaOdbOxCXf";;;;"895812629222100994";https://twitter.com/mionsgf/status/895812629222100994
mionsgf;2017-08-11 00:58;0;0;"this is 1st pic pic.twitter.com/kAPrZb7C69";;;;"895811646769254405";https://twitter.com/mionsgf/status/895811646769254405
mionsgf;2017-08-11 00:58;0;0;"WAIT I";;;;"895811576053346306";https://twitter.com/mionsgf/status/895811576053346306
mionsgf;2017-08-11 00:57;0;0;"pic.twitter.com/vLs59AaI9V";;;;"895811325074518016";https://twitter.com/mionsgf/status/895811325074518016
mionsgf;2017-08-11 00:45;0;0;"is this a srs question cuz ill give you an essay";;;;"895808454006329344";https://twitter.com/mionsgf/status/895808454006329344
mionsgf;2017-08-11 00:45;0;0;"pic.twitter.com/wTrG9NaQZk";;;;"895808394207952896";https://twitter.com/mionsgf/status/895808394207952896
mionsgf;2017-08-11 00:43;0;0;"another easy dl.. n ya i would rec the orig sprites which r in the steam ver over ps3 anyway.. but would also rec read higu 1st";;;;"895807913083760640";https://twitter.com/mionsgf/status/895807913083760640
mionsgf;2017-08-11 00:43;0;0;"wtffhjfs Back in my day it was just 1 clic n it was fine.. the site i got it from doesnt exist any more but id be surprised if there werenr";;;;"895807749208125441";https://twitter.com/mionsgf/status/895807749208125441
mionsgf;2017-08-11 00:40;0;0;"also u can get a patch for the sprites for steam ver if u can afford it.. it took me abt 100 hrs to read q arcs so its well worth the money";;;;"895807067667267584";https://twitter.com/mionsgf/status/895807067667267584
mionsgf;2017-08-11 00:39;0;0;"OH there's no way i couldve watched it w my attn span i needed the clicking every 5 sec why dont u torrent it?";;;;"895806895142957056";https://twitter.com/mionsgf/status/895806895142957056
mionsgf;2017-08-11 00:37;0;0;"do u have the steam vers btw?";;;;"895806461883936770";https://twitter.com/mionsgf/status/895806461883936770
mionsgf;2017-08-11 00:36;0;0;"its worth it wtc r probably the best stories ever written but u gotta enjoy that Slow";;;;"895806041534988289";https://twitter.com/mionsgf/status/895806041534988289
mionsgf;2017-08-11 00:35;0;3;"i was hooked on higu but it still took a year or so even though i wasnt that busy";;;;"895805870138736640";https://twitter.com/mionsgf/status/895805870138736640
mionsgf;2017-08-11 00:35;0;3;"im so happy wtc so long cuz u get to live in those worlds n come back 2 them even thruout life i kno im not the only 1 who took yrs to read";;;;"895805753893822464";https://twitter.com/mionsgf/status/895805753893822464
mionsgf;2017-08-11 00:34;0;7;"umineko is by far the most complex n ambitious work of literature ive ever come across it wouldnt work if it werent 200 hrs long";;;;"895805533659246596";https://twitter.com/mionsgf/status/895805533659246596
mionsgf;2017-08-11 00:33;0;0;"the pace picks up MASSIVELY in chiru q arcs are meant 2 be slow ya kno";;;;"895805320173424640";https://twitter.com/mionsgf/status/895805320173424640
mionsgf;2017-08-11 00:32;0;0;"still yea i mean the point is that its Long n takes a lot of time n attention so if that doesnt suit u.. higu is pretty dif";;;;"895805156855566336";https://twitter.com/mionsgf/status/895805156855566336
mionsgf;2017-08-11 00:32;0;0;"it is super engaging after the 1st bit";;;;"895805016866422784";https://twitter.com/mionsgf/status/895805016866422784
mionsgf;2017-08-11 00:31;0;0;"yea i get u icr if i said already but it took me 2 yrs 2 read umi.. usually i would never manage a series so long but the vast majority of";;;;"895804949845639168";https://twitter.com/mionsgf/status/895804949845639168
mionsgf;2017-08-11 00:30;0;0;"yes technically it's an accompaniment but it's also rly long and the ost is 1 of the best thingz";;;;"895804509540106241";https://twitter.com/mionsgf/status/895804509540106241
mionsgf;2017-08-11 00:21;0;1;"lee is nrly at chiru pic.twitter.com/FOgoIcjo9a";;;;"895802281337204736";https://twitter.com/mionsgf/status/895802281337204736
mionsgf;2017-08-11 00:17;0;0;"literally me";;;;"895801422922432513";https://twitter.com/mionsgf/status/895801422922432513
mionsgf;2017-08-11 00:17;0;0;"every time i have 2 tell my mum how much money she owes me from basic shit like food but its london so its £56522577742421457";;;;"895801354006007811";https://twitter.com/mionsgf/status/895801354006007811
mionsgf;2017-08-11 00:14;0;0;"pic.twitter.com/nRmVODAAnM";;;;"895800517963636736";https://twitter.com/mionsgf/status/895800517963636736
mionsgf;2017-08-11 00:14;0;1;"mion sonozaki and jessica ushiromiya: Inheriting loadsa money and power and could both kill you with one hand";;;;"895800436610826240";https://twitter.com/mionsgf/status/895800436610826240
mionsgf;2017-08-11 00:12;0;0;"@lambiadelta have you seen this incredibly woke image";;@lambiadelta;;"895800079478661120";https://twitter.com/mionsgf/status/895800079478661120
mionsgf;2017-08-11 00:12;0;1;"we are all love jessica ushiromiya";;;;"895799979993780224";https://twitter.com/mionsgf/status/895799979993780224
mionsgf;2017-08-11 00:11;0;1;"pic.twitter.com/QO7Emkrlu3";;;;"895799916995395584";https://twitter.com/mionsgf/status/895799916995395584
mionsgf;2017-08-11 00:11;0;4;"i love jessica ushiromiya";;;;"895799701588586497";https://twitter.com/mionsgf/status/895799701588586497
mionsgf;2017-08-11 00:04;0;0;"u are dragging him thru the mud";;;;"895797959845175297";https://twitter.com/mionsgf/status/895797959845175297
mionsgf;2017-08-11 00:03;0;1;"UHHH..";;;;"895797828571856897";https://twitter.com/mionsgf/status/895797828571856897
mionsgf;2017-08-11 00:03;0;2;"do u ever rmb that eberyome in higurashi is alive :) tag your cast goals";;;;"895797731305717760";https://twitter.com/mionsgf/status/895797731305717760
mionsgf;2017-08-10 23:59;0;2;"do u ever just rmb that like every1 in umineko is dead.. such a mood";;;;"895796833343111169";https://twitter.com/mionsgf/status/895796833343111169
mionsgf;2017-08-10 23:56;0;1;"lee building their internet fame empire of of stealing my jokes";;;;"895796092704608256";https://twitter.com/mionsgf/status/895796092704608256
mionsgf;2017-08-10 23:54;0;0;"@lambiadelta";;@lambiadelta;;"895795469766594560";https://twitter.com/mionsgf/status/895795469766594560
mionsgf;2017-08-10 23:53;1;2;"https:// youtu.be/D9ZXCvRj3Q0 george in ep4 when he chooses to sacrifice his whole family and save shannon";;;;"895795376208392192";https://twitter.com/mionsgf/status/895795376208392192
mionsgf;2017-08-10 23:52;0;2;"having no washing up to do is the sexist feeling evr";;;;"895795055147057152";https://twitter.com/mionsgf/status/895795055147057152
mionsgf;2017-08-10 23:52;0;1;"im george in ep4 but me n mion";;;;"895795007042486273";https://twitter.com/mionsgf/status/895795007042486273
mionsgf;2017-08-10 23:52;0;1;"my dinner burned while i wss georgeposting";;;;"895794902830690305";https://twitter.com/mionsgf/status/895794902830690305
mionsgf;2017-08-10 23:50;0;0;"rmb me when ur twtfamous actualy ur already tumble famoys";;;;"895794468019896321";https://twitter.com/mionsgf/status/895794468019896321
mionsgf;2017-08-10 23:49;0;3;"george in ep4 is woke cuz he realises his whole family is shit";;;;"895794355516166145";https://twitter.com/mionsgf/status/895794355516166145
mionsgf;2017-08-10 23:49;0;2;"tht pic thts lik Wpuld a snake wear trousers like this (pic of snake a trousets) or this (pic of george) is george sacrificibg his whole fam";;;;"895794146501373952";https://twitter.com/mionsgf/status/895794146501373952
mionsgf;2017-08-10 23:48;1;1;"i love hpw ur acc has just become george hateposting";;;;"895793908399169536";https://twitter.com/mionsgf/status/895793908399169536
mionsgf;2017-08-10 20:22;0;0;"https://www. youtube.com/watch?v=-HJKJx QRmgc … pic.twitter.com/XNzhvSBM3R";;;;"895742079019532289";https://twitter.com/mionsgf/status/895742079019532289
mionsgf;2017-08-10 20:14;0;0;"do btob spend all their free time streaming they love us sm.";;;;"895740180597940224";https://twitter.com/mionsgf/status/895740180597940224
mionsgf;2017-08-10 20:13;0;0;"this album is years long";;;;"895739838451695616";https://twitter.com/mionsgf/status/895739838451695616
mionsgf;2017-08-10 20:06;0;0;"not like all kinds of shit Doesnt happen within it too but. maybe that would be less of a problem if they had the resources 2 function";;;;"895738173225041921";https://twitter.com/mionsgf/status/895738173225041921
mionsgf;2017-08-10 20:05;0;0;"i hope it is obv wgen i criticize the nhs i mean like.. what yhe governments let it become n not ppl working within it";;;;"895737944971104257";https://twitter.com/mionsgf/status/895737944971104257
mionsgf;2017-08-10 20:01;0;0;"the nhs is the uks biggest inside joke";;;;"895736922492063744";https://twitter.com/mionsgf/status/895736922492063744
mionsgf;2017-08-10 19:59;0;0;"yes!!";;;;"895736370483916801";https://twitter.com/mionsgf/status/895736370483916801
mionsgf;2017-08-10 19:58;0;1;"its not that deep jessica";;;;"895736100651716608";https://twitter.com/mionsgf/status/895736100651716608
mionsgf;2017-08-10 19:57;0;1;"LITERALLYFGDFY problek solved";;;;"895735944610971648";https://twitter.com/mionsgf/status/895735944610971648
mionsgf;2017-08-10 19:55;0;1;"TH";;;;"895735393672462338";https://twitter.com/mionsgf/status/895735393672462338
mionsgf;2017-08-10 19:52;0;0;"listening 2 uverworlds new album ive transcended. my body and depression";;;;"895734703604600832";https://twitter.com/mionsgf/status/895734703604600832
mionsgf;2017-08-10 19:52;0;0;"lrt anyway.... i hope the club are having a good day";;;;"895734591713148928";https://twitter.com/mionsgf/status/895734591713148928
mionsgf;2017-08-10 18:51;0;0;"i love them sfm seein them live is on my bucket list";;;;"895719272768573443";https://twitter.com/mionsgf/status/895719272768573443
mionsgf;2017-08-10 18:43;0;0;"they became my fave band a yr ago when i caught up w their discog cuz their 3 most recent albums b4 this one r all incredible";;;;"895717372568494084";https://twitter.com/mionsgf/status/895717372568494084
mionsgf;2017-08-10 18:43;0;1;"i shouldve known they were 2 keep yrs ago when i was watching their live perfs n their passion reminded me of btob";;;;"895717210911592449";https://twitter.com/mionsgf/status/895717210911592449
mionsgf;2017-08-10 18:42;0;1;"im just listeming to the old singles on uverworlds new album n im already so happy";;;;"895717033781972993";https://twitter.com/mionsgf/status/895717033781972993
mionsgf;2017-08-10 18:12;0;1;"goin out in the UK in just shorts is so unfamiliar.. global warming is wild";;;;"895709557086924800";https://twitter.com/mionsgf/status/895709557086924800
mionsgf;2017-08-10 18:12;0;1;"the age old adage.. ppl would not get so defensive over stuff if they werent aware on some level they were in the wrong";;;;"895709435120803840";https://twitter.com/mionsgf/status/895709435120803840
mionsgf;2017-08-10 18:06;0;0;"anyway Juice Time..";;;;"895707883903602688";https://twitter.com/mionsgf/status/895707883903602688
mionsgf;2017-08-10 18:05;0;1;"its so funny how ppl will crawl out of the woodworks to defend this shit guilty conscience much";;;;"895707708288102400";https://twitter.com/mionsgf/status/895707708288102400
mionsgf;2017-08-10 17:59;0;2;"100% tired of having to deal with gross people on this website";;;;"895706071876214784";https://twitter.com/mionsgf/status/895706071876214784
mionsgf;2017-08-10 17:58;0;2;"and you havent read this READ IT*";;;;"895705939155836931";https://twitter.com/mionsgf/status/895705939155836931
mionsgf;2017-08-10 17:58;0;2;"if you follow me and you havent read this and unfollow if you dont fit the criteria. block if were mutuals http:// listography.com/cottondrifting /byf/4917014090 …";;;;"895705870578974721";https://twitter.com/mionsgf/status/895705870578974721
mionsgf;2017-08-10 17:56;0;1;"luckily it wasnt a mutual but. anyway its in my byf if you disagree w me on this youre not welcome to follow me fuck off";;;;"895705453417639937";https://twitter.com/mionsgf/status/895705453417639937
mionsgf;2017-08-10 17:55;0;1;"always good when someone comes into my mentions arguing abt this so i know who to block";;;;"895705220466057217";https://twitter.com/mionsgf/status/895705220466057217
mionsgf;2017-08-10 17:45;0;1;"but thats enough of that for today i need to go to the shop and buy some fucken juice";;;;"895702628616851457";https://twitter.com/mionsgf/status/895702628616851457
mionsgf;2017-08-10 17:43;0;2;"(same old crap here about Real adults using this normalisation in fandom settings then preying on Real kids)";;;;"895702196234448896";https://twitter.com/mionsgf/status/895702196234448896
mionsgf;2017-08-10 17:42;0;2;"very young ppl r being taught smth else entirely when they see this shit but whats new";;;;"895701977321046017";https://twitter.com/mionsgf/status/895701977321046017
mionsgf;2017-08-10 17:42;0;3;"but i feel like ppl forget thats what relationships are good relationships are ones where you help each other grow and its so scary";;;;"895701853022892032";https://twitter.com/mionsgf/status/895701853022892032
mionsgf;2017-08-10 17:40;0;3;"and anyone who choicably goes for that shit? predator! taking advantage of someones vulnerability! its not complicated";;;;"895701336989339648";https://twitter.com/mionsgf/status/895701336989339648
mionsgf;2017-08-10 17:40;0;3;"what does some1 in their mid-20s have to gain in personal growth from a r/s w someone who is basically a child? nothing!";;;;"895701310892322818";https://twitter.com/mionsgf/status/895701310892322818
mionsgf;2017-08-10 17:34;0;5;"like its sad n worrying ppl do not realise how predatory this shit is";;;;"895699837798273024";https://twitter.com/mionsgf/status/895699837798273024
mionsgf;2017-08-10 17:33;0;4;"r we just gnna ignore the huge difference in maturity + life experience u can get btwn 2 ppl even one year apart at that stage of their life";;;;"895699693040279552";https://twitter.com/mionsgf/status/895699693040279552
mionsgf;2017-08-10 17:33;0;6;"ppl who rly think a 7 yr age gap w the younger person bein 18 is a healthy r/s need 2 get off the internet for a bit n contextualize lbr";;;;"895699554766659584";https://twitter.com/mionsgf/status/895699554766659584
mionsgf;2017-08-10 17:30;0;1;"holding themselves accountable for stuff like not exposing minors to p*rn etc etc but obv its all relative";;;;"895699006659203072";https://twitter.com/mionsgf/status/895699006659203072
mionsgf;2017-08-10 17:30;0;1;"oh yea i know of the general adults not bein comfortable interacting w kids thing i dont rly follow it personally ill always be for adults";;;;"895698786940571649";https://twitter.com/mionsgf/status/895698786940571649
mionsgf;2017-08-10 17:26;0;1;"o 18/25 isnt ok though dvjjd idk which ppl use the minor argument its age gaps that matter";;;;"895697911480188928";https://twitter.com/mionsgf/status/895697911480188928
mionsgf;2017-08-10 17:24;0;0;"theyre so strong and amazing and i love them";;;;"895697275061755904";https://twitter.com/mionsgf/status/895697275061755904
mionsgf;2017-08-10 17:23;0;0;"that through until. you know what";;;;"895697200453472256";https://twitter.com/mionsgf/status/895697200453472256
mionsgf;2017-08-10 17:23;0;0;"mion and rena seeing how keiichi's acting and vowing together not to let what happened w satoshi happen w him no matter what and following";;;;"895697151594024961";https://twitter.com/mionsgf/status/895697151594024961
mionsgf;2017-08-10 17:21;0;1;"anyway keimiirena are married or watever and in love and happy together now";;;;"895696706188320771";https://twitter.com/mionsgf/status/895696706188320771
mionsgf;2017-08-10 17:20;0;0;"o what happened..";;;;"895696255011180544";https://twitter.com/mionsgf/status/895696255011180544
mionsgf;2017-08-10 17:18;0;0;"which..";;;;"895695937166823424";https://twitter.com/mionsgf/status/895695937166823424
mionsgf;2017-08-10 17:18;4;7;"nononono pic.twitter.com/PaHgJ0aSJx";;;;"895695889909657600";https://twitter.com/mionsgf/status/895695889909657600
mionsgf;2017-08-10 17:17;0;0;"rena and mion cared about keiichi sm they did everything to help him even though he scared and hurt them sm i";;;;"895695590096502786";https://twitter.com/mionsgf/status/895695590096502786
mionsgf;2017-08-10 17:06;0;0;"they are really like. hard to get through they took such a toll on me lmfao but the answer arcs r life-affirming enough to make up 4 it";;;;"895692811395358723";https://twitter.com/mionsgf/status/895692811395358723
mionsgf;2017-08-10 17:05;0;1;"im watching that right now im not coping ome!";;;;"895692564816437254";https://twitter.com/mionsgf/status/895692564816437254
mionsgf;2017-08-10 17:04;0;0;"the higurashi q arcs are literally so upsetting";;;;"895692424433078272";https://twitter.com/mionsgf/status/895692424433078272
mionsgf;2017-08-10 17:02;0;0;"i was going to say onikakushi never gets any less painful but rly it gets worse";;;;"895691802979835904";https://twitter.com/mionsgf/status/895691802979835904
mionsgf;2017-08-10 17:01;0;1;"house trying to nurse him later on. im fine and not about to burst into tears";;;;"895691580908220416";https://twitter.com/mionsgf/status/895691580908220416
mionsgf;2017-08-10 17:01;0;1;"when keiichi basically chokes mion and screams in her face theyre not friends and slams renas hands in the door and theyre still at his";;;;"895691493175955457";https://twitter.com/mionsgf/status/895691493175955457
mionsgf;2017-08-10 16:59;0;4;"when you read onikakushi again and see how desperately mion and rena were trying to get through to keiichi right until the end ghhhhhh";;;;"895690958716764160";https://twitter.com/mionsgf/status/895690958716764160
mionsgf;2017-08-10 16:20;0;2;"https:// youtu.be/LNjFGuxcokw";;;;"895681268037427200";https://twitter.com/mionsgf/status/895681268037427200
mionsgf;2017-08-10 03:14;0;0;"fuck amakusa";;;;"895483490535395328";https://twitter.com/mionsgf/status/895483490535395328
mionsgf;2017-08-09 23:31;0;0;"ok gn pic.twitter.com/9jE73y6gAa";;;;"895427247225614336";https://twitter.com/mionsgf/status/895427247225614336
mionsgf;2017-08-09 23:30;0;0;"marry me pic.twitter.com/4ikamas0tO";;;;"895427182524121088";https://twitter.com/mionsgf/status/895427182524121088
mionsgf;2017-08-09 23:27;0;0;"lrt i love her";;;;"895426350500069376";https://twitter.com/mionsgf/status/895426350500069376
mionsgf;2017-08-09 23:26;0;0;"i try n sleep now";;;;"895426074888351744";https://twitter.com/mionsgf/status/895426074888351744
mionsgf;2017-08-09 23:20;0;0;"lee mentioned liking him and it got me tginking about bad taste (i love you) (i dont love amakusa)";;;;"895424691896283137";https://twitter.com/mionsgf/status/895424691896283137
mionsgf;2017-08-09 22:43;0;0;"i bet august liked amakusa";;;;"895415366570004480";https://twitter.com/mionsgf/status/895415366570004480
mionsgf;2017-08-09 22:43;0;0;"lrtghurdyu @me next time";;@me;;"895415197795586048";https://twitter.com/mionsgf/status/895415197795586048
mionsgf;2017-08-09 22:42;0;0;"battler found dead in miami";;;;"895415009018347521";https://twitter.com/mionsgf/status/895415009018347521
mionsgf;2017-08-09 22:41;0;0;"pic.twitter.com/WZnYrLLV9J";;;;"895414756298903552";https://twitter.com/mionsgf/status/895414756298903552
mionsgf;2017-08-09 22:16;0;0;"oh no";;;;"895408495398457345";https://twitter.com/mionsgf/status/895408495398457345
mionsgf;2017-08-09 21:39;0;1;"i am 100% certain that i feel more love in my heart when i look @mions face than any married straight couple ever has";;@mions;;"895399284639662081";https://twitter.com/mionsgf/status/895399284639662081
mionsgf;2017-08-09 21:35;0;0;"when i write reader x mion n its just abt her hugging me";;;;"895398112428265473";https://twitter.com/mionsgf/status/895398112428265473
mionsgf;2017-08-09 21:34;0;1;"i wish to spend the rest pf my life in your arms pic.twitter.com/oUB4AGdroi";;;;"895397951257882624";https://twitter.com/mionsgf/status/895397951257882624
mionsgf;2017-08-09 19:44;0;1;"https:// youtu.be/awV-baSDeGg !!!";;;;"895370131798446080";https://twitter.com/mionsgf/status/895370131798446080
mionsgf;2017-08-09 19:40;21;21;"happy birthday 2 the best cast of all time pic.twitter.com/pm44P1f83n";;;;"895369122497822721";https://twitter.com/mionsgf/status/895369122497822721
mionsgf;2017-08-09 18:44;0;0;"jk probably i have 2 v nearly finished tho";;;;"895355010724368384";https://twitter.com/mionsgf/status/895355010724368384
mionsgf;2017-08-09 18:43;0;0;"wat if i put up a higu fic 2day for bants";;;;"895354939312144384";https://twitter.com/mionsgf/status/895354939312144384
mionsgf;2017-08-09 18:41;0;1;"i hate cars . for a buncg of reasons its not that deep but i dont ever wanna have 2 own one. or learn 2 drive preferably but idk";;;;"895354457415962625";https://twitter.com/mionsgf/status/895354457415962625
mionsgf;2017-08-09 18:40;0;0;"everything is laid out like driving > walking n ppl drive places u could walk to in 15 min its so dif from my experience";;;;"895354028921585664";https://twitter.com/mionsgf/status/895354028921585664
mionsgf;2017-08-09 18:36;0;0;"america is so like. car-centric its rly jarring";;;;"895353014424395777";https://twitter.com/mionsgf/status/895353014424395777
mionsgf;2017-08-09 18:35;0;0;"wait my american family do but we dont talk abt them";;;;"895352938100658176";https://twitter.com/mionsgf/status/895352938100658176
mionsgf;2017-08-09 18:35;0;1;"literally 1 person in my whole extended family of like 25 ppl drives";;;;"895352882060460032";https://twitter.com/mionsgf/status/895352882060460032
mionsgf;2017-08-09 18:34;0;0;"we cant usually go places like this cuz my parents dont drive but my uncle who does is there rn.. i wanna go *__*";;;;"895352724627361804";https://twitter.com/mionsgf/status/895352724627361804
mionsgf;2017-08-09 18:34;0;4;"mum sent me this vid of some mountains they went 2 today near where we live pic.twitter.com/2bHdp2gZX8";;;;"895352652766351372";https://twitter.com/mionsgf/status/895352652766351372
mionsgf;2017-08-09 18:26;0;1;"you like characters? like stories? like emotions? like reaching internal peace and contentment with the fact that you exist? we got it";;;;"895350568625090560";https://twitter.com/mionsgf/status/895350568625090560
mionsgf;2017-08-09 18:24;1;3;"hey its the 15th anni of the release of the story that changed my life forever n reminds me how to be ok and happy every day read it https:// twitter.com/mionsgf/status /887031517758857216 …";;;;"895350211672977408";https://twitter.com/mionsgf/status/895350211672977408
mionsgf;2017-08-09 18:24;0;0;"!!! https:// twitter.com/mionsgf/status /882273091262533632 …";;;;"895350004600242176";https://twitter.com/mionsgf/status/895350004600242176
mionsgf;2017-08-09 18:19;0;1;"im home for the day and soaking wet s/o to london for always knowin how 2 show us a good summer";;;;"895348824801251331";https://twitter.com/mionsgf/status/895348824801251331
mionsgf;2017-08-09 14:15;1;3;"HAPPY 15TH 2 MY FAVE SERIES OF ALL TIME AND 10TH 2 MY SECOND";;;;"895287362405773312";https://twitter.com/mionsgf/status/895287362405773312
mionsgf;2017-08-09 05:35;0;0;"i love you pic.twitter.com/k7WKcHCtGq";;;;"895156611148337153";https://twitter.com/mionsgf/status/895156611148337153
mionsgf;2017-08-09 05:34;0;1;"wow queen pic.twitter.com/n8ywHSfoWi";;;;"895156345678286848";https://twitter.com/mionsgf/status/895156345678286848
mionsgf;2017-08-09 05:34;0;2;"im a furry now pic.twitter.com/rfP1b1VhaM";;;;"895156222151847936";https://twitter.com/mionsgf/status/895156222151847936
mionsgf;2017-08-09 05:20;0;0;"y o u pic.twitter.com/O4ZrpfVwzz";;;;"895152725100515328";https://twitter.com/mionsgf/status/895152725100515328
mionsgf;2017-08-09 05:20;0;0;"harold theyre pic.twitter.com/xkVPnVxufb";;;;"895152667152060416";https://twitter.com/mionsgf/status/895152667152060416
mionsgf;2017-08-09 05:03;0;2;"pic.twitter.com/9tjAj5DzzC";;;;"895148606281453568";https://twitter.com/mionsgf/status/895148606281453568
mionsgf;2017-08-09 05:01;0;0;"join me in my capping endeavours pic.twitter.com/Noe4L5otlM";;;;"895148065627279360";https://twitter.com/mionsgf/status/895148065627279360
mionsgf;2017-08-09 04:45;0;0;"talking abt keimiirena pic.twitter.com/2a9SIvB4Cv";;;;"895144004945367040";https://twitter.com/mionsgf/status/895144004945367040
mionsgf;2017-08-09 04:45;0;1;"woke and wokenness A novel pic.twitter.com/89XXweQlJ3";;;;"895143904479150081";https://twitter.com/mionsgf/status/895143904479150081
mionsgf;2017-08-09 04:41;0;1;"sunny Woke";;;;"895142892397875200";https://twitter.com/mionsgf/status/895142892397875200
mionsgf;2017-08-09 04:32;0;0;"i hav no idea what svene that iz but word";;;;"895140756817629184";https://twitter.com/mionsgf/status/895140756817629184
mionsgf;2017-08-09 04:28;0;0;":)";;;;"895139749740072961";https://twitter.com/mionsgf/status/895139749740072961
mionsgf;2017-08-09 03:35;0;0;"breeges scotland crashcourse";;;;"895126432703279105";https://twitter.com/mionsgf/status/895126432703279105
mionsgf;2017-08-09 03:35;0;0;"NNNNNNNN";;;;"895126312842670080";https://twitter.com/mionsgf/status/895126312842670080
mionsgf;2017-08-09 03:34;0;1;"keiichi would just make really obscure slightly frightening shitposts n nbd knows how seriously to take him";;;;"895126156923502593";https://twitter.com/mionsgf/status/895126156923502593
