username;date;retweets;favorites;text;geo;mentions;hashtags;id;permalink
SinBinTBirds;2017-10-21 00:41;0;1;"tempers are starting to flare as Chase Balisy dropped the gloves with Colby Cave";;;;"921536819954638848";https://twitter.com/SinBinTBirds/status/921536819954638848
SinBinTBirds;2017-10-21 00:35;0;0;"Austin Czarnik now makes it 3-0 for the Bruins";;;;"921535319446605824";https://twitter.com/SinBinTBirds/status/921535319446605824
SinBinTBirds;2017-10-21 00:29;0;0;"Danton Heinen scores another shorthanded goal for the Bruins its 2-0";;;;"921533884172521473";https://twitter.com/SinBinTBirds/status/921533884172521473
SinBinTBirds;2017-10-21 00:28;0;1;"Anton Blidh gets called for high sticking with 7:01 remaining in the second for the Bruins Thunderbirds on the power play";;;;"921533557188775937";https://twitter.com/SinBinTBirds/status/921533557188775937
SinBinTBirds;2017-10-21 00:20;0;0;"The Thunderbirds will now have a 5 on 3 power play for 23 seconds as Matt Grzelcyk goes for high sticking";;;;"921531493578608640";https://twitter.com/SinBinTBirds/status/921531493578608640
SinBinTBirds;2017-10-21 00:17;0;0;"and just like that the Bruins get a shorthanded goal from Justin Szwarz as Danton Heinen set Szwarz up for the open net its 1-0 Bruins";;;;"921530829532291074";https://twitter.com/SinBinTBirds/status/921530829532291074
SinBinTBirds;2017-10-21 00:16;0;0;"Justin Hickman will receive a penalty for the Bruins for hooking at 7:20";;;;"921530645146415107";https://twitter.com/SinBinTBirds/status/921530645146415107
SinBinTBirds;2017-10-21 00:13;0;0;"yea I hear ya";;;;"921529913391411201";https://twitter.com/SinBinTBirds/status/921529913391411201
SinBinTBirds;2017-10-21 00:08;0;0;"I find it very weird the refs are letting them play tonight";;;;"921528544664137728";https://twitter.com/SinBinTBirds/status/921528544664137728
SinBinTBirds;2017-10-21 00:03;0;0;"Thunderbirds Chase Balisy will receive a penalty 19 seconds into the second period for slashing";;;;"921527393927467008";https://twitter.com/SinBinTBirds/status/921527393927467008
SinBinTBirds;2017-10-21 00:02;0;0;"second period underway";;;;"921527143032590336";https://twitter.com/SinBinTBirds/status/921527143032590336
SinBinTBirds;2017-10-20 23:43;0;0;"End of one period no score SOG T-Birds 8 Bruins 6";;;;"921522276545253377";https://twitter.com/SinBinTBirds/status/921522276545253377
SinBinTBirds;2017-10-20 23:37;0;0;"Justin Swarz shorthanded opportunity for the Bruins but hit the post";;;;"921520864620892160";https://twitter.com/SinBinTBirds/status/921520864620892160
SinBinTBirds;2017-10-20 23:36;0;1;"Thunderbirds will get another power play opportunity as Austin Czarnik heads to the box for Providence for slashing at 15:34";;;;"921520416379887616";https://twitter.com/SinBinTBirds/status/921520416379887616
SinBinTBirds;2017-10-20 23:31;0;0;"6:16 remaining in the first no score both teams have gotten scoring opportunities";;;;"921519198819569664";https://twitter.com/SinBinTBirds/status/921519198819569664
SinBinTBirds;2017-10-20 23:13;0;0;"We have the games first penalty 44 seconds in as Tommy Cross goes to the box for Providence for slashing";;;;"921514741289377793";https://twitter.com/SinBinTBirds/status/921514741289377793
SinBinTBirds;2017-10-20 23:11;0;0;"Game underway";;;;"921514281715273728";https://twitter.com/SinBinTBirds/status/921514281715273728
SinBinTBirds;2017-10-20 23:00;1;0;"Tonights Game officials are referee Alex Garon and Michael Mullen and Linesman Mike Baker and Kyle Richetelle";;;;"921511594093432832";https://twitter.com/SinBinTBirds/status/921511594093432832
SinBinTBirds;2017-10-20 22:58;2;0;"starting line up for the Springfield Thunderbirds D Josh Brown D Mike Downing F Jayce Hawryluk F Chase Balisy F Dryden Hunt G Samuel Montembeault";;;;"921511070887481344";https://twitter.com/SinBinTBirds/status/921511070887481344
SinBinTBirds;2017-10-20 22:57;1;0;"starting line up for the Providence Bruins D Tommy Cross D Jeremy Lauzon F Austin Czarnik F Jordan Szwarz F Danton Heinen G Jordan Binnington";;;;"921510736131739653";https://twitter.com/SinBinTBirds/status/921510736131739653
SinBinTBirds;2017-10-20 22:49;1;0;"scratches tonight for the Providence Bruins Connor Clifton Zach Senyshyn Sena Acolatse Adam Payerl Colton Hargrove Rob O'Gara";;;;"921508797562195968";https://twitter.com/SinBinTBirds/status/921508797562195968
SinBinTBirds;2017-10-20 22:48;1;0;"scratches tonight for the Springfield Thunderbirds Henrik Haapla Matt MacKenzie Francois Beauchmein";;;;"921508483513581568";https://twitter.com/SinBinTBirds/status/921508483513581568
SinBinTBirds;2017-10-20 21:40;0;1;"We are here tonight in Springfield as the @ThunderbirdsAHL take on the @AHLBruins puck will drop at 7:05 p.m.";;@ThunderbirdsAHL @AHLBruins;;"921491372066164736";https://twitter.com/SinBinTBirds/status/921491372066164736
SinBinTBirds;2017-10-08 15:45;0;0;"A tough loss for the Thunderbirds last night in Providence @AHLBruins here is our story http:// thesinbin.net/bruins-prevail -in-home-opener-against-thunderbirds/ …";;@AHLBruins;;"917053433160634368";https://twitter.com/SinBinTBirds/status/917053433160634368
SinBinTBirds;2017-10-06 01:02;0;1;"Former @AHLBruins Jake DeBrusk scored his first NHL goal tonight";;@AHLBruins;;"916106475877163008";https://twitter.com/SinBinTBirds/status/916106475877163008
SinBinTBirds;2017-09-30 01:23;0;0;"SOG Thunderbirds 28 Bruins 28";;;;"913937235589914624";https://twitter.com/SinBinTBirds/status/913937235589914624
SinBinTBirds;2017-09-30 01:22;0;1;"Thunderbirds win 2-1 !! These two teams will meet again tomorrow night in Providence";;;;"913937183186280448";https://twitter.com/SinBinTBirds/status/913937183186280448
SinBinTBirds;2017-09-30 00:47;0;0;"Third Period Underway";;;;"913928285104607232";https://twitter.com/SinBinTBirds/status/913928285104607232
SinBinTBirds;2017-09-30 00:28;0;0;"End of two periods Thunderbirds 2 Bruins 1 SOG Thunderbirds 21 Bruins 21";;;;"913923565015138306";https://twitter.com/SinBinTBirds/status/913923565015138306
SinBinTBirds;2017-09-30 00:25;0;0;"Providence gets on the board with 1:48 remaining its 2-1";;;;"913922795607871489";https://twitter.com/SinBinTBirds/status/913922795607871489
SinBinTBirds;2017-09-29 23:56;0;0;"second period underway";;;;"913915396817915905";https://twitter.com/SinBinTBirds/status/913915396817915905
SinBinTBirds;2017-09-29 23:37;0;1;"End of one period Thunderbirds 2 Bruins 0 SOG Thunderbirds 12 Bruins 10";;;;"913910727295082501";https://twitter.com/SinBinTBirds/status/913910727295082501
SinBinTBirds;2017-09-29 23:25;0;0;"Chase Balisy now makes it 2-0 for the Thunderbirds";;;;"913907501640404998";https://twitter.com/SinBinTBirds/status/913907501640404998
SinBinTBirds;2017-09-29 23:24;0;0;"goal was scored by Curtis Valk";;;;"913907268097396736";https://twitter.com/SinBinTBirds/status/913907268097396736
SinBinTBirds;2017-09-29 23:23;0;0;"Thunderbirds get on the board its 1-0";;;;"913907020910252033";https://twitter.com/SinBinTBirds/status/913907020910252033
SinBinTBirds;2017-09-29 23:19;0;0;"11:13 remaining no score a little four-on-four hockey and Providence will get a 58 second power play";;;;"913906096670220288";https://twitter.com/SinBinTBirds/status/913906096670220288
SinBinTBirds;2017-09-29 23:03;0;0;"First period underway";;;;"913901982112501765";https://twitter.com/SinBinTBirds/status/913901982112501765
SinBinTBirds;2017-09-29 22:59;0;0;"Starting Line Up for the Thunderbirds D Downing D Scarlett LW Horvat C Lammikko RW Beachemein G Montembeault";;;;"913901158879637504";https://twitter.com/SinBinTBirds/status/913901158879637504
SinBinTBirds;2017-09-29 22:56;0;0;"Starting line up for the Providence Bruins D Blujus D Marshall LW Hickman C Fitzgerald RW Blidh G Carruth";;;;"913900410259279873";https://twitter.com/SinBinTBirds/status/913900410259279873
SinBinTBirds;2017-09-29 22:38;0;0;"Sam Montembeault to get the start in goal for the Thunderbirds while Mac Carruth will get the start in goal for the Providence @AHLBruins";;@AHLBruins;;"913895673573060611";https://twitter.com/SinBinTBirds/status/913895673573060611
SinBinTBirds;2017-09-29 22:10;0;0;"Less than an hour away from the puck drop here in Springfield";;;;"913888665318850560";https://twitter.com/SinBinTBirds/status/913888665318850560
SinBinTBirds;2017-09-29 21:51;0;2;"never a bad seat to watch a game !!";;;;"913884062565244928";https://twitter.com/SinBinTBirds/status/913884062565244928
SinBinTBirds;2017-09-29 17:43;0;0;"no sir it isn't lol";;;;"913821649685934081";https://twitter.com/SinBinTBirds/status/913821649685934081
SinBinTBirds;2017-09-29 17:34;3;0;"Our story on an historic day in Portland http:// thesinbin.net/portland-echl- franchise-has-a-name/ …";;;;"913819195854479361";https://twitter.com/SinBinTBirds/status/913819195854479361
SinBinTBirds;2017-09-29 15:57;0;2;"The Thunderbirds take on the Providence Bruins in preseason action tonight at the @MM_Center . The puck will drop at 7:05 p.m.";;@MM_Center;;"913794843574448130";https://twitter.com/SinBinTBirds/status/913794843574448130
SinBinTBirds;2017-09-08 19:38;1;1;"Our story on Joe Whitney http:// thesinbin.net/wolf-pack-add- veteran-forward-to-17-18-roster/ …";;;;"906240253828182017";https://twitter.com/SinBinTBirds/status/906240253828182017
SinBinTBirds;2017-09-06 22:04;0;0;"Who was excited about the news of David Ortiz coming to Springfield on November 11";;;;"905552213141061634";https://twitter.com/SinBinTBirds/status/905552213141061634
SinBinTBirds;2017-09-01 17:28;2;3;"Please give this a read folks our team is truly dedicated to give great coverage of hockey http:// thesinbin.net/letter-from-th e-editors-a-heartfelt-thank-you-to-our-readers/ …";;;;"903670821515907073";https://twitter.com/SinBinTBirds/status/903670821515907073
SinBinTBirds;2017-09-01 17:22;2;4;"Look forward to bringing coverage of Springfield Thunderbirds hockey during the 2017-18 season.";;;;"903669419712413696";https://twitter.com/SinBinTBirds/status/903669419712413696
SinBinTBirds;2016-09-20 19:23;0;1;"Here is our story on the Springfield Thunderbirds http:// thesinbin.net/getting-to-kno w-the-springfield-thunderbirds/ …";;;;"778313625626894341";https://twitter.com/SinBinTBirds/status/778313625626894341
SinBinTBirds;2016-09-07 02:08;0;0;"Fans we want to know how excited you are about the hockey season starting soon !!";;;;"773342030181310465";https://twitter.com/SinBinTBirds/status/773342030181310465
SinBinTBirds;2016-08-22 19:31;0;0;"The AHL schedule has been released what do you fans think of the schedule ??";;;;"767806407336943616";https://twitter.com/SinBinTBirds/status/767806407336943616
SinBinTBirds;2016-08-22 18:47;1;1;"we cant wait to see the schedule and hockey fans please pass along about this fan page";;;;"767795434542727168";https://twitter.com/SinBinTBirds/status/767795434542727168
SinBinTBirds;2016-08-22 18:45;0;0;"we are all excited !!";;;;"767794933109497856";https://twitter.com/SinBinTBirds/status/767794933109497856
SinBinTBirds;2016-08-22 18:34;0;0;"only 26 more minutes !!";;;;"767792171021991937";https://twitter.com/SinBinTBirds/status/767792171021991937
SinBinTBirds;2016-08-22 18:32;0;0;"oh I am sorry we hope you look forward to the schedule release";;;;"767791678472220672";https://twitter.com/SinBinTBirds/status/767791678472220672
SinBinTBirds;2016-08-22 18:32;0;0;"we know you must be excited to see the schedule";;;;"767791578891096065";https://twitter.com/SinBinTBirds/status/767791578891096065
SinBinTBirds;2016-08-22 18:25;0;0;"It will be released at 3 pm today";;;;"767789893854650368";https://twitter.com/SinBinTBirds/status/767789893854650368
SinBinTBirds;2016-08-22 18:24;0;1;"The AHL schedule will be released this afternoon !! Whos excited for hockey to come back ?? Give us your opinion on the 2016-2017 schedule";;;;"767789481550307328";https://twitter.com/SinBinTBirds/status/767789481550307328
SinBinTBirds;2016-08-04 22:27;0;0;"Wolfpack Fans !! We would like to know what you are looking forward to about the 2016-2017 season in the AHL";;;;"761327826645704704";https://twitter.com/SinBinTBirds/status/761327826645704704
SinBinTBirds;2016-07-02 00:53;1;0;"Hockey fans we had the first day of free agency signing. Were you shocked about some of today's signings give us your feedback !!";;;;"749043331200614400";https://twitter.com/SinBinTBirds/status/749043331200614400
SinBinTBirds;2016-06-14 19:52;2;0;"Hey everyone here is our story on the new AHL team in Springfield, MA http:// thesinbin.net/ahl-hockey-ret urning-to-springfield-for-2016-2017-season/ …";;;;"742807008764628992";https://twitter.com/SinBinTBirds/status/742807008764628992
SinBinTBirds;2016-06-01 21:06;0;0;"Who do you think will win this years @CalderCup @monstershockey or the @TheHersheyBears";;@CalderCup @monstershockey @TheHersheyBears;;"738114482145267716";https://twitter.com/SinBinTBirds/status/738114482145267716
SinBinTBirds;2016-05-28 17:14;0;0;"We hope that all of you enjoy a great Memorial Day Weekend with family and friends !! Be Safe !!";;;;"736606674568552448";https://twitter.com/SinBinTBirds/status/736606674568552448
SinBinTBirds;2016-05-27 18:12;0;0;"@elminet35 Thank you for the Follow !!";;@elminet35;;"736258808369012736";https://twitter.com/SinBinTBirds/status/736258808369012736
SinBinTBirds;2016-05-23 20:15;0;0;"The AHL Board Of Governors have approve the sale of Portland moving to Springfield and will play at the Massmutual Center in 16-17";;;;"734840294303236096";https://twitter.com/SinBinTBirds/status/734840294303236096
SinBinTBirds;2016-05-18 01:19;0;0;"Hey everyone here is a story on the Portland Pirates hoping to make the ECHL in 2017-2018 http:// thesinbin.net/portland-hopes -to-be-in-the-echl-in-2017-2018/ …";;;;"732742450440220672";https://twitter.com/SinBinTBirds/status/732742450440220672
SinBinTBirds;2016-05-14 21:36;0;0;"@KatyLovesHockey Thank You For The Follow Katharine !! Please pass the word out about this page";;@KatyLovesHockey;;"731599128426385409";https://twitter.com/SinBinTBirds/status/731599128426385409
SinBinTBirds;2016-05-14 21:34;0;1;"@The_Hockey_Prof Thank you For The Follow Seth !! Please pass the word out on this page";;@The_Hockey_Prof;;"731598570332274690";https://twitter.com/SinBinTBirds/status/731598570332274690
SinBinTBirds;2016-05-14 00:45;0;0;"great to see some new followers join !! please pass the word out as we look forward to covering some AHL hockey this season";;;;"731284158484520960";https://twitter.com/SinBinTBirds/status/731284158484520960
SinBinTBirds;2016-05-13 20:53;0;0;"@TwoForBoarding Thank you for the follow !!";;@TwoForBoarding;;"731225771931512833";https://twitter.com/SinBinTBirds/status/731225771931512833
SinBinTBirds;2016-05-13 20:51;0;1;"@agutowski88 thank you for the follow !!";;@agutowski88;;"731225502099382276";https://twitter.com/SinBinTBirds/status/731225502099382276
SinBinTBirds;2016-05-13 20:51;0;0;"@bunkinator thank you very much for the follow !!";;@bunkinator;;"731225285736157184";https://twitter.com/SinBinTBirds/status/731225285736157184
SinBinTBirds;2016-05-13 20:50;0;1;"@kfisette24 thank you very much for the follow";;@kfisette24;;"731225116160475136";https://twitter.com/SinBinTBirds/status/731225116160475136
SinBinTBirds;2016-05-13 20:38;2;1;"Welcome to the new SinBinWolfPack Twitter Page as this season we will follow the Hartford Wolfpack and the new AHL Team in Springfield";;;;"731222137164431361";https://twitter.com/SinBinTBirds/status/731222137164431361