username;date;retweets;favorites;text;geo;mentions;hashtags;id;permalink
versacetaes;2017-11-03 01:55;0;0;"Uhhhh Like a boy, Foreign, Touchin Lovin, Marvin’s room, and trust issues";;;;"926266535408058369";https://twitter.com/versacetaes/status/926266535408058369
versacetaes;2017-11-03 01:54;0;1;"I COULD TELL! ICOULD TEL I COULD TELL CERTAIN PEOPLE DONT LIKE ME NO MO";;;;"926266289689018368";https://twitter.com/versacetaes/status/926266289689018368
versacetaes;2017-11-03 01:54;0;2;"DRIZZY DRAKE";;;;"926266177965273088";https://twitter.com/versacetaes/status/926266177965273088
versacetaes;2017-11-03 01:53;0;3;"WOAHHHHH TRUST ISSUES OHHHHHHhh";;;;"926266075813068801";https://twitter.com/versacetaes/status/926266075813068801
versacetaes;2017-11-03 01:53;0;1;"Which one. I’ve tweeted like 5";;;;"926266031089229825";https://twitter.com/versacetaes/status/926266031089229825
versacetaes;2017-11-03 01:52;0;2;"YOU JNOW WHAT I LIKEEEE OH YEAHHH OH YEAHHHH";;;;"926265847940661248";https://twitter.com/versacetaes/status/926265847940661248
versacetaes;2017-11-03 01:51;0;2;"SOMEBODY SHOULDA TOLD YA IM ON ONE";;;;"926265656168693760";https://twitter.com/versacetaes/status/926265656168693760
versacetaes;2017-11-03 01:51;0;2;"NOW FOR JUSTINS COVER OF TRUST ISSUES";;;;"926265541257392128";https://twitter.com/versacetaes/status/926265541257392128
versacetaes;2017-11-03 01:50;0;4;"ONCE YOU HAD THE BEST BOY YOU CANT DO BETTER. BABY IM THE BEST SO GOU CANT DO BETTER pic.twitter.com/FXGN5gc70n";;;;"926265183458156545";https://twitter.com/versacetaes/status/926265183458156545
versacetaes;2017-11-03 01:49;0;3;"Are you drunk right now? IM JUST SAYING YOU CANT DO BETTER";;;;"926265058916646913";https://twitter.com/versacetaes/status/926265058916646913
versacetaes;2017-11-03 01:49;0;3;"WHEN YOURE IN HER I KNOW IM IN YOUR HWAD";;;;"926265010736607232";https://twitter.com/versacetaes/status/926265010736607232
versacetaes;2017-11-03 01:48;0;4;"IVE BEEN UP FOR THREE DAYS. ADDERALL AND RED BULL. THIS CALL IS A MISTAKE. SOMETHING STRONG INTHIS WATER BOTTLE";;;;"926264863772442624";https://twitter.com/versacetaes/status/926264863772442624
versacetaes;2017-11-03 01:48;0;2;"Now we gon listen to jojo’s cover of Marvin’s room";;;;"926264750215806976";https://twitter.com/versacetaes/status/926264750215806976
versacetaes;2017-11-03 01:47;0;2;"HE LIKE IT WHEN I RIDE IT SLOOOOOOWWWWW";;;;"926264480350138369";https://twitter.com/versacetaes/status/926264480350138369
versacetaes;2017-11-03 01:47;0;3;"I CANT BEEATHE CUPCAKKE";;;;"926264438147072002";https://twitter.com/versacetaes/status/926264438147072002
versacetaes;2017-11-03 01:44;0;2;"iF YOURE TALKING BOUT SEX. GIRL YOU KNOW THAT I INVENTED";;;;"926263860721459200";https://twitter.com/versacetaes/status/926263860721459200
versacetaes;2017-11-03 01:43;0;1;"Okay I only listen to Justin’s part. Time for nicki and trey";;;;"926263651425591296";https://twitter.com/versacetaes/status/926263651425591296
versacetaes;2017-11-03 01:42;0;0;"MAKES ME FEEL SOME TUPE OF WAY. SHOUT OUT MIAMI FOR HAVING SO MANY FOREIGN BABES";;;;"926263395459899392";https://twitter.com/versacetaes/status/926263395459899392
versacetaes;2017-11-03 01:41;0;1;"WHATCHA MAD CANT HANDLE IT";;;;"926262981540724737";https://twitter.com/versacetaes/status/926262981540724737
versacetaes;2017-11-03 01:41;0;1;"WOULD THE RULES CHANGE UP OR WOULD THEY STILL APPLY!! IF IIII PLAYED YOU LIKE A TOYTYY SOMETIMES I WISH I COULD ACT LIKE A BOOOoooOoOOOUYY";;;;"926262931485949952";https://twitter.com/versacetaes/status/926262931485949952
versacetaes;2017-11-03 01:40;0;0;"WHY YOU GETTING MAD! WHY YOU MAD! CANT HANDLE IT!!";;;;"926262775222906880";https://twitter.com/versacetaes/status/926262775222906880
versacetaes;2017-11-03 01:39;0;1;"CCCCCCCC IIIIIIII AAAAAAA R A";;;;"926262609367613440";https://twitter.com/versacetaes/status/926262609367613440
versacetaes;2017-11-03 01:39;0;0;"Okay but lowkey when I was younger I had a crush on Ciara... especially in the like a boy mv. She’s so beautiful";;;;"926262505567002625";https://twitter.com/versacetaes/status/926262505567002625
versacetaes;2017-11-03 01:38;0;0;"Their minds... https:// twitter.com/oh_mes/status/ 926261372232531968 …";;;;"926262342622384128";https://twitter.com/versacetaes/status/926262342622384128
versacetaes;2017-11-03 01:38;0;1;"OOOO BIFJC https:// twitter.com/oh_mes/status/ 926261372232531968 …";;;;"926262198678065153";https://twitter.com/versacetaes/status/926262198678065153
versacetaes;2017-11-03 01:37;0;0;"WISH WE COULD SWITCH UP THE ROLES AND I COULD BE THERE. TELL YOU I LOVE YOU BUT WHEN YOU CALL I NEVER GET BACK. WOULD YOU ASK DUNB QUESTIONS";;;;"926262093195616261";https://twitter.com/versacetaes/status/926262093195616261
versacetaes;2017-11-03 01:36;0;0;"C. I!!! A!!! R A";;;;"926261886559051776";https://twitter.com/versacetaes/status/926261886559051776
versacetaes;2017-11-03 01:36;0;0;"LIKE A BOY BY CIARA...";;;;"926261851226177536";https://twitter.com/versacetaes/status/926261851226177536
versacetaes;2017-11-03 01:30;0;1;"I get all sad too. That keyshia song slaps";;;;"926260302303215621";https://twitter.com/versacetaes/status/926260302303215621
versacetaes;2017-11-03 01:30;0;1;"Everytime war of hormone comes on for like .7 seconds I think it’s keyshia cole";;;;"926260234594672640";https://twitter.com/versacetaes/status/926260234594672640
versacetaes;2017-11-03 01:29;0;0;"TOUCH THE SKY WITH ME";;;;"926260054457643008";https://twitter.com/versacetaes/status/926260054457643008
versacetaes;2017-11-03 01:28;0;0;"How that taste is one of Kehlani’s best songs";;;;"926259668900462592";https://twitter.com/versacetaes/status/926259668900462592
versacetaes;2017-11-03 01:27;0;0;"THEY DIDNT WANT ME THEN. THEY WANT ME NOW! DID NOT WANT ME TO WIN. BUT NOW THEY PROUD";;;;"926259546187644929";https://twitter.com/versacetaes/status/926259546187644929
versacetaes;2017-11-03 00:45;0;0;"SHE DOESNT KISS ME ON THE MIUTH ANYMORE";;;;"926248864562081792";https://twitter.com/versacetaes/status/926248864562081792
versacetaes;2017-11-03 00:43;0;0;"YOU AINT GOING NOOOoooOoOoOOOOOO WHERE";;;;"926248448227020800";https://twitter.com/versacetaes/status/926248448227020800
versacetaes;2017-11-03 00:42;0;1;"FIRST OFF GIVE A GIRL SOME CREDID";;;;"926248248397803520";https://twitter.com/versacetaes/status/926248248397803520
versacetaes;2017-11-03 00:26;0;3;"Lemme finish hw so I can workout and then vote. If y’all see me on here fight me";;;;"926244268636749824";https://twitter.com/versacetaes/status/926244268636749824
versacetaes;2017-11-02 23:58;0;0;"What the hell.... how’d we drop so much https:// twitter.com/btsanalytics/s tatus/926235838928781320 …";;;;"926237161497665536";https://twitter.com/versacetaes/status/926237161497665536
versacetaes;2017-11-02 23:57;0;1;"Okay you’re not wrong but ion know who I’m double biasing";;;;"926236880441454597";https://twitter.com/versacetaes/status/926236880441454597
versacetaes;2017-11-02 23:51;0;0;"WHY ARE YOU SO AGGRESSIVEDJBSKFF";;;;"926235433700270080";https://twitter.com/versacetaes/status/926235433700270080
versacetaes;2017-11-02 23:51;0;4;"The remastered version of reflection pic.twitter.com/41yXSt0W7K";;;;"926235424028114945";https://twitter.com/versacetaes/status/926235424028114945
versacetaes;2017-11-02 23:31;0;2;"She’s so cute https:// twitter.com/lalisagustd/st atus/926229094764859392 …";;;;"926230300362907648";https://twitter.com/versacetaes/status/926230300362907648
versacetaes;2017-11-02 22:54;0;2;"Wooshhhh pic.twitter.com/G4GOeM64Pn";;;;"926220996238983168";https://twitter.com/versacetaes/status/926220996238983168
versacetaes;2017-11-02 22:53;0;1;"Time for yoongis !";;;;"926220755938942976";https://twitter.com/versacetaes/status/926220755938942976
versacetaes;2017-11-02 22:49;0;1;"I just started crying over joon’s mixtape like that pic.twitter.com/J6DqSvvbXq";;;;"926219850938118144";https://twitter.com/versacetaes/status/926219850938118144
versacetaes;2017-11-02 22:21;0;4;"Now I’m in the mood to listen to Joon’s mixtape";;;;"926212587364085761";https://twitter.com/versacetaes/status/926212587364085761
versacetaes;2017-11-02 22:19;0;3;"I’m too attached to versacetaes tho";;;;"926212272212516864";https://twitter.com/versacetaes/status/926212272212516864
versacetaes;2017-11-02 22:19;0;4;"I wanna change my @";;@;;"926212221436174336";https://twitter.com/versacetaes/status/926212221436174336
versacetaes;2017-11-02 22:19;0;2;"It’s over";;;;"926212138095407104";https://twitter.com/versacetaes/status/926212138095407104
versacetaes;2017-11-02 22:18;2;6;"UGHHHHH I KNOW HOSEOK IS GONNA FEED MY SO WELL WITH HIXTAPE";;;;"926211999427522562";https://twitter.com/versacetaes/status/926211999427522562
versacetaes;2017-11-02 22:16;0;3;"IM PISSED. I CANT HEAR OUT OF MY RIGHT EAR SO ITS ONLY REALLY LOUD IN MY LEFT ONEKDJDK";;;;"926211536317702145";https://twitter.com/versacetaes/status/926211536317702145
versacetaes;2017-11-02 22:16;0;3;"pic.twitter.com/V9AgtSKl8x";;;;"926211445938839552";https://twitter.com/versacetaes/status/926211445938839552
versacetaes;2017-11-02 22:11;0;2;"If you can’t tell I love hoseok";;;;"926210209709563904";https://twitter.com/versacetaes/status/926210209709563904
versacetaes;2017-11-02 22:10;0;5;"Now I have my mind set on vocalist hoseok showing up on hixtape";;;;"926210025634140160";https://twitter.com/versacetaes/status/926210025634140160
versacetaes;2017-11-02 22:09;0;2;"Hoseok is the vocalist of our generation pic.twitter.com/uvGcB2ZqsI";;;;"926209620053340160";https://twitter.com/versacetaes/status/926209620053340160
versacetaes;2017-11-02 22:08;0;3;"I want the whole thing bruh! I love vocalist hoseok";;;;"926209319304962048";https://twitter.com/versacetaes/status/926209319304962048
versacetaes;2017-11-02 22:07;0;1;"I’m never gonna stop thinking of it now";;;;"926209098755932160";https://twitter.com/versacetaes/status/926209098755932160
versacetaes;2017-11-02 22:06;0;5;"Could y’all imagine if hoseok starts singing on hixtape...";;;;"926208911333408768";https://twitter.com/versacetaes/status/926208911333408768
versacetaes;2017-11-02 21:33;0;0;"I want some like tacos or a sope";;;;"926200577670778880";https://twitter.com/versacetaes/status/926200577670778880
versacetaes;2017-11-02 21:31;0;1;"THOSE MFS PLAY TOO MUCH!";;;;"926200193178988544";https://twitter.com/versacetaes/status/926200193178988544
versacetaes;2017-11-02 21:28;1;0;"I HATE JINMINKOOK";;;;"926199472203247616";https://twitter.com/versacetaes/status/926199472203247616
versacetaes;2017-11-02 21:07;0;0;"She’s so cute omg";;;;"926194049156988928";https://twitter.com/versacetaes/status/926194049156988928
versacetaes;2017-11-02 21:04;0;4;"HELLO I pic.twitter.com/9p5UY86l1Q";;;;"926193408212795392";https://twitter.com/versacetaes/status/926193408212795392
versacetaes;2017-11-02 21:02;0;2;"Hello I love dahyun";;;;"926192726269243392";https://twitter.com/versacetaes/status/926192726269243392
versacetaes;2017-11-02 20:48;0;1;"Hdkdjdjfjf I think about this EVERDAY AND IT PISSES ME OFF";;;;"926189328132325376";https://twitter.com/versacetaes/status/926189328132325376
versacetaes;2017-11-02 20:47;0;0;"fuCDODIODID I CNT BEYWAJ https:// twitter.com/hqonew/status/ 925957140476411905 …";;;;"926188971926765568";https://twitter.com/versacetaes/status/926188971926765568
versacetaes;2017-11-02 20:02;1;1;"You’re so beautiful omg https:// twitter.com/taesbane/statu s/926176440948838400 …";;;;"926177799747936256";https://twitter.com/versacetaes/status/926177799747936256
versacetaes;2017-11-02 19:57;0;0;"Y’all trash if you making fun of accents! Ion want none of that";;;;"926176495025786880";https://twitter.com/versacetaes/status/926176495025786880
versacetaes;2017-11-02 19:56;0;1;"Katana https:// twitter.com/arianaftnamjoo n/status/926168251347980288 …";;;;"926176266864046080";https://twitter.com/versacetaes/status/926176266864046080
versacetaes;2017-11-02 18:56;0;0;"BICJ https:// twitter.com/kat_mcnamara/s tatus/926131109208797185 …";;;;"926161024033554432";https://twitter.com/versacetaes/status/926161024033554432
versacetaes;2017-11-02 18:45;0;0;"Wait.... the bridge of best of me??";;;;"926158416371892224";https://twitter.com/versacetaes/status/926158416371892224
versacetaes;2017-11-02 13:27;0;1;"THE PRETTIEST https:// twitter.com/allbtspics/sta tus/926078151310168064 …";;;;"926078285917831171";https://twitter.com/versacetaes/status/926078285917831171
versacetaes;2017-11-02 13:27;0;0;"I uhhhh love seokjin and hoseok so much";;;;"926078219010285568";https://twitter.com/versacetaes/status/926078219010285568
versacetaes;2017-11-02 13:05;0;0;"Jin dancing to mama JDJSJD HES so annotingkfnfk";;;;"926072885084536832";https://twitter.com/versacetaes/status/926072885084536832
versacetaes;2017-11-02 12:09;0;1;"Dawon!";;;;"926058704545259520";https://twitter.com/versacetaes/status/926058704545259520
versacetaes;2017-11-02 06:11;0;1;"Goodnight I love bts chanyeol and inseong!";;;;"925968694844338177";https://twitter.com/versacetaes/status/925968694844338177
versacetaes;2017-11-02 06:11;0;0;"11:11 bts are happy";;;;"925968542117257216";https://twitter.com/versacetaes/status/925968542117257216
versacetaes;2017-11-02 06:11;0;1;"11:11 happy mutuals";;;;"925968520008966144";https://twitter.com/versacetaes/status/925968520008966144
versacetaes;2017-11-02 06:11;0;0;"11:11 good grades";;;;"925968501084381184";https://twitter.com/versacetaes/status/925968501084381184
versacetaes;2017-11-02 05:28;0;1;"I’ll miss you";;;;"925957760168030208";https://twitter.com/versacetaes/status/925957760168030208
versacetaes;2017-11-02 05:02;0;3;"PANDA PANDA PANDA https:// twitter.com/lifeofdesiigne r/status/925943011523026951 …";;;;"925951349140865025";https://twitter.com/versacetaes/status/925951349140865025
versacetaes;2017-11-02 04:32;0;0;"Now why would I do that if it deserves to be in the top 3...";;;;"925943637334097920";https://twitter.com/versacetaes/status/925943637334097920
versacetaes;2017-11-02 04:30;0;3;"I miss Isabelle Lightwood and Magnus Bane on this day";;;;"925943131278680066";https://twitter.com/versacetaes/status/925943131278680066
versacetaes;2017-11-02 04:29;0;0;"No. I’m leaving";;;;"925942890676740096";https://twitter.com/versacetaes/status/925942890676740096
versacetaes;2017-11-02 04:29;0;2;"Oomf thinks she’s funny... pic.twitter.com/WhWxyf5buC";;;;"925942884024467456";https://twitter.com/versacetaes/status/925942884024467456
versacetaes;2017-11-02 04:28;0;0;"If you’re gonna keep it in the top 5 then it’s gonna need another update cuz it belongs at the end of the list";;;;"925942563223191552";https://twitter.com/versacetaes/status/925942563223191552
versacetaes;2017-11-02 04:26;0;0;"My soulmate.... wow. Okay. Whatever.";;;;"925942282548682752";https://twitter.com/versacetaes/status/925942282548682752
versacetaes;2017-11-02 04:26;0;0;"Anyways it’s not but there will be no later. Case closed.";;;;"925942150704939008";https://twitter.com/versacetaes/status/925942150704939008
versacetaes;2017-11-02 04:25;0;3;"I can’t say ANYTHING about Bts’ best song. All my mutuals hate me pic.twitter.com/il2SQ6c1um";;;;"925941841802825729";https://twitter.com/versacetaes/status/925941841802825729
versacetaes;2017-11-02 04:24;0;0;"Oh you wanna start too! You think tomorrow is their best song!";;;;"925941691181293574";https://twitter.com/versacetaes/status/925941691181293574
versacetaes;2017-11-02 04:24;0;0;"I said what I said! Pied piper is good but not good enough to be in top 5!";;;;"925941588454285312";https://twitter.com/versacetaes/status/925941588454285312
versacetaes;2017-11-02 04:23;0;0;"Yes! That song bops";;;;"925941412683661312";https://twitter.com/versacetaes/status/925941412683661312
versacetaes;2017-11-02 04:21;0;1;"Ion trust no one who think pied piper belongs in the top 5 best songs off of Her!";;;;"925940936168714240";https://twitter.com/versacetaes/status/925940936168714240
versacetaes;2017-11-02 04:21;0;0;"Go go sweetie...";;;;"925940802961907713";https://twitter.com/versacetaes/status/925940802961907713
versacetaes;2017-11-02 04:11;0;3;"Some y’all tweet some weird crap";;;;"925938316280676352";https://twitter.com/versacetaes/status/925938316280676352
versacetaes;2017-11-02 04:10;0;2;"******** https:// twitter.com/_marigold_jin/ status/925811075596951553 …";;;;"925938047287410689";https://twitter.com/versacetaes/status/925938047287410689
versacetaes;2017-11-02 03:56;0;1;"my LRT THEYRE ALL SO ANNOYINGKFJFKSNKDF";;;;"925934534553509888";https://twitter.com/versacetaes/status/925934534553509888
versacetaes;2017-11-02 03:46;0;1;"Like gosh. Slow you’re roll omg lemme get up my legs hurt dang";;;;"925931973477933056";https://twitter.com/versacetaes/status/925931973477933056
versacetaes;2017-11-02 03:45;0;2;"She sits at our table she yelled “STAND UP” pic.twitter.com/HnoVbMzfER";;;;"925931968012812288";https://twitter.com/versacetaes/status/925931968012812288
versacetaes;2017-11-02 03:44;0;0;"Today my friend and I were doing stuff as the announcements came on so we were bout to stand up as it started but this girl,,,,";;;;"925931715784146944";https://twitter.com/versacetaes/status/925931715784146944
versacetaes;2017-11-02 03:44;0;0;"So I like to see if he’ll get mad if I don’t pay attention sometimes cuz I like pissing him off right";;;;"925931597890600960";https://twitter.com/versacetaes/status/925931597890600960
versacetaes;2017-11-02 03:44;0;0;"FOR THE PLEDGE OOPS";;;;"925931486741594112";https://twitter.com/versacetaes/status/925931486741594112
versacetaes;2017-11-02 03:43;0;0;"Oh my gosh my bio teacher has a problem when people don’t put their hand over their hearts for my pledge";;;;"925931447512428545";https://twitter.com/versacetaes/status/925931447512428545
versacetaes;2017-11-02 03:42;0;1;"I LOVE THIS SONG https:// twitter.com/rosyioves/stat us/925171383302111232 …";;;;"925931128271208448";https://twitter.com/versacetaes/status/925931128271208448
versacetaes;2017-11-02 03:30;0;1;"Taeyang dancing to Move...";;;;"925928020250042368";https://twitter.com/versacetaes/status/925928020250042368
versacetaes;2017-11-02 03:28;0;1;"Sf9’s rAPLINE";;;;"925927517189320704";https://twitter.com/versacetaes/status/925927517189320704
versacetaes;2017-11-02 03:26;0;1;"HE S SO PRETTY https:// twitter.com/vivid_in_/stat us/925722932554297344 …";;;;"925926995845713920";https://twitter.com/versacetaes/status/925926995845713920
versacetaes;2017-11-02 03:23;0;1;"This is what I deserve https:// twitter.com/starwars/statu s/925904402031898624 …";;;;"925926221208174592";https://twitter.com/versacetaes/status/925926221208174592
versacetaes;2017-11-02 03:20;0;2;"THE LYRICS WHY DID HE https:// twitter.com/kordeinization /status/925925178659483648 …";;;;"925925587918602241";https://twitter.com/versacetaes/status/925925587918602241
versacetaes;2017-11-02 03:16;0;1;"The fire dance practice is shaking";;;;"925924588411695104";https://twitter.com/versacetaes/status/925924588411695104
versacetaes;2017-11-02 03:16;0;2;"That’s a Mario hat right?? With a J pic.twitter.com/ZVHZIDe4Y8";;;;"925924539510407170";https://twitter.com/versacetaes/status/925924539510407170
versacetaes;2017-11-02 03:04;0;3;"Jin with his guitar and little sugar gliders :’) pic.twitter.com/Fmc9HRQ56U";;;;"925921531267391488";https://twitter.com/versacetaes/status/925921531267391488
versacetaes;2017-11-02 03:03;0;1;"LOOK AT THE LITTLE JIMIN AND THE CAT https:// twitter.com/pixiedust_twt/ status/925920985446051840 …";;;;"925921242527363072";https://twitter.com/versacetaes/status/925921242527363072
versacetaes;2017-11-02 03:02;0;1;"Why! Did you leaveeee me here to burn! I’m! Way too young to be this. Hurt.";;;;"925921087833088000";https://twitter.com/versacetaes/status/925921087833088000
versacetaes;2017-11-02 03:02;0;1;"I’m one follower away from 2.1k";;;;"925920966546296832";https://twitter.com/versacetaes/status/925920966546296832
versacetaes;2017-11-02 03:01;0;1;"Like she was my mf BABY. I would die for her";;;;"925920817623396352";https://twitter.com/versacetaes/status/925920817623396352
versacetaes;2017-11-02 03:01;0;1;"I’m excited https:// twitter.com/bighitent/stat us/925920468023963648 …";;;;"925920676690587648";https://twitter.com/versacetaes/status/925920676690587648
versacetaes;2017-11-02 03:00;0;0;"BIHHHHHH https:// twitter.com/bighitent/stat us/925920468023963648 …";;;;"925920579395317760";https://twitter.com/versacetaes/status/925920579395317760
versacetaes;2017-11-02 03:00;0;1;"Ugh I’m remembering my Dinah stan days... I miss her";;;;"925920508440330241";https://twitter.com/versacetaes/status/925920508440330241
versacetaes;2017-11-02 01:44;0;1;"Ugh same";;;;"925901494129369088";https://twitter.com/versacetaes/status/925901494129369088
versacetaes;2017-11-02 01:43;0;0;"Feel like I ain’t said this in forever but,,, i LOVE seokjin so much. He’s the cutest boy ever and I hope hes both happy and healthy rn pic.twitter.com/YIgjQCmsXO";;;;"925901240197816320";https://twitter.com/versacetaes/status/925901240197816320
versacetaes;2017-11-02 01:42;0;0;"Thank you https:// twitter.com/btsxpics/statu s/925900296198422528 …";;;;"925900910630354944";https://twitter.com/versacetaes/status/925900910630354944
versacetaes;2017-11-02 01:36;0;2;"Do y’all ever see a pic of seokjin and";;;;"925899426719186944";https://twitter.com/versacetaes/status/925899426719186944
versacetaes;2017-11-02 01:36;0;0;"He- https:// twitter.com/yoongisoutfit/ status/925732854398640130 …";;;;"925899364907679744";https://twitter.com/versacetaes/status/925899364907679744
versacetaes;2017-11-02 01:36;0;2;"BAMBAM IS MY BIAS HES THE CUTESTTTT";;;;"925899284167344128";https://twitter.com/versacetaes/status/925899284167344128
versacetaes;2017-11-02 01:35;0;1;"Me, a known vocalist! Hobi stan";;;;"925899147697209344";https://twitter.com/versacetaes/status/925899147697209344
versacetaes;2017-11-02 01:18;0;1;"She better keep her opinions to haself! pic.twitter.com/zYtgjTnQ6z";;;;"925894762627940352";https://twitter.com/versacetaes/status/925894762627940352
versacetaes;2017-11-02 01:06;0;2;"She just laughed. Tf does that mean?? Huh?? She a jin anti!";;;;"925891810836090880";https://twitter.com/versacetaes/status/925891810836090880
versacetaes;2017-11-02 01:06;0;5;"This girl in my English class likes Bts so I tried to be her friend since we have something in common so I showed her my jin photo card";;;;"925891735766495232";https://twitter.com/versacetaes/status/925891735766495232
versacetaes;2017-11-02 01:03;0;1;"I love save me :)))";;;;"925891063100796930";https://twitter.com/versacetaes/status/925891063100796930
versacetaes;2017-11-02 01:01;5;10;"Where did I go wrong pic.twitter.com/NysXIHrs1r";;;;"925890476858753025";https://twitter.com/versacetaes/status/925890476858753025
versacetaes;2017-11-02 00:57;0;1;"Seriously considering digging into my savings to get me some @BTS_twt tickets!!!";;@BTS_twt;;"925889505625653248";https://twitter.com/versacetaes/status/925889505625653248
versacetaes;2017-11-01 23:57;0;0;"BABIES https:// twitter.com/jinarchive/sta tus/925874290645454848 …";;;;"925874431200600064";https://twitter.com/versacetaes/status/925874431200600064
versacetaes;2017-11-01 23:46;0;0;"Also remember how I said I’m gon like,,,, triple bias in exo?? Well I lied!";;;;"925871717951475713";https://twitter.com/versacetaes/status/925871717951475713
versacetaes;2017-11-01 23:46;0;0;"I’m here to say that I uhhhhh love seokjin hoseok taehyung jisoo and chanyeol";;;;"925871584966934528";https://twitter.com/versacetaes/status/925871584966934528
versacetaes;2017-11-01 23:45;0;1;"Mood kfkdjdk";;;;"925871385041240064";https://twitter.com/versacetaes/status/925871385041240064
versacetaes;2017-11-01 23:26;0;0;"STOP I HATE THIS VIDEODJKD";;;;"925866700788195328";https://twitter.com/versacetaes/status/925866700788195328
versacetaes;2017-11-01 22:49;0;1;"HDJDJJFFJ https:// twitter.com/disney/status/ 925853092255551488 …";;;;"925857381845680129";https://twitter.com/versacetaes/status/925857381845680129
versacetaes;2017-11-01 22:18;0;3;"I wanna tweet something but I’m scared #they will find it and drag me";;;#they;"925849648006180864";https://twitter.com/versacetaes/status/925849648006180864
versacetaes;2017-11-01 22:18;0;1;"Flex deserved it all https:// twitter.com/cartwheelkorde i/status/925568366093488128 …";;;;"925849443982700544";https://twitter.com/versacetaes/status/925849443982700544
versacetaes;2017-11-01 22:01;0;1;"The go go dance practice still sends me";;;;"925845152941326336";https://twitter.com/versacetaes/status/925845152941326336
versacetaes;2017-11-01 21:58;0;1;"The ending of spring day where Jin is singing while the others dance";;;;"925844554653220864";https://twitter.com/versacetaes/status/925844554653220864
versacetaes;2017-11-01 21:54;0;1;"Lemme watch the spring day dance practice cuz it’s pretty";;;;"925843563660718081";https://twitter.com/versacetaes/status/925843563660718081
versacetaes;2017-11-01 20:49;0;0;"I’m sick of him , he’s too talented and too fine bro https:// twitter.com/velvetpjm/stat us/925791927227863041 …";;;;"925827112392581120";https://twitter.com/versacetaes/status/925827112392581120
versacetaes;2017-11-01 20:40;0;0;"I love these kids https:// twitter.com/seokingpics/st atus/925764936709627905 …";;;;"925824797048578048";https://twitter.com/versacetaes/status/925824797048578048
versacetaes;2017-11-01 20:30;0;1;"Russian roulette by Red Velvet bops";;;;"925822276326408192";https://twitter.com/versacetaes/status/925822276326408192
versacetaes;2017-11-01 20:25;0;1;"I CANT BRETAJEKDNDK I laughed https:// twitter.com/sugabemydaddy/ status/925815474708992001 …";;;;"925821185710899200";https://twitter.com/versacetaes/status/925821185710899200
versacetaes;2017-11-01 20:24;0;2;"I’m listening to the best song off of The War";;;;"925820986343145472";https://twitter.com/versacetaes/status/925820986343145472
