username;date;retweets;favorites;text;geo;mentions;hashtags;id;permalink
4MyBlackSon;2017-08-06 17:09;0;1;"Also not saying they should be proud of all.of it either";;;;"894243934964199425";https://twitter.com/4MyBlackSon/status/894243934964199425
4MyBlackSon;2017-08-06 17:08;0;0;"I don't know how people would even say they get their information from @POTUS https:// twitter.com/__0HOUR1_/stat us/894044769239879681 …";;@POTUS;;"894243766311301125";https://twitter.com/4MyBlackSon/status/894243766311301125
4MyBlackSon;2017-08-06 17:05;0;0;"It's no secret . I am damn Billionaire!!";;;;"894243051559931904";https://twitter.com/4MyBlackSon/status/894243051559931904
4MyBlackSon;2017-08-06 17:03;0;0;"Again? Is this right now??";;;;"894242444836995072";https://twitter.com/4MyBlackSon/status/894242444836995072
4MyBlackSon;2017-08-06 17:01;0;1;"Everything thing their ancestors did was to make their lives better. I don't agree with it but it was the law of the land.";;;;"894241966904549377";https://twitter.com/4MyBlackSon/status/894241966904549377
4MyBlackSon;2017-08-06 16:59;0;1;"#confessyourunpopularopinion The US government is more powerful than anyone could ever think. Ever.";;;#confessyourunpopularopinion;"894241582202982401";https://twitter.com/4MyBlackSon/status/894241582202982401
4MyBlackSon;2017-08-06 16:58;1;4;"#confessyourunpopularopinion I think Trans-anything is a mental illness.";;;#confessyourunpopularopinion;"894241191893635072";https://twitter.com/4MyBlackSon/status/894241191893635072
4MyBlackSon;2017-08-06 16:56;1;1;"#confessyourunpopularopinion I wish I would have never moved to the white side of town when I finally got some money.";;;#confessyourunpopularopinion;"894240711066910720";https://twitter.com/4MyBlackSon/status/894240711066910720
4MyBlackSon;2017-08-06 16:55;1;2;"#confessyourunpopularopinion I wish I was white for 30 days. Just so I could know what true opportunity feels like.";;;#confessyourunpopularopinion;"894240453977047040";https://twitter.com/4MyBlackSon/status/894240453977047040
4MyBlackSon;2017-08-06 16:53;3;5;"#confessyourunpopularopinion I hate Tyler Perry movies.";;;#confessyourunpopularopinion;"894239987755102208";https://twitter.com/4MyBlackSon/status/894239987755102208
4MyBlackSon;2017-08-06 16:52;0;3;"It's the music you listen to right before you take 30 pain killers.";;;;"894239709198725121";https://twitter.com/4MyBlackSon/status/894239709198725121
4MyBlackSon;2017-08-06 16:51;0;29;"They look like aliens. I dont think they are cute until they get fat and pudgey";;;;"894239446958317569";https://twitter.com/4MyBlackSon/status/894239446958317569
4MyBlackSon;2017-08-06 16:49;0;4;"They shouldn't feel guilty. pic.twitter.com/EfXKUcFkDb";;;;"894238892278382592";https://twitter.com/4MyBlackSon/status/894238892278382592
4MyBlackSon;2017-08-06 16:46;1;1;"What's your take on some Muslim sects taking on Scientology? I have practiced both Christianity and Muslim faiths in my lifetime.";;;;"894238174318407681";https://twitter.com/4MyBlackSon/status/894238174318407681
4MyBlackSon;2017-08-06 16:42;1;2;"only country to use Nuclear weapons in war?US. Then said nobody else can use them. Like stealing America & making laws from taken them back";;;;"894237250111893504";https://twitter.com/4MyBlackSon/status/894237250111893504
4MyBlackSon;2017-08-06 16:38;0;0;"Forgot to ask you still got that bi&$#a$$ dude following and riding you?";;;#a;"894236278547521536";https://twitter.com/4MyBlackSon/status/894236278547521536
4MyBlackSon;2017-08-06 16:37;0;1;"People that are pro-police are anti-Mueller. How dumb does that sound? They don't stand for anything.";;;;"894235980634435588";https://twitter.com/4MyBlackSon/status/894235980634435588
4MyBlackSon;2017-08-06 16:35;0;0;"I got drink one night and actually thought about becoming a correctional officer just so I could put these hands on Dylan Ruff.";;;;"894235396598640641";https://twitter.com/4MyBlackSon/status/894235396598640641
4MyBlackSon;2017-08-06 16:31;0;2;"Let them die like they killed my cousin. Crack put him out there and we couldn't pull him back. Let all them die.";;;;"894234487118286852";https://twitter.com/4MyBlackSon/status/894234487118286852
4MyBlackSon;2017-08-06 16:30;0;1;"This is @raylewis @KSlash10 and former black player on TV besides @ShannonSharpe . How is Kap a distraction when 80% of the team r black?";;@raylewis @KSlash10 @ShannonSharpe;;"894234217114198020";https://twitter.com/4MyBlackSon/status/894234217114198020
4MyBlackSon;2017-08-06 16:27;0;1;"Why isn't this on TV? Oh yeah, Hillary Clinton lost the election 200 days ago and @FoxNews is still trying to make it a story.";;@FoxNews;;"894233386851729408";https://twitter.com/4MyBlackSon/status/894233386851729408
4MyBlackSon;2017-08-06 16:26;1;1;"Why isn't this on TV? Oh yeah, some white kid drank himself to death and his frat brothers​ had some other stuff to do and let him die.";;;;"894233126792302596";https://twitter.com/4MyBlackSon/status/894233126792302596
4MyBlackSon;2017-08-06 16:22;0;0;"The Obamacare battle should be over. I couldn't hit a baseball after trying over and over so I learned how to play chess. And became good.";;;;"894232298991878144";https://twitter.com/4MyBlackSon/status/894232298991878144
4MyBlackSon;2017-08-06 16:19;1;1;"Why does crazy stuff like this always happen in Florida?";;;;"894231469333377028";https://twitter.com/4MyBlackSon/status/894231469333377028
4MyBlackSon;2017-08-06 16:11;0;1;"#BlackLivesMatter isn't buying limos and jets to save black people in thousand $ suits.";;;#BlackLivesMatter;"894229446936363009";https://twitter.com/4MyBlackSon/status/894229446936363009
4MyBlackSon;2017-08-06 16:09;0;0;"You are right. They have the means to protest. You have to have financial backing for any cause. Poor people don't have boats to save whales";;;;"894228924724633600";https://twitter.com/4MyBlackSon/status/894228924724633600
4MyBlackSon;2017-08-06 16:07;0;1;"This is completely insane and this show black people American religion will take full advantage of you. https:// twitter.com/IndieScieNews/ status/894181452325060608 …";;;;"894228388000485376";https://twitter.com/4MyBlackSon/status/894228388000485376
4MyBlackSon;2017-08-06 16:04;0;1;"Well at this point, there is no religion that a black can follow in America.";;;;"894227689518878721";https://twitter.com/4MyBlackSon/status/894227689518878721
4MyBlackSon;2017-08-06 16:01;1;1;"If it wasn't for the pill popping and syrup, he prolly could have caught them at $10k";;;;"894226943255732224";https://twitter.com/4MyBlackSon/status/894226943255732224
4MyBlackSon;2017-08-06 16:00;0;0;"But for some reason the owners or producers money isn't listed. How much does Sean Hannity make?";;;;"894226766415441923";https://twitter.com/4MyBlackSon/status/894226766415441923
4MyBlackSon;2017-08-06 15:55;1;3;"Black people don't make up their percentage of population of college students. Not even close. But we r 3x in jails.";;;;"894225441174806528";https://twitter.com/4MyBlackSon/status/894225441174806528
4MyBlackSon;2017-08-06 15:53;0;2;"You have never seen a middle class black leader. No matter who. That's why #BlackLivesMatter is huge. No millionaire preachers talking.";;;#BlackLivesMatter;"894225022566490112";https://twitter.com/4MyBlackSon/status/894225022566490112
4MyBlackSon;2017-08-05 20:46;0;1;"It's easier add some swag to a smart woman than it is to teach the most down woman compound interest.";;;;"893936149693165568";https://twitter.com/4MyBlackSon/status/893936149693165568
4MyBlackSon;2017-08-05 16:57;0;0;"@NFLPA @RealMikeWilbon @Freedom4Blks @michaelsmith @bomani_jones Good story here. But I know the NFL is too big so just keep the boys down.";;@NFLPA @RealMikeWilbon @Freedom4Blks @michaelsmith @bomani_jones;;"893878578500206594";https://twitter.com/4MyBlackSon/status/893878578500206594
4MyBlackSon;2017-08-05 16:53;1;2;"Everybody got get some of the Usher money.";;;;"893877548081348608";https://twitter.com/4MyBlackSon/status/893877548081348608
4MyBlackSon;2017-08-05 16:32;0;0;"Fox News is basically the same media outlet used in North Korea for their dictator. Fox salaries don't match their advertising.";;;;"893872266995519488";https://twitter.com/4MyBlackSon/status/893872266995519488
4MyBlackSon;2017-08-05 16:28;1;2;"Please check the prices of opiod company stocks & events in Afghanistan. The TV is about 5-6 months behind was actually happens. U r right";;;;"893871301009571840";https://twitter.com/4MyBlackSon/status/893871301009571840
4MyBlackSon;2017-08-05 15:48;0;0;"Because we "I.n.d.e.p.e.n.d.e.n.t" and "s.t.u.p.i.d."";;;;"893861292754300928";https://twitter.com/4MyBlackSon/status/893861292754300928
4MyBlackSon;2017-08-05 15:46;1;4;"Ray Lewis and Big Ben Rothlesburger didn't even get cut. Didn't miss a damn pay check.";;;;"893860762816577536";https://twitter.com/4MyBlackSon/status/893860762816577536
4MyBlackSon;2017-08-04 21:11;0;2;"Shit crazy";;;;"893580150151008258";https://twitter.com/4MyBlackSon/status/893580150151008258
4MyBlackSon;2017-08-04 19:43;0;0;"Can't be true. What kind of President does this type of stuff.";;;;"893558000757157888";https://twitter.com/4MyBlackSon/status/893558000757157888
4MyBlackSon;2017-08-04 19:37;0;0;"And Christians call Muslims violent. Christians about to starting killing people just because someone else is charged.";;;;"893556465910329344";https://twitter.com/4MyBlackSon/status/893556465910329344
4MyBlackSon;2017-08-04 19:08;0;2;"Both @MikeVick and @raylewis committed crimes, fucking crimes. Kap just didn't stand up. That's it. Fuck Ray and Fuck Mike";;@MikeVick @raylewis;;"893549128399106048";https://twitter.com/4MyBlackSon/status/893549128399106048
4MyBlackSon;2017-08-04 19:06;0;0;"We are now North Korea.";;;;"893548642367307776";https://twitter.com/4MyBlackSon/status/893548642367307776
4MyBlackSon;2017-08-04 19:04;0;0;"There could easily be a black Trump. Just play on religion, be against gays, wear nice clothes, know famous people, & get a TV show.";;;;"893548146650959873";https://twitter.com/4MyBlackSon/status/893548146650959873
4MyBlackSon;2017-08-04 19:00;0;0;"Trumpeters, just a simple explanation on y u were mad when Obama went on vacation but not mad now. Don't say cuz he ain't black. Think hard";;;;"893547145764249601";https://twitter.com/4MyBlackSon/status/893547145764249601
4MyBlackSon;2017-08-04 16:05;0;1;"My Trump supporter voice-"he deserves it for uhm..the thing he did with the uhm...trying to get rid of the uhm.. you know the stuff he did."";;;;"893503153336877056";https://twitter.com/4MyBlackSon/status/893503153336877056
4MyBlackSon;2017-08-04 16:01;0;0;"There was one close by. pic.twitter.com/UxdHC43gLU";;;;"893502120690843651";https://twitter.com/4MyBlackSon/status/893502120690843651
4MyBlackSon;2017-08-04 16:00;0;0;"All religious people defend him just because they mad at LGBT or Muslim person. They r only mad cuz they aren't happy with themselves.";;;;"893501900997447680";https://twitter.com/4MyBlackSon/status/893501900997447680
4MyBlackSon;2017-08-04 13:07;0;1;"http:// bleacherreport.com/articles/27253 64-politics-the-only-thing-keeping-terrell-owens-from-his-rightful-place-in-canton …";;;;"893458410301214720";https://twitter.com/4MyBlackSon/status/893458410301214720
4MyBlackSon;2017-08-04 12:12;0;4;"No separation of church and state... trooper. #BlueLivesMatter";;;#BlueLivesMatter;"893444509090140160";https://twitter.com/4MyBlackSon/status/893444509090140160
4MyBlackSon;2017-08-04 12:10;0;0;"If you dad is driving, who is in the front seat you or your boyfriend??";;;;"893444023947538432";https://twitter.com/4MyBlackSon/status/893444023947538432
4MyBlackSon;2017-08-04 12:09;0;2;"Because of $$$$. Check his finances. He is making almost billions of those dumb rednecks in West Virginia. Hundreds of millions";;;;"893443667452710912";https://twitter.com/4MyBlackSon/status/893443667452710912
4MyBlackSon;2017-08-04 11:45;1;0;"$570 million. That's how much on the low end he and his family has made since he's been in the white house.";;;;"893437823583485952";https://twitter.com/4MyBlackSon/status/893437823583485952
4MyBlackSon;2017-08-04 01:15;1;2;"Better titled how picking the wrong the chick to have a baby with can mess you up for life";;;;"893279273062088705";https://twitter.com/4MyBlackSon/status/893279273062088705
4MyBlackSon;2017-08-04 01:11;0;0;"Mad at the girl and the boys parents. How could you raise a boy so fragile? The girl's parents are just horrible people. That's obvious.";;;;"893278292756713473";https://twitter.com/4MyBlackSon/status/893278292756713473
4MyBlackSon;2017-08-04 01:09;0;2;"Let them die like you did with crackheads. Government gave us the drug and then decided to let them die";;;;"893277806364286977";https://twitter.com/4MyBlackSon/status/893277806364286977
4MyBlackSon;2017-08-04 01:08;0;0;"Just write her a check for $1.2 million out of the police retirement fund and call it a day. @BlueLivesMatter";;@BlueLivesMatter;;"893277372279136256";https://twitter.com/4MyBlackSon/status/893277372279136256
4MyBlackSon;2017-08-03 23:34;0;0;"This is what they do in @BaltimorePolice Prolly the same guys telling @Ravens not to sign Kap. @raylewis";;@BaltimorePolice @Ravens @raylewis;;"893253778119503877";https://twitter.com/4MyBlackSon/status/893253778119503877
4MyBlackSon;2017-08-03 20:33;0;1;"Funny as hell to think the same people that say blacks shouldn't hate the police are now saying they don't like Mueller Because of Trump";;;;"893208331355119617";https://twitter.com/4MyBlackSon/status/893208331355119617
4MyBlackSon;2017-08-03 20:32;1;1;"What???!!!!! I am not supposed to watch the NFL because of Kap and hate Jason & Jerry because of Lucky but damn I love some football.";;;;"893207956317237249";https://twitter.com/4MyBlackSon/status/893207956317237249
4MyBlackSon;2017-08-03 20:30;0;3;"You are officially an activist. I think every craft brewery in your area owes you a beer. Seriously.";;;;"893207489788903424";https://twitter.com/4MyBlackSon/status/893207489788903424
4MyBlackSon;2017-08-03 20:04;0;0;"People really believe this social media stuff. Got to some lonely boring ass people. I need $100k because my dryer broke. By next Friday.";;;;"893200966798987266";https://twitter.com/4MyBlackSon/status/893200966798987266
4MyBlackSon;2017-08-03 19:58;0;0;"LMAO. This is why I love America. Crazy people have the right to do crazy shit.";;;;"893199291971506176";https://twitter.com/4MyBlackSon/status/893199291971506176
4MyBlackSon;2017-08-03 19:55;0;0;"No one cares about 7% of anything. But 14% can caused a disturbance. But add another 30% and we change something. But 7% ain't tax on a $.";;;;"893198776801923072";https://twitter.com/4MyBlackSon/status/893198776801923072
4MyBlackSon;2017-08-03 19:50;0;0;"According to @seanhannity Marines are a bunch of lying dumb criminals.";;@seanhannity;;"893197371701686273";https://twitter.com/4MyBlackSon/status/893197371701686273
4MyBlackSon;2017-08-03 17:45;2;3;"Because they don't need us to make the film and we aren't spending money at the movies. They say we got Tyler Perry and his movies.";;;;"893166022143991808";https://twitter.com/4MyBlackSon/status/893166022143991808
4MyBlackSon;2017-08-03 17:43;4;12;"It's @UofAlabama @AlabamaFTBL . This is what they and Sessions want. But they clap hard to see the black man run and jump on Saturdays.";;@UofAlabama @AlabamaFTBL;;"893165393837248512";https://twitter.com/4MyBlackSon/status/893165393837248512
4MyBlackSon;2017-08-03 17:40;0;0;"And @raylewis obviously knows his place. That boy is one of the smart ones.";;@raylewis;;"893164795213623296";https://twitter.com/4MyBlackSon/status/893164795213623296
4MyBlackSon;2017-08-03 17:38;0;3;"This is why I hate Alabama. And also because of Sessions.";;;;"893164201040125952";https://twitter.com/4MyBlackSon/status/893164201040125952
4MyBlackSon;2017-08-03 17:36;1;3;"The most ironic thing is that #BlackLivesMatter came about with a black President.";;;#BlackLivesMatter;"893163718250569728";https://twitter.com/4MyBlackSon/status/893163718250569728
4MyBlackSon;2017-08-03 17:35;0;3;"Start taking this money out of Police retirement. #BlueLivesMatter";;;#BlueLivesMatter;"893163492257214465";https://twitter.com/4MyBlackSon/status/893163492257214465
4MyBlackSon;2017-08-03 17:35;0;1;"It's what #BlueLivesMatter does to keep their conviction rates up.";;;#BlueLivesMatter;"893163324996767744";https://twitter.com/4MyBlackSon/status/893163324996767744
4MyBlackSon;2017-08-03 17:30;0;1;"I saw Sean with this the other day. pic.twitter.com/MjUZUNJ4Fh";;;;"893162202005471232";https://twitter.com/4MyBlackSon/status/893162202005471232
4MyBlackSon;2017-08-03 13:43;0;0;"I received this when I took the White House tour last month. pic.twitter.com/LlpUioXei0";;;;"893105069901611008";https://twitter.com/4MyBlackSon/status/893105069901611008
4MyBlackSon;2017-08-03 13:41;0;0;"Top 10 current black media professional. He writes on SNL too.";;;;"893104512658964480";https://twitter.com/4MyBlackSon/status/893104512658964480
4MyBlackSon;2017-08-03 13:33;0;0;"My son and nephew were told in school that slavery was when black people had to work for free.";;;;"893102616951083009";https://twitter.com/4MyBlackSon/status/893102616951083009
4MyBlackSon;2017-08-03 13:31;0;0;"I call it the black Dunkirk of 2017. People need to watch it. Especially young black suburban kids. They think it's all sweet.";;;;"893101988279439361";https://twitter.com/4MyBlackSon/status/893101988279439361
4MyBlackSon;2017-08-03 13:06;0;1;"I just hope the person who made theshirts is black and making money. We aren't getting nothing off Louis. pic.twitter.com/t0GO78NlXn";;;;"893095827757047808";https://twitter.com/4MyBlackSon/status/893095827757047808
4MyBlackSon;2017-08-03 13:02;0;0;"It's called gentrification.";;;;"893094809396752384";https://twitter.com/4MyBlackSon/status/893094809396752384