username;date;retweets;favorites;text;geo;mentions;hashtags;id;permalink
ArmGot1;2017-11-02 20:04;0;0;"А мясо из чего?";;;;"926178203072385025";https://twitter.com/ArmGot1/status/926178203072385025
ArmGot1;2017-10-29 21:10;0;1;"Так дебилов и не подвергали репрессиям.";;;;"924745159572586496";https://twitter.com/ArmGot1/status/924745159572586496
ArmGot1;2017-10-23 17:08;0;1;"Недоступные - это когда очень дорогие.";;;;"922510134773010432";https://twitter.com/ArmGot1/status/922510134773010432
ArmGot1;2017-10-23 14:49;0;0;"https:// twitter.com/Sandy_mustache /status/922428968334012417 …";;;;"922474955903832064";https://twitter.com/ArmGot1/status/922474955903832064
ArmGot1;2017-10-22 21:33;3;0;"https:// twitter.com/History_Ukrain e/status/922159926461501446 …";;;;"922214241863598080";https://twitter.com/ArmGot1/status/922214241863598080
ArmGot1;2017-10-21 12:15;0;1;"Для фильмов ужасов подойдёт.";;;;"921711658665463808";https://twitter.com/ArmGot1/status/921711658665463808
ArmGot1;2017-10-18 18:12;0;0;"Самый прозрачный кандидат в президенты России всё видно до трусов. https:// twitter.com/gniloywest/sta tus/920690231795470336 …";;;;"920714304512561158";https://twitter.com/ArmGot1/status/920714304512561158
ArmGot1;2017-10-18 18:01;0;0;"С каких это пор депутаты живут только на одну зарплату?";;;;"920711452473921538";https://twitter.com/ArmGot1/status/920711452473921538
ArmGot1;2017-10-18 17:57;0;0;"Это самая. https:// twitter.com/Fake_MIDRF/sta tus/920690664161075200 …";;;;"920710415004438533";https://twitter.com/ArmGot1/status/920710415004438533
ArmGot1;2017-10-17 20:21;0;0;"https:// twitter.com/natohawks/stat us/920210973985820672 …";;;;"920384364248264704";https://twitter.com/ArmGot1/status/920384364248264704
ArmGot1;2017-10-14 23:50;0;0;"Путин с голым торсом возле коня, вы собственно на что намикаете???";;;;"919349692672114688";https://twitter.com/ArmGot1/status/919349692672114688
ArmGot1;2017-10-11 23:17;0;0;"Дрочеры.";;;;"918254286676615170";https://twitter.com/ArmGot1/status/918254286676615170
ArmGot1;2017-10-11 16:44;0;0;"Типа шпийоны их мать. Это же как нормальному ватному мозгу тяжело быть среди пиндоснейших врагов России.";;;;"918155405792108544";https://twitter.com/ArmGot1/status/918155405792108544
ArmGot1;2017-10-10 12:40;0;0;"Я так понимаю вам кто-то в интернете посоветовал отказаться от советов других людей в интернете и стех пор...";;;;"917731480851374082";https://twitter.com/ArmGot1/status/917731480851374082
ArmGot1;2017-10-09 20:57;0;0;"https:// twitter.com/krymrealii/sta tus/917488637675229185 …";;;;"917494145639505920";https://twitter.com/ArmGot1/status/917494145639505920
ArmGot1;2017-10-09 20:55;0;0;"С одной стороны так даже лучше.";;;;"917493660836655104";https://twitter.com/ArmGot1/status/917493660836655104
ArmGot1;2017-10-09 20:46;0;0;"Если бы это произошло в другой стране было бы охренеть, а так пробиваете очередное дно.";;;;"917491415881539584";https://twitter.com/ArmGot1/status/917491415881539584
ArmGot1;2017-10-09 09:07;0;0;"Так на пьяную голову можно все что хочешь сказать.";;;;"917315595921707008";https://twitter.com/ArmGot1/status/917315595921707008
ArmGot1;2017-10-07 18:17;0;0;"Зачем переворачивать автозак если внутри его можно сделать классное селфи.";;;;"916729179416285186";https://twitter.com/ArmGot1/status/916729179416285186
ArmGot1;2017-10-07 18:09;1;0;"https:// twitter.com/veraizmaylova4 1/status/916142867072110593 …";;;;"916727095547629571";https://twitter.com/ArmGot1/status/916727095547629571
ArmGot1;2017-10-07 17:44;0;2;"Сравните Россию с Арабскими Эмиратами и вместе посмиёмся над тем что "построил" Путин.";;;;"916720836815540229";https://twitter.com/ArmGot1/status/916720836815540229
ArmGot1;2017-10-06 19:22;0;0;"Твой друг это кровать.";;;;"916383286217363456";https://twitter.com/ArmGot1/status/916383286217363456
ArmGot1;2017-10-06 19:20;0;0;"Зачем?";;;;"916382572741120000";https://twitter.com/ArmGot1/status/916382572741120000
ArmGot1;2017-10-06 17:12;0;0;"Да на трезвую голову как иначе. Альтернативы как нажраться нет?";;;;"916350539641884678";https://twitter.com/ArmGot1/status/916350539641884678
ArmGot1;2017-10-06 11:24;0;0;"Между демократической страной и страной з диктаторским режимом так много общего как у йожика и колючей проволокой.";;;;"916263011144359936";https://twitter.com/ArmGot1/status/916263011144359936
ArmGot1;2017-10-06 08:58;0;0;"В открытую нападать ссут.";;;;"916226034336444417";https://twitter.com/ArmGot1/status/916226034336444417
ArmGot1;2017-10-06 08:52;0;0;"Да вот только деньги идут в чей карман?";;;;"916224566992699392";https://twitter.com/ArmGot1/status/916224566992699392
ArmGot1;2017-10-06 07:11;0;0;"Современная Россия. https:// twitter.com/CurrentTimeTv/ status/915977805879488512 …";;;;"916199209975648256";https://twitter.com/ArmGot1/status/916199209975648256
ArmGot1;2017-10-04 18:19;0;0;"pic.twitter.com/2kPbeYmih7";;;;"915642456284258307";https://twitter.com/ArmGot1/status/915642456284258307
ArmGot1;2017-10-04 17:54;0;0;"Подростающие поколение шахтеров. pic.twitter.com/8KF5xHyw6q";;;;"915636160994607112";https://twitter.com/ArmGot1/status/915636160994607112
ArmGot1;2017-10-04 17:45;0;0;"Главное что улыбаются, а на оружие в руках не обращайте внимание. pic.twitter.com/v4vxqVCbZQ";;;;"915634027754934274";https://twitter.com/ArmGot1/status/915634027754934274
ArmGot1;2017-10-03 18:28;0;2;"Зачем что-то изобретать, вкладывать миллионы долларов в будущие, когда намного проще розворовать деньги и обсырать того кто лучше тебя.";;;;"915282540914724865";https://twitter.com/ArmGot1/status/915282540914724865
ArmGot1;2017-10-03 17:39;0;0;"https:// twitter.com/666_mancer/sta tus/915230084386213888 … Якобы, их там нет.";;;;"915270002277797900";https://twitter.com/ArmGot1/status/915270002277797900
ArmGot1;2017-10-03 16:56;0;0;"Их там нет. https:// twitter.com/666_mancer/sta tus/915230084386213888 …";;;;"915259201257115648";https://twitter.com/ArmGot1/status/915259201257115648
ArmGot1;2017-09-30 21:36;0;0;"Исходя из того что эта особь страдает запорами, срёт ртом.";;;;"914242603985592322";https://twitter.com/ArmGot1/status/914242603985592322
ArmGot1;2017-09-30 21:30;0;0;"Он не гнойный у него просто гангрена в мозгах. Да такой опарыш и блевать начинает как только посмотрит на себя в зеркало утром.";;;;"914241152391553025";https://twitter.com/ArmGot1/status/914241152391553025
ArmGot1;2017-09-29 21:30;0;0;"https:// twitter.com/sakirkhader/st atus/913876379078455296 … Оружие, войны, смерть. Россиянам чем-то другим нечему гордиться???";;;;"913878750332428289";https://twitter.com/ArmGot1/status/913878750332428289
ArmGot1;2017-09-28 10:08;0;1;"Немного тупого троллинга, что бы немного оживить ватные нейроны.";;;;"913344700345667584";https://twitter.com/ArmGot1/status/913344700345667584
ArmGot1;2017-09-28 10:05;0;0;"Вот если бы там был кусок сала, а так безвкусный троллинг.";;;;"913343868048957440";https://twitter.com/ArmGot1/status/913343868048957440
ArmGot1;2017-09-28 01:06;0;0;"Почему вы все о передке думаете. Может быть коррупцию в России легализировали?";;;;"913208289353175041";https://twitter.com/ArmGot1/status/913208289353175041
ArmGot1;2017-09-28 00:57;0;0;"Камни с неба, по тому и плакали.";;;;"913206017357434880";https://twitter.com/ArmGot1/status/913206017357434880
ArmGot1;2017-09-28 00:55;0;0;"Звездатая Мария.";;;;"913205403063898112";https://twitter.com/ArmGot1/status/913205403063898112
ArmGot1;2017-09-28 00:48;0;0;"Это когда к нечему приложить. ;)";;;;"913203642966081537";https://twitter.com/ArmGot1/status/913203642966081537
ArmGot1;2017-09-27 20:54;0;2;"Это дельфины зомби. Они мертвые и их становиться больше.";;;;"913144818880131072";https://twitter.com/ArmGot1/status/913144818880131072
ArmGot1;2017-09-27 17:49;0;0;"Это загримированный Путин.";;;;"913098331936759816";https://twitter.com/ArmGot1/status/913098331936759816
ArmGot1;2017-09-26 18:52;0;0;"https:// twitter.com/PowerNaShary/s tatus/912122418524823552 … Изобрели рогатку.";;;;"912751860058124289";https://twitter.com/ArmGot1/status/912751860058124289
ArmGot1;2017-09-25 17:33;0;0;"Чё за бомжи?";;;;"912369459184246784";https://twitter.com/ArmGot1/status/912369459184246784
ArmGot1;2017-09-24 22:53;0;3;"Вы такой умный... Вам же не нужно объяснять причину по которой она бы долго горела?";;;;"912087614282518528";https://twitter.com/ArmGot1/status/912087614282518528
ArmGot1;2017-09-24 20:36;0;0;"Учиться, учиться, учиться. И не работал бы как моторная лодка каждый день.";;;;"912053132930273280";https://twitter.com/ArmGot1/status/912053132930273280
ArmGot1;2017-09-24 20:21;0;0;"Что-бы потом отдать бедным.";;;;"912049403682279424";https://twitter.com/ArmGot1/status/912049403682279424
ArmGot1;2017-09-24 20:03;0;0;"Так можно и инфаркт получить.";;;;"912044914573234177";https://twitter.com/ArmGot1/status/912044914573234177
ArmGot1;2017-09-24 19:56;0;0;"pic.twitter.com/0hm2nNAaJT";;;;"912043046753185804";https://twitter.com/ArmGot1/status/912043046753185804
ArmGot1;2017-09-24 19:49;0;0;"Сколько любови в комментариях от (братского) народа. Как у Гитлера к евреям.";;;;"912041317471014912";https://twitter.com/ArmGot1/status/912041317471014912
ArmGot1;2017-09-23 15:26;0;0;"Может оторвать все но кроме мозгов.";;;;"911612666317344769";https://twitter.com/ArmGot1/status/911612666317344769
ArmGot1;2017-09-22 10:15;0;1;"На аллее кровавых маньяков рядом с гитлером - ДА.";;;;"911172170151276545";https://twitter.com/ArmGot1/status/911172170151276545
ArmGot1;2017-09-21 17:07;0;0;"Она никто и звать её никак. Шуму много толку мало. Она лишь планктон среди акул.";;;;"910913479112044544";https://twitter.com/ArmGot1/status/910913479112044544
ArmGot1;2017-09-20 09:09;0;0;"https:// twitter.com/ShadenFM/statu s/910420693682094081 …";;;;"910430711768862720";https://twitter.com/ArmGot1/status/910430711768862720
ArmGot1;2017-09-19 18:38;0;1;"pic.twitter.com/Trrk5Kz0SE";;;;"910211482712989696";https://twitter.com/ArmGot1/status/910211482712989696
ArmGot1;2017-09-19 18:06;0;0;"Что ж вам так покоя не дают украинцы. Вам завидно или жалко? Вам бы к психологу может чего поможет?";;;;"910203396044595201";https://twitter.com/ArmGot1/status/910203396044595201
ArmGot1;2017-09-19 16:44;0;0;"На честно ворованные деньги.";;;;"910182752061968384";https://twitter.com/ArmGot1/status/910182752061968384
ArmGot1;2017-09-19 16:13;0;2;"Китайцы или коммунисты?";;;;"910175061876920321";https://twitter.com/ArmGot1/status/910175061876920321
ArmGot1;2017-09-19 15:48;0;0;"Как приятно выдумывать того чего нет, хохлы простят... Где ссылки на хохлов? Нету тогда выключайте вентилятор.";;;;"910168609279954949";https://twitter.com/ArmGot1/status/910168609279954949
ArmGot1;2017-09-19 15:30;0;0;"https:// twitter.com/Zn_Portnova/st atus/910122823036829696 … Больше нет.";;;;"910164217294188550";https://twitter.com/ArmGot1/status/910164217294188550
ArmGot1;2017-09-16 20:52;0;1;"И ради чего все. Х@й их поймет.";;@;;"909158146156974080";https://twitter.com/ArmGot1/status/909158146156974080
ArmGot1;2017-09-16 19:25;0;1;"Видно что приучают з детства жить в зоопарке.";;;;"909136071597928452";https://twitter.com/ArmGot1/status/909136071597928452
ArmGot1;2017-09-16 16:21;0;0;"Святой - это понятие растяжимое. Вот только товарищи коммунисты об этом не знали. Сейчас правда модно им памятники ставить.";;;;"909089777433145346";https://twitter.com/ArmGot1/status/909089777433145346
ArmGot1;2017-09-15 15:56;0;3;"Разрешённая террористическая организация в России.";;;;"908721316714381314";https://twitter.com/ArmGot1/status/908721316714381314
ArmGot1;2017-09-15 13:10;0;0;"По лицу и так видно к чему у неё любовь.";;;;"908679298923601921";https://twitter.com/ArmGot1/status/908679298923601921
ArmGot1;2017-09-15 13:07;0;0;"Сравняли ёжика и колючую проволоку.";;;;"908678594901282816";https://twitter.com/ArmGot1/status/908678594901282816
ArmGot1;2017-09-15 10:53;0;0;"Это говорит гражданин страны где растут сталагмиты из фекалий, лепят скульптуры из фекалий и метают коровьи фекалии.";;;;"908644820918374400";https://twitter.com/ArmGot1/status/908644820918374400
ArmGot1;2017-09-15 10:31;0;0;"Может быть потому что Каталония и Донбасс не одно и тоже. В любом случае это лишь личное мнение постороннего человека.";;;;"908639487940546560";https://twitter.com/ArmGot1/status/908639487940546560
ArmGot1;2017-09-14 18:12;0;0;"Да там так плохо что работают больше одного миллиона украинцев. Так плохо, так плохо... Надеюсь вам уже стало легче.";;;;"908393091165552640";https://twitter.com/ArmGot1/status/908393091165552640
ArmGot1;2017-09-13 15:10;0;0;"Fidanzato ragazzina яя confessa e fa trovare il corpo http://xn--notizie-pkg5h.virgilio.it/top-news/si-cerca-anche-in-grкotte-e-pozzi-la-ragazza-scomparsa-in-puglia-45690 notфizяie.virgilio.it/top-news/si-ce …";;;;"907984850933739522";https://twitter.com/ArmGot1/status/907984850933739522
ArmGot1;2017-09-12 21:13;0;0;"Так в большинстве (то есть почти в всех) российских изданиях и маразм пишут. Ищите всегда первоисточник в оригинале.";;;;"907713746679853056";https://twitter.com/ArmGot1/status/907713746679853056
ArmGot1;2017-09-12 21:03;0;0;"Да в библии очень часто упоминается такая страна Россия, и что Россия последняя надежда Бога. Там так и написано. Иначе от куда они знают?";;;;"907711198547804162";https://twitter.com/ArmGot1/status/907711198547804162
ArmGot1;2017-09-12 19:22;0;0;"Индийцы с индейцами.";;;;"907685893246525445";https://twitter.com/ArmGot1/status/907685893246525445
ArmGot1;2017-09-12 06:22;0;0;"Нищие России выдохнули с облегчением и им столо намного легче.";;;;"907489527782133760";https://twitter.com/ArmGot1/status/907489527782133760
ArmGot1;2017-09-11 22:47;0;0;"Это точно.";;;;"907375180636413952";https://twitter.com/ArmGot1/status/907375180636413952
ArmGot1;2017-09-11 21:17;0;1;"Да. Хуже уже некуда. Здесь психиатор диагноз должен ставить.";;;;"907352535840813056";https://twitter.com/ArmGot1/status/907352535840813056
ArmGot1;2017-09-11 20:40;0;0;"Зрада здорового глузду, або перемога над здоровим глуздом. Це вже як кому подобається.";;;;"907343228189495296";https://twitter.com/ArmGot1/status/907343228189495296
ArmGot1;2017-09-11 18:47;0;0;"Трамп - это погремушка, вот только в чьих руках???";;;;"907314554429956096";https://twitter.com/ArmGot1/status/907314554429956096
ArmGot1;2017-09-11 18:44;0;0;"Да м... Не только размеры яхты важны.";;;;"907313911984254976";https://twitter.com/ArmGot1/status/907313911984254976
ArmGot1;2017-09-11 18:37;0;0;"Если вы только что покушали тем более, чуть не вырыгнул, бл@ть.";;@;;"907312154117799936";https://twitter.com/ArmGot1/status/907312154117799936
ArmGot1;2017-09-10 18:50;0;0;"Щыри пидароботы ольгинцы, как правило воняют за километр. Даже как боты они полное говно.";;;;"906953018796539910";https://twitter.com/ArmGot1/status/906953018796539910
ArmGot1;2017-09-10 18:38;0;0;"Порошенко с Саакашвили мог все решить цивилизованным путем и без этого цирка.";;;;"906950017801482241";https://twitter.com/ArmGot1/status/906950017801482241
ArmGot1;2017-09-10 15:06;1;0;"5. Это же так надо было наложить в штаны что-бы задержать поезд.";;;;"906896752145510402";https://twitter.com/ArmGot1/status/906896752145510402
ArmGot1;2017-09-10 14:34;0;0;"Что ж очень соблазнительное предложение.";;;;"906888699316760577";https://twitter.com/ArmGot1/status/906888699316760577
ArmGot1;2017-09-09 17:30;0;2;"Такое впечатление что это пишет не человек,а первый искусственный интеллект сделанный в России.";;;;"906570533025828864";https://twitter.com/ArmGot1/status/906570533025828864
ArmGot1;2017-09-09 17:05;0;1;"Скорее всего ты некрасивая сказка, а обыкновенный прыщавый бот с яйцами.";;;;"906564141053292544";https://twitter.com/ArmGot1/status/906564141053292544
ArmGot1;2017-09-08 23:09;0;0;"Если Мазепа еврейская фамилия то да.";;;;"906293410889392128";https://twitter.com/ArmGot1/status/906293410889392128
ArmGot1;2017-09-08 16:21;0;5;"Ещё один дошел до Киева.";;;;"906190771887288320";https://twitter.com/ArmGot1/status/906190771887288320
ArmGot1;2017-09-08 09:16;0;0;"Ещё один не дошел до Киева. https:// twitter.com/sashakots/stat us/906079997806379008 …";;;;"906083938308947968";https://twitter.com/ArmGot1/status/906083938308947968
ArmGot1;2017-09-08 09:11;0;0;"Какое больное воображение.";;;;"906082476723982337";https://twitter.com/ArmGot1/status/906082476723982337
ArmGot1;2017-09-06 22:36;1;1;"Зверства военнослужащих США в Афганистане. pic.twitter.com/1WwrWSXoNy";;;;"905560418747387907";https://twitter.com/ArmGot1/status/905560418747387907
ArmGot1;2017-09-04 09:15;0;0;"Отвечает (общество)? Ватное общество.";;;;"904633962097770497";https://twitter.com/ArmGot1/status/904633962097770497
ArmGot1;2017-09-03 19:16;0;0;"Попробуй пропустить такие новости.";;;;"904422791302270976";https://twitter.com/ArmGot1/status/904422791302270976
ArmGot1;2017-09-01 23:30;0;0;"https:// twitter.com/Fake_MIDRF/sta tus/903718805041537033 …";;;;"903762019735797760";https://twitter.com/ArmGot1/status/903762019735797760
ArmGot1;2017-09-01 19:06;0;0;"Почему жуткие кадры?";;;;"903695690630647812";https://twitter.com/ArmGot1/status/903695690630647812
ArmGot1;2017-09-01 19:01;0;0;"Это даже не смешно. Ужасно. Ужасно потому что тем людям на все наплевать, то-ли от лени, то-ли бездарности.";;;;"903694343642472450";https://twitter.com/ArmGot1/status/903694343642472450
ArmGot1;2017-09-01 17:25;0;1;"Человечище, большой поклон.";;;;"903670082945077248";https://twitter.com/ArmGot1/status/903670082945077248
ArmGot1;2017-08-29 19:29;0;0;"Посинели.";;;;"902614247498244102";https://twitter.com/ArmGot1/status/902614247498244102
ArmGot1;2017-08-26 20:13;0;0;"Флойд сильнее тут и гадать особо не нужно.";;;;"901538184361914368";https://twitter.com/ArmGot1/status/901538184361914368
ArmGot1;2017-08-26 20:12;0;1;"Кто его знает, может и договорились кто кого, за такие то деньги?";;;;"901537796657172480";https://twitter.com/ArmGot1/status/901537796657172480
ArmGot1;2017-08-23 04:22;0;0;"Мадуро руками показывает сколько ещё денег нужно от Путина. Ура товарищи!";;;;"900211707892695041";https://twitter.com/ArmGot1/status/900211707892695041
ArmGot1;2017-08-20 16:24;0;0;"https:// twitter.com/meduzaproject/ status/899279998116409345 …";;;;"899306064864215043";https://twitter.com/ArmGot1/status/899306064864215043
ArmGot1;2017-08-19 22:42;0;0;"";;;;"899038860914683904";https://twitter.com/ArmGot1/status/899038860914683904
ArmGot1;2017-08-16 17:14;0;0;"pic.twitter.com/2p8pnKl2Vm";;;;"897869165486329858";https://twitter.com/ArmGot1/status/897869165486329858
ArmGot1;2017-08-15 00:08;0;0;"Боже это же какую кашу нужно иметь в голове.";;;;"897248673213579265";https://twitter.com/ArmGot1/status/897248673213579265
ArmGot1;2017-08-13 17:15;0;0;"Hax!";;;;"896782223214620672";https://twitter.com/ArmGot1/status/896782223214620672
ArmGot1;2017-08-12 00:03;0;0;"https:// twitter.com/n_etkind/statu s/896153485644775424 …";;;;"896160234950901760";https://twitter.com/ArmGot1/status/896160234950901760
ArmGot1;2017-07-12 06:18;0;0;"Ещё так лет десять и можно снимать фильм про Робинзона Крузо.";;;;"885020547339497472";https://twitter.com/ArmGot1/status/885020547339497472
ArmGot1;2017-07-11 17:39;0;0;"20. Страна кривых зеркал.";;;;"884829566614872066";https://twitter.com/ArmGot1/status/884829566614872066
ArmGot1;2017-07-10 16:58;0;0;"Несмотря на то что сталин уничтожил миллионы людей, он не фашист, не нацист и не фюрер. Как-то несправедливо, не по-русски.";;;;"884456724702351361";https://twitter.com/ArmGot1/status/884456724702351361
ArmGot1;2017-07-10 16:53;0;0;"Чудо-трава.";;;;"884455598254940162";https://twitter.com/ArmGot1/status/884455598254940162
ArmGot1;2017-07-10 16:49;0;0;"https:// twitter.com/natohawks/stat us/884159933163479041 … Русский не фашист (он там есть) приехал в Луганск убивать украинцев.";;;;"884454659750068224";https://twitter.com/ArmGot1/status/884454659750068224
ArmGot1;2017-07-10 16:18;0;0;"ЗООПАРК.";;;;"884446734646210561";https://twitter.com/ArmGot1/status/884446734646210561
ArmGot1;2017-07-10 09:05;0;1;"Боже дякую що я не москаль!";;;;"884337740095119360";https://twitter.com/ArmGot1/status/884337740095119360
ArmGot1;2017-07-09 19:49;0;0;"Норма это как? Сколько белков, углеводов, и жиров должно быть в дневном рационе? Что-то там не густо.";;;;"884137496942129152";https://twitter.com/ArmGot1/status/884137496942129152
ArmGot1;2017-07-09 19:09;0;0;"Денег нет, но вы держитесь.";;;;"884127462787043328";https://twitter.com/ArmGot1/status/884127462787043328
ArmGot1;2017-07-09 15:24;0;0;"Да, да прям как Мусолини.";;;;"884070763418005504";https://twitter.com/ArmGot1/status/884070763418005504
ArmGot1;2017-07-09 15:07;1;0;"Смотри так и секс запретят и перейдут на штучное оплодотворение, да ещё селекцией займутся. Вот таких больных людей как он.";;;;"884066518241353730";https://twitter.com/ArmGot1/status/884066518241353730
ArmGot1;2017-07-08 23:17;0;0;"А там решать не чего, но есть кого.";;;;"883827414429835264";https://twitter.com/ArmGot1/status/883827414429835264
ArmGot1;2017-07-08 23:10;0;0;"Лизать - это святое, а повод найдётся.";;;;"883825696459587584";https://twitter.com/ArmGot1/status/883825696459587584
