username;date;retweets;favorites;text;geo;mentions;hashtags;id;permalink
ArmGot1;2017-07-08 23:04;0;0;"Крым армией не захватывал, войну на Донбассе не начинал, русский бук пассажирский самолёт не сбивал.";;;;"883824136090464256";https://twitter.com/ArmGot1/status/883824136090464256
ArmGot1;2017-07-08 22:40;0;0;""ЛДНР" - разрешённая террористическая организация в России.";;;;"883818008845701122";https://twitter.com/ArmGot1/status/883818008845701122
ArmGot1;2017-07-08 22:33;0;0;"18.";;;;"883816271137169408";https://twitter.com/ArmGot1/status/883816271137169408
ArmGot1;2017-07-07 18:19;0;0;"P@zda. З большой буквы.";;@zda;;"883389991551881216";https://twitter.com/ArmGot1/status/883389991551881216
ArmGot1;2017-07-02 08:47;0;0;"Может и расстрельные списки уже есть как при сталине?";;;;"881434216730431489";https://twitter.com/ArmGot1/status/881434216730431489
ArmGot1;2017-07-01 20:30;0;0;"Было бы смешно, если бы не так грустно.";;;;"881248595923566592";https://twitter.com/ArmGot1/status/881248595923566592
ArmGot1;2017-07-01 17:53;0;1;"На чемпионат мира по футболу готовятся.";;;;"881209209714593793";https://twitter.com/ArmGot1/status/881209209714593793
ArmGot1;2017-06-21 21:21;0;0;"https:// twitter.com/Khaqani_M/stat us/877633251912720384 …";;;;"877637749230227456";https://twitter.com/ArmGot1/status/877637749230227456
ArmGot1;2017-06-20 18:36;0;0;"Скоро, скоро, скоро................................";;;;"877233618241937408";https://twitter.com/ArmGot1/status/877233618241937408
ArmGot1;2017-06-15 00:09;0;0;"Больной на голову человек. "Дети коррупционеров" - вы только вдумайтесь какой бред. Это же какую кашу нужно иметь в голове.";;;;"875143279339339776";https://twitter.com/ArmGot1/status/875143279339339776
ArmGot1;2017-06-04 17:35;0;0;"Бл@ть! Кость собаке так даже не кидают.";;@;;"871420044252729346";https://twitter.com/ArmGot1/status/871420044252729346
ArmGot1;2017-05-31 20:21;0;0;"Интересно а что Кадыров лично организует встречу с геями?";;;;"870012285242286080";https://twitter.com/ArmGot1/status/870012285242286080
ArmGot1;2017-05-31 20:01;0;0;"Обижаются только те кто имеет комплекс неполноценности или недонацисты которое ищут более значимое прошлое. Примеры найдутся.";;;;"870007291839467520";https://twitter.com/ArmGot1/status/870007291839467520
ArmGot1;2017-05-31 17:08;0;0;"А потому что принадлежал варягам. Вот и всё.";;;;"869963877764788224";https://twitter.com/ArmGot1/status/869963877764788224
ArmGot1;2017-05-31 17:07;0;0;"Русь это варяги, то-есть шведы. Киев был (русским) не потому что там жили русские";;;;"869963434774982656";https://twitter.com/ArmGot1/status/869963434774982656
ArmGot1;2017-05-31 15:44;0;0;"под своими собственными названиями.";;;;"869942737478594560";https://twitter.com/ArmGot1/status/869942737478594560
ArmGot1;2017-05-31 15:40;0;0;"До призвания варягов территорию первого русского государства населяли балтийские, финно-угорские и восточно-славянские племена.";;;;"869941675422085120";https://twitter.com/ArmGot1/status/869941675422085120
ArmGot1;2017-05-31 15:36;0;0;"https:// ru.m.wikipedia.org/wiki/%D0%A0%D1 %83%D1%81%D1%8C_(%D0%BD%D0%B0%D0%B7%D0%B2%D0%B0%D0%BD%D0%B8%D0%B5) …";;;;"869940752385814531";https://twitter.com/ArmGot1/status/869940752385814531
ArmGot1;2017-05-31 14:46;0;0;"Вот и учи несвидомый и залежный. В состав Киевской Руси входили разные етнические племена, русских и украинцев не было.";;;;"869928138096201728";https://twitter.com/ArmGot1/status/869928138096201728
ArmGot1;2017-05-31 06:12;0;0;"Зачем угро-финам Анна Киевская???";;;;"869798647801802752";https://twitter.com/ArmGot1/status/869798647801802752
ArmGot1;2017-05-30 21:16;0;0;"По середине х@й получается.";;@;;"869663837129252864";https://twitter.com/ArmGot1/status/869663837129252864
ArmGot1;2017-05-30 20:57;0;0;"Погиб русский оккупант. За что погиб???";;;;"869659104918331392";https://twitter.com/ArmGot1/status/869659104918331392
ArmGot1;2017-05-30 20:47;0;0;"В 11-м веке была Киевская Русь и угро-фины на её окраинах, украинцев и русских не было.";;;;"869656434664853505";https://twitter.com/ArmGot1/status/869656434664853505
ArmGot1;2017-05-24 06:22;0;0;"Когда такие же дети гибнут в Сирии, Ираке, Афганистане и т.д. почему-то по ТВ не показывают?";;;;"867264431251755010";https://twitter.com/ArmGot1/status/867264431251755010
ArmGot1;2017-05-21 20:20;0;0;"https:// twitter.com/Zn_Portnova/st atus/865990615292669952 …";;;;"866388245428535300";https://twitter.com/ArmGot1/status/866388245428535300
ArmGot1;2017-05-17 06:39;0;0;"https:// twitter.com/Fake_MIDRF/sta tus/864718514426392576 …";;;;"864732084815974400";https://twitter.com/ArmGot1/status/864732084815974400
ArmGot1;2017-05-13 17:14;0;0;"Зачем Охлобыстину два паспорта днр?";;;;"863442277041152000";https://twitter.com/ArmGot1/status/863442277041152000
ArmGot1;2017-05-13 16:55;0;0;"Батько три дні помирав у страшних муках; - сім'я звинувачує медиків у смерті родича https:// gazeta.ua/articles/np/_b atko-tri-dni-pomirav-u-strashnih-mukah-simya-zvinuvachuye-medikiv-u-smerti-rodicha/772060 …";;;;"863437681916882945";https://twitter.com/ArmGot1/status/863437681916882945
ArmGot1;2017-05-10 17:34;0;0;"Нашого цвіту про всьому світу.";;;;"862360262384418816";https://twitter.com/ArmGot1/status/862360262384418816
ArmGot1;2017-05-04 21:27;0;2;"https:// twitter.com/StalinGulag/st atus/860188886143774720 …";;;;"860244565789335552";https://twitter.com/ArmGot1/status/860244565789335552
ArmGot1;2017-05-02 17:09;0;0;"Spartan Race. Да изобрели велосипед. ;)";;;;"859454828891820032";https://twitter.com/ArmGot1/status/859454828891820032
ArmGot1;2017-04-22 16:42;0;0;"Смешно. Царь - есть, помещики и капиталисты тоже и крепостные на подходе. Ленина тоже скоро закопают. Что вам ещё нужено?";;;;"855824095732273152";https://twitter.com/ArmGot1/status/855824095732273152
ArmGot1;2017-04-20 19:41;0;0;"У Сирії військовий фотокореспондент врятував хлопчика https:// m.gazeta.ua/articles/child ren/_vijskovij-fotokorespondent-zupiniv-zjomku-schob-vryatuvati-hlopchika-vrazhayuchi-znimki/767619 … via @gazetaua_twit";;@gazetaua_twit;;"855144458177978368";https://twitter.com/ArmGot1/status/855144458177978368
ArmGot1;2017-04-14 06:40;0;0;"Да вы правда забыли сказать что он там всё разбомбил, а так ничего.";;;;"852773464696012803";https://twitter.com/ArmGot1/status/852773464696012803
ArmGot1;2017-04-12 17:07;1;0;"На Винипуха похож. Я тучка, тучка, тучка, я вовсе не ведьмедь.";;;;"852206554086592513";https://twitter.com/ArmGot1/status/852206554086592513
ArmGot1;2017-04-09 19:33;0;0;"https:// twitter.com/worldonalert/s tatus/849183364737376256 … Кто скажет что это фейк, того же (не желаю).";;;;"851156154776514564";https://twitter.com/ArmGot1/status/851156154776514564
ArmGot1;2017-04-08 08:39;0;0;"https:// twitter.com/worldonalert/s tatus/849183364737376256 …";;;;"850629281541652481";https://twitter.com/ArmGot1/status/850629281541652481
ArmGot1;2017-04-07 23:02;0;0;"ВСУ не использовали на Донбассе фосфорных бомб, как например Асад в Сирии.";;;;"850483907485106176";https://twitter.com/ArmGot1/status/850483907485106176
ArmGot1;2017-04-07 22:36;0;0;"https:// twitter.com/CITeam_ru/stat us/850445445226795009 …";;;;"850477329428230144";https://twitter.com/ArmGot1/status/850477329428230144
ArmGot1;2017-04-07 22:33;0;0;"https:// twitter.com/worldonalert/s tatus/849183364737376256 …";;;;"850476597606010880";https://twitter.com/ArmGot1/status/850476597606010880
ArmGot1;2017-04-07 22:31;0;0;"https:// twitter.com/CITeam_ru/stat us/850445445226795009 …";;;;"850476121166630912";https://twitter.com/ArmGot1/status/850476121166630912
ArmGot1;2017-04-06 19:14;0;0;"pic.twitter.com/2bN99WE1zZ";;;;"850064084200558593";https://twitter.com/ArmGot1/status/850064084200558593
ArmGot1;2017-04-06 06:23;0;2;"Фотографии сделанные в Полтавской области.";;;;"849870064501362689";https://twitter.com/ArmGot1/status/849870064501362689
ArmGot1;2017-04-04 18:21;0;0;"Да, так всё по-пацански обрисовал.";;;;"849326035715969026";https://twitter.com/ArmGot1/status/849326035715969026
ArmGot1;2017-04-02 18:47;0;1;"Да и кушать вредно и пить воду и дышать скоро будет вредно.";;;;"848607792365785093";https://twitter.com/ArmGot1/status/848607792365785093
ArmGot1;2017-03-30 09:36;0;0;"https:// twitter.com/StalinGulag/st atus/847368891835727872 …";;;;"847382076215107584";https://twitter.com/ArmGot1/status/847382076215107584
ArmGot1;2017-03-24 18:37;0;0;"https:// twitter.com/ntvru/status/8 45343297551962112 …";;;;"845343895366127617";https://twitter.com/ArmGot1/status/845343895366127617
ArmGot1;2017-03-24 18:35;0;0;"https:// twitter.com/openrussia_org /status/844882673785094144 …";;;;"845343289515687936";https://twitter.com/ArmGot1/status/845343289515687936
ArmGot1;2017-03-24 18:31;0;0;"Цель - ожирение.";;;;"845342407357030401";https://twitter.com/ArmGot1/status/845342407357030401
ArmGot1;2017-03-24 18:24;0;0;"Увлекательный день? А что же там увлекательного? Вы бы же как-то поподробнее рассказали.";;;;"845340611603509248";https://twitter.com/ArmGot1/status/845340611603509248
ArmGot1;2017-03-24 18:17;0;0;"Порохоботы.";;;;"845338692352966656";https://twitter.com/ArmGot1/status/845338692352966656
ArmGot1;2017-03-24 18:09;0;0;"За багату Україну без під@рів!";;@;;"845336674049634305";https://twitter.com/ArmGot1/status/845336674049634305
ArmGot1;2017-02-28 18:14;0;0;"Прикарманизация, это просто романтика...";;;;"836640790713614337";https://twitter.com/ArmGot1/status/836640790713614337
ArmGot1;2017-02-24 18:36;0;0;"Как говорят, деньги не пахнут.";;;;"835196667708178432";https://twitter.com/ArmGot1/status/835196667708178432
ArmGot1;2017-02-19 17:47;0;2;"Очень часто смотрит в низ когда говорит, да и Соловьев кислий как лимон. Скорее всего он и сам не знает о чём говорит.";;;;"833372365216219137";https://twitter.com/ArmGot1/status/833372365216219137
ArmGot1;2017-02-18 12:49;0;0;"Гиркин который спровоцировал войну на Донбассе кто по-вашему. Ведь до него не было войны. https:// twitter.com/ArmGot1/status /761259527534764032 …";;;;"832935099410808832";https://twitter.com/ArmGot1/status/832935099410808832
ArmGot1;2017-02-18 07:10;0;0;"@mixailtugarin Человек который защищает свою страну это патриот.";;@mixailtugarin;;"832849750105923584";https://twitter.com/ArmGot1/status/832849750105923584