"сука, идиот !"
"не завидуй !"
"бля ))) спасибо поржал! ))"
"и так можно сказать про практически каждую европейскую страну ! но МОНСТР конечно СССР , Россия , Сталин и Путин !"
"типа секси ? фу блять!"
"я один нихуя не понял !?"
"главное чтобы не осталось очередной болтовнёй . ибо уже напрягает ."
"добровольцы с ледорубом шаг вперёд !"
"Маня дело говоришь! Привет !"
"не могу посмотреть видео , нету телеграмма , но предполагаю что мелкий пиздюк не просто так огрёб а нарвался . выложите на яндекс диск"
"что это блятЬ!!! нахуй я это увидел !??"
"дыык в чём проблема )) хирургию ещё никто не отменял )!!!"
"заебётесь пыль глотать идиоты ."
"так бояться спать и кушать не могут ! да тебе уже твои школьники не верят , чего уж там о взрослых людях говорить. сисястое ты уёбище !"
"пускай анальный и обеспечивает её работой . нехуй хуйнёй страдать"
"цель то как раз и не мутная . поиметь с лошар бабло ! это и был единственная цель а лошары радостно крякают наш президент ))"
"только тупая школата и дауны верйят что у него есть шанс стать презиком . а ему от вас нужно только БАБЛО ."
"ваш презик . предохраняйтесь чтобы такие дебилы не появлялись"
"а что думаешь другая причина была , пока есть такие лохи , чего бы с них бабло не пособирать"
"там и оставайся долбоёб ))"
"ты главное не рефлексуй распространяй , засылай бабло и отсасывай у навального ! остальное пох ))"
"а если покурить то на 200 ?"
"даун убогий тут ты один . побыстрее бы уже твоя недострана нахуй развалилась, и ДНР ЛНР вздохнут спокойно ."
"надо как в европе пиздить дубинками, водомётами и резиновыми пулями ! прочувствовали бы разницу !"
"Интервью главного редактора издания Ukraina.ru с главным врагом киевского режима http:// ukraina.ru/exclusive/2017 1030/1019448986.html …"
"Интервью главного редактора издания Ukraina.ru с главным врагом киевского режима http:// ukraina.ru/exclusive/2017 1030/1019448986.html …"
"допиздится ковалёв , возьмут и насрут ему на ебало ."
"ну ладно , пойду спать , спокойной ночи , спишемся ещё))"
"нну не важно яндекс или гугл , робот он и есть робот ))"
"Доброе утро ) да всё норм спасибо , ты как ? вот подумал загляну перед снов сюда , посмотрю что нового ))"
"т.е в предложение , я понимаю что перевод гугла но всё же ))"
"Горжусь что я тоже вложил маленькую толику в это дело )))"
"да они ебанутые , насмотрелись всяких гомикадце и чушь несут . чёрный траффик Кремля , украденные лайки и прочая чепуха ."
"вообще то в предложения Я Счастлив 2 слова ))"
"похуй ! увижу в хорошем качестве на торрентах скачаю и посмотрю ."
"почему нет , особенно если есть что показать , главное чтобы это выглядело красиво а не пошло и дёшево ."
"привет ))"
"вивсёврёте , это же фотошоп ))"
"и тут жирика понесло)))"
"конечно же моста нет !!! круто научились на Мосфильме снимать ))"
