"Sure thing, buddy. Good talk. I wish you the best."
"I don't believe so."
"All of those things become a part of an individual's identity, burh"
"Dude, if you don't believe in free will the concept of "self" is lost."
"LOL. So a man just born a carpenter, father and brother?? This is ridiculous."
"Be free will *is* required to believe that the "self" is central."
"Personalism claims that the "self' is central. How does that concept perfectly align with identitarianism? That's paradoxical. Absurdity."
"Oh, of course it's irrelevant. That suits your argument."
"What? You don't even believe in free will. What are you talking about?"
"Odd. Most other identitarians I've spoken with willingly admit that their ideology is collectivist."
"You're deciding to take things out of context. I was speaking strictly ideologically."
"Not at all. There may be a misunderstanding."
"Amalgamating into a collective makes you a collectivist."
"I made a relatively concise statement. Not sure what you didn't comprehend."
"Those "authentic" attributes are arbitrary because they are randomly assigned and not by any measure category."
"No, I'm being rather courteous, actually. If I wanted to characterized you unfavorably I would point out the innate flaws of collectivism."
"Your question relies on the assumption that "Never Trumper RINOs" have established objectives based upon being Never Trumper RINOs."
"All of that to say, Knowles' estimation of the group is correct."
"Libertarian is now only a preposition to describe your ideological leanings in context of your group."
"so it is the obverse of collectivism which relies (in this situation) on arbitrary congenital attributes."
"If you amalgamate into a collective, you are a collectivist (context). Libertarianism is meritocratic at it's core,"
"You seem to be in denial about the nature of what you've chosen to affiliate yourself with."
"Knowles perfectly summed up the collective nature of the group. The "in a respect" was a courtesy b/c the group's prepositions are equivocal"
"Personal interest is only interconnected with race if you are a collectivist. Civilization produces peoples, not the other way around."
"The group is best described as pseudo-pro-Christian and economically nebulous (perhaps trifurcated)."
"I am a male. There are no feelings of acrimony. All is well"
"Not positive about that. Regardless, and no matter if he uses undesirable adjectives, he describes it's nature quite perfectly,"
"I know a goodly amount about the collective's vision. I believe he perfectly captures the ideology, in a respect."
"This ideology isn't new"
"It's not slanderous propaganda if it's truthful and objective. Anyone who has done their research knows Knowles isn't practicing mendacity."
"Looks like my inference is correct. Michael did a great jobs is summing the group up."
"t's been my ever-present suspicion that videos criticizing the Alt-right are spammed with down votes to oblivion by it's adherents."
"David corn probed for inappropriate workplace behavior. Lots of people angry at David, I'm sure."
"Delineate his deflection. He simply followed McCarthy's pattern of discourse. She prevaricated and so did he."
"perceived minorities*"
"I'm not at all a fan of you, Steven, but this is an observable truth. Good on you for pointing it out."
"@DataDistribute A compelling vid on race realism. They don't explore the IQ question, but it's an informative debate https://www. youtube.com/watch?v=a_VSWl njavY …"
"My secret is reading until I reach exhaustion It works 10-90% of the time"
"pic.twitter.com/vAral7KPdu"
"Thank you, kindly :)) Sleep well!"
"Count the sheep, and then count the stars lol I wish you luck :)"
"Yea I'm sort of an insomniac"
"Oh, of course not! He's not what I consider entertainment. I only watched part of it tonight to see if he cried lol"
"Yea, he seems quite selective"
"Jimmy Kimmel didn't shed one tear tonight. KINDA ODD, HUH??!!1!1!"
"After hearing about the most recent Islamic extremist attack in NY, your first thought should not be, "but the WHITE guy in Vegas!"."
"But as a Christian American who enjoys religious liberty in the US, I'm obligated to defend the rights of peaceful Muslim American moderates"
"I agree. Things Kahn has said are inexcusable, and I happen to agree with what Ben Shapiro says in this video https://www. youtube.com/watch?v=g7TAAw 3oQvg …"
"Also, I'd just like to bring to your attention that I'm not defending Islam here. I'm not a fan of Islam at all."
"Ok, what are your thoughts on this? https:// docs.google.com/spreadsheets/d /1e8BjMW36CMNc4-qc9UNQku0blstZSzp5FMtkdlavqzc/edit#gid=0 …"
"For what it's worth, here is a website dedicated to documenting muslims condemning Islamic extremist attacks. https:// muslimscondemn.com /"
"When you've sexually abused so many individuals until you've completely lost count "I choose now to live as a gay man""
"There is still ample time to avoid Skynet. We need to do something about this https:// twitter.com/FortuneMagazin e/status/925256093294612480 …"
"lol pic.twitter.com/NaAgRFrK6h"
"The equanimous left, consistently graceful in their attempts to create dialogue. And never race-baiting! (sarcasm, in case anyone misses it)"
"Asinine article lol Also, interesting aphorism. Extremely versatile"
"I'm convinced that we, humans, don't have any novel thoughts or predilections. Although we are unique, we are also are extremely unoriginal."
"I think he's just being himself."
"I know, right? This lady is sick."
"That is me whenever an identitarinist hashtag trends on Twitter."
"lol swweeet"
"I was born with five fingers on each hand. #5FingersPride #ProudToBe #CanThingsGetAnySillierThanThis ?"
"No one who refers to themselves as an "expert on race" should be taken seriously."
"Sure. Thanks for a bit of clarity."
"I see. Do you know the name of the individual who made the first video, and why they felt the need to bring to light old information?"
"I see. If that's true, it's a shame. However, I am still curious why this hasn't been criticized earlier than now... it's so bizarre."
"Just seems queer that people outraged, once again, over extremely old news."
"The site is up but it's been virtually stripped and has been at a standstill for months..."
"No, not at all. But it is an organized attacked... I'm not talking conspiracies. I'm talking about the reality of what's happening."
"I understand that critique, but it does seem like an organised attack.... She was criticized for this over a year ago..."
"Just seems rather queer..."
"Not a fan of hers, so no, I'm white knighting. I watched half of one of her videos and her style wasn't to my liking."
"I think Social Autopsy terrible, but she was criticized for the creation of it over a year ago... Why is this topic being brought again?"
"Looks like China's getting woke"
""More Chinese women push back against the traditional notion that they must marry & have children at a young age." http://www. bbc.com/news/world-asi a-china-41757971 …"
"I'm sure "feminist" attorneys don't have the same code of conduct as commonplace attorneys"
"It means the dishes are getting super duper clean"
"This. Price doesn't matter. It's Christmas https://www. amazon.com/gp/offer-listi ng/B00GMA414S/ref=sr_1_12_olp?s=toys-and-games&ie=UTF8&qid=1508993429&sr=1-12&condition=used …"
"I agree. People seem far too eager to judge."
"Yes. It's similar to how the left calls everyone Nazis or racists for disagreeing with them. The demarcations are becoming rather distinct."
"That's awesome lol"
"Precisely"
"I like how they say "Justice prevailed". The irony."
"Aww. Get well soon, my fran"
"I picked "Other", because girls can't be Boy Scouts"
"I placed exactly where I imagined I would. pic.twitter.com/Sr1Enjm2EW"
"So this is what scientists do all day"
"Not sure if I'll ever open these again..... Maybe in a week. Two weeks tops"
"Yea, I should have been a a lot more wary. Thankfully I'm not scarred for life or anything. I'm presently just triggered by this image pic.twitter.com/fg27iNY3EE"
"Thanks man"
"Trashy*"
"I don't care how this poll turns out, I'd rather you take care of yourself and your present/future financial well-being."
"Honestly, it's not worth talking about. Just pretty trashing. I won't help it spread :)"
"I backed away slowly. I did not pass GO, I did not collect my $200. It was bad man."
"I accidentally found weird, sinister Twitter. Things are getting out of hand."
"Well that sounds splendid :)"
"Identitarianism is cancerous."
"Yes. The article is terribly inaccurate, however, their criticism of identitarianism, though doubtlessly hypocritical, is appropriate."
"College student about the US Constitution: "I don't think that's a relevant document right now" We are in dark times https:// twitter.com/notaxation/sta tus/922509521884299264 …"
"That'll learn you"
"What happened to us?"
"I know the Antifa guys is a parody, but him? Not at all sure."
"Identitarianism is narcissism."
"We are both blessed :) Here's a view from my back porch. pic.twitter.com/IxwSbtZFSV"
"This would be legendary. Yes."
"I share this sentiment. Like 24/7"
"Would you be opposed to cluing me in on the secretive nature of Idaho? I am now curious about this state's particular appeal."
"That is beautiful."
"@DataDistribute Despite disagreeing with the creator politically and otherwise, I found this content interesting. https://www. youtube.com/watch?v=GgZFGg JlAsk …"
"Twitter's Overton window pic.twitter.com/mSBQmbvYaE"
"Thanks for putting me into box. Much appreciated."
"Thank you."
"Then why are they discussing it on a public platform if nothing is being done? Just stirring up spurious controversy, I guess."
""
"If Southern has proof that someone was sexually assaulted by Loomer then she should have given said proof to the proper authorities by now."
"Agreed, but good political commentators show discernment. It's fine if we disagree :)"
"I don't mind if you disagree."
"Cassandra protests, stirs up controversy and get arrested. Like I've stated, they all have an amount of substance, but they're all immature"
"And Lauren is constantly bucking authority, stirring up controversy and claiming that no one understands the woes befalling the west."
"And, to a certain extent, they feed on controversy. They're immature."
"I'm not claiming that they don't have insight concerning particular topics. I'm stating that they lack discernment."
"Far too much immaturity."
"I've been thinking this for about a year, but now I'm confident that they are all terrible frontwomen for the right, toxic even."
"Bickering on Twitter just makes them appear morally deficient, or immature, or both."
"individual, then they should possess the moral wherewithal to give the information to the proper authorities."
"Actually, this is extremely disturbing and the opposite of funny. If Fairbanks & Southern have information on Loomer (allegedly) raping an"
"I'm sorry this happen. I'm glad you took down the tweet that included their profile. Privacy is very valuable. I'll be praying for you, MB."
"Idioms are racist. pic.twitter.com/AuZlGfaFD9"
"Can I be the nicest man that you have never met?"
"Me too! But I'm not sexist or racist. They need to expand their horizons a little bit. Maybe get to know us and see what we're really like."
"Ye, like they could say "If you vote republican then you're also a nihilist, misanthrope who wants to see the world burn." That's exciting"
"I can't help it. Their accusations are so methodical. It's getting boring."
"Whenever you're an enemy of the left you're always either sexist, racist ,or both. They truly need to come up with some fresher accusations"
"Yea. Tree called me a "low IQ negro", and subsequently blocked me, for asking a plausible Q concerning one of her tweets. She's repulsive."
"So, are you racist and do you condemn black supremacy? (Hint: Your answer doesn't matter, you're racist ) https:// twitter.com/alwaystheself/ status/921124712700436481 …"
"These are some really tough rules to play by."
"Shadilay, my brother. We shall rise again."
"Hmm. I'm getting the "you're a loyal friend" vibe from this description of yourself. Extremely loyal, to the grave even."
"pic.twitter.com/C9NBecfkz2"
"You can thank the left for that"
"I think it's hilarious."
"Doesn't it seem absurd to you? Are you proud to be born with (hopefully) all of your digit, or do you just recognize that you have digits?"
"Absence of shame doesn't equal pride, the two aren't connected. No one should be proud or ashamed of something they had no control over."
"It's, of course, absurd & illogical to feel ashamed of your race as well, but pride? Recognition, yes, but pride? It's preposterous."
"It's always baffled me how anyone could feel a sense of pride in a component of their lives that they had no control over."
"So, you're gonna debate her?"
"The crazies are attracted to you."
"You've got a filthy tongue. https:// twitter.com/2tall4u2/statu s/921095844337614849 …"
"Victimhood - The bread and butter of identity politicking."
"First cast out the beam from your own eye
"California is so progressive"
"Also this year in California http://www. latimes.com/politics/essen tial/la-pol-ca-essential-politics-updates-knowlingly-exposing-others-to-hiv-1496281754-htmlstory.html …"
"This year in California http://www. latimes.com/local/californ ia/la-me-ln-std-rates-20170926-story.html …"
"Last year in California http://www. latimes.com/local/lanow/la -me-ln-std-rates-20161025-snap-story.html …"
"Regardless of what these people are saying, you are correct. Demand may create the opportunity for a job but the capital comes from the rich"
"One a socialist, one a capitalist is a much fairer comparison."
"The Q begs to be asked, are gay & trans women obligated to advocate for "women", & if not, are they now apostates of Feminism? So intense."
"So, where do we go from here? This tweet questions the very fabric of life. https:// twitter.com/RileyJayDennis /status/920720478909620224 …"
"Looks like you only have one option. Both."
"I'm assuming a America is a totalitarian state in this future."
"Which option is easier?"
"I'm partially wrong. No country permits an individual citizenship based on genes alone. Proof of relation via DNA sampling would be required"
"Israel doesn't DNA test "immigrants". When necessary, DNA tests are administered to Jews who claim Right of Return, for the record."
"Generally, any country that acknowledges Right of Return necessitates DNA testing as a proxy for paper work or other documentations."
"lol. With such uncommon standards it's possible that your SO-to-be's standards for an SO will be "must have an adequate bug pet collection.""
"These guys are pretty awesome and I do really need to stop watching the news. Thank you Mo"
"That's just my opinion, but I'm most likely over thinking things or not thinking in the right terms, maybe. lol."
"But I view those changes (not all changes) as regressive because they'll bring ruin."
"Definitely. I think prescription meds, chemical additives and all of those things play a roll in the direction of our society."
"How does he always have proof? Poor guy must be waiting for people to sabotage him,.. or he's just BSing, again."
"Pretty much. It seems we're regressing. It's not comforting to witness."
"Agreed. Neither is an 8 year old, disabled or not, to be handcuffed for misbehaving. I thought these values were rudimentary in our society"
"Any way the wind blows doesn't really matter to me.... to me"
"Look up to the skies and see"
"Their tricks don't trick me. Healthcare and medical care are not synonymous"
"Articles like these are my incentive to live a healthy lifestyle and not rely on medical care."
"Press ctrl+ end+ alt + right + delete = safe"
"Yes. That was child abuse. If a parent did that to a child CPS would be called immediately. The adults would be in prison."
"I'm doing my best. Objectivity is my goal"
"Morning exercise #goals"
"At this point I'm probably just biased toward Trump. What have I become. The media made me into what I am :("
"I think they were looking for something to be upset about, especially Rep. Wilson."
"What if throwing you under the bus to save myself was the only way to save you? decisions decisions"
"That's called #FatPrivilege"
"individual's defining features. This exercise is called dehumanization."
"The first act of injustice against the individual is the absorption of the individual into the collective and the elimination of that"
"No one can claim words, or anything else, is offensive based off of race, sex, or class."
"Very true"
"Floating hospital off hurricane-ravaged Puerto Rico mostly empty http:// nydn.us/2yoALRa"
"A collective is inherently amoral."
"Achievement Unlocked"
"lol"
""You get the chance to talk with the Prime Minister " - Justin Trudeau 2017"
"This will surely help to proliferate traditionalism."
"That or CERN"
"You couldn't pay me to watch it. After seeing Sleepy Hollow in my teens I swore off the horror films. The imagery gets to me lol"
"Or maybe it's that 4 dimensional chess."
"Oh, I've never seen it. I'm too scared."
"Is Trump tipping an invisible fedora here?"
"That's a fascinating notion."
"A soft word turns away wrath."
"Yes, I hold that belief as well, albeit very loosely."
"Ah."
"Nothing too bad. I just have a low tolerance for ridiculousness."
"Gosh, I really need to stay away from Stupid Twitter."
"The tower of Babel had nothing to do with race. It had to do with language. In fact, the Bible never mentions race, only nationality."
"Idiotic."
"You beat me to it"
"Sorry for the outburst. They really get my goat....."
"They've squandered a great opportunity to help America."
"They present the issues childishly and divisively, focusing far too much on race and minority status to be even slightly effective."
"I agree that unwarranted police violence is an issue, though not a salient issue in our time. But despite agreeing, I'm disgusted with BLM."
"A terrible cycle for everyone involved"
"Yea. Unfortunately it seems that a lot of false allegations are made and it really harms the validity of true instances of sexual assaults"
"Even though she worded this oddly it's really sad. Her psyche needs some major healing."
"We finally agree on something."
"The JQ, however, is built upon a narrative of deceit. It is loosely factual and historically inaccurate."
"I thought the videos were entertaining and well put together. I love (not gey) and support Mouthy."
"Congratulations! If at any time you begin to struggle, remember that water and especially mint leaf will moderately attenuate the cravings."
"If that's true that means it's all going to be over soon."
"Correction. *We silence voices on Twitter every day. We’ve been working to silence voices for the past 2 years. https:// twitter.com/jack/status/91 9028949434241024 …"
"Mouthy didn't create Nazi propaganda. He displayed an opinion held among a select group and expressed that they were not his opinions."
"That is one of the most terrifying hashtags that I've ever seen."
"Ugh. A case of identity politicking."
"Where did you get this stat?"
"No problem man. rock on"
"That sounds awesome... wish you had a P.O. box, I'd totally send you some strings. I keep 5 packs on me always."
"I think he's serious."
"Daddy issues."
"Well, that's fine. Have a nice day."
"TFW you realize that identitarians know the price of everything but the value of nothing."
"Ok."
"I don't believe it is. Would you mind opening your DM? I'd like to leave you a message."
"Localities I totally agree with, That falls in line with things I've read. I've never read anyone saying "race is real", except racialists."
"Doesn't make sense."
"Why would someone with a PhD in genetics assume that no one above the Mediterranean has SCD? There are recorded accounts of this."
"Actually, in matters of genetics, dilettante is a perfect characterization of me. However, you still didn't answer my question."
"I never claimed otherwise. :)"
"You didn't answer my question and you've insulted me. The mark of an intellectual."
"So the link I provided you is false? Is that what you're claiming?"
"Making such ridiculous claims, you don't sound like a geneticist."
"First, explain what you mean when you say "race is real". What exactly are you implying?"
"Why would you make the absurd claim that people located above the Mediterranean aren't susceptible to SCD?"
"No, I said the axiom of "race is real" doesn't hold up under scrutiny and it does not, otherwise it would be stop and go."
"Your PhD is in what field?"
"I haven't once asserted anything except that race is a continuum, and that's not even my claim."
"Exactly what field do you have a PhD in?"
"I've never argued against genetic diversity. As I've stated, humans beings are heterogeneous. Race is a continuum, there is not stop and go."
"You've obtained a PhD? I'm parroting what I've heard and read from biologists and genealogists. This information is hardly controversial."
"Novel idea. Emulate the left's identitarian tactics b/c it works SO well for them. No one hates BLM, SJWs and feminist activists"
"Yes, some animals have species & subspecies because they have a larger gene pool than Homo sapien sapiens. Our gene pool is extremely narrow"
"The "race is real" axiom doesn't hold up under scrutiny because humans are heterogeneous beings. Race is more of a continuum, or a spectrum."
"Using your reasoning, it would be appropriate to categorize people who suffer from SCD & melanoma of the skin as two separate racial groups."
"This saying comes to mind -"All men are born equal, but some are more equal than others""
"This source claims that Hispanic, southern European, Middle Eastern, and Asian Indian can suffer from SCD. https://www. nhlbi.nih.gov/health/health- topics/topics/sca/atrisk …"
"Sickle cell disease isn't exclusive to those of African descent, just as melanoma of the skin isn't exclusive to those of European descent."
"It makes one wonder why the Founding Fathers initially felt the need to separate themselves from the Empire of Britannia."
"Love doesn't utilize reason and it eschews logic."
"Your psychology professor must not use a text book."
"You must have an unusually empty life."
"Anyone who unironically substitutes "your" for "you are" deserves to be blocked as a matter of principle."
"CLEAR is needed."
"Ask Blair what came first, the chicken or the egg, and then elucidate."
"That 24 thousand people liked his tweet is more staggering than the suggestive nature of his tweet. Kinda unbelievable"
"Oh, wow. I live in southeastern Georgia so I must be racist. Thank you, Destiny, for informing my life."
"@MouthyBuddha I'm not mad at you bb"
"Eminem & Kaepernick, helping to further bifurcate American politics. Also, they inadvertently endorsed Trump in 2020 https:// twitter.com/Kaepernick7/st atus/917955545197314048 …"
"Lol. If you watch the video till the end he literally says "VOTE TRUMP 2020!!" I didn't know he was such a staunch Trump supporter."
"I didn't know it was possible to "accidentally" place yourself in alignment with a political movement."
"Cuba doesn't deserve that type of treatment. Send them to NK"
"I'm not so sure, however, lately I've adopted a rather pessimistic view of things. If neo-Marxism weren't so prevalent I might have a hope."
"I'm debating whether or not to pin this tweet"
"I was using your username ironically. Idk, I guess. It's a bit of an unrealistic question tbh"
"Not Funny"
""Respect the pronoun or go to jail for up to 1 year" says California."
"Soon California may be able to boast a quarter or more of the nation's new HIV diagnoses as well"
"I'm with you, but there was no counter position to the claim. It was left as a possible truth but there is evidence against such conjuncture"
"You might be in Twitter jail. I haven't been receiving notifications for your tweets."
"race is purely polygenic. In this video Mouthy tried to establish a racial group that wasn't based on common polygenic traits."
"Yes, genetic drift. There's about a 0.1% genetic variance in humans. All racial groups share those genetic variances and because of that"
"I make up 40% of that 90%"
"An interesting chart, but it doesn't pertain to my comment because it's too general."
"used in the video across the board then it's possibly that there would be thousands of racial groups."
"If there is a Jewish race then it's unfair to lump "white" & "black" people into single racial groups. If we used the same metric that was"
"Are these real people?"
"Don't Native Americans have the entire month of November? #IndigenousPeoplesDay #ColumbusDay is one day out of the entire year."
"I'm a pescatarian."
"You got one of them loyal strippers. Lucky"
"Make sure you can trust her before sending those pics. Not all strippers are trustworthy"
"So lame"
"That was fast. I thought she quoted you first"
"Her bio "Driven by love" pic.twitter.com/1R1OJcfjvn"
"Yea I saw this and I pointed out the same thing. It's so dumb. People just want to be offended."
"Happy #ColumbusDay America. "For behold, I create new heavens and a new earth""
"I'm glad to see that you believe in moral autonomy."
"A majority of the toxins come from excrement that passes through your rectum. The insertion tool hardly matters."
"I don't want you to die, Zinnia. You took the discussion there not me. I want you to be healthy."
"Lube doesn't stop rectal trauma, micro tears and toxic pathogens from entering your blood stream. Research it for yourself."
"So unhealthy. The penetration traumatizes your rectum and creates micro tears which allow toxins into your blood stream."
"LIVE: Bob Corker vs Trump! Who can BS the greatest? pic.twitter.com/laURxRoYmM"
"Perfect example of why no one needs 280 characters. This is such a mess."
"My impression was that Dove wants everyone to use their soap."
"Frankly, I don't consider this to be a big deal. They all transform into the Asian woman at the end. From black to white to Asian."
"Lol."
