"Dems insult everyone, then will ask them to vote Democrat in the next election. This is their 2020 campaign slogan: pic.twitter.com/aOTOSunP1W"
"I always check to see if people responding are Soros paid trolls. You can always tell because they have 5 followers and 6,000 tweets."
"http://www. kpbs.org/news/2017/oct/ 25/at-bowe-bergdahls-sentencing-soldier-describes/ …"
"Dave is a paid troll with 123 followers. I've been blocking so many on this thread. No time for Soros funded trolls."
"Soldiers got killed while looking for him after he deserted his post! You are defending a traitor."
"Why did they purchase ours then? They want to control the market, stupid."
"Please educate yourself. He was not captured by ISIS, you stupid troglodyte."
"Me too. Sick to my stomach."
"He should have received the death penalty."
"No, the traitor who signed off on sale of uranium to Russia so they can sell it to Iran and N. Korea & make nukes to kill us with isn't Pres"
"Alert! Paid bot!"
"I hate Bush. That's not what we're talking about now. Try to keep up, bot. Your 38 followers are watching."
"Judges are supposed to uphold the law, period.Traitors are to be dealt with accordingly. You are a bot with 20 followers and 6000 tweets.Bye"
"Traitor apologist. You are a disgrace."
"They should throw the Judge in with him!"
"http://www. nydailynews.com/news/national/ brothers-arms-bash-bowe-bergdahl-traitor-article-1.1814106 …"
"The son of a bitch converted to Islam! http://www. dailymail.co.uk/news/article-1 305184/Bowe-Bergdahl-Taliban-claim-captured-U-S-solider-teaching-fighters-bomb-making-skills.html …"
"Now, traitors get out and walk free after our soldiers were maimed and killed because of this piece of shit! Disgraceful!"
"If you were worth more, you would be paid more. That's why a brain surgeon makes more than a cashier at McDonalds. Skill set dictates wage."
"My husband was in USAF. He is livid! People died, and one soldier got shot in the head and lived but is in bad shape. F*ing disgraceful!"
"#EndCashBail If you don't want to pay bail, stop committing crimes! Simple!"
""Bowe Bergdahl" As someone from a Military family, I can honestly say that I've never been more disgusted in my life."
"F*ing insanity! https:// twitter.com/axios/status/9 26474912176492544 …"
"What an awesome costume! God bless this sweet boy and his family. Go, dad! https:// twitter.com/MilitaryEarth/ status/926202543939530752 …"
"Let me guess? More fun from the religion of peace? http://www. telegraph.co.uk/news/2017/11/0 3/delivery-driver-blinded-fighting-life-acid-attack/ …"
"There's already a rival platform. It's called the Main Stream Media."
"Dems lost over 1,000 seats under Obama&GOP has most Governorships since 1922 because Americans rejected Socialist ideology & dems move left"
"Crooked CIA needs to be shut down, too."
"Insanity. https:// twitter.com/NBCNews/status /926135638621081600 …"
"https://www. washingtonpost.com/news/fact-chec ker/wp/2017/11/02/senate-democrats-falsely-claim-gop-tax-plan-will-raise-taxes-for-most-working-class-families/?utm_term=.12d96b05828c …"
"See how fast Trump sends out the National Guard! They're not under the lawless Obama administration anymore."
"Don't forget pallets of cash in the middle of the night to Iran."
"Also, the American taxpayers have to foot the bill for his trial, legal fees and jail, too! We should make Chuck Shumer pay the bill!"
"pic.twitter.com/nyGxaJbMaN"
"Thank you Staff Sgt. Black for paying the ultimate sacrifice for our freedoms. We are eternally grateful. Rest in Peace, brave soldier."
"Liberals are literally insane. Family of girl murdered by Muslim refugee asks that fund is set up for refugees. http://www. dailymail.co.uk/news/article-4 004480/Pictured-Afghan-migrant-17-modelled-gangsta-rappers-raped-murdered-EU-official-s-daughter-met-work-refugees.html …"
"Here's a list of attacks committed by the religion of peace worldwide. Look how peaceful they are. https:// en.wikipedia.org/wiki/List_of_I slamist_terrorist_attacks …"
"The insanity has to stop! It is a privilege to come to the U.S., not a right. Perhaps we can find people who don't want to murder us."
"If he identified as a cat, the deranged libs would probably put a litter box in the corner for him at work to show him their support."
"Yesterday, I saw someone running down people with a truck and it sure as hell wasn't who the democrats portrayed in their filthy commercial."
"#NoAbortionBan https://www. liveaction.org/news/six-women -quit-abortion-brutality/ …"
"Obama's DHS http:// thehill.com/blogs/congress -blog/homeland-security/268282-dhs-ordered-me-to-scrub-records-of-muslims-with-terror …"
"#NYCTerroristAttack Just a friendly reminder: http:// thehill.com/blogs/congress -blog/homeland-security/268282-dhs-ordered-me-to-scrub-records-of-muslims-with-terror …"
"http:// thehill.com/blogs/congress -blog/homeland-security/268282-dhs-ordered-me-to-scrub-records-of-muslims-with-terror …"
"Then, when you report it, you will promptly be called Islamophobic and shamed."
"We cannot let people into our country who hate our country, western civilization, our freedom and everything about us! It's suicide!"
"Let me know when toddlers catch up to this list of terrorist attacks committed by the religion of peace. https:// en.wikipedia.org/wiki/List_of_I slamist_terrorist_attacks …"
"How many toddlers bombed the World Trade Center?"
"Dems were in power for 8 years. 95% of jobs created under Obama were part time/contract,per Harvard study.No thanks. https://www. investing.com/news/economy-n ews/nearly-95-of-all-job-growth-during-obama-era-part-time,-contract-work-449057 …"
"So far, the World Trade Center has had the bomb of peace, airplanes of peace and now #TruckOfPeace all done by the "Religion of Peace.""
"No one wants to watch a propagandist, @jaketapper , and you have the ratings to prove it. #FakeNewsCNN #FakeTapper"
"Tony Montana? Was that before or after he was in Scarface? On a side note, Kevin Spacey is a vile piece of shit pedo. Lock him up!"
"The "Religion of Peace"bombed World Trade Center,drove planes into the WTC & drove a truck into people in front of WTC. R we having fun yet?"
"Maybe one day, liberals will come to the realization that criminals don't care about laws. https:// twitter.com/LeighChani/sta tus/925718602057207808 …"
"If the truck rental company refused to rent them a truck, ACLU & CAIR would send the lawsuits flying for racism.Our own laws used against us"
"Everyone involved in the Uranium One deal should be locked up for treason. Also, who is Russia selling the Uranium to? N. Korea? Iran?"
"Do you know what helps Russia? 20 percent of our Uranium. Russia can now kill us with nukes made with our own Uranium! Downright treason!"
"They all start out as "Lone Wolf" attack, then 3 days later, they're arresting 15 other people in connection with the "Lone Wolf" attack."
"Islamic terrorists bombed the World Trade Center,drove planes into World Trade Center and drove a truck into bikers in front of WTC.Spare me"
"First, Islamists bombed original World Trade Center.Then,Islamists drove planes into WTC. Today,Islamist drove into bikers in front of WTC."
"It should mean mass murdering piece of shit!"
"If this doesn't piss you off, nothing will! Islamic f*cker hit a bus full of special needs kids on top of running people over!Pray for them!"
"I'm so sick of this PC bullshit! PC kills!"
"Sayfullo Saipov was the winner of @SenSchumer 's Diversity Visa Lottery. Today, 8 Americans were the losers because of Schumer's policy. https:// twitter.com/I_AmAmerica/st atus/925560420840230917 …"
"They need to conduct surveillance every mosque in this country. The US needs to stop being PC! PC kills!"
"It's not radical Islam.It's fundamental Islam.The terrorists whom are committing these acts follow the Quran verbatim.They live by ever word"
"If you see something, say something. Then, PC FBI will clear the terrorist. #PCKills https://www. theguardian.com/us-news/2016/s ep/20/ahmad-khan-rahami-father-fbi-terrorism-bombing …"
"This POS came in on Chuck Schumer's diversity lottery visa program. Blood on his hands!"
"Chesea/NJ bomber's dad told FBI his son was radicalized. FBI cleared him and let him go. PC kills people! http://www. telegraph.co.uk/news/2016/09/2 0/ahmad-khan-rahamis-father-told-fbi-that-his-son-was-a-terrorist/ …"
"If they weren't awake after 911, they'll never be awake. They would rather be dead and PC than alive and speak the truth."
"You can't have guns in NYC. Criminals don't obey the laws!"
"This is a big disinformation campaign.They keep telling us info,then they retract it so we don't know what's really going on & we never will"
"It's hilarious! Trump really does live rent free in the heads of liberals!"
"It's even better when Trump is doing the hammering! What a gem! https://www. youtube.com/watch?v=7nvyQb ZszUk …"
"They don't even teach math facts anymore in Common Core. How can you do math without knowing basic facts, the building blocks of math?"
"Click on this US Gov. org chart to see who's running the show. This was released by Wikileaks. pic.twitter.com/JLUKaSXYNs"
"Almost all are picked and groomed. Many are CIA plants. That's why they hate Trump so much. He's not one of them."
"I'm going to go out on a limb & say that if someone commits murder 3 times, it may not be wise to allow them out of prison to commit a 4th. https:// twitter.com/RealJamesWoods /status/925395007372177408 …"
"Here's the new 2020 Democrat campaign slogan: pic.twitter.com/Yhl0csBTCM"
""Civil War" Interesting reading on the reasons for succession. https://www. civilwar.org/learn/articles /reasons-secession …"
""Civil War" http://www. civil-war.net/pages/1860_cen sus.html …"
"Read! The whole thing. Every bit of it! https://www. civilwar.org/learn/articles /reasons-secession …"
"Can't believe Obama traded top operatives for this POS! Unreal!"
"Many moving parts that led to Civil War. https://www. civilwar.org/learn/articles /reasons-secession …"
"Since @SenSanders loves Socialism so much, perhaps he can sell his expensive car and buy cars and give them to 5 other people."
"I become emotional when I think of all of the wonderful soldiers who died or were severely injured trying to save his traitorous ass!"
""
"Two pedos in a pod."
"https://www. newsmax.com/PatrickBuchana n/steele-campaign-trump-intelligence/2017/10/31/id/823028/ …"
"When I need a good laugh, I watch this video! Hilarious!"
"Democrats are now the party of pedophile sympathizers and perverts. How vile! https:// twitter.com/LauraLoomer/st atus/925157489439576064 …"
"It's intentional. They don't want the benefits of a big tax break to contribute to the economy prior to Trumps re-election. #DrainTheSwamp"
"Perhaps all of the people who want illegals to stay in the U.S. can give up 70% of their paychecks to fund them."
"They need to call Robert Mueller as a witness in the case. He would shit his pants and the house of cards would tumble quickly."
"#TheseCutsHurt People march for illegals to stay without realizing they cost the U.S. over $100 billion/year,taking benefits from Americans"
"Look at line 138 Wasserman? Wonder if it's any relation to Debbie?"
"Mega cities New York and CA do not speak for the entire country! That's why we have the electoral college. Look at that sea of red! pic.twitter.com/8uXqRa5ZZO"
"Democrats want as many people on welfare whom are beholden to government so they can tell them Republicans will take their welfare away."
"Don't forget about Kevin Spacey, who tried to rape a 14 year old boy. Sick SOBS! Lock them up!"
"pic.twitter.com/3ttjmcgNgM"
"Watch until the end.At the end of clip Mika says it's Media's job to control what people think. Not a coincidence. https://www. youtube.com/watch?v=OJ9ce- yMEfc …"
"Operation Mocking Bird. pic.twitter.com/sLlJ9G9c7M"
"#JFKFiles Research Operation Northwoods Here's a little about it. https:// en.wikipedia.org/wiki/Operation _Northwoods …"
"#JFKFiles Research Operation Northwoods https:// allgovernmentslie.com/lie/operation- northwoods …"
"#JFKFiles The Term “Conspiracy Theory” Was Invented in 1967 by the CIA In Order To Prevent Disbelief of Official Government Stories."
"#jfkfiles hitler Not shocking. Other Nazis fled to South America also. http://www. telegraph.co.uk/news/worldnews /southamerica/brazil/4307262/Nazi-angel-of-death-Josef-Mengele-created-twin-town-in-Brazil.html …"
"#JFKFiles Jacqueline Kennedy refused to change out of her blood soaked clothes. Her words:'Let them see what they've done.' #SheKnew"
"#JFKFiles Jacqueline Kennedy refused to change out of her blood soaked dress. These were her words:'Let them see what they've done.' #SheKnew"
"Research Operation Mockingbird. Ever wonder why every news station parrots the same thing? It's not by accident. pic.twitter.com/jlqafYnrac"
"#JFKFiles This is the US government Org chart, which was leaked by Wikileaks. Click on the chart to see who runs the show. pic.twitter.com/GNo9awsWxy"
"And they call us conspiracy theorists!"
"Click on the Government Org Chart to see who's on top. pic.twitter.com/TnAO6LGXMH"
"Anyone wondering who's running the show, just look at the Government org chart from Wikileaks. https:// twitter.com/wikileaks/stat us/839119972538454017?lang=en …"
"Crazy Alyssa thought that Elves on a shelf who were waving were giving nazi solutes. She's bonkers! http:// conservativefighters.com/news/alyssa-mi lano-traumatized-elves-nazi-salute-christmas-store-photo-says-oh-wait/ …"
"Dr. Kelli Ward already destroyed RINO Jeff Flake! Thank God he dropped out! Defeat these RINOS! https://www. kelliward.com /"
"Trump supporter Pastor Scott may run for office! So many great Patriotic Americans are running or considering! #MAGA http://www. cleveland.com/open/index.ssf /2017/10/pro-trump_pastor_darrell_scott.html …"
"Huge Trump supporter Harlan Hill may run for Congress against RINO Lindsey Graham when he's up for re-election."
"Here's more fantastic candidates who want to #MAGA ! If we win super majority, there's no stopping the #TrumpTrain ! http://www. deplorablecongress.com /"
"Danny Tarkanian is taking on Dean Heller, super RINO in NV. Go, Danny! http://www. breitbart.com/big-government /2017/10/27/shock-poll-insurgent-danny-tarkanian-leads-mitch-mcconnells-incumbent-dean-heller-44-to-38-in-nevada/ …"
"Republican and Navy Vet Carla Spalding is taking on Debbie Wasserman Schultz. Go Carla! https://www. spaldingforcongress.com /"
"http:// voteteamtrump.com/candidates/"
"Republican and USAF Vet Aja Smith is running for Congress in CA. So many awesome patriots running! https://www. ajaforcongress.com /"
"Let's get the word out on Patriots who are running for congress! R-Jeff Dove running against dem VA. Watch and RT! https://www. youtube.com/watch?v=QyLaH- ZVZ5A …"
"I have one message for these overpaid crybabies: pic.twitter.com/MBRYzxTTPo"
"I've never seen such insanity in my life. Libs take the fun out of literally everything! Football, Halloween, Hollywood just to name a few."
"Good God! https://www. thepiratescove.us/2014/06/02/its -now-raaaaacist-to-wear-a-coconut-bra-and-grass-skirt/ …"
"Don't worry, this is coming next, too. https://www. usatoday.com/story/travel/d estinations/2012/10/14/hawaii-tourism-grass-skirts-tiki-bars/1624825/ …"
"We have so many great candidates running for Congress. Let's get the word out and support them! Dems and Rinos need to go!"
"R- Aja Smith,USAF Vet running for congress in CA. R-Carla Spalding USN Vet running against Wasserman schultz. http://www. deplorablecongress.com /"
"R-Jeff Dove is an Army Vet, businessman and IT profession running against D-Gerald Conolly in VA11. http://www. doveforcongress.com /"
"R-Danny Tarkanian is running against establishment RINO Dean Heller in NV. http://www. breitbart.com/big-government /2017/10/27/shock-poll-insurgent-danny-tarkanian-leads-mitch-mcconnells-incumbent-dean-heller-44-to-38-in-nevada/ …"
"R-John James, a West Point gran and Army Vet is running in MI. https:// johnjamesforsenate.com /"
"We need to get the word out about the fabulous anti- establishment candidates whom are running!"
"pic.twitter.com/TTBFdYB28e"
"Have you seen this? Las Vegas shooting survivor was shot in vacant home! WTF??? https://www. reviewjournal.com/crime/homicide s/coroner-ids-las-vegas-man-found-shot-dead-in-vacant-home/ …"
"Please pray for the FBI informant set to give testimony on Uranium One. We all know how things go for those set to testify against Clintons."
"Hillary's exemplary human rights record pic.twitter.com/8DbvvOFkKj"
"There are 34 Republicans, 15 Democrats, and 1 independent who hold the office of governor. #Facts . https://www. cbsnews.com/news/gop-expan ds-governorships-and-hold-on-to-state-legislatures/ …"
"https://www. washingtonpost.com/news/the-fix/w p/2016/11/12/these-3-maps-show-just-how-dominant-republicans-are-in-america-after-tuesday/?utm_term=.40cee7658da8 …"
"If the majority of the country are liberals, why did Dems lose 900+ state legislature seats, 12 governors, 69 House seats, 13 Senate seats?"
"This is in 2002. Dirty Byrd still using the N-word! Spare me! What non-racist uses the N-word? None! Here's your Civil Rights leader!"
"https://www. youtube.com/watch?v=gd56qq qOU0I …"
"#LivePD Must watch video! Our police face so much danger every day! https:// twitter.com/orjustthinkit/ status/919217878607396864 …"
"So if someone is unarmed and reaches for an officer's gun with the intention to kill him is that O.K.?What if they are unarmed & charge them"
"These damn commie bastards won't be happy until they dismantle ever piece of American History and won't stop until they abolish Constitution"
"Wayne, these commies won't stop until they abolish our Constitution! This must be stopped!"
"Of course the timing of the dirty Dems is impeccable."
"The corruption never ends. The U.S. Government is a banana republic."
"R-Army Vet & Patriot Jeff Dove is running against Dem Gerald Conolly for House VA Dist.11.Thank God 4 Patriots! #MAGA http://www. doveforcongress.com /"
"All the FBI had to do was subpoena the DNC to gain access to their servers! Sick of these swamp creatures. Crooked SOBS! All of them!"
"They were everywhere over Pittsburgh yesterday. Giant X in the sky."
"@FBI @realDonaldTrump @seanhannity @DonaldJTrumpJr @SebGorka @tedcruz @jeffsessions Antifa to dress as Trump supporters and terrorize the US https:// twitter.com/Lenardhscott10 1/status/924261502680518656 …"
"The left still claims Obama's administration is scandal free. They must have been in a coma the last 8 years."
"Wonder how much their kickback was? Always looking to line their pockets."
"You forgot movies/Hollywood."
"Obama administration is the most corrupt administration in history. https:// twitter.com/USNJack/status /924062792285609984 …"
"Great article. http:// thefederalist.com/2017/10/25/top -10-things-to-know-about-dossier/ …"
"Republicans started opposition research looking into Trump's business dealings. They did not fund the dossier. http:// thefederalist.com/2017/10/25/top -10-things-to-know-about-dossier/ …"
"#RussianDossier http:// thefederalist.com/2017/10/25/top -10-things-to-know-about-dossier/ …"
"I'm sure Russia would love to sell some of that yellow cake used to make nukes to Iran and N. Korea. US will be nuked by our own Uranium!"
