"Only ONE side truly has respect for our soldiers, vets, anthem etc & that's those who respect the right to #TakeAKnee"
"When u'r n theSpotlight @Kaepernick7 w/money lawyers come out theWoodworks 2JOIN theFight
"Meanwhile his "political [allies]" @AGPamBondi & @FLGovScott R equally #GUILTY of #PublicCorruption @FBI w/impunity #rigged"
"@EWErickson What "system of checks & balances" when #ImpeachedCops can conspire w/ #JudgeDonHLester to violate theLaw @FBI"
"TheDevil is n the details
"@ILoveMyWife0007 Awwww: It says the "page doesn't exist"
""
"The Politics Of Tax Reform Are Driving Republicans, Not The Policy - HuffPost https:// apple.news/AL63sjEZyT1ee7 8OIGhd-3g …"
"LONG FORGOTTEN: "A Month After Las Vegas, Rapid-Fire Bump Stocks Are Untouched" - NBC News https:// apple.news/AA4INlH9CRFCGX mPPDLmpLw …"
"IT'S A CRIME: THROUGHOUT THE NATION, INCLUDING "Nevada's Rural Poor [Are] Getting Cheated in Court, ACLU Says" - NBC https:// apple.news/AhDKTuUBkQIymH pOjvGOqbg …"
"UNBELIEVABLE: "'Deport' Flyers Targeting Asian-American Candidates Shock N.J. Township" - NBC News https:// apple.news/AOpO5teWFS9-e_ TLkVUb_PQ …"
"TRUMP'S BURNT BRIDGES: U.S. asked French to broker Trump-Rouhani discussion, but Iranian president said no - WP https:// apple.news/AeHUx62oNR1erF _n9wxh1AA …"
"AFRAID TO ACT: "Judge in Manafort and Gates Case Worried About 'Flight'" - NBC News https:// apple.news/AElq99AozQa6Wk B6Ov3DmJQ …"
"Weinstein Scandal Strikes at Heart of Britain's Toxic Political Culture - NBC News https:// apple.news/ANV_uN7STQ6aqp ToLoZu54g …"
"Poll: Nearly Half Of Americans Believe Trump Likely Committed A Crime Linked To Russia - HuffPost https:// apple.news/AFrflzP0RSW2J5 VW7qWN6Fg …"
"North Korea Accuses U.S. 'Gangsters' of Nuke Drill - NBC News https:// apple.news/AxLxvA0MCRBKrp p2ITnYN-Q …"
"CAUGHT IN THE HEADLIGHTS: "Clovis, Linked to Mueller Probe, Withdraws as Trump USDA Pick" - NBC News https:// apple.news/AyGoRhr_2QSez7 sNhetJoqw …"
"THE FUTURE LOOKS BRIGHT: Sixth-Grade Teacher's Class Rap Will Get You Amped To Learn - HuffPost https:// apple.news/Auz1VGHc6SEOGK ZWUHkRh7Q …"
"Corey Feldman Says Actor Jon Grissom Molested Him In The 1980s - HuffPost https:// apple.news/A5SSNzy8aQii-t gwUHFLKLw …"
"COMING OUT: Several 'House Of Cards' Employees Level New Accusations Against Kevin Spacey - HuffPost https:// apple.news/AQ8Q5roBOT9WhC OLvhDDPPA …"
"U.S. investigators have identified Russian government hackers who breached the DNC - The Washington Post https:// apple.news/AqCRBLnAKQEebZ 5pAUrGxkA …"
"Mexican Gang Leader Getting Plastic Surgery Shot Dead in Hospital - NBC News https:// apple.news/ANgEEQRtbSAK7b uph1w1JWQ …"
"Kevin Spacey Reportedly Investigated By UK Police For 2008 Assault - HuffPost https:// apple.news/AfrpE9TrfTbin8 AH-LO6HSA …"
"THAT'S PROGRESSIVE: "Registered Child Sex Offenders Will Soon Have Convictions Noted On Their Passports" - HuffPost https:// apple.news/AMrdh8ejrSa6xd md9-_70gA …"
"IS MASS INCARCERATION CREATING THE MENTALLY ILL? "El Chapo's Lawyer Says Jail Making Kingpin Hallucinate" - NBC News https:// apple.news/AzpNpXsMyRAKHf rC-OhzVmQ …"
"Muslims Once Again Are Being Targeted For An Attack They Had Nothing To Do With - HuffPost https:// apple.news/AlJPaY_vjS5a0u Zs8Lihv5g …"
"House Tax Bill Would Kill Medical Deductions - NBC News https:// apple.news/AVdkkN9CnSBa78 OvwtXSF-A …"
"Ivanka Trump's Speech About Sexual Harassment Baffles Everyone - HuffPost https:// apple.news/Az-Q8M_e6TY6lU x2U9-fxpg …"
"WHEN YOU LOVE TO WATCH PEOPLE DANCE: 'Stranger Things' Kids Flip Jimmy Fallon Dance Battle Upside Down - HuffPost https:// apple.news/AQVfdNhJwTPS9Z oqHc8EBdw …"
"IT'S THE FUTURE: "Google Grants $1 Million To Non-Profit To Bring More Black Boys To Tech" - HuffPost https:// apple.news/AiIsmaaEkRmSdy VTSlgtNKw …"
"FIRST STEP TO RECOVERY: "Alec Baldwin Regrets Having 'Bullied Women'" - HuffPost https:// apple.news/ABbkHz7ywQOqhw pQAADI-uA …"
"THEY ACQUIT THE GUILTY IN FLORIDA & CONVICT INNOCENT BLACKS: "Trump Slams U.S. Courts as Too Slow & Weak" - NBC News https:// apple.news/AZIMOvT0aRFmcf rQXNAFt1w …"
"That's CRAZY CORRUPT! Take taxpayers money and do nothing but serve yourself
"@mhmhart You wouldn't want to be caught in the middle
"Oooops"
"@BYHISGRACE64 @PapaJohns NOT GOOD when employees are not in line w/the owners on theRIGHT side of a cause. TOO CONFUSING! #smh"
"This is how you drive a JaguarXJ: Put on the music and cruise like it's your party so enjoy the ride pic.twitter.com/VDgZR2Dhya"
"@pistach01 @AlterNet It's "doomed" & eventually evry1 will #TakeAKnee to bow b4 ALL MIGHTY GOD 2ACCT pic.twitter.com/xalmNEpLQO"
"@karoun Will #PublicCorruption arrest #Mueller or will #Mueller arrest #PublicCorruption w/a Repug senate so deeply rooted nRussia"
"@MrsPsp @politico No ONE "remembers" theGuy #LowLevelGeorge @theCenter of theTable w/both #Trump &THAT perjurer @jeffsessions"
"GOD KNOWS who they are &they're going to #HELL for minimizing &capitalizing pic.twitter.com/Z4cPOLDxty"
"THEN pretend they do better bc they somehow worked hard &earn their way as blacks R openly targeted"
"They #STEAL ur valuables, HOME &evn ur liberty bc blacks don't "deserve" their wages #Hmmm #racists"
"@samswey That's Y @AGPamBondi a predominantly WHITE judiciary sends #ImpeachedCops 2HOMES 2ROB blacks under color of law @FBI"
"American democracy has failed bc a predominantly white judiciary/gov is above theLaw
"Remember folks THIS is how a predominantly white judiciary mass incarcerates BLACKS & immigrants of color & #AcquitTheGuilty"
"And there's no question which agencies &individuals dropd theBALL:STOP targetn blacks &CLEAN house"
"You KNOW theSystem is rigged: It's TIME2 hold those accountable who circumvent theLaw enabln such"
"And-believe ME-he fought2REMAIN theCENTER of #PublicCorruption @FBI but theCase was CLEAR like #Mueller"
"@tinyboo49 Under the circumstances, isn't THAT #ObstructionOfJustice I couldn't recuse #JudgeDonHLester w/o cause @AGPamBondi"
"SWEET: The best "treat" to find in your bag in any color... pic.twitter.com/laqTBwQONl"
"He simply refuses to acknowledge how theVery same rigged system is theCatalyst for his rise &FALL"
"@washumom But theAmerican judicial system is so corrupt @FBI evn @realDonaldTrump is made credible n that ONE MOMENT he notes it"
"BrettMac knows who I'm talking about bc @TweetBrettMac he is that man presuming an assuming
"K: Lol! But-in my experience-when it ain't ME I'm not offended bc it's NOT "addressing" ME RIGHT? #Resist pic.twitter.com/tYV5eSpfeJ"
"Will U accuse God too of bn "anti-white" when #WhiteSupremacists R gnashing teeth in #HELL pic.twitter.com/YwrSEjj6BH"
"Meanwhile U continue to show your ignorance when #TakeAKnee is abt anthems & "anti-white" pic.twitter.com/uRix3mvPmY"
"Was #MLK "anti-white" bc he'd STILL #TakeAKnee today bn compelled to protest theSame offenses of urFATHERS NOW YOU"
"@pistach01 What you call "anti-white" is more like "anti-[racism]", "anti-[injustice]", "anti-[ #KillerCops ]" ALL fruit U bear"
"Don't just VOTE evry election but VOTE n theJury box-a predominantly white judiciary relies on ALL WHITE juries"
