"Люди,требующие пересмотреть роль личности Ленина и Сталина в истории, почему-то не требуют пересмотреть роль Ельцина и итоги приватизации(с) https:// twitter.com/dolg132005/sta tus/926092923355254784 …"
"Кто-то хочет закопать Ленина и откопать Сталина. А может закопаем Чубайсов и Ко? Чтоб два раза не копать!"
"Вышедшие в тираж *ляди пиарятся. Никто ничего не соберёт и не зарегистрируются в ЦИК. Пусть заявляют, веселят народ. https:// twitter.com/dolg132005/sta tus/926035697299021825 …"
"Я за! Как эротично микрофоном пользоваться будет! https:// twitter.com/zapvv/status/9 26023739816448000 …"
"Кто-то хочет закопать Ленина и откопать Сталина. А может закопаем Чубайсов и Ко?"
"Хватит бесплатно глазеть на Ленина! Даешь платный вход! https:// twitter.com/dimsmirnov175/ status/925995397251764225 …"
"Штаааа??? https:// twitter.com/dimsmirnov175/ status/925995397251764225 …"
"Шо за кипиш? У Поклонской уже и Ленин замироточил? https:// twitter.com/dimsmirnov175/ status/926038108805783552 …"
"А вот пусть все музеи мира устроят истерику и начнут хоронить фараонов! https:// twitter.com/a_gasparyan/st atus/926020588321337344 …"
""Стареющая лошадь ищет работу в новом шапито"(с) pic.twitter.com/a6F5QrJOrg"
"КобылО Апокалипсиса https:// twitter.com/xernia_sobchak /status/923992670455902208 …"
"Ну , это, наверняка, русские комбайнёры! https:// twitter.com/urugvayintelli g/status/923857170885640192 …"
"Без адвоката Фейгина вас всех посадЮт! https:// twitter.com/xernia_sobchak /status/923534782457434112 …"
"Суд отправил под домашний арест Софью Апфельбаум до 26 декабря. Проходит по делу Серебренникова. Хищения в особо крупных размерах https:// twitter.com/a_gasparyan/st atus/923526031297871873 …"
"Апфельбаум подозревают в подтасовке документов Серебрянникова (госконтракт на 214 млн руб., из которых не менее 68 млн были похищены). https:// twitter.com/qlapeyron/stat us/923522876644487169 …"
"Он же - Грицько,Гриценко, Грищук,Грицеускайте, Грицецуев, Григорьев! https:// twitter.com/armenradiohit/ status/922770034388238336 …"
"#СРОЧНО : В результате взрыва в жилом доме Донецка разрушена несущая стена на первом этаже. Спасатели разбирают завалы. https:// twitter.com/ksk_dnr/status /923552330146074624 …"
"Смотрите новый сериал: "Бандитский Киев" Санта-Барбары-404 https:// twitter.com/mayskolpino/st atus/923287116280467456 …"
"Кадыров уже в Москве? https:// twitter.com/korrespondent/ status/923373873017606144 …"
"Говорят Мосийчук некачественные боеприпасы в ИГИЛ* продавал. Обманывать побратимов - харам. (* - организация разрешенная в Украине) https:// twitter.com/panshekhtman1/ status/923281584773566465 …"
