"Partisan, globalists #scientists should be ostracized to preserve humanity's respect for #science ."
"Decriminalize and tarrif..."
"If I uttered a term like "blackness," would it be considered racist or stereotyping?"
"They should stop counting fictional stranger-than-reality "news" reports: Dog Kills Six Newborns while Cleaning Assault-Style Starter Pistol"
"#NationalizeTwitter ?"
"What's the best way to protect your personal and financial data from Equifax? #impossible"
"Stop counting #fakenews reports."
"How did we cause The Ice Age, and how did we end it? I think it might be naturally cyclical."
"Have you "bullied" children, too, Alec?"
"#Ridiculous ... just say it... special/extra protection under the law."
"Another Loyalty... A Secret Loyalty... A Subversive Loyalty... A Higher Loyalty than That to America and it's Constitution. #globalist #nwo"
"This... as it becomes clearer that the bureaucracy considers citizens(conservative) the enemy"
"Double jeopardy for the light-skinned ones..."
"It was an unlawful/unconstitutional arrest no matter how violent it was."
"#JohnKasich #Kasich #5thColumn https:// twitter.com/LisaSmithWCPO/ status/925544268642639872 …"
"Sensible argument is debatable, but your frustration and insults merely concede the debate. Good day."
"Yes, but that must be used in conjunction with a reading of animal innards or tea leaves."
"Not only was it rough and dehumanizing but, more agregious, it was also unlawful/unconstitutional."
"Is congressional page #pedophilia and sex extortion the next #Satanic shoe to drop?"
"They claim the most outlandish things as if they have even the slightest of knowledge of atmospheric gas levels spanning millions of years."
