"больше демотивашек, Вадик!"
"Цэ так! Сугс!!"
"стена-платить-икаяццо pic.twitter.com/qbkmJRHtzm"
"стена-платить-икаяццо pic.twitter.com/TbWd8C3PIK"
"вот и Лена раскрылась. отписываюсь."
"И по индейцам? https:// twitter.com/Maks_Chepay/st atus/926071397201403905 …"
"Goblin News 29: мнение #собчак про Сталина, жертвы Коричневой революции и... https:// youtu.be/06_7P2F7yD4 с помощью @YouTube #Сталин"
"#ПавелПерец #РЧВ 136 Как промывают мозги в России. Спецвыпуск https:// youtu.be/XJ0w1qQOiS8 с помощью @YouTube"
"Для Кадырова. #Ленин pic.twitter.com/Go1LrJUH4y"
"не знаю, как Минц. это вы его зачем-то вспомнили.."
"pic.twitter.com/iziCVtASz7"
"НЕТ"
"нет-с, скорее В.Н.Земскова лучше почитать.."
"конеЧно! только твои предки чудом избежали геноцида!!"
"а уж сколько среди них знатоков истории вырезания!.."
"а ещё нужно почитать Великага Русскага Писателя солженицана ляксандра исаича!!! И только етих Великих Писателей!! Не историков же читать!.."
"Акунин, мокшане, и их древние предки http:// svpressa.ru/blogs/article/ 181909/ … #ЗахарПрилепин #акунин #украина"
"Как убить автомат Калашникова. https:// youtu.be/OtFhfwrsWy4 с помощью @YouTube"
"25 сайтов, с которыми родителям не страшна школьная программа https:// amarok-man.livejournal.com/2732791.html?u tm_source=twsharing&utm_medium=social … #образование #школа #дети"
"В Москве открыт мемориал жертвам политических репрессий https:// pyhalov.livejournal.com/522446.html?ut m_source=twsharing&utm_medium=social … #Путин #репрессии #ИгорьПыхалов"
