username;date;retweets;favorites;text;geo;mentions;hashtags;id;permalink
UmkaVS;2017-10-30 19:03;0;0;"Да прогнозировали..... И так всю неделю....";;;;"925075758250414080";https://twitter.com/UmkaVS/status/925075758250414080
UmkaVS;2017-10-30 19:02;0;0;"Че вы там разругались? Вот реально как кошка с собакой.... У одного на аве кошка у другого собака....)))) ЗЫ я без родов... ;)";;;;"925075431174307846";https://twitter.com/UmkaVS/status/925075431174307846
UmkaVS;2017-10-30 18:00;0;0;"Так я горилку не пью... Только пиво - вот он рыбу и припер....))))";;;;"925059867198574593";https://twitter.com/UmkaVS/status/925059867198574593
UmkaVS;2017-10-30 17:51;2;2;"Пришел хохол, рыбу горячего копчения припер и пива - пьем.... А за окном ливень....";;;;"925057613485826048";https://twitter.com/UmkaVS/status/925057613485826048
UmkaVS;2017-10-30 16:58;0;0;"У меня комп давно издох, я с мобилы... А у тебя по ходу на зимнее время перешел... Смотри настройки "дата время"....";;;;"925044357547380736";https://twitter.com/UmkaVS/status/925044357547380736
UmkaVS;2017-10-30 16:54;0;0;"Конечно не затих - вчера днем прибегала, соскучилась.... ;)";;;;"925043350985637889";https://twitter.com/UmkaVS/status/925043350985637889
UmkaVS;2017-10-30 16:53;0;0;"Поэтому и аптеки на каждом шагу... Очень прибыльно - как наркотики... ;)";;;;"925042935904731136";https://twitter.com/UmkaVS/status/925042935904731136
UmkaVS;2017-10-30 16:51;0;0;"Постель не повод для знакомства.... ;)";;;;"925042434308034561";https://twitter.com/UmkaVS/status/925042434308034561
UmkaVS;2017-10-30 16:45;0;0;"К мужу убежала... Он из запоя вышел...))))";;;;"925041043787132930";https://twitter.com/UmkaVS/status/925041043787132930
UmkaVS;2017-10-30 16:43;0;0;"Меня бесит реклама NEXT - парацетомол + аспирин... И все... 8 таблеток = 120 рублей.... Круто....";;;;"925040475890909187";https://twitter.com/UmkaVS/status/925040475890909187
UmkaVS;2017-10-30 16:37;0;0;"Не... В презики только клоуны балатируются... Все и так знают кто президент ;)";;;;"925038976318296064";https://twitter.com/UmkaVS/status/925038976318296064