username;date;retweets;favorites;text;geo;mentions;hashtags;id;permalink;replyTo
Crusherofevil;2017-08-18 02:59;0;0;"pic.twitter.com/Sfe2jSpEL3";;;;"898378896147611648";https://twitter.com/Crusherofevil/status/898378896147611648;DawnFults,AlexxdrtrR,JohnTrump20
DawnFults;2017-08-18 02:20;1;2;"At the name of Jesus every knee shall bow...every tongue confess that Jesus Christ is Lord. He is Alpha & Omega Jehovah El Elyon";;;;"898369087805566976";https://twitter.com/DawnFults/status/898369087805566976;AlexxdrtrR,JohnTrump20
Beanswithfrank;2017-08-15 00:56;0;1;"Get my back Tiff, going to dinner, make me proud! nice beach day!";;;;"897260799105802240";https://twitter.com/Beanswithfrank/status/897260799105802240;AlexxdrtrR,tiffanylloree
JustAGuyFrom330;2017-08-14 00:50;0;0;"Ha ha 6 followers again I wonder If I have a troll...";;;;"896896651977138177";https://twitter.com/JustAGuyFrom330/status/896896651977138177;AlexxdrtrR
1mabloom;2017-08-12 22:03;0;0;"Somebody's hacked your profile, putting hate speech about Muslims into it that obviously would never come from one with a Jewish last name.";;;;"896492448456757248";https://twitter.com/1mabloom/status/896492448456757248;AlexxdrtrR