username;date;retweets;favorites;text;geo;mentions;hashtags;id;permalink;replyTo
luxuryprojectc1;2017-11-01 16:31;0;0;"@britneyspears good day , god bless your life on this journey through life by carlos ivan ,bigprojectchilean great week";;@britneyspears;;"925762296210710528";https://twitter.com/luxuryprojectc1/status/925762296210710528;
RobertoVegaRam2;2017-10-26 22:50;0;0;"#Gala7GH maiko y su mítica camiseta rosa,parece britney spears nominaciones Carlos ,Pilar y mina no queremos muebles ni bromas racistas";;;#Gala7GH;"923683254795931648";https://twitter.com/RobertoVegaRam2/status/923683254795931648;
awesemoh;2017-10-26 05:56;0;0;"Lmaooo and Carlos thought Bella Thorne was Britney Spears at first glance and then corrected himself and said oh no its Paulina Rubio";;;;"923428069045452800";https://twitter.com/awesemoh/status/923428069045452800;
Hazelsthoughts;2017-10-23 03:38;0;0;"U have my phones IP address Carlos Santana went to school to be computer programmer and he's been playing with my shit";;;;"922306104754823168";https://twitter.com/Hazelsthoughts/status/922306104754823168;britneyspears
gilvegag;2017-10-20 17:26;6;152;"* Carlos Alvarado apretándose con Britney y Christina*";;;;"921427335961772032";https://twitter.com/gilvegag/status/921427335961772032;
Tuck_killer;2017-10-17 12:37;0;1;"Yo creo que Britney Spears "live concert" "2016"";;;;"920267510435295232";https://twitter.com/Tuck_killer/status/920267510435295232;Carlos_CAMS,w_ltr
mudonnaofpop;2017-10-16 16:38;2;10;"Discografia da Madonna, Cher, Michael Jackson, Lady Gaga, Britney Spears, Janet Jackson, Mariah Carey me ajuda João Carlos ...Kylie Minogue.. https:// twitter.com/scilesshot/sta tus/919946537286987776 …";;;;"919965740920434693";https://twitter.com/mudonnaofpop/status/919965740920434693;
Pedraovk;2017-10-15 05:52;0;0;"Sou eu Britney Carlos";;;;"919440810885767168";https://twitter.com/Pedraovk/status/919440810885767168;Gb_Marrento
agostinhodesena;2017-10-14 18:32;0;0;"Belo e Perla (?), Bethoven, Britney Spears, Celine Dion, Crazy Frog, Dança do Quadrado, Danni Carlos , Donna Summer, Elton Jhon (+)";;;;"919269690119278598";https://twitter.com/agostinhodesena/status/919269690119278598;
disposablez;2017-10-13 23:12;0;0;"Sua compatibilidade com jaykachu22 é Alta. Vocês dois ouvem Backstreet Boys, Britney Spears e Carlos Alexandre.";;;;"918977888434688000";https://twitter.com/disposablez/status/918977888434688000;
guii_mont;2017-10-08 22:20;2;5;"Pabllo Vittar,Zezé Di Camargo, Britney e Luis Carlos (Raça Negra)entram num bar #DingDong";;;#DingDong;"917152844482076672";https://twitter.com/guii_mont/status/917152844482076672;
carlos_ed_rojas;2017-10-06 05:01;0;0;"Carlos Brown / Toxic - Britney Spears (Acoustic Cover) https:// youtu.be/750tINkIjSc vía @YouTube";;@YouTube;;"916166580479946753";https://twitter.com/carlos_ed_rojas/status/916166580479946753;
juliovilam;2017-10-06 03:51;0;0;"Me ha gustado un vídeo de @YouTube ( http:// youtu.be/750tINkIjSc?a - Carlos Brown / Toxic - Britney Spears (Acoustic Cover)).";;@YouTube;;"916148766692007942";https://twitter.com/juliovilam/status/916148766692007942;
MrJonesok;2017-10-05 20:41;1;8;"britney TIENE q volver a performear radar en el proximo tour / residencia / obra en carlos paz q haga";;;;"916040758477709313";https://twitter.com/MrJonesok/status/916040758477709313;
SoyCarlosBrown;2017-10-05 14:37;30;79;"Hola chicos! Hice esta versión de Toxic de Britney , si les gusta escúchenla completa en: http:// goo.gl/tAcnPi Carlos Brown - Toxic pic.twitter.com/AItUYBnis5";;;;"915949173018693633";https://twitter.com/SoyCarlosBrown/status/915949173018693633;
andersonlmend;2017-10-02 22:23;0;0;"Gostei de um vídeo @YouTube http:// youtu.be/7a2YVHrTee8?aT he … Circus Starring: Britney Spears Tour - Boys Live (DVD by Carlos Lima)";;@YouTube;;"914979078633136128";https://twitter.com/andersonlmend/status/914979078633136128;
nickiofrap;2017-10-02 05:39;10;39;"saudade da minha mc beyoncé mc britney mc dede mc tarapi me ajuda joão carlos mc k9 mc romântico mc magrinho pic.twitter.com/asJHojSmCs";;;;"914726392855695361";https://twitter.com/nickiofrap/status/914726392855695361;
ZemiraN;2017-09-30 12:47;0;0;""We Are The Ones" Carlos Garland Contemporary Jazz Class at Britney Boyd Dance Company http:// fb.me/7fXygYZPU";;;;"914109566178271232";https://twitter.com/ZemiraN/status/914109566178271232;
julianojrg;2017-09-27 18:34;0;5;"Meu deus do céu, isso aqui é muito caractere e eu estou muito assustada. Me ajuda João Carlos . O que mais eu twitto nisso aqui? Como vocês estão? Britney é a dona do Pop. Demi só grita. Katy flopada (mas te amo mesmo assim). Eu estou disponível @s podem me adicionar q eu to livre";;@s;;"913109621572857856";https://twitter.com/julianojrg/status/913109621572857856;
MarblecityMade;2017-09-26 18:58;0;0;"We just can't execute like the plays are designed to be executed";;;;"912753287430070274";https://twitter.com/MarblecityMade/status/912753287430070274;MarblecityMade,Chaz_Carlos,britney_hill
arrobabritney;2017-09-20 20:54;0;0;"O Roberto Carlos dos estados unidos, deve ter vendido pros sobreviventes do Titanic";;;;"910608058690228225";https://twitter.com/arrobabritney/status/910608058690228225;celinehit,britneyspears
Conselhosd1mini;2017-09-20 04:38;0;0;"Gostei de um vídeo @YouTube http:// youtu.be/rEdr114jduU?aT he … Circus Starring: Britney Spears - Piece Of Me Live (DVD by Carlos Lima)";;@YouTube;;"910362568513982465";https://twitter.com/Conselhosd1mini/status/910362568513982465;
mooneverything;2017-09-18 21:22;0;3;"madonna beyoncé britney katy gaga rihanna taylor ariana miley selena demi shakira me ajuda joão carlos";;;;"909890501666574336";https://twitter.com/mooneverything/status/909890501666574336;
LeiAisen;2017-09-18 12:30;0;1;"Cómo puede ser que @cienradios tenga radios de Carlos Baute y David Bisbal pero no de Britney y boy bands?!";;@cienradios;;"909756450372759552";https://twitter.com/LeiAisen/status/909756450372759552;
lucho_loglez;2017-09-17 18:05;0;0;"Hay mijoooo si a Jémez le inventaron una novela con su Britney señal jaja, sería mejor analizar que ese señor genera violencia desde cancha";;;;"909478339987025921";https://twitter.com/lucho_loglez/status/909478339987025921;Carlos_Ponz
tecnosgirl;2017-09-16 01:39;0;5;"I would like to see someone like Hank Williams Jr. or Tom Petty or Carlos Santana";;;;"908867981551300609";https://twitter.com/tecnosgirl/status/908867981551300609;stellabelle,steemit
thisbrunno;2017-09-10 19:57;0;0;"amiga da britney e da lindsay, ex vida simples, o que mais, me ajuda joão carlos ...";;;;"906969973930827778";https://twitter.com/thisbrunno/status/906969973930827778;
FueSoloSexo;2017-09-08 14:46;0;1;"Y llega una edad en la que eres la Britney pelona.";;;;"906166840916721664";https://twitter.com/FueSoloSexo/status/906166840916721664;miguesinl,Carlos_Soto_S
carlosluizj;2017-09-08 13:26;0;0;"The latest The Carlos Luiz M. Silva Daily! http:// paper.li/carlosluizj/13 20499597?edition_id=52c4dd30-9499-11e7-87ea-0cc47a0d1609 … Thanks to @vando_correia @Britney _Hadcock #twitchtv #tech";;@vando_correia @Britney;#twitchtv #tech;"906146733310259200";https://twitter.com/carlosluizj/status/906146733310259200;
Pedrodalaik;2017-09-07 15:36;0;0;"Osea inf Cristina sería Cataluña Cristina la persona España Cataluña sería don Juan Carlos Felipe 6 españa";;;;"905816934129836033";https://twitter.com/Pedrodalaik/status/905816934129836033;Pedrodalaik,SonyMusicLatin
Pedrodalaik;2017-09-07 15:28;0;0;"Ordenara y o nadie actuará de oficio contra los acusados de sedicion o sea nadie será detenido por su cobardía esto con don Juan Carlos l no";;;;"905815108672245760";https://twitter.com/Pedrodalaik/status/905815108672245760;Pedrodalaik,SonyMusicLatin
derry_rmdhn;2017-09-02 19:14;0;0;"Petit, raul, veron, buffon, yorke, nedved, davids, rivaldo, britney , carlos , rui costa !!! https:// twitter.com/fballpub/statu s/903621273544220672 …";;;;"904060026519601152";https://twitter.com/derry_rmdhn/status/904060026519601152;
06ramones;2017-09-02 12:59;0;0;"nedved ,turam ,buvon,veron ,canavaro,petit. bawah.edgar,rivaldo, britney , carlos ,costa https:// twitter.com/infosuporter/s tatus/903641321331499011 …";;;;"903965731053748225";https://twitter.com/06ramones/status/903965731053748225;
ryan9april;2017-09-02 03:36;0;0;"Mijatovic, raul, veron, yorke, nedved, davids, rivaldo, carlos , costa, britney .....kiper???";;;;"903823946969112576";https://twitter.com/ryan9april/status/903823946969112576;infosuporter,fballpub
CarlosPotterZ;2017-09-01 22:00;0;0;"Carlos Potter's top 5 artists this week: Britney Spears (62), Rihanna (47), Fifth Harmony (34), Banda UÓ (19), Harry Styles (17) #jotafm";;;#jotafm;"903739282229219328";https://twitter.com/CarlosPotterZ/status/903739282229219328;
DonniPribadii_;2017-09-01 20:56;0;0;"Petit, raul, buffon, yorke, nedved (berdiri) Davida, rivaldo, britney spears, r. carlos , rui costa (jongkok)";;;;"903723361129250817";https://twitter.com/DonniPribadii_/status/903723361129250817;infosuporter,fballpub
robin_ssl;2017-09-01 16:20;0;0;"atas: petit, raul, veron, buffon, hasselbaink ?, nedved bawah: edgar, rivaldo, britney , carlos , rui costa";;;;"903653918797733888";https://twitter.com/robin_ssl/status/903653918797733888;infosuporter,fballpub
faaadle;2017-09-01 15:57;0;0;"petit,raul,veron,buffon,yorke,nedved, davids ,rivaldo, britney , carlos , gatau";;;;"903647925443616769";https://twitter.com/faaadle/status/903647925443616769;infosuporter,fballpub
andre_alpacino;2017-09-01 15:48;0;0;"E. petit, Raul G, J.S. Veron, G. Buffon, D. Yorke, P. nedved, E. davids, Rivaldo, Britney S, R. Carlos , M. Rui Costa";;;;"903645749707018241";https://twitter.com/andre_alpacino/status/903645749707018241;infosuporter,fballpub
moirwans;2017-09-01 15:45;0;0;"Petit, raul, veron, buffon, yorke, nedved. Davids, rivaldo, britney , carlos , rui costa,";;;;"903645029788303361";https://twitter.com/moirwans/status/903645029788303361;infosuporter,fballpub
fath_an;2017-09-01 15:40;0;0;"Emanuel Petit. Raul gonzales.juan Veron.bufon.yorke.pavel Nedved.edgar David.rivaldo. Britney Spears.robertoo carlos .rui costa https:// twitter.com/infosuporter/s tatus/903641321331499011 …";;;;"903643777981603840";https://twitter.com/fath_an/status/903643777981603840;
ikbalisme;2017-09-01 15:34;0;0;"Buffon, nedved, davids, Rivaldo, britney spears, Roberto carlos ... Yang lain lupa hehehe";;;;"903642277108604928";https://twitter.com/ikbalisme/status/903642277108604928;infosuporter,fballpub
RFU12;2017-09-01 15:05;0;0;"Petit, Raul, Veron, Buffon, Yorke, Nedved; Davids, Rivaldo, Britney , Carlos , & Rui Costa https:// twitter.com/fballpub/statu s/903621273544220672 …";;;;"903634852787871744";https://twitter.com/RFU12/status/903634852787871744;
PesPete91;2017-09-01 14:26;0;7;"Feel like a defence of Roberto Carlos and Britney Spears could be exposed";;;;"903625222544338944";https://twitter.com/PesPete91/status/903625222544338944;fballpub
cahya_satria;2017-09-01 14:24;0;0;"Petit-raul-veron-buffon-yorke?-nedved; pitbull-rivaldo- britney - carlos -rui costa https:// twitter.com/fballpub/statu s/903621273544220672 …";;;;"903624587824439296";https://twitter.com/cahya_satria/status/903624587824439296;
aghu5;2017-08-31 16:07;0;0;"Acá con Britney ... Comenten mi genteN en Villa Carlos Paz, Argentina https://www. instagram.com/p/BYdttSJhg8ic vntVv7bBNyasB7lCcGebsYT1pg0/ …";;;;"903288065959108608";https://twitter.com/aghu5/status/903288065959108608;
mymixz;2017-08-31 04:18;0;0;"meu top 10 mais ouvidos no spotify de todos os tempos tem lana del rey, the kills, roberto carlos e britney spears.";;;;"903109766200918016";https://twitter.com/mymixz/status/903109766200918016;
EstherJimal98;2017-08-30 08:58;0;0;"El príncipe de la niebla, de Carlos Ruiz Zafon. Tengo una obsesión con ese hombre";;;;"902817881704030208";https://twitter.com/EstherJimal98/status/902817881704030208;DDemigoddess,Its__Britney
joaosacul;2017-08-28 13:32;4;3;"as que já foram: Xtina, Britney , Beyoncé, Lady Gaga... me ajuda João Carlos https:// twitter.com/joaosacul/stat us/902161512965558274 …";;;;"902161861344407552";https://twitter.com/joaosacul/status/902161861344407552;
TataNaveda;2017-08-28 05:37;0;0;"Soy indecisa y con esto exploto! Britney , Olga, Carlos Rivera, Ash, Hanna,Joy,caleb,Mathew gray...El orden no importa https:// twitter.com/AshleyftJoy/st atus/901950763177521152 …";;;;"902042495735001089";https://twitter.com/TataNaveda/status/902042495735001089;AshleyftJoy
ugo_rock;2017-08-24 02:50;0;0;"Cuando anda Carlos Sánchez, anda esta pandilla. Solución y perdición. Vida y muerte. Suero y veneno. Paquita y Britney Spears.";;;;"900550780180197376";https://twitter.com/ugo_rock/status/900550780180197376;
MrSlornax;2017-08-20 23:42;0;1;"Britney ? En vivo? Esas palabras no van juntas en una oración";;;;"899416407326306304";https://twitter.com/MrSlornax/status/899416407326306304;carlos__kun
snowbal7;2017-08-17 00:41;0;0;"Spanish music is so boring nowadays A Canadian Biebs had 2 help out in LA @rihanna with Carlos Santana also";;@rihanna;;"897981635404103681";https://twitter.com/snowbal7/status/897981635404103681;snowbal7,BombaTUF
pelipintada_;2017-08-15 04:04;0;1;"Hace una hora dije que iba a lavar la loza. Y aquí estoy, pasando de Britney Spears a Carlos Vives.";;;;"897308024565616640";https://twitter.com/pelipintada_/status/897308024565616640;
6reenbird;2017-08-15 01:33;0;0;"OK juan carlos está pasando por su etapa britney pelada pic.twitter.com/zM5SLi9CVC";;;;"897270071759958017";https://twitter.com/6reenbird/status/897270071759958017;6reenbird
madygaga;2017-08-12 11:49;0;0;"Oh WAW Carlos !";;;;"896337956608278530";https://twitter.com/madygaga/status/896337956608278530;carlosgzz03,ladygaga
CarlosPotterZ;2017-08-11 22:00;0;0;"Carlos Potter's top 5 artists this week: RBD (24), Birdy (10), James Blunt (10), Michael Jackson (9), Britney Spears (6) #jotafm";;;#jotafm;"896129138083340289";https://twitter.com/CarlosPotterZ/status/896129138083340289;
FauszAutumn;2017-08-11 19:53;1;6;""You don't even know the difference between a mage and a wizard?!" - Britney to Carlos";;;;"896097282436743169";https://twitter.com/FauszAutumn/status/896097282436743169;
o_mendez2;2017-08-09 23:51;0;0;"un compañerillo que se llama carlos jaja";;;;"895432384283332609";https://twitter.com/o_mendez2/status/895432384283332609;Britney_1109
AngeldeFrutos79;2017-08-08 11:44;0;0;"Carlos Herrera y su incontrolable ataque de risa al comparar a Errejón con… Britney Spears https:// okdiario.com/sociedad/2017/ 02/01/herrera-descontrolable-ataque-risa-comparar-errejon-britney-spears-713888?utm_source=sharebuttons?utm_medium=twitter … via @okdiario";;@okdiario;;"894886926473351169";https://twitter.com/AngeldeFrutos79/status/894886926473351169;
bluedragonboi;2017-08-07 18:03;0;0;"Asked Carlos to bring me a Britney shot glass. Of all places not to have shot glasses! Gotta… https://www. instagram.com/p/BXgHxmSAJCy/";;;;"894619904569200640";https://twitter.com/bluedragonboi/status/894619904569200640;
VAHAES;2017-08-07 07:53;1;4;"it's crazy how carlos from YTV and britney spears both haven't aged a day and have never been photographed in the sunlight :thinking:";;;;"894466545388326913";https://twitter.com/VAHAES/status/894466545388326913;
CarlosPotterZ;2017-08-04 22:00;0;0;"Carlos Potter's top 5 artists this week: RBD (63), Birdy (44), Britney Spears (22), Pabllo Vittar (22), Harry Styles (21) #jotafm";;;#jotafm;"893592420616679424";https://twitter.com/CarlosPotterZ/status/893592420616679424;
didiwija;2017-08-03 03:22;0;0;"I liked a @YouTube video http:// youtu.be/4o7ZxxIyvNI?a The Circus Starring: Britney Spears - Radar Live (DVD by Carlos Lima)";;@YouTube;;"892948875581038593";https://twitter.com/didiwija/status/892948875581038593;
PxdrxRules;2017-07-29 22:34;0;0;"Cada vez que veo la actuación de Madonna Christina y Britney pienso en Adri Carlos y en mí";;;;"891426831794098176";https://twitter.com/PxdrxRules/status/891426831794098176;
carlosluizj;2017-07-28 13:26;0;0;"The latest The Carlos Luiz M. Silva Daily! http:// paper.li/carlosluizj/13 20499597?edition_id=5e5b6280-7398-11e7-8f01-0cc47a0d1609 … Thanks to @Britney _Hadcock #twitchstream #twitchtv";;@Britney;#twitchstream #twitchtv;"890926456762769408";https://twitter.com/carlosluizj/status/890926456762769408;
CynthiaBCG;2017-07-28 02:55;0;0;"Me ha gustado un vídeo de @YouTube ( http:// youtu.be/82CR7fDvRBU?a - WOMANIZER - BRITNEY SPEARS | Coreografo Carlos Cercado).";;@YouTube;;"890767535653695488";https://twitter.com/CynthiaBCG/status/890767535653695488;
Hilton_Alves;2017-07-20 19:32;0;0;"@textcarl alguma noticia sobre o relançamento do seu projeto " Britney Circus" em DVD? Carlos eu quero esse DVD maravilhoso logo.";;@textcarl;;"888119409159438336";https://twitter.com/Hilton_Alves/status/888119409159438336;
inmitadinamita;2017-07-20 08:50;9;7;"Mayorías de edad que marcaron una época: - La bella durmiente - Carlos V - Britney Spears - Chabelita - Alfonso XIII pic.twitter.com/2yxRqlCVgJ";;;;"887957860126257152";https://twitter.com/inmitadinamita/status/887957860126257152;
crlcapitu;2017-07-19 18:10;0;2;"eu tava ouvindo britney spears depois começa a tocar roberto carlos , minha playlist é a mais aleatória desse mundinho";;;;"887736389097447424";https://twitter.com/crlcapitu/status/887736389097447424;
SongRemixBot;2017-07-18 20:20;0;0;"'Young & Crazy' by Frankie Ballard (remix Featuring Carlos Vives & Shakira, Britney Spears, Ty Dolla $ ign )";;;;"887406626080268296";https://twitter.com/SongRemixBot/status/887406626080268296;
_teen_problem;2017-07-17 16:48;0;0;"11-Year-Old Britney Espinoza Spoke at a New York Press Conference on Immigration When Britney Espinoza tapped NYC councilman Carlos Menchac…";;;;"886991061939363840";https://twitter.com/_teen_problem/status/886991061939363840;
aquilos1;2017-07-15 23:07;0;0;"A gente reclama da POM da Britney , mas imagine os fãs do Roberto Carlos aguentando o mesmo show há décadas";;;;"886361721341923328";https://twitter.com/aquilos1/status/886361721341923328;
CarlosPotterZ;2017-07-14 22:00;0;0;"Carlos Potter's top 4 artists this week: Michael Jackson (2), Anitta feat. Maluma (1), Britney Spears (1), Bruno Mars (1) #jotafm";;;#jotafm;"885982273472012289";https://twitter.com/CarlosPotterZ/status/885982273472012289;
EduGunner4;2017-07-14 21:09;0;0;"Beto ya no usa su Twitter desde el momento en que nunca le contestó Ricky Martin y Britney Spears.";;;;"885969624759648256";https://twitter.com/EduGunner4/status/885969624759648256;Carlos_CamachoM
JorgeVictorSoa2;2017-07-13 12:38;0;0;"@pepsi @NFL queremos Britney no sb não gosta de palavrão? Cú caralho porra buceta é me ajuda João Carlos , lambe um cú cheio de merdaaaaaa pic.twitter.com/hwk6XjB6dV";;@pepsi @NFL;;"885478539004456960";https://twitter.com/JorgeVictorSoa2/status/885478539004456960;
AlGhadTV;2017-07-11 17:13;1;4;"#النشرة_الفنية | النجمة العالمية «بريتني سبيرز» تتبرع بمليون دولار لعلاج سرطان الأطفال @britneyspears @carlos _nashef pic.twitter.com/YviYrm4AnN";;@britneyspears @carlos;#;"884822913370685440";https://twitter.com/AlGhadTV/status/884822913370685440;
matheuxcx;2017-07-11 00:16;0;1;"matheuxcx's 5 artists this week: The Weeknd (130), Dua Lipa (113), Roberto Carlos (59), Britney Spears (50), DJ Khaled (48) #jotafm";;;#jotafm;"884567157073469440";https://twitter.com/matheuxcx/status/884567157073469440;
dagunkz;2017-07-08 06:51;0;0;"https://www. buzzfeed.com/gabrielsanchez /most-iconic-kisses?bffbvideo&utm_term=4ldqpi1#4ldqpi1 … my favorite.. definately Britney and Carlos No.20";;;#4ldqpi1;"883579336455892992";https://twitter.com/dagunkz/status/883579336455892992;
DoraAliciaa;2017-07-08 03:40;0;0;"Carlos is really trying to see Britney Spears with me in Vegas next month";;;;"883531106007502853";https://twitter.com/DoraAliciaa/status/883531106007502853;
Millertime1986;2017-07-07 10:55;0;0;"BGT. Keep up Carlos";;;;"883278198506762241";https://twitter.com/Millertime1986/status/883278198506762241;itscarlosbish,lee_lizard
coelhodalua;2017-07-05 17:27;0;0;"e de Britney Spears 2007 ver.";;;;"882652111808409600";https://twitter.com/coelhodalua/status/882652111808409600;jqfac
CARLOSOCHOARCN;2017-07-04 23:10;0;0;"BRITNEY SPEARS CENCURADA EN MTV 2003 CARACOL NOTICIAS CARLOS OCHOA: http:// youtu.be/JrrUC5O9lJs?a via @YouTube";;@YouTube;;"882376115800727552";https://twitter.com/CARLOSOCHOARCN/status/882376115800727552;
CarlosPotterZ;2017-06-30 22:00;0;0;"Carlos Potter's top 6 artists this week: Glee Cast (10), RBD (7), Britney Spears (5), Birdy (4), Michael Jackson (4), Beyoncé (3) #jotafm";;;#jotafm;"880908844968402944";https://twitter.com/CarlosPotterZ/status/880908844968402944;
pcparkour;2017-06-29 13:59;0;0;"eu vejo e chingo de "viadinho" - pra mim é uma subracinha attentionwhore fã de Britney e outras merdas que só faz merda. +";;;;"880425450794864640";https://twitter.com/pcparkour/status/880425450794864640;carlos_casca
carlosluizj;2017-06-28 13:26;0;0;"The latest The Carlos Luiz M. Silva Daily! http:// paper.li/carlosluizj/13 20499597?edition_id=65ffe330-5c05-11e7-915b-0cc47a0d1609 … Thanks to @flaviomuller @Britney _Hadcock #twitchtv #twitch";;@flaviomuller @Britney;#twitchtv #twitch;"880054817112174592";https://twitter.com/carlosluizj/status/880054817112174592;
KahhReeNuhh;2017-06-27 04:22;0;1;"Fuck it? Going through a Britney Spears phase.";;;;"879555562698141696";https://twitter.com/KahhReeNuhh/status/879555562698141696;amaya_913
andersonlmend;2017-06-26 00:14;0;0;"Gostei de um vídeo @YouTube http:// youtu.be/4o7ZxxIyvNI?aT he … Circus Starring: Britney Spears - Radar Live (DVD by Carlos Lima)";;@YouTube;;"879130591022776321";https://twitter.com/andersonlmend/status/879130591022776321;
CarlosPotterZ;2017-06-23 22:00;0;0;"Carlos Potter's top 6 artists this week: Harry Styles (10), James Blunt (6), Lorde (4), RBD (4), Britney Spears (3), Katy Perry (3) #jotafm";;;#jotafm;"878372129166606337";https://twitter.com/CarlosPotterZ/status/878372129166606337;
deorodrigay;2017-06-22 16:52;1;2;""mas isso é roberto carlos , isso sim é cultura" CARALHO EU JÁ DISSE QUE NÃO ESCUTO CULTURA PRA MIM É BEYONCÉ RIHANNA BRITNEY SPEARS pic.twitter.com/co2m93FxUW";;;;"877932364328050688";https://twitter.com/deorodrigay/status/877932364328050688;deorodrigay
thnkngbthrss;2017-06-18 02:04;0;0;"Como me van a cortar a Britney para ponerme un comercial re culo de carlos Vives @Spotify";;@Spotify;;"876259385118531584";https://twitter.com/thnkngbthrss/status/876259385118531584;
fightertina;2017-06-18 01:18;0;7;"não gosta de xingamento, @xtina ? rat flopada sombra da britney preguiçosa que só sabe apertar um botão me ajuda joao carlos gigolôzão";;@xtina;;"876247602169303041";https://twitter.com/fightertina/status/876247602169303041;
fmedinaa_a;2017-06-17 00:35;1;5;"Estoy esperando a Carlos escuchando toda la discografía de Britney Spears pic.twitter.com/GS8f2BTtNq";;;;"875874538227150850";https://twitter.com/fmedinaa_a/status/875874538227150850;
CarlosPotterZ;2017-06-16 22:00;0;0;"Carlos Potter's top 5 artists this week: Harry Styles (6), Katy Perry (4), Ariana Grande (3), Boa (2), Britney Spears (2) #jotafm";;;#jotafm;"875835411213451264";https://twitter.com/CarlosPotterZ/status/875835411213451264;
cathiebianchi;2017-06-15 02:29;0;2;"o meu de física fez isso, por sorte ele mandou uma foto das notas hj e graças a Deus e Britney eu fiquei entre as 3 notas azuis da sala!";;;;"875178531566886912";https://twitter.com/cathiebianchi/status/875178531566886912;thamiris_carlos
twtdabibi;2017-06-13 10:03;0;0;"Vamos ver que hora tem ônibus e não se atrasar. Porque todos os dias agora o Carlos me olha e fala: De novo Britney ? Qual o motivo de hoje?";;;;"874568012984201216";https://twitter.com/twtdabibi/status/874568012984201216;
hugoosment;2017-06-10 16:40;0;0;"Não gosta de palavrão? Lemonade, Britney Jean, Revival, A.K.A, Vai Passar Mal, Joanne, éé... Me ajuda, João Carlos !";;;;"873580763110834176";https://twitter.com/hugoosment/status/873580763110834176;
RAINHADEBOCA;2017-06-09 02:32;0;0;"Britney não tem hit? Toxic Womanizer 3 BOMT Oops Me ajuda João Carlos Work Bitch Hold It Against Me Slave 4 U I Wanna Go Gimme More ... pic.twitter.com/oZG41Bl5My";;;;"873004916289273858";https://twitter.com/RAINHADEBOCA/status/873004916289273858;
CARLOSMARTMusic;2017-06-07 19:13;0;0;"Music Pack 01 AVALIABLE ON PAYPAL 01.- Matty Menck & Terri B! - Sky ( Carlos Martinez Club Mix) 02.- Britney ... http:// fb.me/7MtQOnGSx";;;;"872531967027367936";https://twitter.com/CARLOSMARTMusic/status/872531967027367936;
CARLOSMARTMusic;2017-06-07 19:10;0;0;"Music Pack 01 AVALIABLE ON PAYPAL 01.- Matty Menck & Terri B! - Sky ( Carlos Martinez Club Mix) 02.- Britney ... http:// fb.me/6k5pDPuJ9";;;;"872531176640188419";https://twitter.com/CARLOSMARTMusic/status/872531176640188419;
aaguslemos;2017-06-05 18:12;0;1;"Escuchando en el laburo, llama un tal ' Carlos ' si por favor no le podían pasar 'Baby one more time' de Britney Spears. *Inserte remate*";;;;"871791921760546818";https://twitter.com/aaguslemos/status/871791921760546818;
carlosluizj;2017-06-04 13:26;0;0;"The latest The Carlos Luiz M. Silva Daily! http:// paper.li/carlosluizj/13 20499597?edition_id=6a07c3b0-4929-11e7-b7a1-0cc47a0d1609 … Thanks to @Britney _Hadcock @flaviomuller #twitch #socialmedia";;@Britney @flaviomuller;#twitch #socialmedia;"871357493745774592";https://twitter.com/carlosluizj/status/871357493745774592;
freddykills;2017-06-04 02:55;0;1;"♫ #lastfm artists: Britney Spears (16), Wisin & Yandel (12), Linkin Park (10), Shakira (10) & Carlos Vi.. via @tweeklyfm #music";;@tweeklyfm;#lastfm #music;"871198588516401153";https://twitter.com/freddykills/status/871198588516401153;
