username;date;retweets;favorites;text;geo;mentions;hashtags;id;permalink;replyTo
paulLugai;2017-10-20 12:55;5;2;"Nitwangie solanoki ya G-Defao @QwetuRadio @maroa_wambura #QwetuJioni @TNakhumicha @TasiaTeam @TonyOgawo @luvisiaabigael @frednyabera22";;@QwetuRadio @maroa_wambura @TNakhumicha @TasiaTeam @TonyOgawo @luvisiaabigael @frednyabera22;#QwetuJioni;"921359114021888001";https://twitter.com/paulLugai/status/921359114021888001;
paulLugai;2017-07-20 14:19;2;0;"@maroa_wambura nimetoka Leo chini ya waba naomba G-Defao Solanoki kiwaendee mafuns wote WA Qwetu radio #QwetuJioni @QwetuRadio";;@maroa_wambura @QwetuRadio;#QwetuJioni;"888040565727780866";https://twitter.com/paulLugai/status/888040565727780866;
agortaa;2017-02-26 06:11;1;0;"Adrian Solano, ki še ni videl snega. Jamajška bob ekipa, ki še ni videla snega. To je ... samozavest https:// twitter.com/nytimes/status /835711816282042368 …";;;;"835733893072449536";https://twitter.com/agortaa/status/835733893072449536;
ZNovice;2017-02-23 11:30;0;0;"[VIDEO] Venezuelec komaj prišel do Finske, zdaj se mu smeji ves svet Venezuelski tekač na smučeh Adrian Solano, ki … http:// ift.tt/2mfJ351";;;;"834727190973521920";https://twitter.com/ZNovice/status/834727190973521920;
Joanna_Sty;2017-01-15 07:24;0;4;"Ki azko Ahre no";;;;"820532021214724096";https://twitter.com/Joanna_Sty/status/820532021214724096;DekerGL,rish_solano
maricduca;2016-10-08 14:44;0;1;"ki susto";;;;"784766494781673472";https://twitter.com/maricduca/status/784766494781673472;Gaah_Solano
Apxporpalavras;2016-10-07 03:08;0;0;"Mateus Solano: KI HOMEM";;;;"784228896279564289";https://twitter.com/Apxporpalavras/status/784228896279564289;