username;date;retweets;favorites;text;geo;mentions;hashtags;id;permalink
eluxari_;2016-07-09 21:46;1;1;"Just had a comp w/ everyone solo queued but we used voice chat to coordinate and STOMPED the enemy. feels good~ pic.twitter.com/7TFtE6uffJ";;;;"751895252743643136";https://twitter.com/eluxari_/status/751895252743643136
eluxari_;2016-07-09 20:48;0;1;"Won a comp game, we were 5v6 and had the whiniest Genji ever who thought the team revolved around him. Rank barely moved an inch. THIS GAME.";;;;"751880630653292544";https://twitter.com/eluxari_/status/751880630653292544
eluxari_;2016-07-09 07:19;0;0;"Just had a thought, what if @PlayOverwatch is bringing in this new support sniper as a way to easily phase Symmetra over to defense?";;@PlayOverwatch;;"751677236034605056";https://twitter.com/eluxari_/status/751677236034605056
eluxari_;2016-07-09 06:27;0;0;"@MadynnMads I tried one for the first time in public recently. LOVED IT. twirled a lot, it's freeing. too freeing, soo different from pants.";;@MadynnMads;;"751664133792264192";https://twitter.com/eluxari_/status/751664133792264192
eluxari_;2016-07-08 03:34;0;0;"I'm pretty sure I just came across a level 325 in Overwatch... damn.";;;;"751258249987559424";https://twitter.com/eluxari_/status/751258249987559424
eluxari_;2016-07-06 02:45;0;0;"I use memes to hide my flaws";;;;"750521133930254336";https://twitter.com/eluxari_/status/750521133930254336
eluxari_;2016-07-06 02:45;0;1;"yes :D";;;;"750521029223645184";https://twitter.com/eluxari_/status/750521029223645184
eluxari_;2016-07-05 21:31;0;3;"home from Michigan and I miss it so much u.u ~ can't wait to move up there!";;;;"750441895961165825";https://twitter.com/eluxari_/status/750441895961165825
eluxari_;2016-07-05 21:29;0;1;"PLEASE???? https:// twitter.com/Tzeriel/status /750181040732405760 …";;;;"750441599193194496";https://twitter.com/eluxari_/status/750441599193194496
eluxari_;2016-07-04 02:58;0;1;"thanks";;;;"749799507643146240";https://twitter.com/eluxari_/status/749799507643146240
eluxari_;2016-07-04 00:35;0;6;"summertime and the livin's easy ~ pic.twitter.com/EXFzuPqr2K";;;;"749763608028983298";https://twitter.com/eluxari_/status/749763608028983298
eluxari_;2016-07-03 23:44;0;0;"ooooo what are these for?";;;;"749750805939384320";https://twitter.com/eluxari_/status/749750805939384320
eluxari_;2016-07-03 23:39;0;2;"So far I've only flashed my ass countless times so I think I'm a pro dress-wearer.";;;;"749749415502417921";https://twitter.com/eluxari_/status/749749415502417921
eluxari_;2016-07-03 23:31;0;1;"Absolutely insane, I can't believe this. I don't wanna https:// twitter.com/MichaelJPetty/ status/749741497558327297 …";;;;"749747322679136256";https://twitter.com/eluxari_/status/749747322679136256
eluxari_;2016-07-03 20:31;0;1;"a goddess peep show! But for real I love twirly dresses";;;;"749702154529730561";https://twitter.com/eluxari_/status/749702154529730561
eluxari_;2016-07-03 20:10;0;0;"I'm about to have to hahaha. It's so weird not wearing pants outside of home.";;;;"749696902988521472";https://twitter.com/eluxari_/status/749696902988521472
eluxari_;2016-07-03 19:58;0;0;"Loving this Junkrat cosplay, and gotta love the amazon box D.Va. so much fun https:// twitter.com/8bitblossom/st atus/749690588086185985 …";;;;"749693724205219840";https://twitter.com/eluxari_/status/749693724205219840
eluxari_;2016-07-03 19:55;0;2;"So I'm wearing a dress for the first time and I seriously have no clue how to sit like a lady, help. My bits keep popping out.";;;;"749693113019592706";https://twitter.com/eluxari_/status/749693113019592706
eluxari_;2016-07-03 07:59;0;1;"struggle is fucking for reals right now yo";;;;"749512917846888448";https://twitter.com/eluxari_/status/749512917846888448
eluxari_;2016-07-03 04:52;0;1;"I can't function normally I just need sleep and booze.";;;;"749465703426568193";https://twitter.com/eluxari_/status/749465703426568193
eluxari_;2016-07-01 21:40;0;0;"I'll carry you to victory irl";;;;"748994777895432192";https://twitter.com/eluxari_/status/748994777895432192
eluxari_;2016-07-01 15:47;0;1;"when do they go away? I'm fairly busy this summer but I can hunter dps. all gold, had a few titles. just lmk and I can try to help!";;;;"748905990741856256";https://twitter.com/eluxari_/status/748905990741856256
eluxari_;2016-06-30 18:48;0;0;"getting on that hype train as fem Junkrat ~";;;;"748589139554086912";https://twitter.com/eluxari_/status/748589139554086912
eluxari_;2016-06-30 17:52;0;0;"Sooo... this glitch. What's going on here @PlayOverwatch ? Planning new modes? Haha #PurgeElectionYear pic.twitter.com/kTxJvT9Nkk";;@PlayOverwatch;#PurgeElectionYear;"748574992753901568";https://twitter.com/eluxari_/status/748574992753901568
eluxari_;2016-06-29 21:47;0;1;"I feel the same way. Like I get on and I'm ready to begin and everything feels pretty dead. I just raid now, and even that is meh.";;;;"748271591981711361";https://twitter.com/eluxari_/status/748271591981711361
eluxari_;2016-06-27 21:10;0;2;"cereal";;;;"747537641835487232";https://twitter.com/eluxari_/status/747537641835487232
eluxari_;2016-06-26 01:52;0;1;"just be careful, a lot of cons won't allow bb guns inside. Though with some modifications and an orange tip it should be okay";;;;"746883823321899013";https://twitter.com/eluxari_/status/746883823321899013
eluxari_;2016-06-24 23:43;0;2;"Apartment hunting in Michigan";;;;"746488959929225219";https://twitter.com/eluxari_/status/746488959929225219
eluxari_;2016-06-24 06:27;0;2;"Been practicing Mercy a bit in AI mode. She's really fun but I'm nervous to play quick mode and have everyone scatter across the map.";;;;"746228197587460100";https://twitter.com/eluxari_/status/746228197587460100
eluxari_;2016-06-23 22:34;0;2;"I'll take a pic of my pieces before I start doing too much! Still missing camo shorts and boots of all things haha.";;;;"746109251744108544";https://twitter.com/eluxari_/status/746109251744108544
eluxari_;2016-06-23 22:00;0;5;"Got almost all my pieces for my Junkrat cosplay, time to start putting things together! May not be done in time for @Matsuricon though RIP";;@Matsuricon;;"746100619778334720";https://twitter.com/eluxari_/status/746100619778334720
eluxari_;2016-06-23 21:58;0;1;"ALSO GRATS <3";;;;"746100131641032706";https://twitter.com/eluxari_/status/746100131641032706
eluxari_;2016-06-23 21:58;0;1;"just in time for #SteamSummerSale !";;;#SteamSummerSale;"746100085067481088";https://twitter.com/eluxari_/status/746100085067481088
eluxari_;2016-06-20 00:20;0;1;"junkies 4 life";;;;"744686391922143232";https://twitter.com/eluxari_/status/744686391922143232
eluxari_;2016-06-19 22:02;0;1;"SAWFT maybe but not soft";;;;"744651652913893376";https://twitter.com/eluxari_/status/744651652913893376
eluxari_;2016-06-18 05:08;0;2;"the best kind";;;;"744034149850300418";https://twitter.com/eluxari_/status/744034149850300418
eluxari_;2016-06-17 20:18;0;1;"I'm so small I always end up crushed in the middle but that's ok";;;;"743900770714681344";https://twitter.com/eluxari_/status/743900770714681344
eluxari_;2016-06-16 07:02;0;0;"I know it's WAY easier said than done, but try not to stress too much over all of it, hopefully a tiny bit of time to unwind :)";;;;"743337918303870976";https://twitter.com/eluxari_/status/743337918303870976
eluxari_;2016-06-16 06:58;0;1;"it's out of your control, you're not letting anyone down <3 If the machines aren't working, they aren't working. -hugs-";;;;"743336998887251968";https://twitter.com/eluxari_/status/743336998887251968
eluxari_;2016-06-15 02:35;0;0;"whenever you WANT<3";;;;"742908253336670208";https://twitter.com/eluxari_/status/742908253336670208
eluxari_;2016-06-13 03:50;0;0;"Yoga Hosers and @ThatKevinSmith get 12/10 weiners, great movie and a fucking inspirational dude. Much love.";;@ThatKevinSmith;;"742202382352822272";https://twitter.com/eluxari_/status/742202382352822272
eluxari_;2016-06-12 19:42;0;4;"En route to see Yoga Hosers and meet the wonderful @ThatKevinSmith in Cbus. Yeeesss";;@ThatKevinSmith;;"742079728132227072";https://twitter.com/eluxari_/status/742079728132227072
eluxari_;2016-06-11 23:50;0;1;"seeing your shop reopened when I got home was even more awesome news for my day <3";;;;"741779689694502912";https://twitter.com/eluxari_/status/741779689694502912
eluxari_;2016-06-11 23:47;0;1;"CHECK THIS SHOP OUT there are AMAZING patches~ just ordered mine for Junkrat <333 https:// twitter.com/serephita/stat us/741731601441165312 …";;;;"741778929342681088";https://twitter.com/eluxari_/status/741778929342681088
eluxari_;2016-06-11 23:22;0;1;"The leather is really stiff, so I'm just going to casually wear this bondage harness around to form it to my shape. #cosplay";;;#cosplay;"741772647630032896";https://twitter.com/eluxari_/status/741772647630032896
eluxari_;2016-06-11 23:06;0;2;"Just got home for the AMAZING #WarcraftMovie to find my Junkrat harness and flask have arrived, fuck yes!";;;#WarcraftMovie;"741768702291550208";https://twitter.com/eluxari_/status/741768702291550208
eluxari_;2016-06-11 19:43;0;0;"Okay this is awesome https:// twitter.com/JolteonYone/st atus/740528050798895106 …";;;;"741717566402400256";https://twitter.com/eluxari_/status/741717566402400256
eluxari_;2016-06-11 19:34;0;1;"Seriously happy to see so many nerds in this theater. I love you all. #WarcraftMovie";;;#WarcraftMovie;"741715176857145349";https://twitter.com/eluxari_/status/741715176857145349
eluxari_;2016-06-11 19:00;0;0;"@dexbonus totally gremlin babby and snow bab";;@dexbonus;;"741706790627348481";https://twitter.com/eluxari_/status/741706790627348481
eluxari_;2016-06-11 18:59;0;1;"This weekend is gunna be good~ #WarcraftMovie today and @YogaHosers plus meet and greet tomorrow";;@YogaHosers;#WarcraftMovie;"741706383867940864";https://twitter.com/eluxari_/status/741706383867940864
eluxari_;2016-06-11 02:03;1;0;"@aureylian @itmeJP haha I'd be down once I get my ass back to streaming";;@aureylian @itmeJP;;"741450719341862912";https://twitter.com/eluxari_/status/741450719341862912
eluxari_;2016-06-10 12:02;0;1;"we're Junkies";;;;"741239077765283840";https://twitter.com/eluxari_/status/741239077765283840
eluxari_;2016-06-10 06:11;0;2;"I'm addicted to Junkrat, and this is my story. https:// youtu.be/vwqTAFQlJOg";;;;"741150823699361792";https://twitter.com/eluxari_/status/741150823699361792
eluxari_;2016-06-10 00:26;0;0;"yes gurl if u paying~";;;;"741064073706639360";https://twitter.com/eluxari_/status/741064073706639360
eluxari_;2016-06-09 23:03;0;0;"good I just quit mine RIP I am pro at life";;;;"741043067147460608";https://twitter.com/eluxari_/status/741043067147460608
eluxari_;2016-06-09 23:03;0;1;"rock hard zorro cock, just for you Uncle Screwy~";;;;"741042971815116800";https://twitter.com/eluxari_/status/741042971815116800
eluxari_;2016-06-09 07:39;0;1;"I have a picture of someone's dick in a Zorro costume for this exact purpose.";;;;"740810635219439616";https://twitter.com/eluxari_/status/740810635219439616
eluxari_;2016-06-09 04:33;0;1;"happy birthday!!!";;;;"740763630581485572";https://twitter.com/eluxari_/status/740763630581485572
eluxari_;2016-06-09 01:54;0;1;"I need a vacation really far away like now.";;;;"740723601167552512";https://twitter.com/eluxari_/status/740723601167552512
eluxari_;2016-06-08 18:41;0;0;"Anyone have ideas/tips on making this gun? I've never done anything like this, so even semi-premade toys would work. pic.twitter.com/pOFC21cbyU";;;;"740614636991590404";https://twitter.com/eluxari_/status/740614636991590404
eluxari_;2016-06-08 07:54;1;3;"this is a thing and most likely happening, and wouldn't be too hard to travel to #Blizzcon with~ pic.twitter.com/P5Os35KK7w";;;#Blizzcon;"740452031308128256";https://twitter.com/eluxari_/status/740452031308128256
eluxari_;2016-06-08 07:53;0;0;"you tha bomb lady <3";;;;"740451780388106241";https://twitter.com/eluxari_/status/740451780388106241
eluxari_;2016-06-08 01:44;1;2;"I went to open WoW for raid and ended up opening #Overwatch out of habit, sorry @Delusions_RT , gotta play now that it's open.";;@Delusions_RT;#Overwatch;"740358868396605444";https://twitter.com/eluxari_/status/740358868396605444
eluxari_;2016-06-08 01:21;0;0;"I'm getting better at everything except winning and dying, but hey, dying makes EXPLODEYS~ pic.twitter.com/1MKnLhde35";;;;"740352970743775232";https://twitter.com/eluxari_/status/740352970743775232
eluxari_;2016-06-08 00:10;0;2;"My mental health has been overwhelming me lately, but there's been so much positivity sent my way, I really appreciate everyone, FOR REALS.";;;;"740335221954994177";https://twitter.com/eluxari_/status/740335221954994177
eluxari_;2016-06-07 23:47;0;2;"love you boys always!";;;;"740329321106149376";https://twitter.com/eluxari_/status/740329321106149376
eluxari_;2016-06-07 23:38;0;0;"thanks love~ I appreciate it, just can't accept it myself yet. working out in Jukado will get me in shape a bit tho!";;;;"740327094748581888";https://twitter.com/eluxari_/status/740327094748581888
eluxari_;2016-06-07 23:27;0;1;"Flesh-tone tanktop! I couldn't find any good wigs for his upspiked hair, so going for this feminine version of his hair as well.";;;;"740324329779429376";https://twitter.com/eluxari_/status/740324329779429376
eluxari_;2016-06-07 23:26;0;1;"I'm actually going a little more subtle due to body confidence issues. I found this sketch online! pic.twitter.com/OzLHHEWnXm";;;;"740324002531573760";https://twitter.com/eluxari_/status/740324002531573760
eluxari_;2016-06-07 23:22;0;2;"My femrat wig should be here Thursday, so I think styling and playing with the wig will be my first step, then onto my mech arm and leg!";;;;"740323011987935232";https://twitter.com/eluxari_/status/740323011987935232
eluxari_;2016-06-07 23:21;0;1;"ARE THESE HIGH HEELS OMG LOVE";;;;"740322742961070080";https://twitter.com/eluxari_/status/740322742961070080
eluxari_;2016-06-07 23:07;0;2;"hey, I love you forever! I'm so glad I met you <3";;;;"740319423240798208";https://twitter.com/eluxari_/status/740319423240798208
eluxari_;2016-06-07 23:07;0;0;"that's what I figured, damn. well lady, I'll make sure to be keepign an eye on your feed and my twitter so I don't miss anything.";;;;"740319191710851072";https://twitter.com/eluxari_/status/740319191710851072
eluxari_;2016-06-07 23:04;0;0;"Is texting between US and Canada weird? I can DM you my cell if you'd like, just in case I poof from twitter.";;;;"740318666126942208";https://twitter.com/eluxari_/status/740318666126942208
eluxari_;2016-06-07 23:03;0;1;"needs more explosions and Junkrat! <3";;;;"740318191256100865";https://twitter.com/eluxari_/status/740318191256100865
eluxari_;2016-06-07 23:01;0;1;"I'm here for you love, if you need/want anything, or just need a distraction, always.";;;;"740317765236576259";https://twitter.com/eluxari_/status/740317765236576259
eluxari_;2016-06-07 23:00;0;1;"the struggle UGH";;;;"740317638115622912";https://twitter.com/eluxari_/status/740317638115622912
eluxari_;2016-06-06 19:11;0;0;"damnit! The best is when people turn around and don't think to look down and miss me. SNEAKY.";;;;"739897567081693184";https://twitter.com/eluxari_/status/739897567081693184
eluxari_;2016-06-06 19:07;0;1;"I can't wait to meet you again at Blizzcon and probably tackle you this time.";;;;"739896559496794113";https://twitter.com/eluxari_/status/739896559496794113
eluxari_;2016-06-06 05:13;0;1;"everything's coming up explodey hehehehhee";;;;"739686586208686080";https://twitter.com/eluxari_/status/739686586208686080
eluxari_;2016-06-06 00:19;0;1;"happy birthday beautiful";;;;"739612754726780928";https://twitter.com/eluxari_/status/739612754726780928
eluxari_;2016-06-05 19:27;0;0;"so much this. <3 I love you all https:// twitter.com/Naerchanqt/sta tus/739529658346135553 …";;;;"739539256679538688";https://twitter.com/eluxari_/status/739539256679538688
eluxari_;2016-06-05 17:14;0;0;"it's not too much if it's what you want! Fuck em and get birb. Birb for life.";;;;"739505574388322304";https://twitter.com/eluxari_/status/739505574388322304
eluxari_;2016-06-05 17:11;0;1;"Why do I even do things.";;;;"739504982353907712";https://twitter.com/eluxari_/status/739504982353907712
eluxari_;2016-06-05 05:36;0;0;"Bought my Junkrat cosplay wig. SO EXCITE.";;;;"739330124223553536";https://twitter.com/eluxari_/status/739330124223553536
eluxari_;2016-06-05 01:54;0;0;"I didn't realize he voiced McCree and now I have an even bigger need to meet him UGH that is AWESOME.";;;;"739274269281136640";https://twitter.com/eluxari_/status/739274269281136640
eluxari_;2016-06-05 01:46;0;1;"I MUST GO.";;;;"739272139564568576";https://twitter.com/eluxari_/status/739272139564568576
eluxari_;2016-06-05 00:56;0;0;"THEY LOOK SO YUM. I had some for the first time at the North Market after our last meeting. addicted now";;;;"739259534800244736";https://twitter.com/eluxari_/status/739259534800244736
eluxari_;2016-06-05 00:55;0;1;"I wanna see it sooner but I'm waiting to watch it with my boyfriend. WORTH THE WAIT THO <3";;;;"739259329249939456";https://twitter.com/eluxari_/status/739259329249939456
eluxari_;2016-06-05 00:54;0;0;"ugh I need, what flavor?";;;;"739259040497324032";https://twitter.com/eluxari_/status/739259040497324032
eluxari_;2016-06-04 19:07;0;0;"oooh, that's good to hear. I'm really pumped for this!";;;;"739171822286077953";https://twitter.com/eluxari_/status/739171822286077953
eluxari_;2016-06-04 19:06;0;5;"finally did the thing <3 #WarcraftMovie pic.twitter.com/7ZQjD6v0tU";;;#WarcraftMovie;"739171416214491136";https://twitter.com/eluxari_/status/739171416214491136
eluxari_;2016-06-04 18:59;0;0;"Okay solo-queue not bad so far today. :3";;;;"739169823582752768";https://twitter.com/eluxari_/status/739169823582752768
eluxari_;2016-06-04 18:59;0;0;"added you, I'm guardengnome~";;;;"739169751860183040";https://twitter.com/eluxari_/status/739169751860183040
eluxari_;2016-06-04 18:37;0;0;"No one on my friends list is playing #Overwatch right now, this is weird. Time to enter solo-queue hell.";;;#Overwatch;"739164287952900096";https://twitter.com/eluxari_/status/739164287952900096
eluxari_;2016-06-03 21:00;1;1;"GAWT IT http:// splashbrush.deviantart.com/art/Overwatch- Junkrat-R63-599978585 …";;;;"738837772388184064";https://twitter.com/eluxari_/status/738837772388184064
eluxari_;2016-06-03 20:45;0;0;"SHIT THAT'S PRETTY MUCH IT do you have a link to the artist?";;;;"738834038249639936";https://twitter.com/eluxari_/status/738834038249639936
eluxari_;2016-06-03 20:35;0;0;"I have all these wonderful ideas for a female Junkrat cosplay, one day I NEED to make it~<3";;;;"738831562997911552";https://twitter.com/eluxari_/status/738831562997911552
eluxari_;2016-05-31 22:03;0;0;"that's gotta be the slogan";;;;"737766358843195392";https://twitter.com/eluxari_/status/737766358843195392
eluxari_;2016-05-31 19:39;0;0;"12/10 partly cloudly with a chance of high noon and justice";;;;"737730157918687232";https://twitter.com/eluxari_/status/737730157918687232
eluxari_;2016-05-31 15:38;0;1;"dude yes. What would you call it?";;;;"737669480122322945";https://twitter.com/eluxari_/status/737669480122322945
eluxari_;2016-05-29 07:09;0;0;"baerat https:// twitter.com/Rannef_Art/sta tus/736801351728959489 …";;;;"736816652877234176";https://twitter.com/eluxari_/status/736816652877234176
eluxari_;2016-05-29 07:04;0;1;"YASSS I love him!";;;;"736815504082522112";https://twitter.com/eluxari_/status/736815504082522112
eluxari_;2016-05-24 02:59;0;0;"it's finally #Overwatch time I can't wait <3";;;#Overwatch;"734941916807233536";https://twitter.com/eluxari_/status/734941916807233536
eluxari_;2016-05-24 00:51;0;0;"7 bruises already. RIP ME.";;;;"734909731312001024";https://twitter.com/eluxari_/status/734909731312001024
eluxari_;2016-05-24 00:38;0;0;"Activision-Blizzard: Please Remove Guns From Your Game "Overwatch." http://www. thepetitionsite.com/tell-a-friend/ 23588462 … BWAHAHAHA.";;;;"734906383850688512";https://twitter.com/eluxari_/status/734906383850688512
eluxari_;2016-05-24 00:29;0;0;"More bone hardening drills today. My forearms are double their normal size. Dead. Can't wait to get on that #Overwatch hype";;;#Overwatch;"734904135707938818";https://twitter.com/eluxari_/status/734904135707938818
eluxari_;2016-05-21 23:47;0;0;"So @PlayOverwatch is launching when I'm supposed to be in my Jukado class. SUCH TEMPTATION. But I gotta stick to my exercise first!";;@PlayOverwatch;;"734168728938684416";https://twitter.com/eluxari_/status/734168728938684416
eluxari_;2016-05-20 00:22;0;1;"My muscles are trying to claw their way out from 2 years of pizza and cookies and damn it hurts, I'm sorry muscles. pic.twitter.com/YSXoa8TqWK";;;;"733452877239357440";https://twitter.com/eluxari_/status/733452877239357440
eluxari_;2016-05-19 15:29;0;0;"but you're a wonderful person momma Z <3";;;;"733318612900024321";https://twitter.com/eluxari_/status/733318612900024321
eluxari_;2016-05-19 14:30;0;0;"Seriously not gunna yell over your office gossip just to do my job AND hold your hand when I'm sick.";;;;"733303903413018624";https://twitter.com/eluxari_/status/733303903413018624
eluxari_;2016-05-19 02:32;0;0;"I don't know if you deserve being thrown by a midget in a kigurumi~";;;;"733123223169171460";https://twitter.com/eluxari_/status/733123223169171460
eluxari_;2016-05-19 02:31;0;0;"BOYS. hahaha I could throw you both across the room now <3";;;;"733122813444362240";https://twitter.com/eluxari_/status/733122813444362240
eluxari_;2016-05-19 00:59;0;0;"no problem!!! I remembered the technique because the gold tones would match so wonderfully!";;;;"733099619287207936";https://twitter.com/eluxari_/status/733099619287207936
eluxari_;2016-05-19 00:58;0;1;"LT: essentially you just BASH YOUR BONES against your partner over and over and over AGAIN AND AGAIN. But I survived day 2! getting it yo!";;;;"733099430044372992";https://twitter.com/eluxari_/status/733099430044372992
eluxari_;2016-05-19 00:56;0;0;"After Monday's destroyed me/sick on Tuesday, I slept all day today to recover for tonight. THANK GOD. CAUSE BONE HARDENING DRILLS ARE HELL.";;;;"733098957459558400";https://twitter.com/eluxari_/status/733098957459558400
eluxari_;2016-05-18 18:40;0;1;"these are AMAZING SO MUCH UGH";;;;"733004422792503297";https://twitter.com/eluxari_/status/733004422792503297
eluxari_;2016-05-18 18:39;0;0;"<3 tamales so much";;;;"733004128406929408";https://twitter.com/eluxari_/status/733004128406929408
eluxari_;2016-05-18 18:13;0;3;"GOOD NEWS EVERYONE I finally have beef lo mein.";;;;"732997571069763584";https://twitter.com/eluxari_/status/732997571069763584
eluxari_;2016-05-18 18:12;0;1;"I just backed Noisy Person Cards on @Kickstarter http:// kck.st/1U2bMai <3";;@Kickstarter;;"732997228873322497";https://twitter.com/eluxari_/status/732997228873322497
eluxari_;2016-05-18 17:16;0;0;"So much contest entry spam, I'M SORRY FRIENDS I JUST WANT BETA.";;;;"732983270284070912";https://twitter.com/eluxari_/status/732983270284070912
eluxari_;2016-05-18 17:14;0;0;"World of Warcraft #Legion Closed Beta Key Giveaway! Enter Here -> https:// gleam.io/ISQyN/world-of -warcraft-legion-beta-key …";;;#Legion;"732982780246663169";https://twitter.com/eluxari_/status/732982780246663169
eluxari_;2016-05-18 17:13;0;1;"beeeeef lo mein get in me";;;;"732982448234061824";https://twitter.com/eluxari_/status/732982448234061824
eluxari_;2016-05-18 16:43;1;3;"Super excited to go pick up my chinese food but realized I forgot to order it a half hour ago 10/10 pic.twitter.com/uwLbZ8m7yt";;;;"732974847605755904";https://twitter.com/eluxari_/status/732974847605755904
eluxari_;2016-05-18 16:40;0;0;"kintsugi! https:// en.wikipedia.org/wiki/Kintsugi LOOKS AWESOME THO <3";;;;"732974213246689280";https://twitter.com/eluxari_/status/732974213246689280
eluxari_;2016-05-17 01:36;0;0;"you're next gg";;;;"732384287534780416";https://twitter.com/eluxari_/status/732384287534780416
eluxari_;2016-05-17 00:49;0;1;"OKAY jukado kicked my ass HARD. but I also flipped a dude twice my size, which I never ever would have imagined. Just gotta push through!";;;;"732372524047192065";https://twitter.com/eluxari_/status/732372524047192065
eluxari_;2016-05-16 19:40;0;4;"I've got my first jukado class tonight, I'm so PUMPED to finally be moving forward and getting active. Gunna be SWOLE.";;;;"732294699592077312";https://twitter.com/eluxari_/status/732294699592077312
eluxari_;2016-05-16 19:33;0;1;"GUYS @FUNimation is coming out this year! Let's give them a super awesome welcome~ https:// twitter.com/Matsuricon/sta tus/732250723660922880 …";;@FUNimation;;"732292823735795715";https://twitter.com/eluxari_/status/732292823735795715
eluxari_;2016-05-15 13:28;0;0;"oh god I missed it. happy birthing day";;;;"731838599696662529";https://twitter.com/eluxari_/status/731838599696662529
eluxari_;2016-05-12 23:17;1;1;"check out this dude's stream he is kinda cool https:// twitter.com/Rikemasil/stat us/730899457189908481 …";;;;"730899655672762369";https://twitter.com/eluxari_/status/730899655672762369
eluxari_;2016-05-10 23:23;0;1;"@AGG_Freshca I can't imagine how scary that is, I hope she is going to be alright!";;@AGG_Freshca;;"730176414784294916";https://twitter.com/eluxari_/status/730176414784294916
eluxari_;2016-05-10 19:54;0;0;"@Tzeriel @PlayOverwatch 10/10 my feels";;@Tzeriel @PlayOverwatch;;"730123793864241154";https://twitter.com/eluxari_/status/730123793864241154
eluxari_;2016-05-10 19:52;0;2;"@AGG_Freshca take care of yourself first! <3";;@AGG_Freshca;;"730123265855897600";https://twitter.com/eluxari_/status/730123265855897600
eluxari_;2016-05-10 19:51;0;0;"@akaWrecks I'll forever be a lightweight, but it helps makes drinking cheaper ;)";;@akaWrecks;;"730123085035274240";https://twitter.com/eluxari_/status/730123085035274240
eluxari_;2016-05-10 19:50;0;0;"Getting signed up for Jukado courses, $50 for 10 weeks, uh hell yes?! Finally putting my ass in motion.";;;;"730122907033145344";https://twitter.com/eluxari_/status/730122907033145344
